Titre,Vendeur,Acheteurs,Notes,Date Dernier Avis,Catégorie,Sous-Catégorie,Mots Clés,Lien
إعداد القوائم المالية والتحليل المالي مع تقارير ونسب احترافي,.Mohammed G,0,0,Aucun avis,أعمال,خدمات مالية ومحاسبية,"pdf, محاسبة, تقارير مالية, قوائم مالية, نسب مالية",https://khamsat.com/business/financial-statements/3564119-%D8%A5%D8%B9%D8%AF%D8%A7%D8%AF-%D8%A7%D9%84%D9%82%D9%88%D8%A7%D8%A6%D9%85-%D8%A7%D9%84%D9%85%D8%A7%D9%84%D9%8A%D8%A9-%D9%88%D8%A7%D9%84%D8%AA%D8%AD%D9%84%D9%8A%D9%84-%D8%A7%D9%84%D9%85%D8%A7%D9%84%D9%8A-%D9%85%D8%B9-%D8%AA%D9%82%D8%A7%D8%B1%D9%8A%D8%B1-%D9%88%D9%86%D8%B3%D8%A8-%D8%A7%D8%AD%D8%AA%D8%B1%D8%A7%D9%81%D9%8A
مسك الدفاتر المحاسبية باستخدام excel,.Ali A,0,0,Aucun avis,أعمال,خدمات مالية ومحاسبية,"حسابات, قيود, محاسب, أكسل, دفترة",https://khamsat.com/business/accounting-bookkeeping/3775953-%D9%85%D8%B3%D9%83-%D8%A7%D9%84%D8%AF%D9%81%D8%A7%D8%AA%D8%B1-%D8%A7%D9%84%D9%85%D8%AD%D8%A7%D8%B3%D8%A8%D9%8A%D8%A9-%D8%A8%D8%A7%D8%B3%D8%AA%D8%AE%D8%AF%D8%A7%D9%85-excel
محاسبة ومسك دفاتر احترافية على Excel بدقة,منة الله ز.,0,0,Aucun avis,أعمال,خدمات مالية ومحاسبية,"حسابات, محاسبة, دفاتر, محاسب, تحليل بيانات",https://khamsat.com/business/accounting-bookkeeping/3361230-%D9%85%D8%AD%D8%A7%D8%B3%D8%A8%D8%A9-%D9%88%D9%85%D8%B3%D9%83-%D8%AF%D9%81%D8%A7%D8%AA%D8%B1-%D8%A7%D8%AD%D8%AA%D8%B1%D8%A7%D9%81%D9%8A%D8%A9-%D8%B9%D9%84%D9%89-excel-%D8%A8%D8%AF%D9%82%D8%A9
VAT إعداد اقرار ضريبة القيمة المضافة,عبدالعزيز ا.,0,0,Aucun avis,أعمال,خدمات مالية ومحاسبية,"محاسبة, ضريبة, المحاسبة المالية, ضريبة القيمة المضافة, خدمات مسك الدفاتر المحاسبية",https://khamsat.com/business/tax/3544591-vat-%D8%A5%D8%B9%D8%AF%D8%A7%D8%AF-%D8%A7%D9%82%D8%B1%D8%A7%D8%B1-%D8%B6%D8%B1%D9%8A%D8%A8%D8%A9-%D8%A7%D9%84%D9%82%D9%8A%D9%85%D8%A9-%D8%A7%D9%84%D9%85%D8%B6%D8%A7%D9%81%D8%A9
محاسبة وإدخال بيانات للشركات والمشاريع الصغيرة,نيفين ا.,0,0,Aucun avis,أعمال,خدمات مالية ومحاسبية,"excel, ادخال بيانات, تقارير مالية, فواتير, محاسبة مالية",https://khamsat.com/business/accounting-bookkeeping/3816495-%D9%85%D8%AD%D8%A7%D8%B3%D8%A8%D8%A9-%D9%88%D8%A5%D8%AF%D8%AE%D8%A7%D9%84-%D8%A8%D9%8A%D8%A7%D9%86%D8%A7%D8%AA-%D9%84%D9%84%D8%B4%D8%B1%D9%83%D8%A7%D8%AA-%D9%88%D8%A7%D9%84%D9%85%D8%B4%D8%A7%D8%B1%D9%8A%D8%B9-%D8%A7%D9%84%D8%B5%D8%BA%D9%8A%D8%B1%D8%A9
إعداد القوائم المالية والتقارير المحاسبية بدقة,مروان س.,0,0,Aucun avis,أعمال,خدمات مالية ومحاسبية,"قيود, محاسب, مصروفات",https://khamsat.com/business/financial-statements/3642831-%D8%A5%D8%B9%D8%AF%D8%A7%D8%AF-%D8%A7%D9%84%D9%82%D9%88%D8%A7%D8%A6%D9%85-%D8%A7%D9%84%D9%85%D8%A7%D9%84%D9%8A%D8%A9-%D9%88%D8%A7%D9%84%D8%AA%D9%82%D8%A7%D8%B1%D9%8A%D8%B1-%D8%A7%D9%84%D9%85%D8%AD%D8%A7%D8%B3%D8%A8%D9%8A%D8%A9-%D8%A8%D8%AF%D9%82%D8%A9
اعداد قيود اليومية واعداد التقارير المالية المختلفة,.Mohamed A,0,0,Aucun avis,أعمال,خدمات مالية ومحاسبية,"مسك, اكسل, المحاسبة, الدفاتر",https://khamsat.com/business/accounting-bookkeeping/3578373-%D8%A7%D8%B9%D8%AF%D8%A7%D8%AF-%D9%82%D9%8A%D9%88%D8%AF-%D8%A7%D9%84%D9%8A%D9%88%D9%85%D9%8A%D8%A9-%D9%88%D8%A7%D8%B9%D8%AF%D8%A7%D8%AF-%D8%A7%D9%84%D8%AA%D9%82%D8%A7%D8%B1%D9%8A%D8%B1-%D8%A7%D9%84%D9%85%D8%A7%D9%84%D9%8A%D8%A9-%D8%A7%D9%84%D9%85%D8%AE%D8%AA%D9%84%D9%81%D8%A9
محاسب عن بعد لتنظيم أعمالك وعمل إقرار ضريبة القيمة المضافة,.Mohamed A,0,0,Aucun avis,أعمال,خدمات مالية ومحاسبية,"حسابات, محاسبة, محاسب, محاسبة عن بعد",https://khamsat.com/business/accounting-bookkeeping/3653850-%D9%85%D8%AD%D8%A7%D8%B3%D8%A8-%D8%B9%D9%86-%D8%A8%D8%B9%D8%AF-%D9%84%D8%AA%D9%86%D8%B8%D9%8A%D9%85-%D8%A3%D8%B9%D9%85%D8%A7%D9%84%D9%83-%D9%88%D8%B9%D9%85%D9%84-%D8%A5%D9%82%D8%B1%D8%A7%D8%B1-%D8%B6%D8%B1%D9%8A%D8%A8%D8%A9-%D8%A7%D9%84%D9%82%D9%8A%D9%85%D8%A9-%D8%A7%D9%84%D9%85%D8%B6%D8%A7%D9%81%D8%A9
تحليل وإعداد القوائم المالية والتقارير باستخدام Excel,.Mostafa A,0,0,Aucun avis,أعمال,خدمات مالية ومحاسبية,"excel, تحليل, محاسبة, قوائم مالية, data analysis",https://khamsat.com/business/financial-analysis/3662290-%D8%AA%D8%AD%D9%84%D9%8A%D9%84-%D9%88%D8%A5%D8%B9%D8%AF%D8%A7%D8%AF-%D8%A7%D9%84%D9%82%D9%88%D8%A7%D8%A6%D9%85-%D8%A7%D9%84%D9%85%D8%A7%D9%84%D9%8A%D8%A9-%D9%88%D8%A7%D9%84%D8%AA%D9%82%D8%A7%D8%B1%D9%8A%D8%B1-%D8%A8%D8%A7%D8%B3%D8%AA%D8%AE%D8%AF%D8%A7%D9%85-excel
إعداد القيود المحاسبية والتقارير المالية باحتراف,.Zain Alabdin B,0,0,Aucun avis,أعمال,خدمات مالية ومحاسبية,"محاسبة, اكسل, الدخل, قوائم مالية, مصروفات",https://khamsat.com/business/tax/3582032-%D8%A5%D8%B9%D8%AF%D8%A7%D8%AF-%D8%A7%D9%84%D9%82%D9%8A%D9%88%D8%AF-%D8%A7%D9%84%D9%85%D8%AD%D8%A7%D8%B3%D8%A8%D9%8A%D8%A9-%D9%88%D8%A7%D9%84%D8%AA%D9%82%D8%A7%D8%B1%D9%8A%D8%B1-%D8%A7%D9%84%D9%85%D8%A7%D9%84%D9%8A%D8%A9-%D8%A8%D8%A7%D8%AD%D8%AA%D8%B1%D8%A7%D9%81
محاسب عن بعد لمتابعة جميع التعاملات المالية لشركات والمؤسسات,.Hassan N,0,0,Aucun avis,أعمال,خدمات مالية ومحاسبية,"قيود, محاسب, محاسبية, فواتير, قوائم مالية",https://khamsat.com/business/accounting-bookkeeping/3744080-%D9%85%D8%AD%D8%A7%D8%B3%D8%A8-%D8%B9%D9%86-%D8%A8%D8%B9%D8%AF-%D9%84%D9%85%D8%AA%D8%A7%D8%A8%D8%B9%D8%A9-%D8%AC%D9%85%D9%8A%D8%B9-%D8%A7%D9%84%D8%AA%D8%B9%D8%A7%D9%85%D9%84%D8%A7%D8%AA-%D8%A7%D9%84%D9%85%D8%A7%D9%84%D9%8A%D8%A9-%D9%84%D8%B4%D8%B1%D9%83%D8%A7%D8%AA-%D9%88%D8%A7%D9%84%D9%85%D8%A4%D8%B3%D8%B3%D8%A7%D8%AA
اعداد القوائم المالية الدخل والميزانية بدقة عالية,ريم م.,0,0,Aucun avis,أعمال,خدمات مالية ومحاسبية,"excel, محاسبة, ميزانية, قوائم مالية, قائمة دخل",https://khamsat.com/business/financial-statements/3766708-%D8%A7%D8%B9%D8%AF%D8%A7%D8%AF-%D8%A7%D9%84%D9%82%D9%88%D8%A7%D8%A6%D9%85-%D8%A7%D9%84%D9%85%D8%A7%D9%84%D9%8A%D8%A9-%D8%A7%D9%84%D8%AF%D8%AE%D9%84-%D9%88%D8%A7%D9%84%D9%85%D9%8A%D8%B2%D8%A7%D9%86%D9%8A%D8%A9-%D8%A8%D8%AF%D9%82%D8%A9-%D8%B9%D8%A7%D9%84%D9%8A%D8%A9
اعداد ومراجعة القوائم المالية السنوية كاملة بجميع مرفقاتها,.Mohamed T,0,0,Aucun avis,أعمال,خدمات مالية ومحاسبية,"ميزانية, تقارير مالية, تحليل بيانات, الحسابات, قوائم مالية",https://khamsat.com/business/financial-statements/3588975-%D8%A7%D8%B9%D8%AF%D8%A7%D8%AF-%D9%88%D9%85%D8%B1%D8%A7%D8%AC%D8%B9%D8%A9-%D8%A7%D9%84%D9%82%D9%88%D8%A7%D8%A6%D9%85-%D8%A7%D9%84%D9%85%D8%A7%D9%84%D9%8A%D8%A9-%D8%A7%D9%84%D8%B3%D9%86%D9%88%D9%8A%D8%A9-%D9%83%D8%A7%D9%85%D9%84%D8%A9-%D8%A8%D8%AC%D9%85%D9%8A%D8%B9-%D9%85%D8%B1%D9%81%D9%82%D8%A7%D8%AA%D9%87%D8%A7
تقديم اقرار القيمة المضافة VAT Declaration,منةالله ا.,0,0,Aucun avis,أعمال,خدمات مالية ومحاسبية,"ضرائب, قيمة_مضافة, اقرار_ضريبى, خدمات_ضريبية, اقرار_قيمة_مضافة",https://khamsat.com/business/tax/3686711-%D8%AA%D9%82%D8%AF%D9%8A%D9%85-%D8%A7%D9%82%D8%B1%D8%A7%D8%B1-%D8%A7%D9%84%D9%82%D9%8A%D9%85%D8%A9-%D8%A7%D9%84%D9%85%D8%B6%D8%A7%D9%81%D8%A9-vat-declaration
محاسب للعمل على برنامج ساب  Sap Business One,احمد ي.,0,0,Aucun avis,أعمال,خدمات مالية ومحاسبية,"محاسبة, data entry, تحليل مالي, accounting, sap",https://khamsat.com/business/accounting-bookkeeping/3582339-%D9%85%D8%AD%D8%A7%D8%B3%D8%A8-%D9%84%D9%84%D8%B9%D9%85%D9%84-%D8%B9%D9%84%D9%89-%D8%A8%D8%B1%D9%86%D8%A7%D9%85%D8%AC-%D8%B3%D8%A7%D8%A8-sap-business-one
إدخال وتنظيم القيود المالية في Excel مع تقرير مبسط,أيمن ب.,0,0,Aucun avis,أعمال,خدمات مالية ومحاسبية,"تنظيم, إدخال البيانات, اكسل, محاسب, تقارير مالية",https://khamsat.com/business/accounting-bookkeeping/3718297-%D8%A5%D8%AF%D8%AE%D8%A7%D9%84-%D9%88%D8%AA%D9%86%D8%B8%D9%8A%D9%85-%D8%A7%D9%84%D9%82%D9%8A%D9%88%D8%AF-%D8%A7%D9%84%D9%85%D8%A7%D9%84%D9%8A%D8%A9-%D9%81%D9%8A-excel-%D9%85%D8%B9-%D8%AA%D9%82%D8%B1%D9%8A%D8%B1-%D9%85%D8%A8%D8%B3%D8%B7
تحليل مالي للقوائم المالية,ضاري ا.,0,0,Aucun avis,أعمال,خدمات مالية ومحاسبية,"تحليل, pdf, المالية, مالي, قوائم مالية",https://khamsat.com/business/financial-statements/3482227-%D8%AA%D8%AD%D9%84%D9%8A%D9%84-%D9%85%D8%A7%D9%84%D9%8A-%D9%84%D9%84%D9%82%D9%88%D8%A7%D8%A6%D9%85-%D8%A7%D9%84%D9%85%D8%A7%D9%84%D9%8A%D8%A9
مدير حسابات عن بعد لضبط حساباتك واعمالك وتحقيق ارباحك,محمد ا.,0,0,Aucun avis,أعمال,خدمات مالية ومحاسبية,"مالية, اكسيل, محاسبه, تقارير مالية, قوائم مالية",https://khamsat.com/business/accounting-bookkeeping/3553485-%D9%85%D8%AF%D9%8A%D8%B1-%D8%AD%D8%B3%D8%A7%D8%A8%D8%A7%D8%AA-%D8%B9%D9%86-%D8%A8%D8%B9%D8%AF-%D9%84%D8%B6%D8%A8%D8%B7-%D8%AD%D8%B3%D8%A7%D8%A8%D8%A7%D8%AA%D9%83-%D9%88%D8%A7%D8%B9%D9%85%D8%A7%D9%84%D9%83-%D9%88%D8%AA%D8%AD%D9%82%D9%8A%D9%82-%D8%A7%D8%B1%D8%A8%D8%A7%D8%AD%D9%83
تسجيل من اول قيد اليوميه وحتي القوائم المالية,.Mohanad N,0,0,Aucun avis,أعمال,خدمات مالية ومحاسبية,"حسابات, مراجعة, مالية, قيود, اكسيل",https://khamsat.com/business/accounting-bookkeeping/3472536-%D8%AA%D8%B3%D8%AC%D9%8A%D9%84-%D9%85%D9%86-%D8%A7%D9%88%D9%84-%D9%82%D9%8A%D8%AF-%D8%A7%D9%84%D9%8A%D9%88%D9%85%D9%8A%D9%87-%D9%88%D8%AD%D8%AA%D9%8A-%D8%A7%D9%84%D9%82%D9%88%D8%A7%D8%A6%D9%85-%D8%A7%D9%84%D9%85%D8%A7%D9%84%D9%8A%D8%A9
خدمة المراجعة و الضرائب و اعداد التقارير المالية,اسلام ح.,0,0,Aucun avis,أعمال,خدمات مالية ومحاسبية,"محاسبة, اعداد, اكسيل, تقارير مالية, قوائم مالية",https://khamsat.com/business/tax/3367724-%D8%AE%D8%AF%D9%85%D8%A9-%D8%A7%D9%84%D9%85%D8%B1%D8%A7%D8%AC%D8%B9%D8%A9-%D9%88-%D8%A7%D9%84%D8%B6%D8%B1%D8%A7%D8%A6%D8%A8-%D9%88-%D8%A7%D8%B9%D8%AF%D8%A7%D8%AF-%D8%A7%D9%84%D8%AA%D9%82%D8%A7%D8%B1%D9%8A%D8%B1-%D8%A7%D9%84%D9%85%D8%A7%D9%84%D9%8A%D8%A9
محاسبة ومسك الدفاتر وإعداد القيود المحاسبية وتنظيم الحسابات,.Aysar A,0,0,Aucun avis,أعمال,خدمات مالية ومحاسبية,"محاسبة, مسك, دفاتر, محاسب, تقارير مالية",https://khamsat.com/business/accounting-bookkeeping/3779789-%D9%85%D8%AD%D8%A7%D8%B3%D8%A8%D8%A9-%D9%88%D9%85%D8%B3%D9%83-%D8%A7%D9%84%D8%AF%D9%81%D8%A7%D8%AA%D8%B1-%D9%88%D8%A5%D8%B9%D8%AF%D8%A7%D8%AF-%D8%A7%D9%84%D9%82%D9%8A%D9%88%D8%AF-%D8%A7%D9%84%D9%85%D8%AD%D8%A7%D8%B3%D8%A8%D9%8A%D8%A9-%D9%88%D8%AA%D9%86%D8%B8%D9%8A%D9%85-%D8%A7%D9%84%D8%AD%D8%B3%D8%A7%D8%A8%D8%A7%D8%AA
برنامج لإدارة المشتريات والمبيعات والمخازن,.Khaled M,0,0,Aucun avis,أعمال,خدمات مالية ومحاسبية,"مبيعات, برنامج, محاسبة, اكسيل, مخازن",https://khamsat.com/business/accounting-bookkeeping/3780882-%D8%A8%D8%B1%D9%86%D8%A7%D9%85%D8%AC-%D9%84%D8%A5%D8%AF%D8%A7%D8%B1%D8%A9-%D8%A7%D9%84%D9%85%D8%B4%D8%AA%D8%B1%D9%8A%D8%A7%D8%AA-%D9%88%D8%A7%D9%84%D9%85%D8%A8%D9%8A%D8%B9%D8%A7%D8%AA-%D9%88%D8%A7%D9%84%D9%85%D8%AE%D8%A7%D8%B2%D9%86
اعداد ومراجعة الإقرارات الضريبية في الأردن للأفراد والشركات,مراد ا.,0,0,Aucun avis,أعمال,خدمات مالية ومحاسبية,"استشارات, تحليل, محاسبة, فواتير, ضريبة",https://khamsat.com/business/tax/3350449-%D8%A7%D8%B9%D8%AF%D8%A7%D8%AF-%D9%88%D9%85%D8%B1%D8%A7%D8%AC%D8%B9%D8%A9-%D8%A7%D9%84%D8%A5%D9%82%D8%B1%D8%A7%D8%B1%D8%A7%D8%AA-%D8%A7%D9%84%D8%B6%D8%B1%D9%8A%D8%A8%D9%8A%D8%A9-%D9%81%D9%8A-%D8%A7%D9%84%D8%A3%D8%B1%D8%AF%D9%86-%D9%84%D9%84%D8%A3%D9%81%D8%B1%D8%A7%D8%AF-%D9%88%D8%A7%D9%84%D8%B4%D8%B1%D9%83%D8%A7%D8%AA
اعداد ورفع الاقرار الضريبى,اسامه ع.,0,0,Aucun avis,أعمال,خدمات مالية ومحاسبية,"السعودية, الحسابات, ضريبة, المضافة",https://khamsat.com/business/tax/3628116-%D8%A7%D8%B9%D8%AF%D8%A7%D8%AF-%D9%88%D8%B1%D9%81%D8%B9-%D8%A7%D9%84%D8%A7%D9%82%D8%B1%D8%A7%D8%B1-%D8%A7%D9%84%D8%B6%D8%B1%D9%8A%D8%A8%D9%89
مسك الدفاتر المحاسبية وإعداد التقارير المالية,مراد ا.,0,0,Aucun avis,أعمال,خدمات مالية ومحاسبية,"خدمات, محاسبة, إدخال, قيود, تقارير مالية",https://khamsat.com/business/accounting-bookkeeping/3348008-%D9%85%D8%B3%D9%83-%D8%A7%D9%84%D8%AF%D9%81%D8%A7%D8%AA%D8%B1-%D8%A7%D9%84%D9%85%D8%AD%D8%A7%D8%B3%D8%A8%D9%8A%D8%A9-%D9%88%D8%A5%D8%B9%D8%AF%D8%A7%D8%AF-%D8%A7%D9%84%D8%AA%D9%82%D8%A7%D8%B1%D9%8A%D8%B1-%D8%A7%D9%84%D9%85%D8%A7%D9%84%D9%8A%D8%A9
محاسب عن بعد لتنظيم الادارة المالية واعداد التقارير المالية,.Ahmed R,0,0,Aucun avis,أعمال,خدمات مالية ومحاسبية,"محاسبة, اكسل, ميزانية, تقارير مالية, قوائم مالية",https://khamsat.com/business/accounting-bookkeeping/3737636-%D9%85%D8%AD%D8%A7%D8%B3%D8%A8-%D8%B9%D9%86-%D8%A8%D8%B9%D8%AF-%D9%84%D8%AA%D9%86%D8%B8%D9%8A%D9%85-%D8%A7%D9%84%D8%A7%D8%AF%D8%A7%D8%B1%D8%A9-%D8%A7%D9%84%D9%85%D8%A7%D9%84%D9%8A%D8%A9-%D9%88%D8%A7%D8%B9%D8%AF%D8%A7%D8%AF-%D8%A7%D9%84%D8%AA%D9%82%D8%A7%D8%B1%D9%8A%D8%B1-%D8%A7%D9%84%D9%85%D8%A7%D9%84%D9%8A%D8%A9
تصميم شيت Excel احترافي لإدارة الخزنة ودفتر اليومية,.Khaled A,0,0,Aucun avis,أعمال,خدمات مالية ومحاسبية,"excel, حسابات, محاسبة, اكسيل, الدفاتر",https://khamsat.com/business/accounting-bookkeeping/3680281-%D8%AA%D8%B5%D9%85%D9%8A%D9%85-%D8%B4%D9%8A%D8%AA-excel-%D8%A7%D8%AD%D8%AA%D8%B1%D8%A7%D9%81%D9%8A-%D9%84%D8%A5%D8%AF%D8%A7%D8%B1%D8%A9-%D8%A7%D9%84%D8%AE%D8%B2%D9%86%D8%A9-%D9%88%D8%AF%D9%81%D8%AA%D8%B1-%D8%A7%D9%84%D9%8A%D9%88%D9%85%D9%8A%D8%A9
محاسب عن بعد وإعداد القوائم المالية,كيرلس ح.,0,0,Aucun avis,أعمال,خدمات مالية ومحاسبية,"مراجعة, اكسل, محاسبية, الحسابات, قوائم مالية",https://khamsat.com/business/accounting-bookkeeping/2925104-%D9%85%D8%AD%D8%A7%D8%B3%D8%A8-%D8%B9%D9%86-%D8%A8%D8%B9%D8%AF-%D9%88%D8%A5%D8%B9%D8%AF%D8%A7%D8%AF-%D8%A7%D9%84%D9%82%D9%88%D8%A7%D8%A6%D9%85-%D8%A7%D9%84%D9%85%D8%A7%D9%84%D9%8A%D8%A9
سأعدّ لك تقارير مالية أو جداول محاسبية دقيقة باستخدام Exce,.Thaer A,0,0,Aucun avis,أعمال,خدمات مالية ومحاسبية,"قائمة, قوائم, تقارير, مالية, مالي",https://khamsat.com/business/accounting-bookkeeping/3425185-%D8%B3%D8%A3%D8%B9%D8%AF-%D9%84%D9%83-%D8%AA%D9%82%D8%A7%D8%B1%D9%8A%D8%B1-%D9%85%D8%A7%D9%84%D9%8A%D8%A9-%D8%A3%D9%88-%D8%AC%D8%AF%D8%A7%D9%88%D9%84-%D9%85%D8%AD%D8%A7%D8%B3%D8%A8%D9%8A%D8%A9-%D8%AF%D9%82%D9%8A%D9%82%D8%A9-%D8%A8%D8%A7%D8%B3%D8%AA%D8%AE%D8%AF%D8%A7%D9%85-exce
إعداد قيود اليومية الشهرية لنشاطك التجاري باحتراف,سالم ب.,0,0,Aucun avis,أعمال,خدمات مالية ومحاسبية,"محاسب, قيود يومية, تنظيم دفاتر, تقارير شهرية, محاسبة مشاريع صغيرة",https://khamsat.com/business/accounting-bookkeeping/3333799-%D8%A5%D8%B9%D8%AF%D8%A7%D8%AF-%D9%82%D9%8A%D9%88%D8%AF-%D8%A7%D9%84%D9%8A%D9%88%D9%85%D9%8A%D8%A9-%D8%A7%D9%84%D8%B4%D9%87%D8%B1%D9%8A%D8%A9-%D9%84%D9%86%D8%B4%D8%A7%D8%B7%D9%83-%D8%A7%D9%84%D8%AA%D8%AC%D8%A7%D8%B1%D9%8A-%D8%A8%D8%A7%D8%AD%D8%AA%D8%B1%D8%A7%D9%81
إدخال بيانات محاسبية على Excel أو برنامج محاسبى,.Masoud M,0,0,Aucun avis,أعمال,خدمات مالية ومحاسبية,"excel, محاسبة, اكسل, data entry, إدخال بيانات",https://khamsat.com/business/accounting-bookkeeping/3664005-%D8%A5%D8%AF%D8%AE%D8%A7%D9%84-%D8%A8%D9%8A%D8%A7%D9%86%D8%A7%D8%AA-%D9%85%D8%AD%D8%A7%D8%B3%D8%A8%D9%8A%D8%A9-%D8%B9%D9%84%D9%89-excel-%D8%A3%D9%88-%D8%A8%D8%B1%D9%86%D8%A7%D9%85%D8%AC-%D9%85%D8%AD%D8%A7%D8%B3%D8%A8%D9%89
سأقوم بإعداد وتحليل جداول Excel مالية وميزانيات باحترافية,صابر ا.,0,0,Aucun avis,أعمال,خدمات مالية ومحاسبية,"محاسبة, تقارير, ادخال بيانات, microsoft excel, تقارير مالية",https://khamsat.com/business/financial-analysis/3540241-%D8%B3%D8%A3%D9%82%D9%88%D9%85-%D8%A8%D8%A5%D8%B9%D8%AF%D8%A7%D8%AF-%D9%88%D8%AA%D8%AD%D9%84%D9%8A%D9%84-%D8%AC%D8%AF%D8%A7%D9%88%D9%84-excel-%D9%85%D8%A7%D9%84%D9%8A%D8%A9-%D9%88%D9%85%D9%8A%D8%B2%D8%A7%D9%86%D9%8A%D8%A7%D8%AA-%D8%A8%D8%A7%D8%AD%D8%AA%D8%B1%D8%A7%D9%81%D9%8A%D8%A9
ملف اكسيل للخزينة لتنظيم الايرادات والمصروفات,مروان ع.,0,0,Aucun avis,أعمال,خدمات مالية ومحاسبية,"excel, حسابات, برنامج, ملف, اكسيل",https://khamsat.com/business/accounting-bookkeeping/3270914-%D9%85%D9%84%D9%81-%D8%A7%D9%83%D8%B3%D9%8A%D9%84-%D9%84%D9%84%D8%AE%D8%B2%D9%8A%D9%86%D8%A9-%D9%84%D8%AA%D9%86%D8%B8%D9%8A%D9%85-%D8%A7%D9%84%D8%A7%D9%8A%D8%B1%D8%A7%D8%AF%D8%A7%D8%AA-%D9%88%D8%A7%D9%84%D9%85%D8%B5%D8%B1%D9%88%D9%81%D8%A7%D8%AA
إعداد القيود اليومية وترحيلها بدقة,عبدالإله ا.,0,0,Aucun avis,أعمال,خدمات مالية ومحاسبية,"excel, حسابات, قوائم, قيود, الدفاتر",https://khamsat.com/business/accounting-bookkeeping/3663966-%D8%A5%D8%B9%D8%AF%D8%A7%D8%AF-%D8%A7%D9%84%D9%82%D9%8A%D9%88%D8%AF-%D8%A7%D9%84%D9%8A%D9%88%D9%85%D9%8A%D8%A9-%D9%88%D8%AA%D8%B1%D8%AD%D9%8A%D9%84%D9%87%D8%A7-%D8%A8%D8%AF%D9%82%D8%A9
"إعداد فواتير وتقارير مالية احترافية باستخدام Excel , Word",.Nada Q,0,0,Aucun avis,أعمال,خدمات مالية ومحاسبية,"محاسبة, اكسيل, تحليل مالي, تقارير مالية, فواتير",https://khamsat.com/business/accounting-bookkeeping/3543606-%D8%A5%D8%B9%D8%AF%D8%A7%D8%AF-%D9%81%D9%88%D8%A7%D8%AA%D9%8A%D8%B1-%D9%88%D8%AA%D9%82%D8%A7%D8%B1%D9%8A%D8%B1-%D9%85%D8%A7%D9%84%D9%8A%D8%A9-%D8%A7%D8%AD%D8%AA%D8%B1%D8%A7%D9%81%D9%8A%D8%A9-%D8%A8%D8%A7%D8%B3%D8%AA%D8%AE%D8%AF%D8%A7%D9%85-excel-word
إعداد الإقرار الضريبي لضريبة القيمة المضافة,.Mohammed A,0,0,Aucun avis,أعمال,خدمات مالية ومحاسبية,"ضرائب, القيمة, الزكاة, ضريبة, المضافة",https://khamsat.com/business/tax/3343769-%D8%A5%D8%B9%D8%AF%D8%A7%D8%AF-%D8%A7%D9%84%D8%A5%D9%82%D8%B1%D8%A7%D8%B1-%D8%A7%D9%84%D8%B6%D8%B1%D9%8A%D8%A8%D9%8A-%D9%84%D8%B6%D8%B1%D9%8A%D8%A8%D8%A9-%D8%A7%D9%84%D9%82%D9%8A%D9%85%D8%A9-%D8%A7%D9%84%D9%85%D8%B6%D8%A7%D9%81%D8%A9
VAT إعداد اقرار ضريبة القيمة المضافة,عبدالعزيز ا.,0,0,Aucun avis,أعمال,خدمات مالية ومحاسبية,"محاسبة, ضريبة, المحاسبة المالية, ضريبة القيمة المضافة, خدمات مسك الدفاتر المحاسبية",https://khamsat.com/business/tax/3544591-vat-%D8%A5%D8%B9%D8%AF%D8%A7%D8%AF-%D8%A7%D9%82%D8%B1%D8%A7%D8%B1-%D8%B6%D8%B1%D9%8A%D8%A8%D8%A9-%D8%A7%D9%84%D9%82%D9%8A%D9%85%D8%A9-%D8%A7%D9%84%D9%85%D8%B6%D8%A7%D9%81%D8%A9
محاسبة عن بعد ومسك الدفاتر للشركة او المؤسسة للسعودية,.Hosny G,0,0,Aucun avis,أعمال,خدمات مالية ومحاسبية,"حسابات, محاسبة, دليل, اكسيل, تأسيس",https://khamsat.com/business/accounting-bookkeeping/3074365-%D9%85%D8%AD%D8%A7%D8%B3%D8%A8%D8%A9-%D8%B9%D9%86-%D8%A8%D8%B9%D8%AF-%D9%88%D9%85%D8%B3%D9%83-%D8%A7%D9%84%D8%AF%D9%81%D8%A7%D8%AA%D8%B1-%D9%84%D9%84%D8%B4%D8%B1%D9%83%D8%A9-%D8%A7%D9%88-%D8%A7%D9%84%D9%85%D8%A4%D8%B3%D8%B3%D8%A9-%D9%84%D9%84%D8%B3%D8%B9%D9%88%D8%AF%D9%8A%D8%A9
محاسبة وإعداد القوائم المالية وفقًا للمعايير الدولية IFRS,.Ahmed E,0,0,Aucun avis,أعمال,خدمات مالية ومحاسبية,"حسابات, محاسبة, قيود, ميزانية, محاسبية",https://khamsat.com/business/accounting-bookkeeping/3690912-%D9%85%D8%AD%D8%A7%D8%B3%D8%A8%D8%A9-%D9%88%D8%A5%D8%B9%D8%AF%D8%A7%D8%AF-%D8%A7%D9%84%D9%82%D9%88%D8%A7%D8%A6%D9%85-%D8%A7%D9%84%D9%85%D8%A7%D9%84%D9%8A%D8%A9-%D9%88%D9%81%D9%82%D8%A7-%D9%84%D9%84%D9%85%D8%B9%D8%A7%D9%8A%D9%8A%D8%B1-%D8%A7%D9%84%D8%AF%D9%88%D9%84%D9%8A%D8%A9-ifrs
شيت Excel بروفيشنال لإدارة الموظفين والرواتب مع تقارير وحضور,.Basel F,0,0,Aucun avis,أعمال,خدمات مالية ومحاسبية,"شيت excel, محاسبة excel, رواتب الموظفين, إدارة موظفين, حساب المرتبات",https://khamsat.com/business/accounting-bookkeeping/3668983-%D8%B4%D9%8A%D8%AA-excel-%D8%A8%D8%B1%D9%88%D9%81%D9%8A%D8%B4%D9%86%D8%A7%D9%84-%D9%84%D8%A5%D8%AF%D8%A7%D8%B1%D8%A9-%D8%A7%D9%84%D9%85%D9%88%D8%B8%D9%81%D9%8A%D9%86-%D9%88%D8%A7%D9%84%D8%B1%D9%88%D8%A7%D8%AA%D8%A8-%D9%85%D8%B9-%D8%AA%D9%82%D8%A7%D8%B1%D9%8A%D8%B1-%D9%88%D8%AD%D8%B6%D9%88%D8%B1
إعداد تقارير مالية وميزانيات احترافية على Excel,احمد م.,0,0,Aucun avis,أعمال,خدمات مالية ومحاسبية,"كتابة, مقالات, pdf, microsoft excel, exel",https://khamsat.com/business/financial-analysis/3477263-%D8%A5%D8%B9%D8%AF%D8%A7%D8%AF-%D8%AA%D9%82%D8%A7%D8%B1%D9%8A%D8%B1-%D9%85%D8%A7%D9%84%D9%8A%D8%A9-%D9%88%D9%85%D9%8A%D8%B2%D8%A7%D9%86%D9%8A%D8%A7%D8%AA-%D8%A7%D8%AD%D8%AA%D8%B1%D8%A7%D9%81%D9%8A%D8%A9-%D8%B9%D9%84%D9%89-excel
حلول محاسبية متكاملة: تنظيم الدفاتر وإعداد تقارير مالية.,محمد ر.,0,0,Aucun avis,أعمال,خدمات مالية ومحاسبية,"حسابات, إدخال, أكسل, تقارير مالية, قوائم مالية",https://khamsat.com/business/financial-statements/3526704-%D8%AD%D9%84%D9%88%D9%84-%D9%85%D8%AD%D8%A7%D8%B3%D8%A8%D9%8A%D8%A9-%D9%85%D8%AA%D9%83%D8%A7%D9%85%D9%84%D8%A9-%D8%AA%D9%86%D8%B8%D9%8A%D9%85-%D8%A7%D9%84%D8%AF%D9%81%D8%A7%D8%AA%D8%B1-%D9%88%D8%A5%D8%B9%D8%AF%D8%A7%D8%AF-%D8%AA%D9%82%D8%A7%D8%B1%D9%8A%D8%B1-%D9%85%D8%A7%D9%84%D9%8A%D8%A9
اعداد القوائم المالية الدخل والميزانية بدقة عالية,ريم م.,0,0,Aucun avis,أعمال,خدمات مالية ومحاسبية,"excel, محاسبة, ميزانية, قوائم مالية, قائمة دخل",https://khamsat.com/business/financial-statements/3766708-%D8%A7%D8%B9%D8%AF%D8%A7%D8%AF-%D8%A7%D9%84%D9%82%D9%88%D8%A7%D8%A6%D9%85-%D8%A7%D9%84%D9%85%D8%A7%D9%84%D9%8A%D8%A9-%D8%A7%D9%84%D8%AF%D8%AE%D9%84-%D9%88%D8%A7%D9%84%D9%85%D9%8A%D8%B2%D8%A7%D9%86%D9%8A%D8%A9-%D8%A8%D8%AF%D9%82%D8%A9-%D8%B9%D8%A7%D9%84%D9%8A%D8%A9
اعداد ومراجعة القوائم المالية السنوية كاملة بجميع مرفقاتها,.Mohamed T,0,0,Aucun avis,أعمال,خدمات مالية ومحاسبية,"ميزانية, تقارير مالية, تحليل بيانات, الحسابات, قوائم مالية",https://khamsat.com/business/financial-statements/3588975-%D8%A7%D8%B9%D8%AF%D8%A7%D8%AF-%D9%88%D9%85%D8%B1%D8%A7%D8%AC%D8%B9%D8%A9-%D8%A7%D9%84%D9%82%D9%88%D8%A7%D8%A6%D9%85-%D8%A7%D9%84%D9%85%D8%A7%D9%84%D9%8A%D8%A9-%D8%A7%D9%84%D8%B3%D9%86%D9%88%D9%8A%D8%A9-%D9%83%D8%A7%D9%85%D9%84%D8%A9-%D8%A8%D8%AC%D9%85%D9%8A%D8%B9-%D9%85%D8%B1%D9%81%D9%82%D8%A7%D8%AA%D9%87%D8%A7
تقديم اقرار القيمة المضافة VAT Declaration,منةالله ا.,0,0,Aucun avis,أعمال,خدمات مالية ومحاسبية,"ضرائب, قيمة_مضافة, اقرار_ضريبى, خدمات_ضريبية, اقرار_قيمة_مضافة",https://khamsat.com/business/tax/3686711-%D8%AA%D9%82%D8%AF%D9%8A%D9%85-%D8%A7%D9%82%D8%B1%D8%A7%D8%B1-%D8%A7%D9%84%D9%82%D9%8A%D9%85%D8%A9-%D8%A7%D9%84%D9%85%D8%B6%D8%A7%D9%81%D8%A9-vat-declaration
محاسب للعمل على برنامج ساب  Sap Business One,احمد ي.,0,0,Aucun avis,أعمال,خدمات مالية ومحاسبية,"محاسبة, data entry, تحليل مالي, accounting, sap",https://khamsat.com/business/accounting-bookkeeping/3582339-%D9%85%D8%AD%D8%A7%D8%B3%D8%A8-%D9%84%D9%84%D8%B9%D9%85%D9%84-%D8%B9%D9%84%D9%89-%D8%A8%D8%B1%D9%86%D8%A7%D9%85%D8%AC-%D8%B3%D8%A7%D8%A8-sap-business-one
تحليل مالي باستخدام Power BI,.Youssef M,0,0,Aucun avis,أعمال,خدمات مالية ومحاسبية,"محاسبة, financial, قوائم مالية, visualization, powerbi",https://khamsat.com/business/financial-analysis/3786293-%D8%AA%D8%AD%D9%84%D9%8A%D9%84-%D9%85%D8%A7%D9%84%D9%8A-%D8%A8%D8%A7%D8%B3%D8%AA%D8%AE%D8%AF%D8%A7%D9%85-powerbi
