Titre,Vendeur,Acheteurs,Notes,Date Dernier Avis,Catégorie,Sous-Catégorie,Mots Clés,Lien
كتابة محتوى مواقع باللغات العربية الإنكليزية والألمانية,آية ا.,12,6,منذ سنتين و6 أشهر,كتابة وترجمة,محتوى مواقع,"مواقع, كتابة محتوى, تسويقي, كوبي, رايتنغ",https://khamsat.com/writing/articles-blogposts/2303626-%D9%83%D8%AA%D8%A7%D8%A8%D8%A9-%D9%85%D8%AD%D8%AA%D9%88%D9%89-%D9%85%D9%88%D8%A7%D9%82%D8%B9-%D8%A8%D8%A7%D9%84%D9%84%D8%BA%D8%A7%D8%AA-%D8%A7%D9%84%D8%B9%D8%B1%D8%A8%D9%8A%D8%A9-%D8%A7%D9%84%D8%A5%D9%86%D9%83%D9%84%D9%8A%D8%B2%D9%8A%D8%A9-%D9%88%D8%A7%D9%84%D8%A3%D9%84%D9%85%D8%A7%D9%86%D9%8A%D8%A9
كتابة مقالات SEO احترافية مضمونة للظهور في نتائج البحث الأولى,محمود ش.,2,1,منذ 4 أشهر و16 يوم,كتابة وترجمة,محتوى مواقع,"تصميم, مواقع, كتابة, مقالات, word",https://khamsat.com/writing/articles-blogposts/3262061-%D9%83%D8%AA%D8%A7%D8%A8%D8%A9-%D9%85%D9%82%D8%A7%D9%84%D8%A7%D8%AA-seo-%D8%A7%D8%AD%D8%AA%D8%B1%D8%A7%D9%81%D9%8A%D8%A9-%D9%85%D8%B6%D9%85%D9%88%D9%86%D8%A9-%D9%84%D9%84%D8%B8%D9%87%D9%88%D8%B1-%D9%81%D9%8A-%D9%86%D8%AA%D8%A7%D8%A6%D8%AC-%D8%A7%D9%84%D8%A8%D8%AD%D8%AB-%D8%A7%D9%84%D8%A3%D9%88%D9%84%D9%89
كتابة مقالات احترافية سيو قوي جدا,محمد إ.,2,1,منذ شهر و5 أيام,كتابة وترجمة,محتوى مواقع,"ووردبريس, مواقع, كتابة, مقالات, سيو",https://khamsat.com/writing/articles-blogposts/3669421-%D9%83%D8%AA%D8%A7%D8%A8%D8%A9-%D9%85%D9%82%D8%A7%D9%84%D8%A7%D8%AA-%D8%A7%D8%AD%D8%AA%D8%B1%D8%A7%D9%81%D9%8A%D8%A9-%D8%B3%D9%8A%D9%88-%D9%82%D9%88%D9%8A-%D8%AC%D8%AF%D8%A7
نشر جيست بوست دوفولو علي موقعي التقني الشخصي (itechmobik),.Shawky A,3,0,Aucun avis,كتابة وترجمة,محتوى مواقع,"مقالات, seo, باك لينك, بوست, جيست بوست",https://khamsat.com/writing/articles-blogposts/2905077-%D9%86%D8%B4%D8%B1-%D8%AC%D9%8A%D8%B3%D8%AA-%D8%A8%D9%88%D8%B3%D8%AA-%D8%AF%D9%88%D9%81%D9%88%D9%84%D9%88-%D8%B9%D9%84%D9%8A-%D9%85%D9%88%D9%82%D8%B9%D9%8A-%D8%A7%D9%84%D8%AA%D9%82%D9%86%D9%8A-%D8%A7%D9%84%D8%B4%D8%AE%D8%B5%D9%8A-itechmobik
كتابة مقالات عربية وإنكليزية احترافية متوافقة مع SEO,.Ruba I,17,16,منذ 5 أشهر و10 أيام,كتابة وترجمة,محتوى مواقع,"بحث, كتابة, محتوى, مقال, seo",https://khamsat.com/writing/articles-blogposts/2401277-%D9%83%D8%AA%D8%A7%D8%A8%D8%A9-%D9%85%D9%82%D8%A7%D9%84%D8%A7%D8%AA-%D8%B9%D8%B1%D8%A8%D9%8A%D8%A9-%D9%88%D8%A5%D9%86%D9%83%D9%84%D9%8A%D8%B2%D9%8A%D8%A9-%D8%A7%D8%AD%D8%AA%D8%B1%D8%A7%D9%81%D9%8A%D8%A9-%D9%85%D8%AA%D9%88%D8%A7%D9%81%D9%82%D8%A9-%D9%85%D8%B9-seo
سأعطيك 8مليون مقال و5 الاف كتاب,.Miloud C,48,28,منذ شهر و8 أيام,كتابة وترجمة,محتوى مواقع,"مقالات, كتب, مال, pdf, بيع, كسب, plr, articles, سيو, حصري",https://khamsat.com/writing/articles-blogposts/1467688-%D8%B3%D8%A3%D8%B9%D8%B7%D9%8A%D9%83-8%D9%85%D9%84%D9%8A%D9%88%D9%86-%D9%85%D9%82%D8%A7%D9%84-%D9%885-%D8%A7%D9%84%D8%A7%D9%81-%D9%83%D8%AA%D8%A7%D8%A8
كتابة مقالات علمية رياضية واقتصادية,عبدالرحمن أ.,2,1,منذ 7 أشهر و13 يوم,كتابة وترجمة,محتوى مواقع,"كتابة, مقالات, سيو, مقالات حصرية, محتوى مواقع",https://khamsat.com/writing/articles-blogposts/3169596-%D9%83%D8%AA%D8%A7%D8%A8%D8%A9-%D9%85%D9%82%D8%A7%D9%84%D8%A7%D8%AA-%D8%B9%D9%84%D9%85%D9%8A%D8%A9-%D8%B1%D9%8A%D8%A7%D8%B6%D9%8A%D8%A9-%D9%88%D8%A7%D9%82%D8%AA%D8%B5%D8%A7%D8%AF%D9%8A%D8%A9
مقالات فريدة وممتعة عن عالم القطط,خولة ط.,1,1,منذ 4 أشهر و7 أيام,كتابة وترجمة,محتوى مواقع,"مدونة, كتابة, مقالات, word",https://khamsat.com/writing/articles-blogposts/3378823-%D9%85%D9%82%D8%A7%D9%84%D8%A7%D8%AA-%D9%81%D8%B1%D9%8A%D8%AF%D8%A9-%D9%88%D9%85%D9%85%D8%AA%D8%B9%D8%A9-%D8%B9%D9%86-%D8%B9%D8%A7%D9%84%D9%85-%D8%A7%D9%84%D9%82%D8%B7%D8%B7
كتابة مقالة عن السيارات (مراجعة سيارة),.Nawar W,9,6,منذ 7 أشهر و5 أيام,كتابة وترجمة,محتوى مواقع,"موقع, سيارة, الكتروني, سيو",https://khamsat.com/writing/articles-blogposts/1713806-%D9%83%D8%AA%D8%A7%D8%A8%D8%A9-%D9%85%D9%82%D8%A7%D9%84%D8%A9-%D8%B9%D9%86-%D8%A7%D9%84%D8%B3%D9%8A%D8%A7%D8%B1%D8%A7%D8%AA-%D9%85%D8%B1%D8%A7%D8%AC%D8%B9%D8%A9-%D8%B3%D9%8A%D8%A7%D8%B1%D8%A9
كتابة المقالات بطريقة احترافية,.Mahmoud E,11,9,منذ سنة وشهر,كتابة وترجمة,محتوى مواقع,"كتابة, مقالات, محتوى, علمية, كتابة ابداعية",https://khamsat.com/writing/articles-blogposts/2308297-%D9%83%D8%AA%D8%A7%D8%A8%D8%A9-%D8%A7%D9%84%D9%85%D9%82%D8%A7%D9%84%D8%A7%D8%AA-%D8%A8%D8%B7%D8%B1%D9%8A%D9%82%D8%A9-%D8%A7%D8%AD%D8%AA%D8%B1%D8%A7%D9%81%D9%8A%D8%A9
كتابة مقالات essay باللغة الإنجليزية في أي موضوع,آية ك.,41,27,منذ سنة ويومين,كتابة وترجمة,محتوى مواقع,"مقالات, مقال, إنجليزية, essay, apa",https://khamsat.com/writing/articles-blogposts/1713320-%D9%83%D8%AA%D8%A7%D8%A8%D8%A9-%D9%85%D9%82%D8%A7%D9%84%D8%A7%D8%AA-essay-%D8%A8%D8%A7%D9%84%D9%84%D8%BA%D8%A9-%D8%A7%D9%84%D8%A5%D9%86%D8%AC%D9%84%D9%8A%D8%B2%D9%8A%D8%A9-%D9%81%D9%8A-%D8%A3%D9%8A-%D9%85%D9%88%D8%B6%D9%88%D8%B9
كتابة مقالات ومحتوى أصلي بالعربية والإنجليزية، بقواعد السيو,إشراقة س.,6,4,منذ 5 أشهر و12 يوم,كتابة وترجمة,محتوى مواقع,"كتابة, مقالات, كتابة محتوى مواقع, كتابة محتوى, سيو",https://khamsat.com/writing/articles-blogposts/2978083-%D9%83%D8%AA%D8%A7%D8%A8%D8%A9-%D9%85%D9%82%D8%A7%D9%84%D8%A7%D8%AA-%D9%88%D9%85%D8%AD%D8%AA%D9%88%D9%89-%D8%A3%D8%B5%D9%84%D9%8A-%D8%A8%D8%A7%D9%84%D8%B9%D8%B1%D8%A8%D9%8A%D8%A9-%D9%88%D8%A7%D9%84%D8%A5%D9%86%D8%AC%D9%84%D9%8A%D8%B2%D9%8A%D8%A9-%D8%A8%D9%82%D9%88%D8%A7%D8%B9%D8%AF-%D8%A7%D9%84%D8%B3%D9%8A%D9%88
كتابة مقالات حصرية لمدونتك تتصدر محركات البحث,محمد ع.,1,1,منذ سنة و21 يوم,كتابة وترجمة,محتوى مواقع,"مدونة, كتابة, مقالات, حصرية, seo",https://khamsat.com/writing/articles-blogposts/3043513-%D9%83%D8%AA%D8%A7%D8%A8%D8%A9-%D9%85%D9%82%D8%A7%D9%84%D8%A7%D8%AA-%D8%AD%D8%B5%D8%B1%D9%8A%D8%A9-%D9%84%D9%85%D8%AF%D9%88%D9%86%D8%AA%D9%83-%D8%AA%D8%AA%D8%B5%D8%AF%D8%B1-%D9%85%D8%AD%D8%B1%D9%83%D8%A7%D8%AA-%D8%A7%D9%84%D8%A8%D8%AD%D8%AB
كتابة مقالات موافقة لمعايير السيو SEO,.Eman H,16,14,منذ سنتين و3 أشهر,كتابة وترجمة,محتوى مواقع,"عربي, ووردبريس, كتابه, مواقع, كتابة, مقالات, مقال, seo, كتابة مقالات, سيو",https://khamsat.com/writing/articles-blogposts/2487287-%D9%83%D8%AA%D8%A7%D8%A8%D8%A9-%D9%85%D9%82%D8%A7%D9%84%D8%A7%D8%AA-%D9%85%D9%88%D8%A7%D9%81%D9%82%D8%A9-%D9%84%D9%85%D8%B9%D8%A7%D9%8A%D9%8A%D8%B1-%D8%A7%D9%84%D8%B3%D9%8A%D9%88-seo
كتابة مقالات طبية حصرية متوافقة مع قواعد السيو,.Manal S,10,10,منذ سنتين و7 أيام,كتابة وترجمة,محتوى مواقع,"ووردبريس, كتابة محتوى, كتابة مقالات, سيو, كتابة مقالات طبية",https://khamsat.com/writing/articles-blogposts/2530226-%D9%83%D8%AA%D8%A7%D8%A8%D8%A9-%D9%85%D9%82%D8%A7%D9%84%D8%A7%D8%AA-%D8%B7%D8%A8%D9%8A%D8%A9-%D8%AD%D8%B5%D8%B1%D9%8A%D8%A9-%D9%85%D8%AA%D9%88%D8%A7%D9%81%D9%82%D8%A9-%D9%85%D8%B9-%D9%82%D9%88%D8%A7%D8%B9%D8%AF-%D8%A7%D9%84%D8%B3%D9%8A%D9%88
كتابة مقالات إبداعيّة متوافقة مع شروط السّيو,زينب ط.,4,3,منذ سنة و8 أشهر,كتابة وترجمة,محتوى مواقع,"عربي, كتابة, مقالات, تدقيق, كتابة مواضيع, رسائل حب, كتابة ابداعية, كتابة للمواقع, كتابة متوافقة مع شروط السيو",https://khamsat.com/writing/articles-blogposts/2392181-%D9%83%D8%AA%D8%A7%D8%A8%D8%A9-%D9%85%D9%82%D8%A7%D9%84%D8%A7%D8%AA-%D8%A5%D8%A8%D8%AF%D8%A7%D8%B9%D9%8A%D8%A9-%D9%85%D8%AA%D9%88%D8%A7%D9%81%D9%82%D8%A9-%D9%85%D8%B9-%D8%B4%D8%B1%D9%88%D8%B7-%D8%A7%D9%84%D8%B3%D9%8A%D9%88
كتابة مقالات تتوافق مع السيو,مروان أ.,53,34,منذ 6 أشهر و11 يوم,كتابة وترجمة,محتوى مواقع,"كتابة, مقالات, كتابة محتوى, السيو, كتابة إبداعية",https://khamsat.com/writing/articles-blogposts/1947836-%D9%83%D8%AA%D8%A7%D8%A8%D8%A9-%D9%85%D9%82%D8%A7%D9%84%D8%A7%D8%AA-%D8%AA%D8%AA%D9%88%D8%A7%D9%81%D9%82-%D9%85%D8%B9-%D8%A7%D9%84%D8%B3%D9%8A%D9%88
كتابة مقالات صحفية متنوعة في مختلف المجالات,.Ahmed M,34,27,منذ 3 أشهر و15 يوم,كتابة وترجمة,محتوى مواقع,"بحث, تلخيص, تفريغ, كتابة, مقالات, حصرية, تأليف, pdf, فكر, ورد",https://khamsat.com/writing/articles-blogposts/2261272-%D9%83%D8%AA%D8%A7%D8%A8%D8%A9-%D9%85%D9%82%D8%A7%D9%84%D8%A7%D8%AA-%D8%B5%D8%AD%D9%81%D9%8A%D8%A9-%D9%85%D8%AA%D9%86%D9%88%D8%B9%D8%A9-%D9%81%D9%8A-%D9%85%D8%AE%D8%AA%D9%84%D9%81-%D8%A7%D9%84%D9%85%D8%AC%D8%A7%D9%84%D8%A7%D8%AA
سأكتب لك  مقالات متوافقة مع شروط السيو,تهاني ع.,67,53,منذ 6 أيام و4 ساعات,كتابة وترجمة,محتوى مواقع,"مواقع, كتابة, مقالات, محتوى, وردبريس",https://khamsat.com/writing/articles-blogposts/1560261-%D8%B3%D8%A3%D9%83%D8%AA%D8%A8-%D9%84%D9%83-%D9%85%D9%82%D8%A7%D9%84%D8%A7%D8%AA-%D9%85%D8%AA%D9%88%D8%A7%D9%81%D9%82%D8%A9-%D9%85%D8%B9-%D8%B4%D8%B1%D9%88%D8%B7-%D8%A7%D9%84%D8%B3%D9%8A%D9%88
كتابة مقالات حصرية مطابقة لمعايير السيو,.Hager M,5,4,منذ 11 شهر و25 يوم,كتابة وترجمة,محتوى مواقع,"كتابة, مقالات, حصرية, سيو",https://khamsat.com/writing/articles-blogposts/1624146-%D9%83%D8%AA%D8%A7%D8%A8%D8%A9-%D9%85%D9%82%D8%A7%D9%84%D8%A7%D8%AA-%D8%AD%D8%B5%D8%B1%D9%8A%D8%A9-%D9%85%D8%B7%D8%A7%D8%A8%D9%82%D8%A9-%D9%84%D9%85%D8%B9%D8%A7%D9%8A%D9%8A%D8%B1-%D8%A7%D9%84%D8%B3%D9%8A%D9%88
كتابة محتوى باللغتين العربية والإنجليزية متوافقة مع SEO,سجى ح.,27,18,منذ سنتين وشهرين,كتابة وترجمة,محتوى مواقع,"كتابة, وورد, بريس, محتوى, seo",https://khamsat.com/writing/articles-blogposts/2286248-%D9%83%D8%AA%D8%A7%D8%A8%D8%A9-%D9%85%D8%AD%D8%AA%D9%88%D9%89-%D8%A8%D8%A7%D9%84%D9%84%D8%BA%D8%AA%D9%8A%D9%86-%D8%A7%D9%84%D8%B9%D8%B1%D8%A8%D9%8A%D8%A9-%D9%88%D8%A7%D9%84%D8%A5%D9%86%D8%AC%D9%84%D9%8A%D8%B2%D9%8A%D8%A9-%D9%85%D8%AA%D9%88%D8%A7%D9%81%D9%82%D8%A9-%D9%85%D8%B9-seo
كتابة مقال مناسب للنشر في ويكيبيديا,.Bishoy G,15,12,منذ شهر و19 يوم,كتابة وترجمة,محتوى مواقع,"كتابة, مقالات, تسويق الكتروني, النشر, ويكيبيديا",https://khamsat.com/writing/articles-blogposts/3018876-%D9%83%D8%AA%D8%A7%D8%A8%D8%A9-%D9%85%D9%82%D8%A7%D9%84-%D9%85%D9%86%D8%A7%D8%B3%D8%A8-%D9%84%D9%84%D9%86%D8%B4%D8%B1-%D9%81%D9%8A-%D9%88%D9%8A%D9%83%D9%8A%D8%A8%D9%8A%D8%AF%D9%8A%D8%A7
"كتابة مقالة عربية متوافقة مع السيو SEO, مقالات حصرية",.Mouhssine B,6,6,منذ 5 أشهر و9 أيام,كتابة وترجمة,محتوى مواقع,"كتابة, مقالة, مقالات, مقال, seo",https://khamsat.com/writing/articles-blogposts/2912602-%D9%83%D8%AA%D8%A7%D8%A8%D8%A9-%D9%85%D9%82%D8%A7%D9%84%D8%A9-%D8%B9%D8%B1%D8%A8%D9%8A%D8%A9-%D9%85%D8%AA%D9%88%D8%A7%D9%81%D9%82%D8%A9-%D9%85%D8%B9-%D8%A7%D9%84%D8%B3%D9%8A%D9%88-seo-%D9%85%D9%82%D8%A7%D9%84%D8%A7%D8%AA-%D8%AD%D8%B5%D8%B1%D9%8A%D8%A9
كتابة مقالات باللغة العربية متوافقة مع قواعد السيو,.Oula A,3,4,منذ 3 أشهر و20 يوم,كتابة وترجمة,محتوى مواقع,"عربي, كتابة محتوى, word, seo, كتابة مقالات",https://khamsat.com/writing/articles-blogposts/2789776-%D9%83%D8%AA%D8%A7%D8%A8%D8%A9-%D9%85%D9%82%D8%A7%D9%84%D8%A7%D8%AA-%D8%A8%D8%A7%D9%84%D9%84%D8%BA%D8%A9-%D8%A7%D9%84%D8%B9%D8%B1%D8%A8%D9%8A%D8%A9-%D9%85%D8%AA%D9%88%D8%A7%D9%81%D9%82%D8%A9-%D9%85%D8%B9-%D9%82%D9%88%D8%A7%D8%B9%D8%AF-%D8%A7%D9%84%D8%B3%D9%8A%D9%88
كتابة مقالات احترافية متوافقة مع السيو seo في جميع المجالات,.Hanaa S,7,4,منذ سنتين وشهر,كتابة وترجمة,محتوى مواقع,"كتابة, مقالات, محتوى, جوجل, حصرية, إحترافية, مقال, seo, سيو, كتابة المقالات",https://khamsat.com/writing/articles-blogposts/2598071-%D9%83%D8%AA%D8%A7%D8%A8%D8%A9-%D9%85%D9%82%D8%A7%D9%84%D8%A7%D8%AA-%D8%A7%D8%AD%D8%AA%D8%B1%D8%A7%D9%81%D9%8A%D8%A9-%D9%85%D8%AA%D9%88%D8%A7%D9%81%D9%82%D8%A9-%D9%85%D8%B9-%D8%A7%D9%84%D8%B3%D9%8A%D9%88-seo-%D9%81%D9%8A-%D8%AC%D9%85%D9%8A%D8%B9-%D8%A7%D9%84%D9%85%D8%AC%D8%A7%D9%84%D8%A7%D8%AA
كتابة المقالات بالعربية فن التعبير وإبداع الأفكار,فاطمة الزهراء ا.,7,6,منذ شهر و19 يوم,كتابة وترجمة,محتوى مواقع,"محتوى, كتابة مقالات, article, المقالات, مقالات حصرية",https://khamsat.com/writing/articles-blogposts/3043501-%D9%83%D8%AA%D8%A7%D8%A8%D8%A9-%D8%A7%D9%84%D9%85%D9%82%D8%A7%D9%84%D8%A7%D8%AA-%D8%A8%D8%A7%D9%84%D8%B9%D8%B1%D8%A8%D9%8A%D8%A9-%D9%81%D9%86-%D8%A7%D9%84%D8%AA%D8%B9%D8%A8%D9%8A%D8%B1-%D9%88%D8%A5%D8%A8%D8%AF%D8%A7%D8%B9-%D8%A7%D9%84%D8%A3%D9%81%D9%83%D8%A7%D8%B1
كتابة مقالات ووردبريس وبلوجر متوافقة مع السيو SEO,نزهة ا.,1,1,منذ شهرين و12 يوم,كتابة وترجمة,محتوى مواقع,"بلوجر, كتابة مقالات, الوردبريس, المقالات, السيو",https://khamsat.com/writing/articles-blogposts/3491501-%D9%83%D8%AA%D8%A7%D8%A8%D8%A9-%D9%85%D9%82%D8%A7%D9%84%D8%A7%D8%AA-%D9%88%D9%88%D8%B1%D8%AF%D8%A8%D8%B1%D9%8A%D8%B3-%D9%88%D8%A8%D9%84%D9%88%D8%AC%D8%B1-%D9%85%D8%AA%D9%88%D8%A7%D9%81%D9%82%D8%A9-%D9%85%D8%B9-%D8%A7%D9%84%D8%B3%D9%8A%D9%88-seo
كتابة مقالات متخصصة بأسلوب إنساني مؤثر,هيفاء س.,2,1,منذ 10 أيام وساعتين,كتابة وترجمة,محتوى مواقع,"كتابة, مقالات, seo, كتابة المقالات, كتابة ابداعية",https://khamsat.com/writing/articles-blogposts/3871783-%D9%83%D8%AA%D8%A7%D8%A8%D8%A9-%D9%85%D9%82%D8%A7%D9%84%D8%A7%D8%AA-%D9%85%D8%AA%D8%AE%D8%B5%D8%B5%D8%A9-%D8%A8%D8%A3%D8%B3%D9%84%D9%88%D8%A8-%D8%A5%D9%86%D8%B3%D8%A7%D9%86%D9%8A-%D9%85%D8%A4%D8%AB%D8%B1
كتابة مقالات حصرية في كافة المجالات,مصطفى ا.,95,64,منذ شهرين و23 يوم,كتابة وترجمة,محتوى مواقع,"كتابة, مقالات, صحة, حصرية, شعر, فن, ادب",https://khamsat.com/writing/articles-blogposts/625959-%D9%83%D8%AA%D8%A7%D8%A8%D8%A9-%D9%85%D9%82%D8%A7%D9%84%D8%A7%D8%AA-%D8%AD%D8%B5%D8%B1%D9%8A%D8%A9-%D9%81%D9%8A-%D9%83%D8%A7%D9%81%D8%A9-%D8%A7%D9%84%D9%85%D8%AC%D8%A7%D9%84%D8%A7%D8%AA
كتابة مقالات حصرية متوافقة مع الSEO,فرح ا.,153,119,منذ شهر و7 أيام,كتابة وترجمة,محتوى مواقع,"كتابة, مقالات, كاتبة, seo, كتابة مقالات",https://khamsat.com/writing/articles-blogposts/1755757-%D9%83%D8%AA%D8%A7%D8%A8%D8%A9-%D9%85%D9%82%D8%A7%D9%84%D8%A7%D8%AA-%D8%AD%D8%B5%D8%B1%D9%8A%D8%A9-%D9%85%D8%AA%D9%88%D8%A7%D9%81%D9%82%D8%A9-%D9%85%D8%B9-%D8%A7%D9%84seo
كتابة مقالات حصرية متوافقة مع الSEO,فرح ا.,153,119,منذ شهر و7 أيام,كتابة وترجمة,محتوى مواقع,"كتابة, مقالات, كاتبة, seo, كتابة مقالات",https://khamsat.com/writing/articles-blogposts/1755757-%D9%83%D8%AA%D8%A7%D8%A8%D8%A9-%D9%85%D9%82%D8%A7%D9%84%D8%A7%D8%AA-%D8%AD%D8%B5%D8%B1%D9%8A%D8%A9-%D9%85%D8%AA%D9%88%D8%A7%D9%81%D9%82%D8%A9-%D9%85%D8%B9-%D8%A7%D9%84seo
كتابة مقال مناسب للنشر في ويكيبيديا,.Bishoy G,15,12,منذ شهر و19 يوم,كتابة وترجمة,محتوى مواقع,"كتابة, مقالات, تسويق الكتروني, النشر, ويكيبيديا",https://khamsat.com/writing/articles-blogposts/3018876-%D9%83%D8%AA%D8%A7%D8%A8%D8%A9-%D9%85%D9%82%D8%A7%D9%84-%D9%85%D9%86%D8%A7%D8%B3%D8%A8-%D9%84%D9%84%D9%86%D8%B4%D8%B1-%D9%81%D9%8A-%D9%88%D9%8A%D9%83%D9%8A%D8%A8%D9%8A%D8%AF%D9%8A%D8%A7
"كتابة مقالة عربية متوافقة مع السيو SEO, مقالات حصرية",.Mouhssine B,6,6,منذ 5 أشهر و9 أيام,كتابة وترجمة,محتوى مواقع,"كتابة, مقالة, مقالات, مقال, seo",https://khamsat.com/writing/articles-blogposts/2912602-%D9%83%D8%AA%D8%A7%D8%A8%D8%A9-%D9%85%D9%82%D8%A7%D9%84%D8%A9-%D8%B9%D8%B1%D8%A8%D9%8A%D8%A9-%D9%85%D8%AA%D9%88%D8%A7%D9%81%D9%82%D8%A9-%D9%85%D8%B9-%D8%A7%D9%84%D8%B3%D9%8A%D9%88-seo-%D9%85%D9%82%D8%A7%D9%84%D8%A7%D8%AA-%D8%AD%D8%B5%D8%B1%D9%8A%D8%A9
خدمة لكتابة المقالات بشكل احترافي باللغة العربية او E,عبدالله ع.,2,1,منذ سنة و10 أشهر,كتابة وترجمة,محتوى مواقع,"عربية, كتابة, مقالة, مقالات, كتابة محتوى, محتوى, كتابة مقالات, المقالات, السيو, مقالات حصرية",https://khamsat.com/writing/articles-blogposts/2516822-%D8%AE%D8%AF%D9%85%D8%A9-%D9%84%D9%83%D8%AA%D8%A7%D8%A8%D8%A9-%D8%A7%D9%84%D9%85%D9%82%D8%A7%D9%84%D8%A7%D8%AA-%D8%A8%D8%B4%D9%83%D9%84-%D8%A7%D8%AD%D8%AA%D8%B1%D8%A7%D9%81%D9%8A-%D8%A8%D8%A7%D9%84%D9%84%D8%BA%D8%A9-%D8%A7%D9%84%D8%B9%D8%B1%D8%A8%D9%8A%D8%A9-%D8%A7%D9%88-e
كتابة مقالات حصرية 100% في جميع المجالات بأسلوب احترافي,.Bilal L,18,13,منذ 7 أشهر و22 يوم,كتابة وترجمة,محتوى مواقع,"مقالات, محتوى, كتابة مقال, مقالات حصرية, كتابه مقالات",https://khamsat.com/writing/articles-blogposts/1301562-%D9%83%D8%AA%D8%A7%D8%A8%D8%A9-%D9%85%D9%82%D8%A7%D9%84%D8%A7%D8%AA-%D8%AD%D8%B5%D8%B1%D9%8A%D8%A9-100-%D9%81%D9%8A-%D8%AC%D9%85%D9%8A%D8%B9-%D8%A7%D9%84%D9%85%D8%AC%D8%A7%D9%84%D8%A7%D8%AA-%D8%A8%D8%A3%D8%B3%D9%84%D9%88%D8%A8-%D8%A7%D8%AD%D8%AA%D8%B1%D8%A7%D9%81%D9%8A
كتابه مقالات لتصدر نتائج البحث عربى وانجليزى,.Ahmed S,18,17,منذ سنة و4 أشهر,كتابة وترجمة,محتوى مواقع,"مواقع, كتابة, مقالات, محتوى, مقال, seo, كلمة, كلمات, سيو, افتتاحية",https://khamsat.com/writing/articles-blogposts/2264350-%D9%83%D8%AA%D8%A7%D8%A8%D9%87-%D9%85%D9%82%D8%A7%D9%84%D8%A7%D8%AA-%D9%84%D8%AA%D8%B5%D8%AF%D8%B1-%D9%86%D8%AA%D8%A7%D8%A6%D8%AC-%D8%A7%D9%84%D8%A8%D8%AD%D8%AB-%D8%B9%D8%B1%D8%A8%D9%89-%D9%88%D8%A7%D9%86%D8%AC%D9%84%D9%8A%D8%B2%D9%89
كتابة مقالات حصرية في كافة المجالات,مصطفى ا.,95,64,منذ شهرين و23 يوم,كتابة وترجمة,محتوى مواقع,"كتابة, مقالات, صحة, حصرية, شعر, فن, ادب",https://khamsat.com/writing/articles-blogposts/625959-%D9%83%D8%AA%D8%A7%D8%A8%D8%A9-%D9%85%D9%82%D8%A7%D9%84%D8%A7%D8%AA-%D8%AD%D8%B5%D8%B1%D9%8A%D8%A9-%D9%81%D9%8A-%D9%83%D8%A7%D9%81%D8%A9-%D8%A7%D9%84%D9%85%D8%AC%D8%A7%D9%84%D8%A7%D8%AA
كتابة مقالات حصرية ومتخصصة بالعربية و الإنجليزية,.Abd Elazeam S,13,10,منذ 3 أشهر و26 يوم,كتابة وترجمة,محتوى مواقع,"ترجمة, كتابة, مقالات, pdf, word",https://khamsat.com/writing/articles-blogposts/3142651-%D9%83%D8%AA%D8%A7%D8%A8%D8%A9-%D9%85%D9%82%D8%A7%D9%84%D8%A7%D8%AA-%D8%AD%D8%B5%D8%B1%D9%8A%D8%A9-%D9%88%D9%85%D8%AA%D8%AE%D8%B5%D8%B5%D8%A9-%D8%A8%D8%A7%D9%84%D8%B9%D8%B1%D8%A8%D9%8A%D8%A9-%D9%88-%D8%A7%D9%84%D8%A5%D9%86%D8%AC%D9%84%D9%8A%D8%B2%D9%8A%D8%A9
خدمة المقالة الماسية,مصطفى ا.,16,9,منذ سنة و11 شهر,كتابة وترجمة,محتوى مواقع,"كتابة, مقالة, مقالات, كتابة محتوى, حصرية, إبداع, جودة, كتابة مقالات, تميز, كتابة مقالة",https://khamsat.com/writing/articles-blogposts/696909-%D8%AE%D8%AF%D9%85%D8%A9-%D8%A7%D9%84%D9%85%D9%82%D8%A7%D9%84%D8%A9-%D8%A7%D9%84%D9%85%D8%A7%D8%B3%D9%8A%D8%A9
كتابة مقالات متنوعة المحتوى باللغة الانكليزية والعربية,.Duaa I,4,3,منذ سنة و5 أشهر,كتابة وترجمة,محتوى مواقع,"ترجمة, العربية, الانجليزية, كتابة, مقالة, مقالات, فنية, تكنولوجيا, علمية, أدبية",https://khamsat.com/writing/articles-blogposts/2690572-%D9%83%D8%AA%D8%A7%D8%A8%D8%A9-%D9%85%D9%82%D8%A7%D9%84%D8%A7%D8%AA-%D9%85%D8%AA%D9%86%D9%88%D8%B9%D8%A9-%D8%A7%D9%84%D9%85%D8%AD%D8%AA%D9%88%D9%89-%D8%A8%D8%A7%D9%84%D9%84%D8%BA%D8%A9-%D8%A7%D9%84%D8%A7%D9%86%D9%83%D9%84%D9%8A%D8%B2%D9%8A%D8%A9-%D9%88%D8%A7%D9%84%D8%B9%D8%B1%D8%A8%D9%8A%D8%A9
كتابة محتوى بطريقة احترافية,.Ebram A,31,22,منذ سنة و10 أشهر,كتابة وترجمة,محتوى مواقع,"تلخيص, كتابة, وورد, مقالة, مراجعة, كتاب, محتوي, نصوي",https://khamsat.com/writing/articles-blogposts/2295797-%D9%83%D8%AA%D8%A7%D8%A8%D8%A9-%D9%85%D8%AD%D8%AA%D9%88%D9%89-%D8%A8%D8%B7%D8%B1%D9%8A%D9%82%D8%A9-%D8%A7%D8%AD%D8%AA%D8%B1%D8%A7%D9%81%D9%8A%D8%A9
كتابة مقالات على الووردبريس باللغة العربية و الإنكليزية,آية ا.,10,7,منذ 8 أشهر و8 أيام,كتابة وترجمة,محتوى مواقع,"مقالات, كتابة مقالات, مقالات انجليزية, مقالات عربية, كتابة أبحاث",https://khamsat.com/writing/articles-blogposts/2293050-%D9%83%D8%AA%D8%A7%D8%A8%D8%A9-%D9%85%D9%82%D8%A7%D9%84%D8%A7%D8%AA-%D8%B9%D9%84%D9%89-%D8%A7%D9%84%D9%88%D9%88%D8%B1%D8%AF%D8%A8%D8%B1%D9%8A%D8%B3-%D8%A8%D8%A7%D9%84%D9%84%D8%BA%D8%A9-%D8%A7%D9%84%D8%B9%D8%B1%D8%A8%D9%8A%D8%A9-%D9%88-%D8%A7%D9%84%D8%A5%D9%86%D9%83%D9%84%D9%8A%D8%B2%D9%8A%D8%A9
إعادة صياغة المقالات والأبحاث بطريقة احترافية,.Mhammad M,13,11,منذ 5 أشهر و10 أيام,كتابة وترجمة,محتوى مواقع,"كتابة, صياغة, المقالات, وإعادة",https://khamsat.com/writing/articles-blogposts/2224851-%D8%A5%D8%B9%D8%A7%D8%AF%D8%A9-%D8%B5%D9%8A%D8%A7%D8%BA%D8%A9-%D8%A7%D9%84%D9%85%D9%82%D8%A7%D9%84%D8%A7%D8%AA-%D9%88%D8%A7%D9%84%D8%A3%D8%A8%D8%AD%D8%A7%D8%AB-%D8%A8%D8%B7%D8%B1%D9%8A%D9%82%D8%A9-%D8%A7%D8%AD%D8%AA%D8%B1%D8%A7%D9%81%D9%8A%D8%A9
كتابة مقالات متوافقة مع السيو على أداة Guinrank,آية أ.,96,72,منذ يومين و10 ساعات,كتابة وترجمة,محتوى مواقع,"كتابة محتوى, كتابة مقال, السيو, كتابة مقالات حصرية, كتابة مقالات عربي",https://khamsat.com/writing/articles-blogposts/1708299-%D9%83%D8%AA%D8%A7%D8%A8%D8%A9-%D9%85%D9%82%D8%A7%D9%84%D8%A7%D8%AA-%D9%85%D8%AA%D9%88%D8%A7%D9%81%D9%82%D8%A9-%D9%85%D8%B9-%D8%A7%D9%84%D8%B3%D9%8A%D9%88-%D8%B9%D9%84%D9%89-%D8%A3%D8%AF%D8%A7%D8%A9-guinrank
كتابة مقالات تتصدر بها نتائج البحث في مختلف المجالات,.Aya M,19,15,منذ 12 يوم و7 ساعات,كتابة وترجمة,محتوى مواقع,"بلوجر, ووردبريس, كتابة, مقالات, سيو",https://khamsat.com/writing/articles-blogposts/1653805-%D9%83%D8%AA%D8%A7%D8%A8%D8%A9-%D9%85%D9%82%D8%A7%D9%84%D8%A7%D8%AA-%D8%AA%D8%AA%D8%B5%D8%AF%D8%B1-%D8%A8%D9%87%D8%A7-%D9%86%D8%AA%D8%A7%D8%A6%D8%AC-%D8%A7%D9%84%D8%A8%D8%AD%D8%AB-%D9%81%D9%8A-%D9%85%D8%AE%D8%AA%D9%84%D9%81-%D8%A7%D9%84%D9%85%D8%AC%D8%A7%D9%84%D8%A7%D8%AA
كتابة مقالات دينية إبداعية حصرية وغير منسوخة,دعاء م.,8,6,منذ شهر ويومين,كتابة وترجمة,محتوى مواقع,"كتابة, مقالات, كتابة محتوى مواقع, word, الكتابه",https://khamsat.com/writing/articles-blogposts/2747216-%D9%83%D8%AA%D8%A7%D8%A8%D8%A9-%D9%85%D9%82%D8%A7%D9%84%D8%A7%D8%AA-%D8%AF%D9%8A%D9%86%D9%8A%D8%A9-%D8%A5%D8%A8%D8%AF%D8%A7%D8%B9%D9%8A%D8%A9-%D8%AD%D8%B5%D8%B1%D9%8A%D8%A9-%D9%88%D8%BA%D9%8A%D8%B1-%D9%85%D9%86%D8%B3%D9%88%D8%AE%D8%A9
مقالات حصرية باللغة العربية / الانجليزية,ليلى م.,5,4,منذ سنتين و3 أشهر,كتابة وترجمة,محتوى مواقع,"كتابة, مقالة, سيو, ابداعية",https://khamsat.com/writing/articles-blogposts/2263893-%D9%85%D9%82%D8%A7%D9%84%D8%A7%D8%AA-%D8%AD%D8%B5%D8%B1%D9%8A%D8%A9-%D8%A8%D8%A7%D9%84%D9%84%D8%BA%D8%A9-%D8%A7%D9%84%D8%B9%D8%B1%D8%A8%D9%8A%D8%A9-%D8%A7%D9%84%D8%A7%D9%86%D8%AC%D9%84%D9%8A%D8%B2%D9%8A%D8%A9
كتابة مقالات موافقة لمعايير السيو SEO عربي/فرنسي,إمان ح.,27,26,منذ 5 أيام و9 ساعات,كتابة وترجمة,محتوى مواقع,"عربي, محتوى, مقال, seo, حصري",https://khamsat.com/writing/articles-blogposts/2053818-%D9%83%D8%AA%D8%A7%D8%A8%D8%A9-%D9%85%D9%82%D8%A7%D9%84%D8%A7%D8%AA-%D9%85%D9%88%D8%A7%D9%81%D9%82%D8%A9-%D9%84%D9%85%D8%B9%D8%A7%D9%8A%D9%8A%D8%B1-%D8%A7%D9%84%D8%B3%D9%8A%D9%88-seo-%D8%B9%D8%B1%D8%A8%D9%8A%D9%81%D8%B1%D9%86%D8%B3%D9%8A
