Titre,Vendeur,Acheteurs,Notes,Date Dernier Avis,Catégorie,Sous-Catégorie,Mots Clés,Lien
موشن جرافيك احترافي لمنتجك او شركتك او خدمتك,.Aya M,22,22,منذ شهرين و25 يوم,فيديو وأنيميشن,أنيميشن وموشن جرافيك,"اعلان, احترافي, motion, فيديو موشن جرافيك, فيديو موشن",https://khamsat.com/video-design/motion-graphics/2923664-%D9%85%D9%88%D8%B4%D9%86-%D8%AC%D8%B1%D8%A7%D9%81%D9%8A%D9%83-%D8%A7%D8%AD%D8%AA%D8%B1%D8%A7%D9%81%D9%8A-%D9%84%D9%85%D9%86%D8%AA%D8%AC%D9%83-%D8%A7%D9%88-%D8%B4%D8%B1%D9%83%D8%AA%D9%83-%D8%A7%D9%88-%D8%AE%D8%AF%D9%85%D8%AA%D9%83
موشن جرافيك احترافي وجذاب منصات تيك توك وانستغرام وسناب شات,خالد ع.,2,2,منذ 7 أشهر و3 أيام,فيديو وأنيميشن,أنيميشن وموشن جرافيك,"تصميم, انستغرام, سناب شات, فيديو موشن جرافيك, تيك توك",https://khamsat.com/video-design/motion-graphics/3257179-%D9%85%D9%88%D8%B4%D9%86-%D8%AC%D8%B1%D8%A7%D9%81%D9%8A%D9%83-%D8%A7%D8%AD%D8%AA%D8%B1%D8%A7%D9%81%D9%8A-%D9%88%D8%AC%D8%B0%D8%A7%D8%A8-%D9%85%D9%86%D8%B5%D8%A7%D8%AA-%D8%AA%D9%8A%D9%83-%D8%AA%D9%88%D9%83-%D9%88%D8%A7%D9%86%D8%B3%D8%AA%D8%BA%D8%B1%D8%A7%D9%85-%D9%88%D8%B3%D9%86%D8%A7%D8%A8-%D8%B4%D8%A7%D8%AA
موشن جرافيك احترافي,.Manar A,120,78,منذ شهرين و26 يوم,فيديو وأنيميشن,أنيميشن وموشن جرافيك,"يوتيوب, مونتاج, احترافي, موشن, سناب",https://khamsat.com/video-design/motion-graphics/2079344-%D9%85%D9%88%D8%B4%D9%86-%D8%AC%D8%B1%D8%A7%D9%81%D9%8A%D9%83-%D8%A7%D8%AD%D8%AA%D8%B1%D8%A7%D9%81%D9%8A
موشن جرافيك فيديو احترافي وجذاب,.Ahmed S,7,7,منذ 13 يوم و11 ساعة,فيديو وأنيميشن,أنيميشن وموشن جرافيك,"اعلانى, تصميم فيديو, انيميشن, موشن جرافيك, فيديو موشن جرافيك",https://khamsat.com/video-design/motion-graphics/3151773-%D9%85%D9%88%D8%B4%D9%86-%D8%AC%D8%B1%D8%A7%D9%81%D9%8A%D9%83-%D9%81%D9%8A%D8%AF%D9%8A%D9%88-%D8%A7%D8%AD%D8%AA%D8%B1%D8%A7%D9%81%D9%8A-%D9%88%D8%AC%D8%B0%D8%A7%D8%A8
فيديو موشن جرافيك احترافي مقاس سناب، يوتيوب,.Aya H,1,1,منذ 3 أشهر و8 أيام,فيديو وأنيميشن,أنيميشن وموشن جرافيك,"تصميم, لوجو, موشن جرافيك, فيديو موشن جرافيك",https://khamsat.com/video-design/motion-graphics/3098660-%D9%81%D9%8A%D8%AF%D9%8A%D9%88-%D9%85%D9%88%D8%B4%D9%86-%D8%AC%D8%B1%D8%A7%D9%81%D9%8A%D9%83-%D8%A7%D8%AD%D8%AA%D8%B1%D8%A7%D9%81%D9%8A-%D9%85%D9%82%D8%A7%D8%B3-%D8%B3%D9%86%D8%A7%D8%A8-%D9%8A%D9%88%D8%AA%D9%8A%D9%88%D8%A8
موشن جرافيك احترافي مقاس سناب شات بأفضل جودة,.Manar A,67,48,منذ 9 أيام و16 ساعة,فيديو وأنيميشن,أنيميشن وموشن جرافيك,"فيديو, جرافيك, انستغرام, موشن, سناب",https://khamsat.com/video-design/motion-graphics/2249667-%D9%85%D9%88%D8%B4%D9%86-%D8%AC%D8%B1%D8%A7%D9%81%D9%8A%D9%83-%D8%A7%D8%AD%D8%AA%D8%B1%D8%A7%D9%81%D9%8A-%D9%85%D9%82%D8%A7%D8%B3-%D8%B3%D9%86%D8%A7%D8%A8-%D8%B4%D8%A7%D8%AA-%D8%A8%D8%A3%D9%81%D8%B6%D9%84-%D8%AC%D9%88%D8%AF%D8%A9
تصميم فيديو موشن جرافيك مقاسات السناب شات انستغرام وتيكتوك,محمد ح.,102,79,منذ 11 يوم و7 ساعات,فيديو وأنيميشن,أنيميشن وموشن جرافيك,"فيديو, موشن جرافيك, motion, موشن, motion graphic",https://khamsat.com/video-design/motion-graphics/2608436-%D8%AA%D8%B5%D9%85%D9%8A%D9%85-%D9%81%D9%8A%D8%AF%D9%8A%D9%88-%D9%85%D9%88%D8%B4%D9%86-%D8%AC%D8%B1%D8%A7%D9%81%D9%8A%D9%83-%D9%85%D9%82%D8%A7%D8%B3%D8%A7%D8%AA-%D8%A7%D9%84%D8%B3%D9%86%D8%A7%D8%A8-%D8%B4%D8%A7%D8%AA-%D8%A7%D9%86%D8%B3%D8%AA%D8%BA%D8%B1%D8%A7%D9%85-%D9%88%D8%AA%D9%8A%D9%83%D8%AA%D9%88%D9%83
تصميم فيديو موشن جرافيك احترافي بجودة عالية,دعاء ا.,21,19,منذ 29 يوم و7 ساعات,فيديو وأنيميشن,أنيميشن وموشن جرافيك,"فيديو اعلاني, تصميم فيديو, 2d, موشن جرافيك, motion graphic",https://khamsat.com/video-design/motion-graphics/3406141-%D8%AA%D8%B5%D9%85%D9%8A%D9%85-%D9%81%D9%8A%D8%AF%D9%8A%D9%88-%D9%85%D9%88%D8%B4%D9%86-%D8%AC%D8%B1%D8%A7%D9%81%D9%8A%D9%83-%D8%A7%D8%AD%D8%AA%D8%B1%D8%A7%D9%81%D9%8A-%D8%A8%D8%AC%D9%88%D8%AF%D8%A9-%D8%B9%D8%A7%D9%84%D9%8A%D8%A9
تصميم فيديو موشن جرافيك 2d احترافي,ياسين ك.,19,16,منذ شهر و10 أيام,فيديو وأنيميشن,أنيميشن وموشن جرافيك,"جرافيك, تحريك, شخصيات, موشن, ورسم",https://khamsat.com/video-design/motion-graphics/2207475-%D8%AA%D8%B5%D9%85%D9%8A%D9%85-%D9%81%D9%8A%D8%AF%D9%8A%D9%88-%D9%85%D9%88%D8%B4%D9%86-%D8%AC%D8%B1%D8%A7%D9%81%D9%8A%D9%83-2d-%D8%A7%D8%AD%D8%AA%D8%B1%D8%A7%D9%81%D9%8A
موشن جرافيك اسناب شات,عبدالرحمن ه.,163,120,منذ شهر و13 يوم,فيديو وأنيميشن,أنيميشن وموشن جرافيك,"رسم, تصميم, اعلان, فيديو, تطوير, مصمم, فوتوشوب, تعليم, جرافيك, ديزاين",https://khamsat.com/video-design/motion-graphics/1625918-%D9%85%D9%88%D8%B4%D9%86-%D8%AC%D8%B1%D8%A7%D9%81%D9%8A%D9%83-%D8%A7%D8%B3%D9%86%D8%A7%D8%A8-%D8%B4%D8%A7%D8%AA
تصميم فيديو موشن جرافيك احترافي,.Mohamed B,17,17,منذ 10 ساعات و30 دقيقة,فيديو وأنيميشن,أنيميشن وموشن جرافيك,"تصميم, جرافيك, فديو, motion, موشن",https://khamsat.com/video-design/motion-graphics/2128164-%D8%AA%D8%B5%D9%85%D9%8A%D9%85-%D9%81%D9%8A%D8%AF%D9%8A%D9%88-%D9%85%D9%88%D8%B4%D9%86-%D8%AC%D8%B1%D8%A7%D9%81%D9%8A%D9%83-%D8%A7%D8%AD%D8%AA%D8%B1%D8%A7%D9%81%D9%8A
تصميم فيديو موشن جرافيك احترافي جميع المقاسات,.Amina M,66,55,منذ 27 يوم و11 ساعة,فيديو وأنيميشن,أنيميشن وموشن جرافيك,"تصميم, فيديو, تصميم فيديو, موشن جرافيك, فيديو موشن",https://khamsat.com/video-design/motion-graphics/2652704-%D8%AA%D8%B5%D9%85%D9%8A%D9%85-%D9%81%D9%8A%D8%AF%D9%8A%D9%88-%D9%85%D9%88%D8%B4%D9%86-%D8%AC%D8%B1%D8%A7%D9%81%D9%8A%D9%83-%D8%A7%D8%AD%D8%AA%D8%B1%D8%A7%D9%81%D9%8A-%D8%AC%D9%85%D9%8A%D8%B9-%D8%A7%D9%84%D9%85%D9%82%D8%A7%D8%B3%D8%A7%D8%AA
تصميم فيديو موشن جرافيك,عبدالسلام د.,26,22,منذ 5 أشهر ويوم,فيديو وأنيميشن,أنيميشن وموشن جرافيك,"تصميم, فيديو, دعاية, جرافيك, موشن",https://khamsat.com/video-design/motion-graphics/1458589-%D8%AA%D8%B5%D9%85%D9%8A%D9%85-%D9%81%D9%8A%D8%AF%D9%8A%D9%88-%D9%85%D9%88%D8%B4%D9%86-%D8%AC%D8%B1%D8%A7%D9%81%D9%8A%D9%83
تصميم فيديو موشن جرافيك متميز واحترافي,محمد ن.,48,42,منذ 19 يوم و9 ساعات,فيديو وأنيميشن,أنيميشن وموشن جرافيك,"إعلان, احترافي, تصميم فيديوهات, موشن جرافيك, فيديو موشن جرافيك",https://khamsat.com/video-design/motion-graphics/2595323-%D8%AA%D8%B5%D9%85%D9%8A%D9%85-%D9%81%D9%8A%D8%AF%D9%8A%D9%88-%D9%85%D9%88%D8%B4%D9%86-%D8%AC%D8%B1%D8%A7%D9%81%D9%8A%D9%83-%D9%85%D8%AA%D9%85%D9%8A%D8%B2-%D9%88%D8%A7%D8%AD%D8%AA%D8%B1%D8%A7%D9%81%D9%8A
سأقوم بإنشاء خرائط متحركة لمقاطعك,.Aymane B,1,1,منذ 9 أشهر و13 يوم,فيديو وأنيميشن,أنيميشن وموشن جرافيك,"مونتاج فيديو, موشن جرافيك, after effects, فيديو موشن, خرائط متحركة",https://khamsat.com/video-design/motion-graphics/3026771-%D8%B3%D8%A3%D9%82%D9%88%D9%85-%D8%A8%D8%A5%D9%86%D8%B4%D8%A7%D8%A1-%D8%AE%D8%B1%D8%A7%D8%A6%D8%B7-%D9%85%D8%AA%D8%AD%D8%B1%D9%83%D8%A9-%D9%84%D9%85%D9%82%D8%A7%D8%B7%D8%B9%D9%83
فيديو موشن جرافيك قصير وجذاب لتسويق خدماتك أو متجرك,.Amir Z,3,3,منذ 11 يوم و20 ساعة,فيديو وأنيميشن,أنيميشن وموشن جرافيك,"فيديو, تصميم فيديو, after effect, motion graphic, فيديو موشن جرافيك",https://khamsat.com/video-design/motion-graphics/3592440-%D9%81%D9%8A%D8%AF%D9%8A%D9%88-%D9%85%D9%88%D8%B4%D9%86-%D8%AC%D8%B1%D8%A7%D9%81%D9%8A%D9%83-%D9%82%D8%B5%D9%8A%D8%B1-%D9%88%D8%AC%D8%B0%D8%A7%D8%A8-%D9%84%D8%AA%D8%B3%D9%88%D9%8A%D9%82-%D8%AE%D8%AF%D9%85%D8%A7%D8%AA%D9%83-%D8%A3%D9%88-%D9%85%D8%AA%D8%AC%D8%B1%D9%83
فيديوهات سناب شات انستقرام تيك توك موشن جرافيك احترافي,.Mohamed S,21,20,منذ 3 أشهر و6 أيام,فيديو وأنيميشن,أنيميشن وموشن جرافيك,"فيديو سناب شات, موشن سناب شات, تصميم موشن سناب, فيديو طولي, فيديو ستوري",https://khamsat.com/video-design/motion-graphics/2367270-%D9%81%D9%8A%D8%AF%D9%8A%D9%88%D9%87%D8%A7%D8%AA-%D8%B3%D9%86%D8%A7%D8%A8-%D8%B4%D8%A7%D8%AA-%D8%A7%D9%86%D8%B3%D8%AA%D9%82%D8%B1%D8%A7%D9%85-%D8%AA%D9%8A%D9%83-%D8%AA%D9%88%D9%83-%D9%85%D9%88%D8%B4%D9%86-%D8%AC%D8%B1%D8%A7%D9%81%D9%8A%D9%83-%D8%A7%D8%AD%D8%AA%D8%B1%D8%A7%D9%81%D9%8A
تصميم فديو موشن جرافيك احترافي,.Omran A,44,42,منذ 11 شهر و22 يوم,فيديو وأنيميشن,أنيميشن وموشن جرافيك,"تصميم, تصميم احترافي, فيديو اعلاني, موشن, فيديو موشن جرافيك",https://khamsat.com/video-design/motion-graphics/2491927-%D8%AA%D8%B5%D9%85%D9%8A%D9%85-%D9%81%D8%AF%D9%8A%D9%88-%D9%85%D9%88%D8%B4%D9%86-%D8%AC%D8%B1%D8%A7%D9%81%D9%8A%D9%83-%D8%A7%D8%AD%D8%AA%D8%B1%D8%A7%D9%81%D9%8A
عمل فيديوهات أنيمشن وموشن جرافيك دعائية,.Adham A,25,17,منذ 4 أشهر و29 يوم,فيديو وأنيميشن,أنيميشن وموشن جرافيك,"رسوم متحركة, موشن جرافيك, animation, أنيمشن, motion graphic",https://khamsat.com/video-design/motion-graphics/2417643-%D8%B9%D9%85%D9%84-%D9%81%D9%8A%D8%AF%D9%8A%D9%88%D9%87%D8%A7%D8%AA-%D8%A3%D9%86%D9%8A%D9%85%D8%B4%D9%86-%D9%88%D9%85%D9%88%D8%B4%D9%86-%D8%AC%D8%B1%D8%A7%D9%81%D9%8A%D9%83-%D8%AF%D8%B9%D8%A7%D8%A6%D9%8A%D8%A9
فيديو موشن جرافيك احترافي,.Mohamed E,334,261,منذ 24 يوم و5 ساعات,فيديو وأنيميشن,أنيميشن وموشن جرافيك,"انفوجرافيك, انيميشن, افترافكت, موشن جرافيك, تحريك شخصيات",https://khamsat.com/video-design/motion-graphics/799998-%D9%81%D9%8A%D8%AF%D9%8A%D9%88-%D9%85%D9%88%D8%B4%D9%86-%D8%AC%D8%B1%D8%A7%D9%81%D9%8A%D9%83-%D8%A7%D8%AD%D8%AA%D8%B1%D8%A7%D9%81%D9%8A
تصميم فيديو موشن جرافيك إحترافي,محمد ضياء ع.,10,9,منذ شهر و12 ساعة,فيديو وأنيميشن,أنيميشن وموشن جرافيك,"جرافيك, موشن جرافيك, motion graphic, فيديو موشن جرافيك, تحريك شعار",https://khamsat.com/video-design/motion-graphics/3068030-%D8%AA%D8%B5%D9%85%D9%8A%D9%85-%D9%81%D9%8A%D8%AF%D9%8A%D9%88-%D9%85%D9%88%D8%B4%D9%86-%D8%AC%D8%B1%D8%A7%D9%81%D9%8A%D9%83-%D8%A5%D8%AD%D8%AA%D8%B1%D8%A7%D9%81%D9%8A
موشن جرافيك مقاس سناب شات لاصحاب السماد والحلويات والعطور,حسن ا.,15,13,منذ سنة وشهرين,فيديو وأنيميشن,أنيميشن وموشن جرافيك,"جرافيك, ادوبي, افترافكت, موشن",https://khamsat.com/video-design/motion-graphics/2102562-%D9%85%D9%88%D8%B4%D9%86-%D8%AC%D8%B1%D8%A7%D9%81%D9%8A%D9%83-%D9%85%D9%82%D8%A7%D8%B3-%D8%B3%D9%86%D8%A7%D8%A8-%D8%B4%D8%A7%D8%AA-%D9%84%D8%A7%D8%B5%D8%AD%D8%A7%D8%A8-%D8%A7%D9%84%D8%B3%D9%85%D8%A7%D8%AF-%D9%88%D8%A7%D9%84%D8%AD%D9%84%D9%88%D9%8A%D8%A7%D8%AA-%D9%88%D8%A7%D9%84%D8%B9%D8%B7%D9%88%D8%B1
اعلان موشن جرافيك احترافي,خالد ا.,2,1,منذ 9 أشهر و20 يوم,فيديو وأنيميشن,أنيميشن وموشن جرافيك,"فيديو, مونتاج, فيديو اعلاني, موشن جرافيك, فيديو موشن",https://khamsat.com/video-design/motion-graphics/3165787-%D8%A7%D8%B9%D9%84%D8%A7%D9%86-%D9%85%D9%88%D8%B4%D9%86-%D8%AC%D8%B1%D8%A7%D9%81%D9%8A%D9%83-%D8%A7%D8%AD%D8%AA%D8%B1%D8%A7%D9%81%D9%8A
إنتاج فيديو موشن جرافيك كامل احترافي,عبادة ب.,1,0,Aucun avis,فيديو وأنيميشن,أنيميشن وموشن جرافيك,"إعلان, فيديو, اعلانات, احترافي, جرافيك, graphic, افتر افكت, 2d, motion, موشن",https://khamsat.com/video-design/motion-graphics/2482181-%D8%A5%D9%86%D8%AA%D8%A7%D8%AC-%D9%81%D9%8A%D8%AF%D9%8A%D9%88-%D9%85%D9%88%D8%B4%D9%86-%D8%AC%D8%B1%D8%A7%D9%81%D9%8A%D9%83-%D9%83%D8%A7%D9%85%D9%84-%D8%A7%D8%AD%D8%AA%D8%B1%D8%A7%D9%81%D9%8A
تصميم فيديو موشن جرافيك ابداعي و احترافي,.Mustapha C,1,1,منذ سنتين و4 أشهر,فيديو وأنيميشن,أنيميشن وموشن جرافيك,"فيديو, تصميم فيديو, انيميشن, موشن, فيديو موشن جرافيك",https://khamsat.com/video-design/motion-graphics/2664803-%D8%AA%D8%B5%D9%85%D9%8A%D9%85-%D9%81%D9%8A%D8%AF%D9%8A%D9%88-%D9%85%D9%88%D8%B4%D9%86-%D8%AC%D8%B1%D8%A7%D9%81%D9%8A%D9%83-%D8%A7%D8%A8%D8%AF%D8%A7%D8%B9%D9%8A-%D9%88-%D8%A7%D8%AD%D8%AA%D8%B1%D8%A7%D9%81%D9%8A
تصميم فيديو انيميشن ثلاثي الابعاد,.Mohamed M,8,5,منذ 5 أشهر و25 يوم,فيديو وأنيميشن,أنيميشن وموشن جرافيك,"3ds, ثلاثي الابعاد, انيميشن, فيديو موشن جرافيك, motion grahpics",https://khamsat.com/video-design/motion-graphics/2902226-%D8%AA%D8%B5%D9%85%D9%8A%D9%85-%D9%81%D9%8A%D8%AF%D9%8A%D9%88-%D8%A7%D9%86%D9%8A%D9%85%D9%8A%D8%B4%D9%86-%D8%AB%D9%84%D8%A7%D8%AB%D9%8A-%D8%A7%D9%84%D8%A7%D8%A8%D8%B9%D8%A7%D8%AF
تصميم فيديو موشن جرافيك ل سناب شات وانستغرام Snapchat Ad,.Haitham A,2,1,منذ سنة وشهرين,فيديو وأنيميشن,أنيميشن وموشن جرافيك,"انيميشن, تعليق صوتي, motion graphics, سناب شات, فيديو موشن جرافيك",https://khamsat.com/video-design/motion-graphics/2838007-%D8%AA%D8%B5%D9%85%D9%8A%D9%85-%D9%81%D9%8A%D8%AF%D9%8A%D9%88-%D9%85%D9%88%D8%B4%D9%86-%D8%AC%D8%B1%D8%A7%D9%81%D9%8A%D9%83-%D9%84-%D8%B3%D9%86%D8%A7%D8%A8-%D8%B4%D8%A7%D8%AA-%D9%88%D8%A7%D9%86%D8%B3%D8%AA%D8%BA%D8%B1%D8%A7%D9%85-snapchat-ad
فيديو موشن جرافيك احترافي,كيرلس ه.,14,8,منذ 8 أشهر و26 يوم,فيديو وأنيميشن,أنيميشن وموشن جرافيك,"تحريك, موشن جرافيك, موشن, فيديو موشن جرافيك, فيديو موشن",https://khamsat.com/video-design/motion-graphics/2804574-%D9%81%D9%8A%D8%AF%D9%8A%D9%88-%D9%85%D9%88%D8%B4%D9%86-%D8%AC%D8%B1%D8%A7%D9%81%D9%8A%D9%83-%D8%A7%D8%AD%D8%AA%D8%B1%D8%A7%D9%81%D9%8A
تصميم فيديو موشن جرافيك وانيميشن بإحترافية,.Ahmed E,28,21,منذ سنة وشهرين,فيديو وأنيميشن,أنيميشن وموشن جرافيك,"تصميم, فيديو, جرافيك, دعائي, شات, انيميشن, انستجرام, موشن, ثواني, لمده",https://khamsat.com/video-design/motion-graphics/1919481-%D8%AA%D8%B5%D9%85%D9%8A%D9%85-%D9%81%D9%8A%D8%AF%D9%8A%D9%88-%D9%85%D9%88%D8%B4%D9%86-%D8%AC%D8%B1%D8%A7%D9%81%D9%8A%D9%83-%D9%88%D8%A7%D9%86%D9%8A%D9%85%D9%8A%D8%B4%D9%86-%D8%A8%D8%A5%D8%AD%D8%AA%D8%B1%D8%A7%D9%81%D9%8A%D8%A9
فيديو موشن جرافيك احترافي بجودة عالية وسعر مناسب,.Mohamed A,21,19,منذ 27 يوم و11 ساعة,فيديو وأنيميشن,أنيميشن وموشن جرافيك,موشن جرافيك,https://khamsat.com/video-design/motion-graphics/3162147-%D9%81%D9%8A%D8%AF%D9%8A%D9%88-%D9%85%D9%88%D8%B4%D9%86-%D8%AC%D8%B1%D8%A7%D9%81%D9%8A%D9%83-%D8%A7%D8%AD%D8%AA%D8%B1%D8%A7%D9%81%D9%8A-%D8%A8%D8%AC%D9%88%D8%AF%D8%A9-%D8%B9%D8%A7%D9%84%D9%8A%D8%A9-%D9%88%D8%B3%D8%B9%D8%B1-%D9%85%D9%86%D8%A7%D8%B3%D8%A8
موشن جرافيك احترافي لمتجرك أو مشروعك سناب شات,عبدالله ت.,6,5,منذ سنة و29 يوم,فيديو وأنيميشن,أنيميشن وموشن جرافيك,"متجر, سناب شات, فيديو موشن جرافيك, مقاس طولي",https://khamsat.com/video-design/motion-graphics/2997187-%D9%85%D9%88%D8%B4%D9%86-%D8%AC%D8%B1%D8%A7%D9%81%D9%8A%D9%83-%D8%A7%D8%AD%D8%AA%D8%B1%D8%A7%D9%81%D9%8A-%D9%84%D9%85%D8%AA%D8%AC%D8%B1%D9%83-%D8%A3%D9%88-%D9%85%D8%B4%D8%B1%D9%88%D8%B9%D9%83-%D8%B3%D9%86%D8%A7%D8%A8-%D8%B4%D8%A7%D8%AA
تصميم فيديو سناب شات موشن جرافيك,محمد ع.,65,45,منذ 18 يوم و12 ساعة,فيديو وأنيميشن,أنيميشن وموشن جرافيك,"فيديو, جرافيك, موشن, ستوري, سناب",https://khamsat.com/video-design/motion-graphics/1384056-%D8%AA%D8%B5%D9%85%D9%8A%D9%85-%D9%81%D9%8A%D8%AF%D9%8A%D9%88-%D8%B3%D9%86%D8%A7%D8%A8-%D8%B4%D8%A7%D8%AA-%D9%85%D9%88%D8%B4%D9%86-%D8%AC%D8%B1%D8%A7%D9%81%D9%8A%D9%83
فيديو موشن جرافيك,.ياسر M,3,3,منذ شهر و25 يوم,فيديو وأنيميشن,أنيميشن وموشن جرافيك,"تصميم, إعلان, رسوم متحركة, احترافي, عالية, جرافيك, جودة, انيميشن, افتر, موشن",https://khamsat.com/video-design/motion-graphics/2751186-%D9%81%D9%8A%D8%AF%D9%8A%D9%88-%D9%85%D9%88%D8%B4%D9%86-%D8%AC%D8%B1%D8%A7%D9%81%D9%8A%D9%83
سأقدم فيديو موشن جرافيك أحترافي مع رسم ابداعي,.Mohammed A,88,67,منذ شهر و12 يوم,فيديو وأنيميشن,أنيميشن وموشن جرافيك,"فيديو اعلاني, تصميم فيديو, موشن جرافيك, فيديو موشن جرافيك, فيديو موشن",https://khamsat.com/video-design/motion-graphics/1946196-%D8%B3%D8%A3%D9%82%D8%AF%D9%85-%D9%81%D9%8A%D8%AF%D9%8A%D9%88-%D9%85%D9%88%D8%B4%D9%86-%D8%AC%D8%B1%D8%A7%D9%81%D9%8A%D9%83-%D8%A3%D8%AD%D8%AA%D8%B1%D8%A7%D9%81%D9%8A-%D9%85%D8%B9-%D8%B1%D8%B3%D9%85-%D8%A7%D8%A8%D8%AF%D8%A7%D8%B9%D9%8A
اعلانات فيديو موشن جرافيك 2D,.Steven E,5,3,منذ 22 يوم و3 ساعات,فيديو وأنيميشن,أنيميشن وموشن جرافيك,"اعلان, تحريك, موشن جرافيك, after effect",https://khamsat.com/video-design/motion-graphics/2956257-%D8%A7%D8%B9%D9%84%D8%A7%D9%86%D8%A7%D8%AA-%D9%81%D9%8A%D8%AF%D9%8A%D9%88-%D9%85%D9%88%D8%B4%D9%86-%D8%AC%D8%B1%D8%A7%D9%81%D9%8A%D9%83-2d
تصميم فيديو موشن جرافيك باحترافية,ملهم م.,15,14,منذ شهر و13 يوم,فيديو وأنيميشن,أنيميشن وموشن جرافيك,"تصميم, إعلانية, motion, ريلز, فيديو موشن جرافيك",https://khamsat.com/video-design/motion-graphics/2854370-%D8%AA%D8%B5%D9%85%D9%8A%D9%85-%D9%81%D9%8A%D8%AF%D9%8A%D9%88-%D9%85%D9%88%D8%B4%D9%86-%D8%AC%D8%B1%D8%A7%D9%81%D9%8A%D9%83-%D8%A8%D8%A7%D8%AD%D8%AA%D8%B1%D8%A7%D9%81%D9%8A%D8%A9
ساقدم فيديو موشن جرافيك احترافي 2d,.Eslam M,7,7,منذ 6 أشهر و15 يوم,فيديو وأنيميشن,أنيميشن وموشن جرافيك,"تصميم, جرافيك, فيديو اعلاني, تصميم فيديوهات, فيديو موشن جرافيك",https://khamsat.com/video-design/motion-graphics/2679755-%D8%B3%D8%A7%D9%82%D8%AF%D9%85-%D9%81%D9%8A%D8%AF%D9%8A%D9%88-%D9%85%D9%88%D8%B4%D9%86-%D8%AC%D8%B1%D8%A7%D9%81%D9%8A%D9%83-%D8%A7%D8%AD%D8%AA%D8%B1%D8%A7%D9%81%D9%8A-2d
تصميم فيديوهات موشن كولاج,أحمد ا.,5,5,منذ شهر و27 يوم,فيديو وأنيميشن,أنيميشن وموشن جرافيك,"موشن جرافيك, موشن, after effect, motion graphic, ريلز",https://khamsat.com/video-design/motion-graphics/3083562-%D8%AA%D8%B5%D9%85%D9%8A%D9%85-%D9%81%D9%8A%D8%AF%D9%8A%D9%88%D9%87%D8%A7%D8%AA-%D9%85%D9%88%D8%B4%D9%86-%D9%83%D9%88%D9%84%D8%A7%D8%AC
سأقدم فيديو موشن جرافيك أحترافي مع رسم ابداعي,.Mohammed A,88,67,منذ شهر و12 يوم,فيديو وأنيميشن,أنيميشن وموشن جرافيك,"فيديو اعلاني, تصميم فيديو, موشن جرافيك, فيديو موشن جرافيك, فيديو موشن",https://khamsat.com/video-design/motion-graphics/1946196-%D8%B3%D8%A3%D9%82%D8%AF%D9%85-%D9%81%D9%8A%D8%AF%D9%8A%D9%88-%D9%85%D9%88%D8%B4%D9%86-%D8%AC%D8%B1%D8%A7%D9%81%D9%8A%D9%83-%D8%A3%D8%AD%D8%AA%D8%B1%D8%A7%D9%81%D9%8A-%D9%85%D8%B9-%D8%B1%D8%B3%D9%85-%D8%A7%D8%A8%D8%AF%D8%A7%D8%B9%D9%8A
ساقدم فيديو موشن جرافيك احترافي 2d,.Eslam M,7,7,منذ 6 أشهر و15 يوم,فيديو وأنيميشن,أنيميشن وموشن جرافيك,"تصميم, جرافيك, فيديو اعلاني, تصميم فيديوهات, فيديو موشن جرافيك",https://khamsat.com/video-design/motion-graphics/2679755-%D8%B3%D8%A7%D9%82%D8%AF%D9%85-%D9%81%D9%8A%D8%AF%D9%8A%D9%88-%D9%85%D9%88%D8%B4%D9%86-%D8%AC%D8%B1%D8%A7%D9%81%D9%8A%D9%83-%D8%A7%D8%AD%D8%AA%D8%B1%D8%A7%D9%81%D9%8A-2d
تصميم فيديو موشن جرافيك تسويقي,.Mahmoud N,16,12,منذ 23 يوم و12 ساعة,فيديو وأنيميشن,أنيميشن وموشن جرافيك,"تصميم, فيديو, motion, موشن, أنفوجرافيك",https://khamsat.com/video-design/motion-graphics/2883017-%D8%AA%D8%B5%D9%85%D9%8A%D9%85-%D9%81%D9%8A%D8%AF%D9%8A%D9%88-%D9%85%D9%88%D8%B4%D9%86-%D8%AC%D8%B1%D8%A7%D9%81%D9%8A%D9%83-%D8%AA%D8%B3%D9%88%D9%8A%D9%82%D9%8A
تصميم فيديو موشن جرافيك مميز,محمد ع.,132,100,منذ 5 أيام وساعة,فيديو وأنيميشن,أنيميشن وموشن جرافيك,"تصميم, اعلان, جرافيك, موشن, سناب",https://khamsat.com/video-design/motion-graphics/675666-%D8%AA%D8%B5%D9%85%D9%8A%D9%85-%D9%81%D9%8A%D8%AF%D9%8A%D9%88-%D9%85%D9%88%D8%B4%D9%86-%D8%AC%D8%B1%D8%A7%D9%81%D9%8A%D9%83-%D9%85%D9%85%D9%8A%D8%B2
موشن جرافيك احترافي بجميع الأبعاد ليتناسب مع احتياجاتك!,.Mennatallah S,3,2,منذ 7 أشهر و11 يوم,فيديو وأنيميشن,أنيميشن وموشن جرافيك,"تصميم, مونتاج فيديو, فيديوهات, تحرير فيديو, موشن غرافيك",https://khamsat.com/video-design/motion-graphics/3033441-%D9%85%D9%88%D8%B4%D9%86-%D8%AC%D8%B1%D8%A7%D9%81%D9%8A%D9%83-%D8%A7%D8%AD%D8%AA%D8%B1%D8%A7%D9%81%D9%8A-%D8%A8%D8%AC%D9%85%D9%8A%D8%B9-%D8%A7%D9%84%D8%A3%D8%A8%D8%B9%D8%A7%D8%AF-%D9%84%D9%8A%D8%AA%D9%86%D8%A7%D8%B3%D8%A8-%D9%85%D8%B9-%D8%A7%D8%AD%D8%AA%D9%8A%D8%A7%D8%AC%D8%A7%D8%AA%D9%83
فيديو موشن جرافيك دعائي احترافي,حسن ا.,4,3,منذ سنتين وشهرين,فيديو وأنيميشن,أنيميشن وموشن جرافيك,"فيديو اعلاني, تحريك, موشن جرافيك, موشن, افترايفيكت",https://khamsat.com/video-design/motion-graphics/2491631-%D9%81%D9%8A%D8%AF%D9%8A%D9%88-%D9%85%D9%88%D8%B4%D9%86-%D8%AC%D8%B1%D8%A7%D9%81%D9%8A%D9%83-%D8%AF%D8%B9%D8%A7%D8%A6%D9%8A-%D8%A7%D8%AD%D8%AA%D8%B1%D8%A7%D9%81%D9%8A
تصميم فيديوهات الموشن جرافيك الابداعية,وارف غ.,37,30,منذ 4 أشهر و15 يوم,فيديو وأنيميشن,أنيميشن وموشن جرافيك,"موقع, فيديو, شركة, تطبيق, جرافيك",https://khamsat.com/video-design/motion-graphics/2317429-%D8%AA%D8%B5%D9%85%D9%8A%D9%85-%D9%81%D9%8A%D8%AF%D9%8A%D9%88%D9%87%D8%A7%D8%AA-%D8%A7%D9%84%D9%85%D9%88%D8%B4%D9%86-%D8%AC%D8%B1%D8%A7%D9%81%D9%8A%D9%83-%D8%A7%D9%84%D8%A7%D8%A8%D8%AF%D8%A7%D8%B9%D9%8A%D8%A9
موشن جرافيك احترافي لتسويق منتجك أو خدمتك بطريقة إبداعية,.Ahmed H,68,61,منذ يوم و12 ساعة,فيديو وأنيميشن,أنيميشن وموشن جرافيك,"رسوم متحركة, موشن جرافيك, motion, موشن, after effect",https://khamsat.com/video-design/motion-graphics/2838770-%D9%85%D9%88%D8%B4%D9%86-%D8%AC%D8%B1%D8%A7%D9%81%D9%8A%D9%83-%D8%A7%D8%AD%D8%AA%D8%B1%D8%A7%D9%81%D9%8A-%D9%84%D8%AA%D8%B3%D9%88%D9%8A%D9%82-%D9%85%D9%86%D8%AA%D8%AC%D9%83-%D8%A3%D9%88-%D8%AE%D8%AF%D9%85%D8%AA%D9%83-%D8%A8%D8%B7%D8%B1%D9%8A%D9%82%D8%A9-%D8%A5%D8%A8%D8%AF%D8%A7%D8%B9%D9%8A%D8%A9
موشن غرافيك احترافي ولكل الغايات,.Ali A,3,3,منذ سنة و5 أشهر,فيديو وأنيميشن,أنيميشن وموشن جرافيك,"تصميم, فيديو, غرافيك, صوتي, تعليق, موشن, عميل",https://khamsat.com/video-design/motion-graphics/2229249-%D9%85%D9%88%D8%B4%D9%86-%D8%BA%D8%B1%D8%A7%D9%81%D9%8A%D9%83-%D8%A7%D8%AD%D8%AA%D8%B1%D8%A7%D9%81%D9%8A-%D9%88%D9%84%D9%83%D9%84-%D8%A7%D9%84%D8%BA%D8%A7%D9%8A%D8%A7%D8%AA
تصميم فيديو موشن جرافيك ترويجى او لقناتك او لمنتجك,.Ahmed R,21,18,منذ شهرين ويومين,فيديو وأنيميشن,أنيميشن وموشن جرافيك,"فيديو, احترافي, جرافيك, جذاب, تصميم فيديو, graphic, انيميشن, موشن جرافيك, motion, موشن",https://khamsat.com/video-design/motion-graphics/2653013-%D8%AA%D8%B5%D9%85%D9%8A%D9%85-%D9%81%D9%8A%D8%AF%D9%8A%D9%88-%D9%85%D9%88%D8%B4%D9%86-%D8%AC%D8%B1%D8%A7%D9%81%D9%8A%D9%83-%D8%AA%D8%B1%D9%88%D9%8A%D8%AC%D9%89-%D8%A7%D9%88-%D9%84%D9%82%D9%86%D8%A7%D8%AA%D9%83-%D8%A7%D9%88-%D9%84%D9%85%D9%86%D8%AA%D8%AC%D9%83
