Titre,Vendeur,Acheteurs,Notes,Date Dernier Avis,Catégorie,Sous-Catégorie,Mots Clés,Lien
كتابة محتوي المواقع الإلكترونية,.Aya A,3,3,منذ شهر و22 يوم,كتابة وترجمة,محتوى مواقع,"كتابة, كتابة محتوى مواقع, كتابة محتوى, كتابة مقالات, كتابة مقال",https://khamsat.com/writing/articles-blogposts/3144204-%D9%83%D8%AA%D8%A7%D8%A8%D8%A9-%D9%85%D8%AD%D8%AA%D9%88%D9%8A-%D8%A7%D9%84%D9%85%D9%88%D8%A7%D9%82%D8%B9-%D8%A7%D9%84%D8%A5%D9%84%D9%83%D8%AA%D8%B1%D9%88%D9%86%D9%8A%D8%A9
كتابة كافة أنواع المحتوى باسلوب احترافي ومميز,ضحى غ.,1,1,منذ سنة وشهر,كتابة وترجمة,محتوى مواقع,"تصميم, شعار, كتابة, احترافية, نصوص",https://khamsat.com/writing/articles-blogposts/2881762-%D9%83%D8%AA%D8%A7%D8%A8%D8%A9-%D9%83%D8%A7%D9%81%D8%A9-%D8%A3%D9%86%D9%88%D8%A7%D8%B9-%D8%A7%D9%84%D9%85%D8%AD%D8%AA%D9%88%D9%89-%D8%A8%D8%A7%D8%B3%D9%84%D9%88%D8%A8-%D8%A7%D8%AD%D8%AA%D8%B1%D8%A7%D9%81%D9%8A-%D9%88%D9%85%D9%85%D9%8A%D8%B2
تحرير و تعديل و كتابة النصوص علي برنامج الوررد,.Fathalrhman Y,0,0,Aucun avis,كتابة وترجمة,محتوى مواقع,"كتابة, تحرير, نص, pdf, word",https://khamsat.com/writing/articles-blogposts/1002479-%D8%AA%D8%AD%D8%B1%D9%8A%D8%B1-%D9%88-%D8%AA%D8%B9%D8%AF%D9%8A%D9%84-%D9%88-%D9%83%D8%AA%D8%A7%D8%A8%D8%A9-%D8%A7%D9%84%D9%86%D8%B5%D9%88%D8%B5-%D8%B9%D9%84%D9%8A-%D8%A8%D8%B1%D9%86%D8%A7%D9%85%D8%AC-%D8%A7%D9%84%D9%88%D8%B1%D8%B1%D8%AF
كتابة مقالات حصرية وفقا لقواعد السيو SEO,.Youcef C,2,2,منذ سنتين و11 شهر,كتابة وترجمة,محتوى مواقع,"بحث, عربي, إنجليزي, كتابة, مقالات, تحرير, محتوى, المقالات, الوورد, مراجعات",https://khamsat.com/writing/articles-blogposts/2243669-%D9%83%D8%AA%D8%A7%D8%A8%D8%A9-%D9%85%D9%82%D8%A7%D9%84%D8%A7%D8%AA-%D8%AD%D8%B5%D8%B1%D9%8A%D8%A9-%D9%88%D9%81%D9%82%D8%A7-%D9%84%D9%82%D9%88%D8%A7%D8%B9%D8%AF-%D8%A7%D9%84%D8%B3%D9%8A%D9%88-seo
كتابة مقالات محاسبيه حصرية على موقعك,احمد م.,3,1,منذ 6 سنوات و6 أشهر,كتابة وترجمة,محتوى مواقع,"كتابه, صياغه, مدونات, تفريغ, مقالات, منتديات, seo, كحنوى",https://khamsat.com/writing/articles-blogposts/1118132-%D9%83%D8%AA%D8%A7%D8%A8%D8%A9-%D9%85%D9%82%D8%A7%D9%84%D8%A7%D8%AA-%D9%85%D8%AD%D8%A7%D8%B3%D8%A8%D9%8A%D9%87-%D8%AD%D8%B5%D8%B1%D9%8A%D8%A9-%D8%B9%D9%84%D9%89-%D9%85%D9%88%D9%82%D8%B9%D9%83
مقالات حصرية متوافقة مع السيو,.Alaa A,4,3,منذ سنتين و3 أشهر,كتابة وترجمة,محتوى مواقع,"كتابة, مقالات, سيو",https://khamsat.com/writing/articles-blogposts/2243922-%D9%85%D9%82%D8%A7%D9%84%D8%A7%D8%AA-%D8%AD%D8%B5%D8%B1%D9%8A%D8%A9-%D9%85%D8%AA%D9%88%D8%A7%D9%81%D9%82%D8%A9-%D9%85%D8%B9-%D8%A7%D9%84%D8%B3%D9%8A%D9%88
كتابة مقالات في أي مجال بدقة لغوية واتباع معايير Seo,أروى ع.,70,46,منذ 21 يوم و23 ساعة,كتابة وترجمة,محتوى مواقع,"كتابة, مقالات, حصرية, seo, سيو",https://khamsat.com/writing/articles-blogposts/952215-%D9%83%D8%AA%D8%A7%D8%A8%D8%A9-%D9%85%D9%82%D8%A7%D9%84%D8%A7%D8%AA-%D9%81%D9%8A-%D8%A3%D9%8A-%D9%85%D8%AC%D8%A7%D9%84-%D8%A8%D8%AF%D9%82%D8%A9-%D9%84%D8%BA%D9%88%D9%8A%D8%A9-%D9%88%D8%A7%D8%AA%D8%A8%D8%A7%D8%B9-%D9%85%D8%B9%D8%A7%D9%8A%D9%8A%D8%B1-seo
- كتابة 3 مقالات كل مقال 500 كلمة,منصور ع.,10,7,منذ سنتين و3 أشهر,كتابة وترجمة,محتوى مواقع,"كتابة, مقالات, مقال, كل, كلمة, 500",https://khamsat.com/writing/articles-blogposts/813922-%D9%83%D8%AA%D8%A7%D8%A8%D8%A9-3-%D9%85%D9%82%D8%A7%D9%84%D8%A7%D8%AA-%D9%83%D9%84-%D9%85%D9%82%D8%A7%D9%84-500-%D9%83%D9%84%D9%85%D8%A9
كتابة مقالات حصرية في كل المجالات,.Mohamed B,2,1,منذ 5 سنوات و6 أشهر,كتابة وترجمة,محتوى مواقع,"كتابة, مقالات, حصرية, إبداعية",https://khamsat.com/writing/articles-blogposts/1403332-%D9%83%D8%AA%D8%A7%D8%A8%D8%A9-%D9%85%D9%82%D8%A7%D9%84%D8%A7%D8%AA-%D8%AD%D8%B5%D8%B1%D9%8A%D8%A9-%D9%81%D9%8A-%D9%83%D9%84-%D8%A7%D9%84%D9%85%D8%AC%D8%A7%D9%84%D8%A7%D8%AA
كتابة  مقالات لتصدر أولى محركات البحث بجميع المجالات,.Mohammed Y,61,46,منذ شهر و5 أيام,كتابة وترجمة,محتوى مواقع,"بلوجر, كتابة, مقالة, مواضيع, مقالات, حصرية, وردبريس, البحث, محركات, محتوي",https://khamsat.com/writing/articles-blogposts/1617552-%D9%83%D8%AA%D8%A7%D8%A8%D8%A9-%D9%85%D9%82%D8%A7%D9%84%D8%A7%D8%AA-%D9%84%D8%AA%D8%B5%D8%AF%D8%B1-%D8%A3%D9%88%D9%84%D9%89-%D9%85%D8%AD%D8%B1%D9%83%D8%A7%D8%AA-%D8%A7%D9%84%D8%A8%D8%AD%D8%AB-%D8%A8%D8%AC%D9%85%D9%8A%D8%B9-%D8%A7%D9%84%D9%85%D8%AC%D8%A7%D9%84%D8%A7%D8%AA
كتابه مقالات متوافقه مع قواعد سيو عربي وانجليزي,.Antar G,3,3,منذ سنة وشهر,كتابة وترجمة,محتوى مواقع,"كتابة, بحوث, مقالات, كتابة بحوث, مقالات حصرية",https://khamsat.com/writing/articles-blogposts/2872007-%D9%83%D8%AA%D8%A7%D8%A8%D9%87-%D9%85%D9%82%D8%A7%D9%84%D8%A7%D8%AA-%D9%85%D8%AA%D9%88%D8%A7%D9%81%D9%82%D9%87-%D9%85%D8%B9-%D9%82%D9%88%D8%A7%D8%B9%D8%AF-%D8%B3%D9%8A%D9%88-%D8%B9%D8%B1%D8%A8%D9%8A-%D9%88%D8%A7%D9%86%D8%AC%D9%84%D9%8A%D8%B2%D9%8A
"كتابة مقالة تتوافق مع معايير السيو , كل 300 كلمة",.Mostafa S,7,5,منذ سنة و6 أشهر,كتابة وترجمة,محتوى مواقع,"كتابة, مقالة, مقالات, seo, إبداع, مبدع, السيو",https://khamsat.com/writing/articles-blogposts/1681241-%D9%83%D8%AA%D8%A7%D8%A8%D8%A9-%D9%85%D9%82%D8%A7%D9%84%D8%A9-%D8%AA%D8%AA%D9%88%D8%A7%D9%81%D9%82-%D9%85%D8%B9-%D9%85%D8%B9%D8%A7%D9%8A%D9%8A%D8%B1-%D8%A7%D9%84%D8%B3%D9%8A%D9%88-%D9%83%D9%84-300-%D9%83%D9%84%D9%85%D8%A9
كتابة مقالات حصرية لموقعك او مدونتك في كل المجالات,ياسمين أ.,1,1,منذ 4 أشهر و24 يوم,كتابة وترجمة,محتوى مواقع,"كتابة, مقالات, السيو, مقالات حصرية, تصدر نتائج البحث",https://khamsat.com/writing/articles-blogposts/2715588-%D9%83%D8%AA%D8%A7%D8%A8%D8%A9-%D9%85%D9%82%D8%A7%D9%84%D8%A7%D8%AA-%D8%AD%D8%B5%D8%B1%D9%8A%D8%A9-%D9%84%D9%85%D9%88%D9%82%D8%B9%D9%83-%D8%A7%D9%88-%D9%85%D8%AF%D9%88%D9%86%D8%AA%D9%83-%D9%81%D9%8A-%D9%83%D9%84-%D8%A7%D9%84%D9%85%D8%AC%D8%A7%D9%84%D8%A7%D8%AA
كتابه علي الوورد والاكسل وتفريغ ملفات,محمد د.,10,7,منذ شهر و14 يوم,كتابة وترجمة,محتوى مواقع,"تصميم, تفريغ, كتابة, مقالات, word",https://khamsat.com/writing/articles-blogposts/2910815-%D9%83%D8%AA%D8%A7%D8%A8%D9%87-%D8%B9%D9%84%D9%8A-%D8%A7%D9%84%D9%88%D9%88%D8%B1%D8%AF-%D9%88%D8%A7%D9%84%D8%A7%D9%83%D8%B3%D9%84-%D9%88%D8%AA%D9%81%D8%B1%D9%8A%D8%BA-%D9%85%D9%84%D9%81%D8%A7%D8%AA
كتابة مقالات حصرية ومتوافقة مع السيو,ابتسام م.,29,21,منذ 3 أشهر وساعة,كتابة وترجمة,محتوى مواقع,"كتابة, مقالات, حصرية",https://khamsat.com/writing/articles-blogposts/2060688-%D9%83%D8%AA%D8%A7%D8%A8%D8%A9-%D9%85%D9%82%D8%A7%D9%84%D8%A7%D8%AA-%D8%AD%D8%B5%D8%B1%D9%8A%D8%A9-%D9%88%D9%85%D8%AA%D9%88%D8%A7%D9%81%D9%82%D8%A9-%D9%85%D8%B9-%D8%A7%D9%84%D8%B3%D9%8A%D9%88
"كتابة مقالة تتوافق مع معايير السيو , كل 300 كلمة",.Mostafa S,7,5,منذ سنة و6 أشهر,كتابة وترجمة,محتوى مواقع,"كتابة, مقالة, مقالات, seo, إبداع, مبدع, السيو",https://khamsat.com/writing/articles-blogposts/1681241-%D9%83%D8%AA%D8%A7%D8%A8%D8%A9-%D9%85%D9%82%D8%A7%D9%84%D8%A9-%D8%AA%D8%AA%D9%88%D8%A7%D9%81%D9%82-%D9%85%D8%B9-%D9%85%D8%B9%D8%A7%D9%8A%D9%8A%D8%B1-%D8%A7%D9%84%D8%B3%D9%8A%D9%88-%D9%83%D9%84-300-%D9%83%D9%84%D9%85%D8%A9
كتابة مقالات حصرية متوافقة مع SEO,رهف ا.,0,0,Aucun avis,كتابة وترجمة,محتوى مواقع,"كتابة, مقالات, كتابة محتوى, seo, سيو",https://khamsat.com/writing/articles-blogposts/3143980-%D9%83%D8%AA%D8%A7%D8%A8%D8%A9-%D9%85%D9%82%D8%A7%D9%84%D8%A7%D8%AA-%D8%AD%D8%B5%D8%B1%D9%8A%D8%A9-%D9%85%D8%AA%D9%88%D8%A7%D9%81%D9%82%D8%A9-%D9%85%D8%B9-seo
كتابة المقالات والمحتوى، بالعربية والإنجليزية,محمد ن.,1,1,منذ 10 أشهر و26 يوم,كتابة وترجمة,محتوى مواقع,"كتابة, كتابة محتوى مواقع, كتابة محتوى, كتابة مقالات, كاتب",https://khamsat.com/writing/articles-blogposts/2969236-%D9%83%D8%AA%D8%A7%D8%A8%D8%A9-%D8%A7%D9%84%D9%85%D9%82%D8%A7%D9%84%D8%A7%D8%AA-%D9%88%D8%A7%D9%84%D9%85%D8%AD%D8%AA%D9%88%D9%89-%D8%A8%D8%A7%D9%84%D8%B9%D8%B1%D8%A8%D9%8A%D8%A9-%D9%88%D8%A7%D9%84%D8%A5%D9%86%D8%AC%D9%84%D9%8A%D8%B2%D9%8A%D8%A9
نشر مقالات رأي على موقع عربي,مصطفى م.,1,1,منذ 3 أشهر و22 يوم,كتابة وترجمة,محتوى مواقع,"مواقع الكترونية, كتابة, مقالات, صحف, جيست بوست",https://khamsat.com/writing/articles-blogposts/3607899-%D9%86%D8%B4%D8%B1-%D9%85%D9%82%D8%A7%D9%84%D8%A7%D8%AA-%D8%B1%D8%A3%D9%8A-%D8%B9%D9%84%D9%89-%D9%85%D9%88%D9%82%D8%B9-%D8%B9%D8%B1%D8%A8%D9%8A
كتابة مقال متوافق مع SEO,.Mahasen A,4,3,منذ سنتين و3 أشهر,كتابة وترجمة,محتوى مواقع,"ووردبرس, seo, readability, صديق مع محركات البحث, متصدر لعملية البحث",https://khamsat.com/writing/articles-blogposts/1880390-%D9%83%D8%AA%D8%A7%D8%A8%D8%A9-%D9%85%D9%82%D8%A7%D9%84-%D9%85%D8%AA%D9%88%D8%A7%D9%81%D9%82-%D9%85%D8%B9-seo
مقالات  احترافية فى مجالات متنوعة,هيام ا.,14,9,منذ 9 سنوات و6 أشهر,كتابة وترجمة,محتوى مواقع,"مدونة, مقالات, المجالات, تقارير, سيو",https://khamsat.com/writing/articles-blogposts/268598-%D9%85%D9%82%D8%A7%D9%84%D8%A7%D8%AA-%D8%A7%D8%AD%D8%AA%D8%B1%D8%A7%D9%81%D9%8A%D8%A9-%D9%81%D9%89-%D9%85%D8%AC%D8%A7%D9%84%D8%A7%D8%AA-%D9%85%D8%AA%D9%86%D9%88%D8%B9%D8%A9
كتابة مقالات ومراجعات أدبية,حيدر ن.,21,17,منذ سنة وشهرين,كتابة وترجمة,محتوى مواقع,"كتابة, محتوى, عرض, علمية, كلمات, مقدمة, مفردات, أدبية, قوة, خاتمة",https://khamsat.com/writing/articles-blogposts/2078895-%D9%83%D8%AA%D8%A7%D8%A8%D8%A9-%D9%85%D9%82%D8%A7%D9%84%D8%A7%D8%AA-%D9%88%D9%85%D8%B1%D8%A7%D8%AC%D8%B9%D8%A7%D8%AA-%D8%A3%D8%AF%D8%A8%D9%8A%D8%A9
تنسق المراجع داخل النص وفي الفهرس,سيوار ا.,2,2,منذ سنتين و10 أشهر,كتابة وترجمة,محتوى مواقع,"بحث, كتابة, مقال, أكاديمية, مراجع, in, ورقة, بحثية, text, فهرس, mla, apa, harvard, citations",https://khamsat.com/writing/articles-blogposts/2285733-%D8%AA%D9%86%D8%B3%D9%82-%D8%A7%D9%84%D9%85%D8%B1%D8%A7%D8%AC%D8%B9-%D8%AF%D8%A7%D8%AE%D9%84-%D8%A7%D9%84%D9%86%D8%B5-%D9%88%D9%81%D9%8A-%D8%A7%D9%84%D9%81%D9%87%D8%B1%D8%B3
كتابة مقالات متوافقة مع SEO تضمن الظهور في محركات البحث,فرح ح.,0,0,Aucun avis,كتابة وترجمة,محتوى مواقع,"كتابة, مقالات, كتابة محتوى, seo, مقالات حصرية",https://khamsat.com/writing/articles-blogposts/3928244-%D9%83%D8%AA%D8%A7%D8%A8%D8%A9-%D9%85%D9%82%D8%A7%D9%84%D8%A7%D8%AA-%D9%85%D8%AA%D9%88%D8%A7%D9%81%D9%82%D8%A9-%D9%85%D8%B9-seo-%D8%AA%D8%B6%D9%85%D9%86-%D8%A7%D9%84%D8%B8%D9%87%D9%88%D8%B1-%D9%81%D9%8A-%D9%85%D8%AD%D8%B1%D9%83%D8%A7%D8%AA-%D8%A7%D9%84%D8%A8%D8%AD%D8%AB
أقدم لك مقالات إبداعية في مختلف المجالات,.Asmaa D,77,60,منذ سنة وشهر,كتابة وترجمة,محتوى مواقع,"الاحتراف, التميز, الإبداع, البساطة, الفكر القيم",https://khamsat.com/writing/articles-blogposts/876015-%D8%A3%D9%82%D8%AF%D9%85-%D9%84%D9%83-%D9%85%D9%82%D8%A7%D9%84%D8%A7%D8%AA-%D8%A5%D8%A8%D8%AF%D8%A7%D8%B9%D9%8A%D8%A9-%D9%81%D9%8A-%D9%85%D8%AE%D8%AA%D9%84%D9%81-%D8%A7%D9%84%D9%85%D8%AC%D8%A7%D9%84%D8%A7%D8%AA
مقالات احترافية تتصدر محركات البحث وتضاعف زيارات موقعك,.Ahmed A,0,0,Aucun avis,كتابة وترجمة,محتوى مواقع,"مقالات, seo, تحسين محركات البحث, تصدر نتائج البحث, تحسين السيو",https://khamsat.com/writing/articles-blogposts/3055953-%D9%85%D9%82%D8%A7%D9%84%D8%A7%D8%AA-%D8%A7%D8%AD%D8%AA%D8%B1%D8%A7%D9%81%D9%8A%D8%A9-%D8%AA%D8%AA%D8%B5%D8%AF%D8%B1-%D9%85%D8%AD%D8%B1%D9%83%D8%A7%D8%AA-%D8%A7%D9%84%D8%A8%D8%AD%D8%AB-%D9%88%D8%AA%D8%B6%D8%A7%D8%B9%D9%81-%D8%B2%D9%8A%D8%A7%D8%B1%D8%A7%D8%AA-%D9%85%D9%88%D9%82%D8%B9%D9%83
كتابة مقالات متوافقة مع السيو SEO,.Abeer A,3,3,منذ سنتين و3 أشهر,كتابة وترجمة,محتوى مواقع,ووردبريس,https://khamsat.com/writing/articles-blogposts/2280827-%D9%83%D8%AA%D8%A7%D8%A8%D8%A9-%D9%85%D9%82%D8%A7%D9%84%D8%A7%D8%AA-%D9%85%D8%AA%D9%88%D8%A7%D9%81%D9%82%D8%A9-%D9%85%D8%B9-%D8%A7%D9%84%D8%B3%D9%8A%D9%88-seo
كتابة مقالات مواقع متنوعة,.Reham A,0,0,Aucun avis,كتابة وترجمة,محتوى مواقع,"تدقيق, حصرية, ووردبرس, سيو, كتابة المقالات",https://khamsat.com/writing/articles-blogposts/3003161-%D9%83%D8%AA%D8%A7%D8%A8%D8%A9-%D9%85%D9%82%D8%A7%D9%84%D8%A7%D8%AA-%D9%85%D9%88%D8%A7%D9%82%D8%B9-%D9%85%D8%AA%D9%86%D9%88%D8%B9%D8%A9
كتابة مقالات احترافية غير منسوخة حصرية 100% لتصدر محرك البحث,.Anas R,0,0,Aucun avis,كتابة وترجمة,محتوى مواقع,"كتابة, مقالات, كتابة محتوى مواقع, البحث, كتابة مقالات, سيو, مقالات حصرية, غير منسوخة, تحسين السيو, تصدر محركات",https://khamsat.com/writing/articles-blogposts/2405213-%D9%83%D8%AA%D8%A7%D8%A8%D8%A9-%D9%85%D9%82%D8%A7%D9%84%D8%A7%D8%AA-%D8%A7%D8%AD%D8%AA%D8%B1%D8%A7%D9%81%D9%8A%D8%A9-%D8%BA%D9%8A%D8%B1-%D9%85%D9%86%D8%B3%D9%88%D8%AE%D8%A9-%D8%AD%D8%B5%D8%B1%D9%8A%D8%A9-100-%D9%84%D8%AA%D8%B5%D8%AF%D8%B1-%D9%85%D8%AD%D8%B1%D9%83-%D8%A7%D9%84%D8%A8%D8%AD%D8%AB
كتابة مقالات حصرية ومتوافقة مع قواعد السيو,هبة س.,132,100,منذ شهرين و4 أيام,كتابة وترجمة,محتوى مواقع,"موقع, ووردبريس, كتابة, مقالات, محتوى",https://khamsat.com/writing/articles-blogposts/1615037-%D9%83%D8%AA%D8%A7%D8%A8%D8%A9-%D9%85%D9%82%D8%A7%D9%84%D8%A7%D8%AA-%D8%AD%D8%B5%D8%B1%D9%8A%D8%A9-%D9%88%D9%85%D8%AA%D9%88%D8%A7%D9%81%D9%82%D8%A9-%D9%85%D8%B9-%D9%82%D9%88%D8%A7%D8%B9%D8%AF-%D8%A7%D9%84%D8%B3%D9%8A%D9%88
كتابة مقالات حصرية,.Ghada D,25,19,منذ 4 سنوات و8 أشهر,كتابة وترجمة,محتوى مواقع,"كتابة, مقالة, مقالات, تدقيق, حصرية",https://khamsat.com/writing/articles-blogposts/607680-%D9%83%D8%AA%D8%A7%D8%A8%D8%A9-%D9%85%D9%82%D8%A7%D9%84%D8%A7%D8%AA-%D8%AD%D8%B5%D8%B1%D9%8A%D8%A9
كتابة محتوى ومقالات SEO عربي إنجليزي,محمد حمزه ج.,1,1,منذ 10 أشهر و14 يوم,كتابة وترجمة,محتوى مواقع,"مقالات, منشورات, seo, الكتابة, صناعة المحتوى",https://khamsat.com/writing/articles-blogposts/3095566-%D9%83%D8%AA%D8%A7%D8%A8%D8%A9-%D9%85%D8%AD%D8%AA%D9%88%D9%89-%D9%88%D9%85%D9%82%D8%A7%D9%84%D8%A7%D8%AA-seo-%D8%B9%D8%B1%D8%A8%D9%8A-%D8%A5%D9%86%D8%AC%D9%84%D9%8A%D8%B2%D9%8A
كتابة مقالات طبية وصحية في مختلف الأمراض والعلاجات والأدوية,رنيم ا.,1,1,منذ 11 شهر و22 يوم,كتابة وترجمة,محتوى مواقع,"كتابة, مقالات, صحة, طبية, مقالات طبية",https://khamsat.com/writing/articles-blogposts/2644904-%D9%83%D8%AA%D8%A7%D8%A8%D8%A9-%D9%85%D9%82%D8%A7%D9%84%D8%A7%D8%AA-%D8%B7%D8%A8%D9%8A%D8%A9-%D9%88%D8%B5%D8%AD%D9%8A%D8%A9-%D9%81%D9%8A-%D9%85%D8%AE%D8%AA%D9%84%D9%81-%D8%A7%D9%84%D8%A3%D9%85%D8%B1%D8%A7%D8%B6-%D9%88%D8%A7%D9%84%D8%B9%D9%84%D8%A7%D8%AC%D8%A7%D8%AA-%D9%88%D8%A7%D9%84%D8%A3%D8%AF%D9%88%D9%8A%D8%A9
كتابه مقالات باللغة العربية,فاطمه إ.,3,2,منذ سنتين و5 أشهر,كتابة وترجمة,محتوى مواقع,"كتابة, كتابة مقالات, مقالات حصرية",https://khamsat.com/writing/articles-blogposts/2505949-%D9%83%D8%AA%D8%A7%D8%A8%D9%87-%D9%85%D9%82%D8%A7%D9%84%D8%A7%D8%AA-%D8%A8%D8%A7%D9%84%D9%84%D8%BA%D8%A9-%D8%A7%D9%84%D8%B9%D8%B1%D8%A8%D9%8A%D8%A9
كتابة محتوى مواقع متوافق مع قواعد السيو,.Seham H,4,3,منذ سنة وشهرين,كتابة وترجمة,محتوى مواقع,"مواقع, كتابة, محتوى, seo",https://khamsat.com/writing/articles-blogposts/1997849-%D9%83%D8%AA%D8%A7%D8%A8%D8%A9-%D9%85%D8%AD%D8%AA%D9%88%D9%89-%D9%85%D9%88%D8%A7%D9%82%D8%B9-%D9%85%D8%AA%D9%88%D8%A7%D9%81%D9%82-%D9%85%D8%B9-%D9%82%D9%88%D8%A7%D8%B9%D8%AF-%D8%A7%D9%84%D8%B3%D9%8A%D9%88
كتابة مقالات احترافية متوافقة مع السيو كل 2000 كلمة مقابل 5$,.Abdelrahman K,3,2,منذ 3 سنوات و3 أشهر,كتابة وترجمة,محتوى مواقع,"كتابة, مقالات, حصرية, احترافية, أخبار, سيو, كاتب",https://khamsat.com/writing/articles-blogposts/1204721-%D9%83%D8%AA%D8%A7%D8%A8%D8%A9-%D9%85%D9%82%D8%A7%D9%84%D8%A7%D8%AA-%D8%A7%D8%AD%D8%AA%D8%B1%D8%A7%D9%81%D9%8A%D8%A9-%D9%85%D8%AA%D9%88%D8%A7%D9%81%D9%82%D8%A9-%D9%85%D8%B9-%D8%A7%D9%84%D8%B3%D9%8A%D9%88-%D9%83%D9%84-2000-%D9%83%D9%84%D9%85%D8%A9-%D9%85%D9%82%D8%A7%D8%A8%D9%84-5
كتابة مقالات باللغة العربية والإنجليزية في مختلف المجالات,خلود ا.,7,8,منذ شهر و20 يوم,كتابة وترجمة,محتوى مواقع,"مواقع, كتابة, مقالات, محتوى, كاتب",https://khamsat.com/writing/articles-blogposts/2263223-%D9%83%D8%AA%D8%A7%D8%A8%D8%A9-%D9%85%D9%82%D8%A7%D9%84%D8%A7%D8%AA-%D8%A8%D8%A7%D9%84%D9%84%D8%BA%D8%A9-%D8%A7%D9%84%D8%B9%D8%B1%D8%A8%D9%8A%D8%A9-%D9%88%D8%A7%D9%84%D8%A5%D9%86%D8%AC%D9%84%D9%8A%D8%B2%D9%8A%D8%A9-%D9%81%D9%8A-%D9%85%D8%AE%D8%AA%D9%84%D9%81-%D8%A7%D9%84%D9%85%D8%AC%D8%A7%D9%84%D8%A7%D8%AA
كتابة مقالات في جميع التخصصات,.Dhoha A,82,56,منذ 10 أشهر و5 أيام,كتابة وترجمة,محتوى مواقع,"عربية, ووردبريس, مقالات, انجليزية, seo",https://khamsat.com/writing/articles-blogposts/1365666-%D9%83%D8%AA%D8%A7%D8%A8%D8%A9-%D9%85%D9%82%D8%A7%D9%84%D8%A7%D8%AA-%D9%81%D9%8A-%D8%AC%D9%85%D9%8A%D8%B9-%D8%A7%D9%84%D8%AA%D8%AE%D8%B5%D8%B5%D8%A7%D8%AA
كتابة مقالات حصرية متوافقة مع السيو,.Ahmed A,0,0,Aucun avis,كتابة وترجمة,محتوى مواقع,"كتابة, مقالات, خدمة, سيو, موقع الكتروني",https://khamsat.com/writing/articles-blogposts/2920766-%D9%83%D8%AA%D8%A7%D8%A8%D8%A9-%D9%85%D9%82%D8%A7%D9%84%D8%A7%D8%AA-%D8%AD%D8%B5%D8%B1%D9%8A%D8%A9-%D9%85%D8%AA%D9%88%D8%A7%D9%81%D9%82%D8%A9-%D9%85%D8%B9-%D8%A7%D9%84%D8%B3%D9%8A%D9%88
كتابة مقالة ضمن قواعد السيو,يحيى م.,2,2,منذ سنة وشهرين,كتابة وترجمة,محتوى مواقع,"مقالات, سيو",https://khamsat.com/writing/articles-blogposts/1966164-%D9%83%D8%AA%D8%A7%D8%A8%D8%A9-%D9%85%D9%82%D8%A7%D9%84%D8%A9-%D8%B6%D9%85%D9%86-%D9%82%D9%88%D8%A7%D8%B9%D8%AF-%D8%A7%D9%84%D8%B3%D9%8A%D9%88
كتابة مقالات متوافقة مع السيو باللغات العربية والفرنسية والا,نوال أ.,4,2,منذ سنة و4 أشهر,كتابة وترجمة,محتوى مواقع,"العربية, الانجليزية, كتابة, مقالة, الفرنسية, السيو",https://khamsat.com/writing/articles-blogposts/2194685-%D9%83%D8%AA%D8%A7%D8%A8%D8%A9-%D9%85%D9%82%D8%A7%D9%84%D8%A7%D8%AA-%D9%85%D8%AA%D9%88%D8%A7%D9%81%D9%82%D8%A9-%D9%85%D8%B9-%D8%A7%D9%84%D8%B3%D9%8A%D9%88-%D8%A8%D8%A7%D9%84%D9%84%D8%BA%D8%A7%D8%AA-%D8%A7%D9%84%D8%B9%D8%B1%D8%A8%D9%8A%D8%A9-%D9%88%D8%A7%D9%84%D9%81%D8%B1%D9%86%D8%B3%D9%8A%D8%A9-%D9%88%D8%A7%D9%84%D8%A7
كتابة مقالات حصرية بشروط SEO باللغة العربية والأنجليزية,.Khaled E,0,0,Aucun avis,كتابة وترجمة,محتوى مواقع,"كتابة, ادسنس, seo, كتابه محتوي",https://khamsat.com/writing/articles-blogposts/3052660-%D9%83%D8%AA%D8%A7%D8%A8%D8%A9-%D9%85%D9%82%D8%A7%D9%84%D8%A7%D8%AA-%D8%AD%D8%B5%D8%B1%D9%8A%D8%A9-%D8%A8%D8%B4%D8%B1%D9%88%D8%B7-seo-%D8%A8%D8%A7%D9%84%D9%84%D8%BA%D8%A9-%D8%A7%D9%84%D8%B9%D8%B1%D8%A8%D9%8A%D8%A9-%D9%88%D8%A7%D9%84%D8%A3%D9%86%D8%AC%D9%84%D9%8A%D8%B2%D9%8A%D8%A9
كتابة محتوى الموقع أو المدونة أو المتجر الخاص بك,محمد ا.,10,4,منذ سنتين و11 شهر,كتابة وترجمة,محتوى مواقع,"كتابة, محتوى, سياسة, الموقع, الخصوصية, الاستخدام, الاسترجاع",https://khamsat.com/writing/articles-blogposts/1636283-%D9%83%D8%AA%D8%A7%D8%A8%D8%A9-%D9%85%D8%AD%D8%AA%D9%88%D9%89-%D8%A7%D9%84%D9%85%D9%88%D9%82%D8%B9-%D8%A3%D9%88-%D8%A7%D9%84%D9%85%D8%AF%D9%88%D9%86%D8%A9-%D8%A3%D9%88-%D8%A7%D9%84%D9%85%D8%AA%D8%AC%D8%B1-%D8%A7%D9%84%D8%AE%D8%A7%D8%B5-%D8%A8%D9%83
كتابة مقالات وأبحاث أدبية,إبراهيم ا.,0,0,Aucun avis,كتابة وترجمة,محتوى مواقع,"كتابة, مقالات, pdf, word, ادبية",https://khamsat.com/writing/articles-blogposts/2890744-%D9%83%D8%AA%D8%A7%D8%A8%D8%A9-%D9%85%D9%82%D8%A7%D9%84%D8%A7%D8%AA-%D9%88%D8%A3%D8%A8%D8%AD%D8%A7%D8%AB-%D8%A3%D8%AF%D8%A8%D9%8A%D8%A9
مقالات حصرية خاصة بالمدونات,دالين م.,11,7,منذ سنتين و9 أشهر,كتابة وترجمة,محتوى مواقع,"كتابة, مقالات, حصرية, seo, السيو",https://khamsat.com/writing/articles-blogposts/1737280-%D9%85%D9%82%D8%A7%D9%84%D8%A7%D8%AA-%D8%AD%D8%B5%D8%B1%D9%8A%D8%A9-%D8%AE%D8%A7%D8%B5%D8%A9-%D8%A8%D8%A7%D9%84%D9%85%D8%AF%D9%88%D9%86%D8%A7%D8%AA
كتابة مقالات حصرية متوافقة مع السيو,.Ammar M,3,2,منذ 4 أشهر و4 أيام,كتابة وترجمة,محتوى مواقع,"ووردبريس, كتابة, مقالات, محتوى, كتابة مقالات حصرية",https://khamsat.com/writing/articles-blogposts/3461403-%D9%83%D8%AA%D8%A7%D8%A8%D8%A9-%D9%85%D9%82%D8%A7%D9%84%D8%A7%D8%AA-%D8%AD%D8%B5%D8%B1%D9%8A%D8%A9-%D9%85%D8%AA%D9%88%D8%A7%D9%81%D9%82%D8%A9-%D9%85%D8%B9-%D8%A7%D9%84%D8%B3%D9%8A%D9%88
كتابة مقالات متوافقة مع السيو,علي ج.,18,12,منذ 14 يوم و19 ساعة,كتابة وترجمة,محتوى مواقع,"حصرية, seo, كتابة مقالات, تحسين محركات البحث, تحسين السيو",https://khamsat.com/writing/articles-blogposts/1918153-%D9%83%D8%AA%D8%A7%D8%A8%D8%A9-%D9%85%D9%82%D8%A7%D9%84%D8%A7%D8%AA-%D9%85%D8%AA%D9%88%D8%A7%D9%81%D9%82%D8%A9-%D9%85%D8%B9-%D8%A7%D9%84%D8%B3%D9%8A%D9%88
كتابة مقالات بطريقة جذّابة وسلسة,.Elhussein H,7,5,منذ 3 سنوات و8 أشهر,كتابة وترجمة,محتوى مواقع,"كتابة, مقالات, seo, السيو, مجالات, كافة",https://khamsat.com/writing/articles-blogposts/2016608-%D9%83%D8%AA%D8%A7%D8%A8%D8%A9-%D9%85%D9%82%D8%A7%D9%84%D8%A7%D8%AA-%D8%A8%D8%B7%D8%B1%D9%8A%D9%82%D8%A9-%D8%AC%D8%B0%D8%A7%D8%A8%D8%A9-%D9%88%D8%B3%D9%84%D8%B3%D8%A9
كتابة مقالات حصرية متوافقة مع محركات البحث,.Basma S,1,1,منذ 5 أشهر و13 يوم,كتابة وترجمة,محتوى مواقع,"مقالات, seo, محركات, تدوينات, مقالات حصرية",https://khamsat.com/writing/articles-blogposts/3072075-%D9%83%D8%AA%D8%A7%D8%A8%D8%A9-%D9%85%D9%82%D8%A7%D9%84%D8%A7%D8%AA-%D8%AD%D8%B5%D8%B1%D9%8A%D8%A9-%D9%85%D8%AA%D9%88%D8%A7%D9%81%D9%82%D8%A9-%D9%85%D8%B9-%D9%85%D8%AD%D8%B1%D9%83%D8%A7%D8%AA-%D8%A7%D9%84%D8%A8%D8%AD%D8%AB
كتابة الأخبار والتقارير الصحفية لموقعك,.Hayat S,1,1,منذ سنة و28 يوم,كتابة وترجمة,محتوى مواقع,"موقع, مواقع, كتابة, مقالات, اخبار, تحرير, صياغة, أخبار, صحافة, صحفية",https://khamsat.com/writing/articles-blogposts/2825590-%D9%83%D8%AA%D8%A7%D8%A8%D8%A9-%D8%A7%D9%84%D8%A3%D8%AE%D8%A8%D8%A7%D8%B1-%D9%88%D8%A7%D9%84%D8%AA%D9%82%D8%A7%D8%B1%D9%8A%D8%B1-%D8%A7%D9%84%D8%B5%D8%AD%D9%81%D9%8A%D8%A9-%D9%84%D9%85%D9%88%D9%82%D8%B9%D9%83
كتابة مقالات,اماني م.,169,120,منذ سنة وشهرين,كتابة وترجمة,محتوى مواقع,"كتابه, مقالات, حصرية, مدونه, سيو",https://khamsat.com/writing/articles-blogposts/779736-%D9%83%D8%AA%D8%A7%D8%A8%D8%A9-%D9%85%D9%82%D8%A7%D9%84%D8%A7%D8%AA
الكتابة الحصرية بالعربية من مصادر أجنبية,هبة م.,19,17,منذ سنتين و5 أشهر,كتابة وترجمة,محتوى مواقع,"ترجمة, تلخيص, كتابة, مقالات, سيو",https://khamsat.com/writing/articles-blogposts/970159-%D8%A7%D9%84%D9%83%D8%AA%D8%A7%D8%A8%D8%A9-%D8%A7%D9%84%D8%AD%D8%B5%D8%B1%D9%8A%D8%A9-%D8%A8%D8%A7%D9%84%D8%B9%D8%B1%D8%A8%D9%8A%D8%A9-%D9%85%D9%86-%D9%85%D8%B5%D8%A7%D8%AF%D8%B1-%D8%A3%D8%AC%D9%86%D8%A8%D9%8A%D8%A9
