Titre,Vendeur,Acheteurs,Notes,Date Dernier Avis,Catégorie,Sous-Catégorie,Mots Clés,Lien
مونتاج فيديوهات قصيرة احترافية,.Omar M,8,3,منذ 7 أيام و11 ساعة,فيديو وأنيميشن,فيديوهات سوشيال وإعلانات,"تصميم, فيديو, مونتاج, مونتاج فيديو, ريلز",https://khamsat.com/video-design/video-editing/3662587-%D9%85%D9%88%D9%86%D8%AA%D8%A7%D8%AC-%D9%81%D9%8A%D8%AF%D9%8A%D9%88%D9%87%D8%A7%D8%AA-%D9%82%D8%B5%D9%8A%D8%B1%D8%A9-%D8%A7%D8%AD%D8%AA%D8%B1%D8%A7%D9%81%D9%8A%D8%A9
مونتاج فيديوهات إحترافية وبجودة عالية جدا,محمد ص.,88,58,منذ 29 يوم و12 ساعة,فيديو وأنيميشن,تحرير الفيديو,"مونتاج, مونتاج فيديو, مونتير, مونتاج احترافي, مونتاج يوتيوب فيديو",https://khamsat.com/video-design/video-editing/2121907-%D9%85%D9%88%D9%86%D8%AA%D8%A7%D8%AC-%D9%81%D9%8A%D8%AF%D9%8A%D9%88%D9%87%D8%A7%D8%AA-%D8%A5%D8%AD%D8%AA%D8%B1%D8%A7%D9%81%D9%8A%D8%A9-%D9%88%D8%A8%D8%AC%D9%88%D8%AF%D8%A9-%D8%B9%D8%A7%D9%84%D9%8A%D8%A9-%D8%AC%D8%AF%D8%A7
سأقوم بعمل فيديو توضيحي لموقعك أو تطبيقك,ياسين ا.,8,5,منذ 11 شهر و3 أيام,فيديو وأنيميشن,إنتاج الفيديو,"تصميم, فيديو",https://khamsat.com/video-design/video-editing/2049609-%D8%B3%D8%A3%D9%82%D9%88%D9%85-%D8%A8%D8%B9%D9%85%D9%84-%D9%81%D9%8A%D8%AF%D9%8A%D9%88-%D8%AA%D9%88%D8%B6%D9%8A%D8%AD%D9%8A-%D9%84%D9%85%D9%88%D9%82%D8%B9%D9%83-%D8%A3%D9%88-%D8%AA%D8%B7%D8%A8%D9%8A%D9%82%D9%83
مونتاج مقاطع الريلز بطريقة احترافية,خالد ع.,22,20,منذ 7 ساعات و51 دقيقة,فيديو وأنيميشن,فيديوهات سوشيال وإعلانات,"مونتاج, video editor, ريلز, reels, مونتاج الريلز",https://khamsat.com/video-design/video-editing/3036273-%D9%85%D9%88%D9%86%D8%AA%D8%A7%D8%AC-%D9%85%D9%82%D8%A7%D8%B7%D8%B9-%D8%A7%D9%84%D8%B1%D9%8A%D9%84%D8%B2-%D8%A8%D8%B7%D8%B1%D9%8A%D9%82%D8%A9-%D8%A7%D8%AD%D8%AA%D8%B1%D8%A7%D9%81%D9%8A%D8%A9
مونتاج فيديو احترافي  Video Editing,عبدالسلام د.,1,1,منذ شهرين و13 يوم,فيديو وأنيميشن,تحرير الفيديو,"تحرير, youtube, مونتاج, مونتاج فيديو, فيديوهات",https://khamsat.com/video-design/video-editing/2920676-%D9%85%D9%88%D9%86%D8%AA%D8%A7%D8%AC-%D9%81%D9%8A%D8%AF%D9%8A%D9%88-%D8%A7%D8%AD%D8%AA%D8%B1%D8%A7%D9%81%D9%8A-video-editing
مونتاج لفيديوهات ريلز بإحترافية,.Mohamed A,2,2,منذ شهرين و15 يوم,فيديو وأنيميشن,فيديوهات سوشيال وإعلانات,"مونتاج, مونتاج فيديو, مونتاج احترافي, ريلز, تيكتوك",https://khamsat.com/video-design/video-editing/3417563-%D9%85%D9%88%D9%86%D8%AA%D8%A7%D8%AC-%D9%84%D9%81%D9%8A%D8%AF%D9%8A%D9%88%D9%87%D8%A7%D8%AA-%D8%B1%D9%8A%D9%84%D8%B2-%D8%A8%D8%A5%D8%AD%D8%AA%D8%B1%D8%A7%D9%81%D9%8A%D8%A9
مونتاج متكامل لكل انواع المحتوي ريلز او بودكاست او اعلان,.Ahmed M,8,7,منذ 14 يوم و5 ساعات,فيديو وأنيميشن,فيديوهات سوشيال وإعلانات,"مونتاج فيديو, video editing, مونتاج احترافي, remove background, reels",https://khamsat.com/video-design/video-editing/3253682-%D9%85%D9%88%D9%86%D8%AA%D8%A7%D8%AC-%D9%85%D8%AA%D9%83%D8%A7%D9%85%D9%84-%D9%84%D9%83%D9%84-%D8%A7%D9%86%D9%88%D8%A7%D8%B9-%D8%A7%D9%84%D9%85%D8%AD%D8%AA%D9%88%D9%8A-%D8%B1%D9%8A%D9%84%D8%B2-%D8%A7%D9%88-%D8%A8%D9%88%D8%AF%D9%83%D8%A7%D8%B3%D8%AA%D8%A7%D9%88%D8%A7%D8%B9%D9%84%D8%A7%D9%86
تصميم اليرتات تويتش,زيد ع.,14,8,منذ 6 أيام و6 ساعات,فيديو وأنيميشن,تحرير الفيديو,"تصميم, تصاميم, يوتيوب, تصاميم احترافية, انمي, مونتاج الفيديو, قيمنق, تويتش, اليرتات, اليرت",https://khamsat.com/video-design/video-editing/2530505-%D8%AA%D8%B5%D9%85%D9%8A%D9%85-%D8%A7%D9%84%D9%8A%D8%B1%D8%AA%D8%A7%D8%AA-%D8%AA%D9%88%D9%8A%D8%AA%D8%B4
مونتاج إحترافي لجميع أنواع الفيديوهات وبجدودة عالية,.Abdalrahman M,28,12,منذ 8 أيام و10 ساعات,فيديو وأنيميشن,تحرير الفيديو,"فيديو, مونتاج, مونتاج فيديو, edit, يويتوب",https://khamsat.com/video-design/video-editing/2881755-%D9%85%D9%88%D9%86%D8%AA%D8%A7%D8%AC-%D8%A5%D8%AD%D8%AA%D8%B1%D8%A7%D9%81%D9%8A-%D9%84%D8%AC%D9%85%D9%8A%D8%B9-%D8%A3%D9%86%D9%88%D8%A7%D8%B9-%D8%A7%D9%84%D9%81%D9%8A%D8%AF%D9%8A%D9%88%D9%87%D8%A7%D8%AA-%D9%88%D8%A8%D8%AC%D8%AF%D9%88%D8%AF%D8%A9-%D8%B9%D8%A7%D9%84%D9%8A%D8%A9
تصميم فيديوهات كروية تحليلية متكاملة تحديد لاعبين  أسماء,.Ahmed M,2,1,منذ 14 يوم و16 ساعة,فيديو وأنيميشن,تحرير الفيديو,"تحليل المباريات بالفيديو, فيديو تحليلي رياضي, tactical analysis, تصميم بروفايل لاعبيين, soccer highlights",https://khamsat.com/video-design/video-editing/3697003-%D8%AA%D8%B5%D9%85%D9%8A%D9%85-%D9%81%D9%8A%D8%AF%D9%8A%D9%88%D9%87%D8%A7%D8%AA-%D9%83%D8%B1%D9%88%D9%8A%D8%A9-%D8%AA%D8%AD%D9%84%D9%8A%D9%84%D9%8A%D8%A9-%D9%85%D8%AA%D9%83%D8%A7%D9%85%D9%84%D8%A9-%D8%AA%D8%AD%D8%AF%D9%8A%D8%AF-%D9%84%D8%A7%D8%B9%D8%A8%D9%8A%D9%86-%D8%A3%D8%B3%D9%85%D8%A7%D8%A1
مونتاج فيديو احترافي وبجودة عالية,.Ahmed S,83,54,منذ 3 أشهر و3 أيام,فيديو وأنيميشن,تحرير الفيديو,"مونتاج, مونتاج فيديو, edit, مونتير, reels",https://khamsat.com/video-design/video-editing/1583720-%D9%85%D9%88%D9%86%D8%AA%D8%A7%D8%AC-%D9%81%D9%8A%D8%AF%D9%8A%D9%88-%D8%A7%D8%AD%D8%AA%D8%B1%D8%A7%D9%81%D9%8A-%D9%88%D8%A8%D8%AC%D9%88%D8%AF%D8%A9-%D8%B9%D8%A7%D9%84%D9%8A%D8%A9
محرر فيديو Video Editor,.Majd Aldin B,10,6,منذ شهر و13 ساعة,فيديو وأنيميشن,تحرير الفيديو,"مونتاج, نصوص, مونتاج فيديوهات, ريلز, تيكتوك",https://khamsat.com/video-design/video-editing/3395989-%D9%85%D8%AD%D8%B1%D8%B1-%D9%81%D9%8A%D8%AF%D9%8A%D9%88-video-editor
عمل ليركس فيديو و مونتاج احترافي,.Ahmed E,2,3,منذ شهر و10 أيام,فيديو وأنيميشن,تحرير الفيديو,"فيديو اعلاني, مونتاج فيديو, تصميم فيديو, انترو, ليركس فيديو",https://khamsat.com/video-design/video-editing/3159885-%D8%B9%D9%85%D9%84-%D9%84%D9%8A%D8%B1%D9%83%D8%B3-%D9%81%D9%8A%D8%AF%D9%8A%D9%88-%D9%88-%D9%85%D9%88%D9%86%D8%AA%D8%A7%D8%AC-%D8%A7%D8%AD%D8%AA%D8%B1%D8%A7%D9%81%D9%8A
مونتاج فيديو احترافي  بدقة عالية,ابراهيم ا.,2,1,منذ 4 أشهر و8 أيام,فيديو وأنيميشن,تحرير الفيديو,"مونتاج, مونتاج فيديو, برومو, تحرير فيديو, video editor",https://khamsat.com/video-design/video-editing/3041421-%D9%85%D9%88%D9%86%D8%AA%D8%A7%D8%AC-%D9%81%D9%8A%D8%AF%D9%8A%D9%88-%D8%A7%D8%AD%D8%AA%D8%B1%D8%A7%D9%81%D9%8A-%D8%A8%D8%AF%D9%82%D8%A9-%D8%B9%D8%A7%D9%84%D9%8A%D8%A9
مونتاج التلاوات القرآنية مع كتابة الآيات باعلي جودة,.Abdullrahman R,12,11,منذ 27 يوم و9 ساعات,فيديو وأنيميشن,إنتاج الفيديو,"تصميم, قرآن, تصميم مقاطع دينية, تصميم تلاوات قرآنية, مونتاج قران",https://khamsat.com/video-design/video-editing/2246751-%D9%85%D9%88%D9%86%D8%AA%D8%A7%D8%AC-%D8%A7%D9%84%D8%AA%D9%84%D8%A7%D9%88%D8%A7%D8%AA-%D8%A7%D9%84%D9%82%D8%B1%D8%A2%D9%86%D9%8A%D8%A9-%D9%85%D8%B9-%D9%83%D8%AA%D8%A7%D8%A8%D8%A9-%D8%A7%D9%84%D8%A2%D9%8A%D8%A7%D8%AA-%D8%A8%D8%A7%D8%B9%D9%84%D9%8A-%D8%AC%D9%88%D8%AF%D8%A9
منتاج احترافي لأي نوع من الفيديوهات يوتيوب، إعلانات، سوشيال,.Oussama H,3,3,منذ 5 أيام و6 ساعات,فيديو وأنيميشن,فيديوهات سوشيال وإعلانات,"تصميم, فيديو, مونتاج, after effect, مونتاج احترافي",https://khamsat.com/video-design/video-editing/3802083-%D9%85%D9%86%D8%AA%D8%A7%D8%AC-%D8%A7%D8%AD%D8%AA%D8%B1%D8%A7%D9%81%D9%8A-%D9%84%D8%A3%D9%8A-%D9%86%D9%88%D8%B9-%D9%85%D9%86-%D8%A7%D9%84%D9%81%D9%8A%D8%AF%D9%8A%D9%88%D9%87%D8%A7%D8%AA-%D9%8A%D9%88%D8%AA%D9%8A%D9%88%D8%A8-%D8%A5%D8%B9%D9%84%D8%A7%D9%86%D8%A7%D8%AA-%D8%B3%D9%88%D8%B4%D9%8A%D8%A7%D9%84
عمل مونتاج احترافي للفيديوهات حسب طلب,شعبان ع.,1,1,منذ 16 يوم و9 ساعات,فيديو وأنيميشن,تحرير الفيديو,"فيديو, يوتيوب, مونتاج, تعديل, فيديوهات",https://khamsat.com/video-design/video-editing/2927147-%D8%B9%D9%85%D9%84-%D9%85%D9%88%D9%86%D8%AA%D8%A7%D8%AC-%D8%A7%D8%AD%D8%AA%D8%B1%D8%A7%D9%81%D9%8A-%D9%84%D9%84%D9%81%D9%8A%D8%AF%D9%8A%D9%88%D9%87%D8%A7%D8%AA-%D8%AD%D8%B3%D8%A8-%D8%B7%D9%84%D8%A8
مونتاج فيديو احترافي,.Ibrahim S,24,13,منذ 8 أيام و6 ساعات,فيديو وأنيميشن,تحرير الفيديو,"فيديو اعلاني, مونتاج فيديو, ريلز, مونتاج يوتيوب, مونتاح احترافي",https://khamsat.com/video-design/video-editing/2794215-%D9%85%D9%88%D9%86%D8%AA%D8%A7%D8%AC-%D9%81%D9%8A%D8%AF%D9%8A%D9%88-%D8%A7%D8%AD%D8%AA%D8%B1%D8%A7%D9%81%D9%8A
مونتاج مقاطع فيديو احترافية و عالية الجودة,.Macidaldin A,8,4,منذ 9 أشهر و24 يوم,فيديو وأنيميشن,تحرير الفيديو,"تصميم, فيديو, يوتيوب, مونتاج, انترو",https://khamsat.com/video-design/video-editing/2572916-%D9%85%D9%88%D9%86%D8%AA%D8%A7%D8%AC-%D9%85%D9%82%D8%A7%D8%B7%D8%B9-%D9%81%D9%8A%D8%AF%D9%8A%D9%88-%D8%A7%D8%AD%D8%AA%D8%B1%D8%A7%D9%81%D9%8A%D8%A9-%D9%88-%D8%B9%D8%A7%D9%84%D9%8A%D8%A9-%D8%A7%D9%84%D8%AC%D9%88%D8%AF%D8%A9
مونتاج احترافي لجميع أنواع الفيديوهات,.Hadjira S,13,8,منذ 8 أشهر و29 يوم,فيديو وأنيميشن,تحرير الفيديو,"فيديو, مونتاج, تعديل, فيديو اعلاني, مونتاج احترافي",https://khamsat.com/video-design/video-editing/3039783-%D9%85%D9%88%D9%86%D8%AA%D8%A7%D8%AC-%D8%A7%D8%AD%D8%AA%D8%B1%D8%A7%D9%81%D9%8A-%D9%84%D8%AC%D9%85%D9%8A%D8%B9-%D8%A3%D9%86%D9%88%D8%A7%D8%B9-%D8%A7%D9%84%D9%81%D9%8A%D8%AF%D9%8A%D9%88%D9%87%D8%A7%D8%AA
مونتاج احترافي لجميع انواع الفيديوهات video editing,منال ع.,14,12,منذ 7 أشهر و14 يوم,فيديو وأنيميشن,تحرير الفيديو,"مونتير, تحرير فيديو, مونتاج فيديوهات, مونتاج احترافي, مونتاج يوتيوب",https://khamsat.com/video-design/video-editing/2744736-%D9%85%D9%88%D9%86%D8%AA%D8%A7%D8%AC-%D8%A7%D8%AD%D8%AA%D8%B1%D8%A7%D9%81%D9%8A-%D9%84%D8%AC%D9%85%D9%8A%D8%B9-%D8%A7%D9%86%D9%88%D8%A7%D8%B9-%D8%A7%D9%84%D9%81%D9%8A%D8%AF%D9%8A%D9%88%D9%87%D8%A7%D8%AA-video-editing
مونتاج فيديو احترافي لمحتوى إسلامي أو تعليمي أو ثقافي,محمد ا.,7,7,منذ 26 يوم و3 ساعات,فيديو وأنيميشن,تحرير الفيديو,"تعليم, مونتير, مونتاج فيديوهات, مونتاج احترافي, ريلز",https://khamsat.com/video-design/video-editing/3047886-%D9%85%D9%88%D9%86%D8%AA%D8%A7%D8%AC-%D9%81%D9%8A%D8%AF%D9%8A%D9%88-%D8%A7%D8%AD%D8%AA%D8%B1%D8%A7%D9%81%D9%8A-%D9%84%D9%85%D8%AD%D8%AA%D9%88%D9%89-%D8%A5%D8%B3%D9%84%D8%A7%D9%85%D9%8A-%D8%A3%D9%88-%D8%AA%D8%B9%D9%84%D9%8A%D9%85%D9%8A-%D8%A3%D9%88-%D8%AB%D9%82%D8%A7%D9%81%D9%8A
مونتاج احترافي للفيديوهات بجودة عالية ومؤثرات بصرية متقنة,.Mahmoud K,2,1,منذ سنة و4 أيام,فيديو وأنيميشن,تحرير الفيديو,"تصميم, مونتاج فيديو, تصميم فيديو, موشن جرافيك, مونتاج يوتيوب",https://khamsat.com/video-design/video-editing/3051687-%D9%85%D9%88%D9%86%D8%AA%D8%A7%D8%AC-%D8%A7%D8%AD%D8%AA%D8%B1%D8%A7%D9%81%D9%8A-%D9%84%D9%84%D9%81%D9%8A%D8%AF%D9%8A%D9%88%D9%87%D8%A7%D8%AA-%D8%A8%D8%AC%D9%88%D8%AF%D8%A9-%D8%B9%D8%A7%D9%84%D9%8A%D8%A9-%D9%88%D9%85%D8%A4%D8%AB%D8%B1%D8%A7%D8%AA-%D8%A8%D8%B5%D8%B1%D9%8A%D8%A9-%D9%85%D8%AA%D9%82%D9%86%D8%A9
مونتاج فيديوهات ريلز احترافي,محمد ي.,7,7,منذ 27 يوم و4 ساعات,فيديو وأنيميشن,فيديوهات سوشيال وإعلانات,"مونتاج, مونتاج فيديوهات, مونتاج احترافي, ريلز, reels",https://khamsat.com/video-design/video-editing/3587536-%D9%85%D9%88%D9%86%D8%AA%D8%A7%D8%AC-%D9%81%D9%8A%D8%AF%D9%8A%D9%88%D9%87%D8%A7%D8%AA-%D8%B1%D9%8A%D9%84%D8%B2-%D8%A7%D8%AD%D8%AA%D8%B1%D8%A7%D9%81%D9%8A
تصميم أو مونتاج فيديو دعائي احترافي,.Mohamed A,1,0,Aucun avis,فيديو وأنيميشن,فيديوهات سوشيال وإعلانات,"تصميم, إعلان, فيديو, دعاية, مونتاج",https://khamsat.com/video-design/video-editing/2181273-%D8%AA%D8%B5%D9%85%D9%8A%D9%85-%D8%A3%D9%88-%D9%85%D9%88%D9%86%D8%AA%D8%A7%D8%AC-%D9%81%D9%8A%D8%AF%D9%8A%D9%88-%D8%AF%D8%B9%D8%A7%D8%A6%D9%8A-%D8%A7%D8%AD%D8%AA%D8%B1%D8%A7%D9%81%D9%8A
إنتاج فيديو إعلاني احترافي للتسويق وزيادة المبيعات,محمود م.,1,1,منذ 8 أشهر ويومين,فيديو وأنيميشن,فيديوهات سوشيال وإعلانات,"تصميم اعلانات, فيديو اعلاني, مونتاج فيديو, فيدوهات, انشاء اعلامن",https://khamsat.com/video-design/video-editing/3229799-%D8%A5%D9%86%D8%AA%D8%A7%D8%AC-%D9%81%D9%8A%D8%AF%D9%8A%D9%88-%D8%A5%D8%B9%D9%84%D8%A7%D9%86%D9%8A-%D8%A7%D8%AD%D8%AA%D8%B1%D8%A7%D9%81%D9%8A-%D9%84%D9%84%D8%AA%D8%B3%D9%88%D9%8A%D9%82-%D9%88%D8%B2%D9%8A%D8%A7%D8%AF%D8%A9-%D8%A7%D9%84%D9%85%D8%A8%D9%8A%D8%B9%D8%A7%D8%AA
مونتاج احترافي للفيديوهات الطويلة والريلز,يحى م.,1,1,منذ شهرين و9 ساعات,فيديو وأنيميشن,تحرير الفيديو,"فيديو, يوتيوب, مونتاج, مونتاج فيديو, فيديوهات",https://khamsat.com/video-design/video-editing/3024698-%D9%85%D9%88%D9%86%D8%AA%D8%A7%D8%AC-%D8%A7%D8%AD%D8%AA%D8%B1%D8%A7%D9%81%D9%8A-%D9%84%D9%84%D9%81%D9%8A%D8%AF%D9%8A%D9%88%D9%87%D8%A7%D8%AA-%D8%A7%D9%84%D8%B7%D9%88%D9%8A%D9%84%D8%A9-%D9%88%D8%A7%D9%84%D8%B1%D9%8A%D9%84%D8%B2
مونتاج وتعديل الفيديو | بجودة عالية,.Ahmed M,3,3,منذ 4 أشهر و7 أيام,فيديو وأنيميشن,تحرير الفيديو,"تحرير, مونتاج, تعديل, مونتاج فيديو, مونتاج احترافي",https://khamsat.com/video-design/video-editing/2947728-%D9%85%D9%88%D9%86%D8%AA%D8%A7%D8%AC-%D9%88%D8%AA%D8%B9%D8%AF%D9%8A%D9%84-%D8%A7%D9%84%D9%81%D9%8A%D8%AF%D9%8A%D9%88-%D8%A8%D8%AC%D9%88%D8%AF%D8%A9-%D8%B9%D8%A7%D9%84%D9%8A%D8%A9
مونتاج ريل فيديو قصير احترافي,.Ahmed A,10,9,منذ 7 أيام و23 ساعة,فيديو وأنيميشن,فيديوهات سوشيال وإعلانات,"تصميم, مونتاج, مونتاج فيديو, تصميم فيديوهات, مونتاج احترافي",https://khamsat.com/video-design/video-editing/3244252-%D9%85%D9%88%D9%86%D8%AA%D8%A7%D8%AC-%D8%B1%D9%8A%D9%84-%D9%81%D9%8A%D8%AF%D9%8A%D9%88-%D9%82%D8%B5%D9%8A%D8%B1-%D8%A7%D8%AD%D8%AA%D8%B1%D8%A7%D9%81%D9%8A
مونتاج احترافي بطريقة سينمائية,جمال ا.,23,25,منذ 9 أشهر و15 يوم,فيديو وأنيميشن,تحرير الفيديو,"فيديو, اعلانات, يوتيوب, مونتاج, سينمائي",https://khamsat.com/video-design/video-editing/1482064-%D9%85%D9%88%D9%86%D8%AA%D8%A7%D8%AC-%D8%A7%D8%AD%D8%AA%D8%B1%D8%A7%D9%81%D9%8A-%D8%A8%D8%B7%D8%B1%D9%8A%D9%82%D8%A9-%D8%B3%D9%8A%D9%86%D9%85%D8%A7%D8%A6%D9%8A%D8%A9
مونتاج ريلز ويوتيوب شامل كل شئ باعلي جوده,احمد ر.,17,15,منذ 3 أشهر و20 يوم,فيديو وأنيميشن,فيديوهات سوشيال وإعلانات,"مونتاج فيديو, premiere, ريلز, مونتاج يوتيوب, تيك توك",https://khamsat.com/video-design/video-editing/2970585-%D9%85%D9%88%D9%86%D8%AA%D8%A7%D8%AC-%D8%B1%D9%8A%D9%84%D8%B2-%D9%88%D9%8A%D9%88%D8%AA%D9%8A%D9%88%D8%A8-%D8%B4%D8%A7%D9%85%D9%84-%D9%83%D9%84-%D8%B4%D8%A6-%D8%A8%D8%A7%D8%B9%D9%84%D9%8A-%D8%AC%D9%88%D8%AF%D9%87
مونتاج فيديوهات بشكل احترافي ومميز,احمد م.,1,1,منذ 15 يوم و4 ساعات,فيديو وأنيميشن,تحرير الفيديو,"تصميم, فيديو, يوتيوب, مونتاج, فيديوهات",https://khamsat.com/video-design/video-editing/2366093-%D9%85%D9%88%D9%86%D8%AA%D8%A7%D8%AC-%D9%81%D9%8A%D8%AF%D9%8A%D9%88%D9%87%D8%A7%D8%AA-%D8%A8%D8%B4%D9%83%D9%84-%D8%A7%D8%AD%D8%AA%D8%B1%D8%A7%D9%81%D9%8A-%D9%88%D9%85%D9%85%D9%8A%D8%B2
مونتاج احترافي للفيديو القصير,.Belal A,1,2,منذ 4 أشهر و15 يوم,فيديو وأنيميشن,فيديوهات سوشيال وإعلانات,"تصميم, مونتاج فيديو, مونتير, مونتاج احترافي, ريلز",https://khamsat.com/video-design/video-editing/3505045-%D9%85%D9%88%D9%86%D8%AA%D8%A7%D8%AC-%D8%A7%D8%AD%D8%AA%D8%B1%D8%A7%D9%81%D9%8A-%D9%84%D9%84%D9%81%D9%8A%D8%AF%D9%8A%D9%88-%D8%A7%D9%84%D9%82%D8%B5%D9%8A%D8%B1
خدمه المونتاج الاحترافي للفيديوهات,.Ahmed S,12,11,منذ 4 أشهر و13 يوم,فيديو وأنيميشن,تحرير الفيديو,"مونتاج, مونتاج فيديو, المونتاج, مونتاج فيديوهات, مونتاج احترافي",https://khamsat.com/video-design/video-editing/2523337-%D8%AE%D8%AF%D9%85%D9%87-%D8%A7%D9%84%D9%85%D9%88%D9%86%D8%AA%D8%A7%D8%AC-%D8%A7%D9%84%D8%A7%D8%AD%D8%AA%D8%B1%D8%A7%D9%81%D9%8A-%D9%84%D9%84%D9%81%D9%8A%D8%AF%D9%8A%D9%88%D9%87%D8%A7%D8%AA
مونتاج فيديو احترافي بجودة عالية,جمال ع.,13,12,منذ 22 يوم و4 ساعات,فيديو وأنيميشن,تحرير الفيديو,"فيديو, يوتيوب, مونتاج, مونتاج فيديو, تعديل الفيديو",https://khamsat.com/video-design/video-editing/2649685-%D9%85%D9%88%D9%86%D8%AA%D8%A7%D8%AC-%D9%81%D9%8A%D8%AF%D9%8A%D9%88-%D8%A7%D8%AD%D8%AA%D8%B1%D8%A7%D9%81%D9%8A-%D8%A8%D8%AC%D9%88%D8%AF%D8%A9-%D8%B9%D8%A7%D9%84%D9%8A%D8%A9
تصميم و مونتاج فيديو بشكل احترافى,رانيا ج.,14,12,منذ 12 يوم و17 ساعة,فيديو وأنيميشن,تحرير الفيديو,"تحرير فيديو, مونتاج احترافي, ريلز, مونتاج يوتيوب, كتابة على الفيديو",https://khamsat.com/video-design/video-editing/3255050-%D8%AA%D8%B5%D9%85%D9%8A%D9%85-%D9%88-%D9%85%D9%88%D9%86%D8%AA%D8%A7%D8%AC-%D9%81%D9%8A%D8%AF%D9%8A%D9%88-%D8%A8%D8%B4%D9%83%D9%84-%D8%A7%D8%AD%D8%AA%D8%B1%D8%A7%D9%81%D9%89
مونتاج فيديو لتلاوة آيات أو سور من القرآن,أحمد ش.,6,6,منذ 8 أيام و12 ساعة,فيديو وأنيميشن,إنتاج الفيديو,"قرآن, مونتاج, مونتاج فيديو, ريلز",https://khamsat.com/video-design/video-editing/2021249-%D9%85%D9%88%D9%86%D8%AA%D8%A7%D8%AC-%D9%81%D9%8A%D8%AF%D9%8A%D9%88-%D9%84%D8%AA%D9%84%D8%A7%D9%88%D8%A9-%D8%A2%D9%8A%D8%A7%D8%AA-%D8%A3%D9%88-%D8%B3%D9%88%D8%B1-%D9%85%D9%86-%D8%A7%D9%84%D9%82%D8%B1%D8%A2%D9%86
مونتاج فيديو احترافي,.Mohamed A,1,1,منذ 20 يوم و7 ساعات,فيديو وأنيميشن,تحرير الفيديو,"اعلانات, يوتيوب, مونتاج, الفيديو, premiere",https://khamsat.com/video-design/video-editing/2785865-%D9%85%D9%88%D9%86%D8%AA%D8%A7%D8%AC-%D9%81%D9%8A%D8%AF%D9%8A%D9%88-%D8%A7%D8%AD%D8%AA%D8%B1%D8%A7%D9%81%D9%8A
تصميم الفيديوهات حسب طلبك,.Mohanad M,3,3,منذ 11 شهر و22 يوم,فيديو وأنيميشن,تحرير الفيديو,"تصميم, فيديو اعلاني, مونتاج فيديو, مونتاج يوتيوب, shorts",https://khamsat.com/video-design/video-editing/3021431-%D8%AA%D8%B5%D9%85%D9%8A%D9%85-%D8%A7%D9%84%D9%81%D9%8A%D8%AF%D9%8A%D9%88%D9%87%D8%A7%D8%AA-%D8%AD%D8%B3%D8%A8-%D8%B7%D9%84%D8%A8%D9%83
تصميم ومونتاج فيديو احترافي ومميز,سامي ف.,7,2,منذ 8 أشهر و11 يوم,فيديو وأنيميشن,فيديوهات سوشيال وإعلانات,"مونتاج فيديو, مونتاج فيديوهات, مونتاج احترافي, ريلز, مونتاج يوتيوب",https://khamsat.com/video-design/video-editing/3068219-%D8%AA%D8%B5%D9%85%D9%8A%D9%85-%D9%88%D9%85%D9%88%D9%86%D8%AA%D8%A7%D8%AC-%D9%81%D9%8A%D8%AF%D9%8A%D9%88-%D8%A7%D8%AD%D8%AA%D8%B1%D8%A7%D9%81%D9%8A-%D9%88%D9%85%D9%85%D9%8A%D8%B2
تحرير ومونتاج فيديوهات إحترافي,.Mohamed A,42,31,منذ شهر و16 يوم,فيديو وأنيميشن,تحرير الفيديو,"مونتاج, تصميم فيديو, مونتاج الفيديو, premier, مونتاج يوتيوب",https://khamsat.com/video-design/video-editing/2699162-%D8%AA%D8%AD%D8%B1%D9%8A%D8%B1-%D9%88%D9%85%D9%88%D9%86%D8%AA%D8%A7%D8%AC-%D9%81%D9%8A%D8%AF%D9%8A%D9%88%D9%87%D8%A7%D8%AA-%D8%A5%D8%AD%D8%AA%D8%B1%D8%A7%D9%81%D9%8A
مونتاج وتصميم الفديوهات بجودة عالية,احمد ن.,12,8,منذ 5 أشهر و11 يوم,فيديو وأنيميشن,تحرير الفيديو,"تصميم, مونتاج, مونتاج فيديو, تصميم فيديو, افتر افكت",https://khamsat.com/video-design/video-editing/2810392-%D9%85%D9%88%D9%86%D8%AA%D8%A7%D8%AC-%D9%88%D8%AA%D8%B5%D9%85%D9%8A%D9%85-%D8%A7%D9%84%D9%81%D8%AF%D9%8A%D9%88%D9%87%D8%A7%D8%AA-%D8%A8%D8%AC%D9%88%D8%AF%D8%A9-%D8%B9%D8%A7%D9%84%D9%8A%D8%A9
تصميم ومونتاج مشاريع فيديو احترافية لكافة المشاريع,شريف م.,28,24,منذ 9 أشهر و10 أيام,فيديو وأنيميشن,تحرير الفيديو,"تصميم, فيديو, تحرير, مونتاج, تعديل",https://khamsat.com/video-design/video-editing/2203953-%D8%AA%D8%B5%D9%85%D9%8A%D9%85-%D9%88%D9%85%D9%88%D9%86%D8%AA%D8%A7%D8%AC-%D9%85%D8%B4%D8%A7%D8%B1%D9%8A%D8%B9-%D9%81%D9%8A%D8%AF%D9%8A%D9%88-%D8%A7%D8%AD%D8%AA%D8%B1%D8%A7%D9%81%D9%8A%D8%A9-%D9%84%D9%83%D8%A7%D9%81%D8%A9-%D8%A7%D9%84%D9%85%D8%B4%D8%A7%D8%B1%D9%8A%D8%B9
منتاج وتعديل الفيديو لجميع المنصات بشكل احترافي Edit Video,عبدالرحمن س.,10,7,منذ شهر و21 يوم,فيديو وأنيميشن,فيديوهات سوشيال وإعلانات,"مونتاج, مونتاج فيديو, تصميم فيديوهات, مونتاج احترافي, مونتاج يوتيوب",https://khamsat.com/video-design/video-editing/3016398-%D9%85%D9%86%D8%AA%D8%A7%D8%AC-%D9%88%D8%AA%D8%B9%D8%AF%D9%8A%D9%84-%D8%A7%D9%84%D9%81%D9%8A%D8%AF%D9%8A%D9%88-%D9%84%D8%AC%D9%85%D9%8A%D8%B9-%D8%A7%D9%84%D9%85%D9%86%D8%B5%D8%A7%D8%AA-%D8%A8%D8%B4%D9%83%D9%84-%D8%A7%D8%AD%D8%AA%D8%B1%D8%A7%D9%81%D9%8A-edit-video
مونتاج الفيديوهات عبر برنامج فيلمورا x,عمر ا.,14,10,منذ شهر و4 أيام,فيديو وأنيميشن,تحرير الفيديو,"تصميم, مونتاج, editor, مونتاج احترافي, video editor",https://khamsat.com/video-design/video-editing/2528901-%D9%85%D9%88%D9%86%D8%AA%D8%A7%D8%AC-%D8%A7%D9%84%D9%81%D9%8A%D8%AF%D9%8A%D9%88%D9%87%D8%A7%D8%AA-%D8%B9%D8%A8%D8%B1-%D8%A8%D8%B1%D9%86%D8%A7%D9%85%D8%AC-%D9%81%D9%8A%D9%84%D9%85%D9%88%D8%B1%D8%A7-x
مونتاج فديوهات احترافيه على حسب طلبك,احمد ا.,24,17,منذ شهر و12 يوم,فيديو وأنيميشن,تحرير الفيديو,"مونتاج, مؤثرات, تعديل الفيديو, تحرير الفيديو, video editor",https://khamsat.com/video-design/video-editing/1252015-%D9%85%D9%88%D9%86%D8%AA%D8%A7%D8%AC-%D9%81%D8%AF%D9%8A%D9%88%D9%87%D8%A7%D8%AA-%D8%A7%D8%AD%D8%AA%D8%B1%D8%A7%D9%81%D9%8A%D9%87-%D8%B9%D9%84%D9%89-%D8%AD%D8%B3%D8%A8-%D8%B7%D9%84%D8%A8%D9%83
مونتاج فيديو وانشاء فيديو ديني,.Wesam A,3,3,منذ 9 أشهر و22 يوم,فيديو وأنيميشن,إنتاج الفيديو,مونتاج فيديو,https://khamsat.com/video-design/video-editing/3058337-%D9%85%D9%88%D9%86%D8%AA%D8%A7%D8%AC-%D9%81%D9%8A%D8%AF%D9%8A%D9%88-%D9%88%D8%A7%D9%86%D8%B4%D8%A7%D8%A1-%D9%81%D9%8A%D8%AF%D9%8A%D9%88-%D8%AF%D9%8A%D9%86%D9%8A
مونتاج احترافي لجميع انواع الفيديوهات,.Ahmed S,3,3,منذ سنة و6 أشهر,فيديو وأنيميشن,تحرير الفيديو,"تصميم, يوتيوب, مونتاج, مونتاج فيديو, video, hd, مونتير, adobe, مونتاج احترافي, مونتاج يوتيوب",https://khamsat.com/video-design/video-editing/2538305-%D9%85%D9%88%D9%86%D8%AA%D8%A7%D8%AC-%D8%A7%D8%AD%D8%AA%D8%B1%D8%A7%D9%81%D9%8A-%D9%84%D8%AC%D9%85%D9%8A%D8%B9-%D8%A7%D9%86%D9%88%D8%A7%D8%B9-%D8%A7%D9%84%D9%81%D9%8A%D8%AF%D9%8A%D9%88%D9%87%D8%A7%D8%AA
مونتاج فيديو احترافي بإبداع سينمائي وبجودة عالية,.Ahmed A,3,2,منذ 24 يوم و6 ساعات,فيديو وأنيميشن,تحرير الفيديو,"فيديو, مونتاج, مونتاج فيديو, مونتاج الفيديو, مونتاج احترافي",https://khamsat.com/video-design/video-editing/3313082-%D9%85%D9%88%D9%86%D8%AA%D8%A7%D8%AC-%D9%81%D9%8A%D8%AF%D9%8A%D9%88-%D8%A7%D8%AD%D8%AA%D8%B1%D8%A7%D9%81%D9%8A-%D8%A8%D8%A5%D8%A8%D8%AF%D8%A7%D8%B9-%D8%B3%D9%8A%D9%86%D9%85%D8%A7%D8%A6%D9%8A-%D9%88%D8%A8%D8%AC%D9%88%D8%AF%D8%A9-%D8%B9%D8%A7%D9%84%D9%8A%D8%A9
