Titre,Vendeur,Acheteurs,Notes,Date Dernier Avis,Catégorie,Sous-Catégorie,Mots Clés,Lien
سأخطط لك جدول سفر مفصل مع اقتراح فنادق مناسبة لميزانيتك,.Yasir A,0,0,Aucun avis,أسلوب حياة,مهارات حياتية وترفيه,"فنادق, حجز, السفر, مخطط سفر, جدول سفر",https://khamsat.com/lifestyle/travel-advice/3694555-%D8%B3%D8%A3%D8%AE%D8%B7%D8%B7-%D9%84%D9%83-%D8%AC%D8%AF%D9%88%D9%84-%D8%B3%D9%81%D8%B1-%D9%85%D9%81%D8%B5%D9%84-%D9%85%D8%B9-%D8%A7%D9%82%D8%AA%D8%B1%D8%A7%D8%AD-%D9%81%D9%86%D8%A7%D8%AF%D9%82-%D9%85%D9%86%D8%A7%D8%B3%D8%A8%D8%A9-%D9%84%D9%85%D9%8A%D8%B2%D8%A7%D9%86%D9%8A%D8%AA%D9%83
استشارات شاملة للطلاب والسياح عن ماليزيا,.Ahmed M,0,0,Aucun avis,أسلوب حياة,مهارات حياتية وترفيه,"سياحة, دراسة, ماليزيا, سفر, جامعة",https://khamsat.com/lifestyle/travel-advice/3083450-%D8%A7%D8%B3%D8%AA%D8%B4%D8%A7%D8%B1%D8%A7%D8%AA-%D8%B4%D8%A7%D9%85%D9%84%D8%A9-%D9%84%D9%84%D8%B7%D9%84%D8%A7%D8%A8-%D9%88%D8%A7%D9%84%D8%B3%D9%8A%D8%A7%D8%AD-%D8%B9%D9%86-%D9%85%D8%A7%D9%84%D9%8A%D8%B2%D9%8A%D8%A7
إستفسار بخصوص قرية او  مدينة مغربية,.Diverse D,0,0,Aucun avis,أسلوب حياة,مهارات حياتية وترفيه,"السياحة, والسفر",https://khamsat.com/lifestyle/travel-advice/2052931-%D8%A5%D8%B3%D8%AA%D9%81%D8%B3%D8%A7%D8%B1-%D8%A8%D8%AE%D8%B5%D9%88%D8%B5-%D9%82%D8%B1%D9%8A%D8%A9-%D8%A7%D9%88-%D9%85%D8%AF%D9%8A%D9%86%D8%A9-%D9%85%D8%BA%D8%B1%D8%A8%D9%8A%D8%A9
طرق لتنمية أبتكاراتك فى تعلم أحتراف فنون خلط العطور والربح,منصور ع.,3,1,منذ 4 سنوات و11 شهر,أسلوب حياة,مهارات حياتية وترفيه,"شعار, كتابة, مقالات, pdf, word",https://khamsat.com/lifestyle/craft-lessons/1444831-%D8%B7%D8%B1%D9%82-%D9%84%D8%AA%D9%86%D9%85%D9%8A%D8%A9-%D8%A3%D8%A8%D8%AA%D9%83%D8%A7%D8%B1%D8%A7%D8%AA%D9%83-%D9%81%D9%89-%D8%AA%D8%B9%D9%84%D9%85-%D8%A3%D8%AD%D8%AA%D8%B1%D8%A7%D9%81-%D9%81%D9%86%D9%88%D9%86-%D8%AE%D9%84%D8%B7-%D8%A7%D9%84%D8%B9%D8%B7%D9%88%D8%B1-%D9%88%D8%A7%D9%84%D8%B1%D8%A8%D8%AD
نقدم لك خلاصة موسوعة تعليم العطور فى 30 صفحة,منصور ع.,19,11,منذ سنة و6 أشهر,أسلوب حياة,مهارات حياتية وترفيه,"تطوير, موسوعة",https://khamsat.com/lifestyle/craft-lessons/1099915-%D9%86%D9%82%D8%AF%D9%85-%D9%84%D9%83-%D8%AE%D9%84%D8%A7%D8%B5%D8%A9-%D9%85%D9%88%D8%B3%D9%88%D8%B9%D8%A9-%D8%AA%D8%B9%D9%84%D9%8A%D9%85-%D8%A7%D9%84%D8%B9%D8%B7%D9%88%D8%B1-%D9%81%D9%89-30-%D8%B5%D9%81%D8%AD%D8%A9
30 نصيحة عن العطور  والبخور والمسك العود,منصور ع.,5,3,منذ سنة و7 أشهر,أسلوب حياة,مهارات حياتية وترفيه,"نصيحة, عن, 30, العود, العطور, والبخور, والمسك",https://khamsat.com/lifestyle/craft-lessons/1769174-30-%D9%86%D8%B5%D9%8A%D8%AD%D8%A9-%D8%B9%D9%86-%D8%A7%D9%84%D8%B9%D8%B7%D9%88%D8%B1-%D9%88%D8%A7%D9%84%D8%A8%D8%AE%D9%88%D8%B1-%D9%88%D8%A7%D9%84%D9%85%D8%B3%D9%83-%D8%A7%D9%84%D8%B9%D9%88%D8%AF
أعلمك فنون تركيب وصناعة العطور بطرق سهله وعالميه,منصور ع.,61,34,منذ 10 أشهر و6 أيام,أسلوب حياة,مهارات حياتية وترفيه,"تركيب, تعليم, شرح, وصناعة, واحتراف",https://khamsat.com/lifestyle/craft-lessons/813523-%D8%A3%D8%B9%D9%84%D9%85%D9%83-%D9%81%D9%86%D9%88%D9%86-%D8%AA%D8%B1%D9%83%D9%8A%D8%A8-%D9%88%D8%B5%D9%86%D8%A7%D8%B9%D8%A9-%D8%A7%D9%84%D8%B9%D8%B7%D9%88%D8%B1-%D8%A8%D8%B7%D8%B1%D9%82-%D8%B3%D9%87%D9%84%D9%87-%D9%88%D8%B9%D8%A7%D9%84%D9%85%D9%8A%D9%87
تعليم فن الكروشية وأشغال الكروشية,.Abir N,1,1,منذ 11 شهر و23 يوم,أسلوب حياة,مهارات حياتية وترفيه,"دروس, تعليم, شرح, تدريس, مهارة",https://khamsat.com/lifestyle/craft-lessons/3077615-%D8%AA%D8%B9%D9%84%D9%8A%D9%85-%D9%81%D9%86-%D8%A7%D9%84%D9%83%D8%B1%D9%88%D8%B4%D9%8A%D8%A9-%D9%88%D8%A3%D8%B4%D8%BA%D8%A7%D9%84-%D8%A7%D9%84%D9%83%D8%B1%D9%88%D8%B4%D9%8A%D8%A9
اعلمك اسرار العطور وأقدم لك كل ما تريد معرفتة عن العطور .,منصور ع.,7,3,منذ سنتين و6 أشهر,أسلوب حياة,مهارات حياتية وترفيه,Aucun tag,https://khamsat.com/lifestyle/craft-lessons/1291509-%D8%A7%D8%B9%D9%84%D9%85%D9%83-%D8%A7%D8%B3%D8%B1%D8%A7%D8%B1-%D8%A7%D9%84%D8%B9%D8%B7%D9%88%D8%B1-%D9%88%D8%A3%D9%82%D8%AF%D9%85-%D9%84%D9%83-%D9%83%D9%84-%D9%85%D8%A7-%D8%AA%D8%B1%D9%8A%D8%AF-%D9%85%D8%B9%D8%B1%D9%81%D8%AA%D8%A9-%D8%B9%D9%86-%D8%A7%D9%84%D8%B9%D8%B7%D9%88%D8%B1-
خبير تقني في تجميع اجهزة الكومبيوتر,.Mostafa T,8,9,منذ شهرين و5 أيام,أسلوب حياة,مهارات حياتية وترفيه,"استشارة, اصلاح, دعم, فني, تجميعة, حاسوب, حاسب, support, كومبيوتر, قطع",https://khamsat.com/lifestyle/craft-lessons/2826930-%D8%AE%D8%A8%D9%8A%D8%B1-%D8%AA%D9%82%D9%86%D9%8A-%D9%81%D9%8A-%D8%AA%D8%AC%D9%85%D9%8A%D8%B9-%D8%A7%D8%AC%D9%87%D8%B2%D8%A9-%D8%A7%D9%84%D9%83%D9%88%D9%85%D8%A8%D9%8A%D9%88%D8%AA%D8%B1
أعلمك قواعد تذهيب الخط العربي,منصور ع.,4,1,منذ سنة و5 أشهر,أسلوب حياة,مهارات حياتية وترفيه,"العربي, الخط, قواعد, أعلمك",https://khamsat.com/lifestyle/craft-lessons/1597828-%D8%A3%D8%B9%D9%84%D9%85%D9%83-%D9%82%D9%88%D8%A7%D8%B9%D8%AF-%D8%AA%D8%B0%D9%87%D9%8A%D8%A8-%D8%A7%D9%84%D8%AE%D8%B7-%D8%A7%D9%84%D8%B9%D8%B1%D8%A8%D9%8A
استشارات زراعيه خاصه بالتسميد ومكافحة الافات الزراعيه,.Ahmed Y,1,1,منذ 5 أشهر و22 يوم,أسلوب حياة,مهارات حياتية وترفيه,"استشارات, شخصية, دعم فني, pdf, زراعه",https://khamsat.com/lifestyle/craft-lessons/3030511-%D8%A7%D8%B3%D8%AA%D8%B4%D8%A7%D8%B1%D8%A7%D8%AA-%D8%B2%D8%B1%D8%A7%D8%B9%D9%8A%D9%87-%D8%AE%D8%A7%D8%B5%D9%87-%D8%A8%D8%A7%D9%84%D8%AA%D8%B3%D9%85%D9%8A%D8%AF-%D9%88%D9%85%D9%83%D8%A7%D9%81%D8%AD%D8%A9-%D8%A7%D9%84%D8%A7%D9%81%D8%A7%D8%AA-%D8%A7%D9%84%D8%B2%D8%B1%D8%A7%D8%B9%D9%8A%D9%87
تعليم مقامات الإنشاد والقران,.Mahmod H,14,14,منذ 4 أشهر و29 يوم,أسلوب حياة,مهارات حياتية وترفيه,"تعليم, تدريب, تحسين, الصوت, التجويد, المقامات",https://khamsat.com/lifestyle/craft-lessons/1851018-%D8%AA%D8%B9%D9%84%D9%8A%D9%85-%D9%85%D9%82%D8%A7%D9%85%D8%A7%D8%AA-%D8%A7%D9%84%D8%A5%D9%86%D8%B4%D8%A7%D8%AF-%D9%88%D8%A7%D9%84%D9%82%D8%B1%D8%A7%D9%86
أقدم نصائح و تعليمات لتحسين الرسم و التلوين مقابل خدمة,نعمة ا.,2,2,منذ سنة و6 أشهر,أسلوب حياة,مهارات حياتية وترفيه,"رسم, تعليم, بناء, نقد, تلوين, فنون",https://khamsat.com/lifestyle/craft-lessons/1796315-%D8%A3%D9%82%D8%AF%D9%85-%D9%86%D8%B5%D8%A7%D8%A6%D8%AD-%D9%88-%D8%AA%D8%B9%D9%84%D9%8A%D9%85%D8%A7%D8%AA-%D9%84%D8%AA%D8%AD%D8%B3%D9%8A%D9%86-%D8%A7%D9%84%D8%B1%D8%B3%D9%85-%D9%88-%D8%A7%D9%84%D8%AA%D9%84%D9%88%D9%8A%D9%86-%D9%85%D9%82%D8%A7%D8%A8%D9%84-%D8%AE%D8%AF%D9%85%D8%A9
دورة صناعة العطور اون لاين,محمد ن.,71,19,منذ شهر و13 يوم,أسلوب حياة,مهارات حياتية وترفيه,"يوتيوب, تجارة, مشروع, عطور, بخور",https://khamsat.com/lifestyle/craft-lessons/1217881-%D8%AF%D9%88%D8%B1%D8%A9-%D8%B5%D9%86%D8%A7%D8%B9%D8%A9-%D8%A7%D9%84%D8%B9%D8%B7%D9%88%D8%B1-%D8%A7%D9%88%D9%86-%D9%84%D8%A7%D9%8A%D9%86
جلسة استشارة تصوير بالموبايل لتطوير مهاراتك,.Rahma H,0,0,Aucun avis,أسلوب حياة,مهارات حياتية وترفيه,"استشارة, تحسين جودة الصور, تحليل الصور, تعلم التصوير بالموبايل, استشارات تصوير",https://khamsat.com/lifestyle/craft-lessons/3883932-%D8%AC%D9%84%D8%B3%D8%A9-%D8%A7%D8%B3%D8%AA%D8%B4%D8%A7%D8%B1%D8%A9-%D8%AA%D8%B5%D9%88%D9%8A%D8%B1-%D8%A8%D8%A7%D9%84%D9%85%D9%88%D8%A8%D8%A7%D9%8A%D9%84-%D9%84%D8%AA%D8%B7%D9%88%D9%8A%D8%B1-%D9%85%D9%87%D8%A7%D8%B1%D8%A7%D8%AA%D9%83
تعلم أصول الإنشاد الديني والمقامات الموسيقة السبعة والإيقاع,.Abdul Latif M,5,5,منذ شهر و25 يوم,أسلوب حياة,مهارات حياتية وترفيه,"صوت, تدريب, تعليق, مقامات, أناشيد",https://khamsat.com/lifestyle/craft-lessons/1675531-%D8%AA%D8%B9%D9%84%D9%85-%D8%A3%D8%B5%D9%88%D9%84-%D8%A7%D9%84%D8%A5%D9%86%D8%B4%D8%A7%D8%AF-%D8%A7%D9%84%D8%AF%D9%8A%D9%86%D9%8A-%D9%88%D8%A7%D9%84%D9%85%D9%82%D8%A7%D9%85%D8%A7%D8%AA-%D8%A7%D9%84%D9%85%D9%88%D8%B3%D9%8A%D9%82%D8%A9-%D8%A7%D9%84%D8%B3%D8%A8%D8%B9%D8%A9-%D9%88%D8%A7%D9%84%D8%A5%D9%8A%D9%82%D8%A7%D8%B9
إعطاء كورس خاص بالدوبلاج لك ولأطفالك,.Kholoud Y,0,0,Aucun avis,أسلوب حياة,مهارات حياتية وترفيه,"كارتون, دوبلاج, تعليم, عن, بعد, كورس",https://khamsat.com/lifestyle/craft-lessons/1840398-%D8%A5%D8%B9%D8%B7%D8%A7%D8%A1-%D9%83%D9%88%D8%B1%D8%B3-%D8%AE%D8%A7%D8%B5-%D8%A8%D8%A7%D9%84%D8%AF%D9%88%D8%A8%D9%84%D8%A7%D8%AC-%D9%84%D9%83-%D9%88%D9%84%D8%A3%D8%B7%D9%81%D8%A7%D9%84%D9%83
كتاب إلكتروني بعنوان (الرعب الذي نحبّه),هيثم م.,0,0,Aucun avis,أسلوب حياة,مهارات حياتية وترفيه,"بحث, كتابة, كتب, الكتاب, المحتوى, منتج, الكتابة, التأليف, الابداعية, الرعب",https://khamsat.com/lifestyle/craft-lessons/2469594-%D9%83%D8%AA%D8%A7%D8%A8-%D8%A5%D9%84%D9%83%D8%AA%D8%B1%D9%88%D9%86%D9%8A-%D8%A8%D8%B9%D9%86%D9%88%D8%A7%D9%86-%D8%A7%D9%84%D8%B1%D8%B9%D8%A8-%D8%A7%D9%84%D8%B0%D9%8A-%D9%86%D8%AD%D8%A8%D9%87
تعليم الكتابة المحترفة بالخط الإنجليزي,.Saif M,0,0,Aucun avis,أسلوب حياة,مهارات حياتية وترفيه,"شعار, كتابة, خط, اسمك, اليد",https://khamsat.com/lifestyle/craft-lessons/3124881-%D8%AA%D8%B9%D9%84%D9%8A%D9%85-%D8%A7%D9%84%D9%83%D8%AA%D8%A7%D8%A8%D8%A9-%D8%A7%D9%84%D9%85%D8%AD%D8%AA%D8%B1%D9%81%D8%A9-%D8%A8%D8%A7%D9%84%D8%AE%D8%B7-%D8%A7%D9%84%D8%A5%D9%86%D8%AC%D9%84%D9%8A%D8%B2%D9%8A
ساعلمك الكروشيه خطوه بخطوه حتى  الاحتراف بأسلوب سهل وممتع,هبه ص.,0,0,Aucun avis,أسلوب حياة,مهارات حياتية وترفيه,"تصميم, تدريب, تعليم عن بعد",https://khamsat.com/lifestyle/craft-lessons/3188400-%D8%B3%D8%A7%D8%B9%D9%84%D9%85%D9%83-%D8%A7%D9%84%D9%83%D8%B1%D9%88%D8%B4%D9%8A%D9%87-%D8%AE%D8%B7%D9%88%D9%87-%D8%A8%D8%AE%D8%B7%D9%88%D9%87-%D8%AD%D8%AA%D9%89-%D8%A7%D9%84%D8%A7%D8%AD%D8%AA%D8%B1%D8%A7%D9%81-%D8%A8%D8%A3%D8%B3%D9%84%D9%88%D8%A8-%D8%B3%D9%87%D9%84-%D9%88%D9%85%D9%85%D8%AA%D8%B9
تعلم العزف على آلة البيانو,.Dr Nermeen H,0,0,Aucun avis,أسلوب حياة,مهارات حياتية وترفيه,"تعليم, موسيقي, اغنية, عزف, بيانو",https://khamsat.com/lifestyle/craft-lessons/2664899-%D8%AA%D8%B9%D9%84%D9%85-%D8%A7%D9%84%D8%B9%D8%B2%D9%81-%D8%B9%D9%84%D9%89-%D8%A2%D9%84%D8%A9-%D8%A7%D9%84%D8%A8%D9%8A%D8%A7%D9%86%D9%88
استشارة في صناعة المشروبات الغازية والطاقة و معالجة المياه,.Mohammad C,1,1,منذ سنة و3 أشهر,أسلوب حياة,مهارات حياتية وترفيه,"استشارة, معالجة, صناعة, مياه, مشروبات",https://khamsat.com/lifestyle/craft-lessons/1900954-%D8%A7%D8%B3%D8%AA%D8%B4%D8%A7%D8%B1%D8%A9-%D9%81%D9%8A-%D8%B5%D9%86%D8%A7%D8%B9%D8%A9-%D8%A7%D9%84%D9%85%D8%B4%D8%B1%D9%88%D8%A8%D8%A7%D8%AA-%D8%A7%D9%84%D8%BA%D8%A7%D8%B2%D9%8A%D8%A9-%D9%88%D8%A7%D9%84%D8%B7%D8%A7%D9%82%D8%A9-%D9%88-%D9%85%D8%B9%D8%A7%D9%84%D8%AC%D8%A9-%D8%A7%D9%84%D9%85%D9%8A%D8%A7%D9%87
تصميم شعار اسم (Logo) عصري ومحترف,كريم ع.,0,0,Aucun avis,أسلوب حياة,مهارات حياتية وترفيه,"شعارات, تصميم لوجو, تصميم شعار, شعار احترافي, logodesign",https://khamsat.com/lifestyle/craft-lessons/3905619-%D8%AA%D8%B5%D9%85%D9%8A%D9%85-%D8%B4%D8%B9%D8%A7%D8%B1-%D8%A7%D8%B3%D9%85-logo-%D8%B9%D8%B5%D8%B1%D9%8A-%D9%88%D9%85%D8%AD%D8%AA%D8%B1%D9%81
استشارة علمية وعملية في مجال معامل الصناعات الغذائية,.Mohammad C,6,4,منذ 4 أشهر و27 يوم,أسلوب حياة,مهارات حياتية وترفيه,"استشارات, جودة, انتاج, اغذية, تحاليل",https://khamsat.com/lifestyle/craft-lessons/1678950-%D8%A7%D8%B3%D8%AA%D8%B4%D8%A7%D8%B1%D8%A9-%D8%B9%D9%84%D9%85%D9%8A%D8%A9-%D9%88%D8%B9%D9%85%D9%84%D9%8A%D8%A9-%D9%81%D9%8A-%D9%85%D8%AC%D8%A7%D9%84-%D9%85%D8%B9%D8%A7%D9%85%D9%84-%D8%A7%D9%84%D8%B5%D9%86%D8%A7%D8%B9%D8%A7%D8%AA-%D8%A7%D9%84%D8%BA%D8%B0%D8%A7%D8%A6%D9%8A%D8%A9
تعليم رسم الباترون وفنون التصميم,.Hanan H,1,0,Aucun avis,أسلوب حياة,مهارات حياتية وترفيه,"تصميم, تطوير, تعليم, احترافية, تعليم عن بعد",https://khamsat.com/lifestyle/craft-lessons/3134202-%D8%AA%D8%B9%D9%84%D9%8A%D9%85-%D8%B1%D8%B3%D9%85-%D8%A7%D9%84%D8%A8%D8%A7%D8%AA%D8%B1%D9%88%D9%86-%D9%88%D9%81%D9%86%D9%88%D9%86-%D8%A7%D9%84%D8%AA%D8%B5%D9%85%D9%8A%D9%85
تعلم العزف علي الجيتار من البداية الي الاحتراف,.Hesham H,1,1,منذ سنة و10 أشهر,أسلوب حياة,مهارات حياتية وترفيه,"تعلم, تدريب, موسيقي, كورس, عزف, موسيقية, نوتة, جيتار",https://khamsat.com/lifestyle/craft-lessons/2554415-%D8%AA%D8%B9%D9%84%D9%85-%D8%A7%D9%84%D8%B9%D8%B2%D9%81-%D8%B9%D9%84%D9%8A-%D8%A7%D9%84%D8%AC%D9%8A%D8%AA%D8%A7%D8%B1-%D9%85%D9%86-%D8%A7%D9%84%D8%A8%D8%AF%D8%A7%D9%8A%D8%A9-%D8%A7%D9%84%D9%8A-%D8%A7%D9%84%D8%A7%D8%AD%D8%AA%D8%B1%D8%A7%D9%81
طريقة صنع إبرتين2 في ماكينة زيڤزاڤ,.اسية A,0,0,Aucun avis,أسلوب حياة,مهارات حياتية وترفيه,"تصميم, تعليم, صنع, تطريز, خياطة",https://khamsat.com/lifestyle/craft-lessons/3842860-%D8%B7%D8%B1%D9%8A%D9%82%D8%A9-%D8%B5%D9%86%D8%B9-%D8%A5%D8%A8%D8%B1%D8%AA%D9%8A%D9%862-%D9%81%D9%8A-%D9%85%D8%A7%D9%83%D9%8A%D9%86%D8%A9-%D8%B2%D9%8A%D8%B2%D8%A7
الدليل المجمع لتربية الدواجن من البداية الي الاحتراف,لمياء ا.,18,13,منذ 4 أشهر و11 يوم,أسلوب حياة,مهارات حياتية وترفيه,"استشارات, فنية, اعمال, مشاريع, أفكار, ابحاث, دراسات, ناشئة, احصائيات, جدوي",https://khamsat.com/lifestyle/craft-lessons/1898680-%D8%A7%D9%84%D8%AF%D9%84%D9%8A%D9%84-%D8%A7%D9%84%D9%85%D8%AC%D9%85%D8%B9-%D9%84%D8%AA%D8%B1%D8%A8%D9%8A%D8%A9-%D8%A7%D9%84%D8%AF%D9%88%D8%A7%D8%AC%D9%86-%D9%85%D9%86-%D8%A7%D9%84%D8%A8%D8%AF%D8%A7%D9%8A%D8%A9-%D8%A7%D9%84%D9%8A-%D8%A7%D9%84%D8%A7%D8%AD%D8%AA%D8%B1%D8%A7%D9%81
أقدم لك كل ما تريد معرفتة عن العطور,.Nor M,0,0,Aucun avis,أسلوب حياة,مهارات حياتية وترفيه,"تصميم, كتابة, مقالات, pdf, word",https://khamsat.com/lifestyle/craft-lessons/3287474-%D8%A3%D9%82%D8%AF%D9%85-%D9%84%D9%83-%D9%83%D9%84-%D9%85%D8%A7-%D8%AA%D8%B1%D9%8A%D8%AF-%D9%85%D8%B9%D8%B1%D9%81%D8%AA%D8%A9-%D8%B9%D9%86-%D8%A7%D9%84%D8%B9%D8%B7%D9%88%D8%B1
سأقدم لك استشارات فى مجال السباكة والدهانات والنجارة,الاكسلا ن.,0,0,Aucun avis,أسلوب حياة,مهارات حياتية وترفيه,"تشطيبات, دهانات, نجارة, تشطيب حمامات, بانوهات فيوتك",https://khamsat.com/lifestyle/craft-lessons/2862262-%D8%B3%D8%A3%D9%82%D8%AF%D9%85-%D9%84%D9%83-%D8%A7%D8%B3%D8%AA%D8%B4%D8%A7%D8%B1%D8%A7%D8%AA-%D9%81%D9%89-%D9%85%D8%AC%D8%A7%D9%84-%D8%A7%D9%84%D8%B3%D8%A8%D8%A7%D9%83%D8%A9-%D9%88%D8%A7%D9%84%D8%AF%D9%87%D8%A7%D9%86%D8%A7%D8%AA-%D9%88%D8%A7%D9%84%D9%86%D8%AC%D8%A7%D8%B1%D8%A9
اعرف نفسك واقترب من ذاتك (باسمك ترتفع ...),محمد س.,0,0,Aucun avis,أسلوب حياة,مهارات حياتية وترفيه,تطوير الذات,https://khamsat.com/lifestyle/craft-lessons/3436001-%D8%A7%D8%B9%D8%B1%D9%81-%D9%86%D9%81%D8%B3%D9%83-%D9%88%D8%A7%D9%82%D8%AA%D8%B1%D8%A8-%D9%85%D9%86-%D8%B0%D8%A7%D8%AA%D9%83-%D8%A8%D8%A7%D8%B3%D9%85%D9%83-%D8%AA%D8%B1%D8%AA%D9%81%D8%B9-
تصميم عمل فني رقمي رمزي مخصص يعبر عنك بأسلوب سريالي فريد,.Nour K,0,0,Aucun avis,أسلوب حياة,مهارات حياتية وترفيه,"رسومات, التصميم الإبداعي, فن رقمي, digital collage, غلاف فني",https://khamsat.com/lifestyle/craft-lessons/3505182-%D8%AA%D8%B5%D9%85%D9%8A%D9%85-%D8%B9%D9%85%D9%84-%D9%81%D9%86%D9%8A-%D8%B1%D9%82%D9%85%D9%8A-%D8%B1%D9%85%D8%B2%D9%8A-%D9%85%D8%AE%D8%B5%D8%B5-%D9%8A%D8%B9%D8%A8%D8%B1-%D8%B9%D9%86%D9%83-%D8%A8%D8%A3%D8%B3%D9%84%D9%88%D8%A8-%D8%B3%D8%B1%D9%8A%D8%A7%D9%84%D9%8A-%D9%81%D8%B1%D9%8A%D8%AF
أساسيات زراعة الخضروات والفواكه,.Diverse D,0,0,Aucun avis,أسلوب حياة,مهارات حياتية وترفيه,"أسرار, الزراعة, أنواع",https://khamsat.com/lifestyle/craft-lessons/2061796-%D8%A3%D8%B3%D8%A7%D8%B3%D9%8A%D8%A7%D8%AA-%D8%B2%D8%B1%D8%A7%D8%B9%D8%A9-%D8%A7%D9%84%D8%AE%D8%B6%D8%B1%D9%88%D8%A7%D8%AA-%D9%88%D8%A7%D9%84%D9%81%D9%88%D8%A7%D9%83%D9%87
استشارات زراعية خبرة 30 عاماً,شذا ق.,6,3,منذ 3 سنوات و27 يوم,أسلوب حياة,مهارات حياتية وترفيه,"زراعة, حقل, مرض, خضار, فواكه, موسم, زراعي, محصول",https://khamsat.com/lifestyle/craft-lessons/1851461-%D8%A7%D8%B3%D8%AA%D8%B4%D8%A7%D8%B1%D8%A7%D8%AA-%D8%B2%D8%B1%D8%A7%D8%B9%D9%8A%D8%A9-%D8%AE%D8%A8%D8%B1%D8%A9-30-%D8%B9%D8%A7%D9%85%D8%A7
فنون وحرف واعمال يدوية واضاءات واعمال ديكور,.Rateb N,0,0,Aucun avis,أسلوب حياة,مهارات حياتية وترفيه,"تصميم, استشارة, اعمال, ارباح, ديكور, احترافي, مشروع, هدايا, ترفيه, هواية",https://khamsat.com/lifestyle/craft-lessons/2476868-%D9%81%D9%86%D9%88%D9%86-%D9%88%D8%AD%D8%B1%D9%81-%D9%88%D8%A7%D8%B9%D9%85%D8%A7%D9%84-%D9%8A%D8%AF%D9%88%D9%8A%D8%A9-%D9%88%D8%A7%D8%B6%D8%A7%D8%A1%D8%A7%D8%AA-%D9%88%D8%A7%D8%B9%D9%85%D8%A7%D9%84-%D8%AF%D9%8A%D9%83%D9%88%D8%B1
جلسة تدريبية على اجتياز المقابلات الوظيفية باحترافية,.Ahmed M,11,8,منذ شهرين و28 يوم,أسلوب حياة,تنمية شخصية,"استشارات, وظيفة, مقابلة, مقابلات, وظيفية, جلسة",https://khamsat.com/lifestyle/career-counseling/2791274-%D8%AC%D9%84%D8%B3%D8%A9-%D8%AA%D8%AF%D8%B1%D9%8A%D8%A8%D9%8A%D8%A9-%D8%B9%D9%84%D9%89-%D8%A7%D8%AC%D8%AA%D9%8A%D8%A7%D8%B2-%D8%A7%D9%84%D9%85%D9%82%D8%A7%D8%A8%D9%84%D8%A7%D8%AA-%D8%A7%D9%84%D9%88%D8%B8%D9%8A%D9%81%D9%8A%D8%A9-%D8%A8%D8%A7%D8%AD%D8%AA%D8%B1%D8%A7%D9%81%D9%8A%D8%A9
نوتبوك عملي: ملخص طرق واستراتيجيات من الكتب,شيماء ش.,1,1,منذ شهرين و16 يوم,أسلوب حياة,تنمية شخصية,"تصميم, تطوير, pdf",https://khamsat.com/lifestyle/career-counseling/3754896-%D9%86%D9%88%D8%AA%D8%A8%D9%88%D9%83-%D8%B9%D9%85%D9%84%D9%8A-%D9%85%D9%84%D8%AE%D8%B5-%D8%B7%D8%B1%D9%82-%D9%88%D8%A7%D8%B3%D8%AA%D8%B1%D8%A7%D8%AA%D9%8A%D8%AC%D9%8A%D8%A7%D8%AA-%D9%85%D9%86-%D8%A7%D9%84%D9%83%D8%AA%D8%A8
كيف اتقدم الى مقابلة العمل,.Mostafa T,6,6,منذ سنة و4 أشهر,أسلوب حياة,تنمية شخصية,"وظيفة, عمل, اعمال, مقابلة, مقابلة العمل",https://khamsat.com/lifestyle/career-counseling/2853063-%D9%83%D9%8A%D9%81-%D8%A7%D8%AA%D9%82%D8%AF%D9%85-%D8%A7%D9%84%D9%89-%D9%85%D9%82%D8%A7%D8%A8%D9%84%D8%A9-%D8%A7%D9%84%D8%B9%D9%85%D9%84
استشارة في تعلم مجالات البرمجة، تسويق الكتروني، ريادة اعمال,.Abram A,2,2,منذ 10 أشهر و14 يوم,أسلوب حياة,تنمية شخصية,"كورسات, مساعد افتراضي, تعليم البرمجة, استشارة تعليمية, مستشار تعليمي",https://khamsat.com/lifestyle/career-counseling/3022358-%D8%A7%D8%B3%D8%AA%D8%B4%D8%A7%D8%B1%D8%A9-%D9%81%D9%8A-%D8%AA%D8%B9%D9%84%D9%85-%D9%85%D8%AC%D8%A7%D9%84%D8%A7%D8%AA-%D8%A7%D9%84%D8%A8%D8%B1%D9%85%D8%AC%D8%A9-%D8%AA%D8%B3%D9%88%D9%8A%D9%82-%D8%A7%D9%84%D9%83%D8%AA%D8%B1%D9%88%D9%86%D9%8A-%D8%B1%D9%8A%D8%A7%D8%AF%D8%A9-%D8%A7%D8%B9%D9%85%D8%A7%D9%84
مهنة الحرية  دليلك الشامل للعمل الحر و كسب المال,.Yussef A,1,0,Aucun avis,أسلوب حياة,تنمية شخصية,"استشارات, اعمال, كتاب, محاسبة, صوتى, الدخل, المحاسبة, مالى, erp, المضافة",https://khamsat.com/lifestyle/career-counseling/2827541-%D9%85%D9%87%D9%86%D8%A9-%D8%A7%D9%84%D8%AD%D8%B1%D9%8A%D8%A9-%D8%AF%D9%84%D9%8A%D9%84%D9%83-%D8%A7%D9%84%D8%B4%D8%A7%D9%85%D9%84-%D9%84%D9%84%D8%B9%D9%85%D9%84-%D8%A7%D9%84%D8%AD%D8%B1-%D9%88-%D9%83%D8%B3%D8%A8-%D8%A7%D9%84%D9%85%D8%A7%D9%84
التدريب الشخصي لطلاب الدكتوراه - PhD Coach,هشام ا.,4,3,منذ شهر و12 يوم,أسلوب حياة,تنمية شخصية,"اللغة الانجليزية, proofreading, دكتوراه, coach, phd",https://khamsat.com/lifestyle/career-counseling/3004085-%D8%A7%D9%84%D8%AA%D8%AF%D8%B1%D9%8A%D8%A8-%D8%A7%D9%84%D8%B4%D8%AE%D8%B5%D9%8A-%D9%84%D8%B7%D9%84%D8%A7%D8%A8-%D8%A7%D9%84%D8%AF%D9%83%D8%AA%D9%88%D8%B1%D8%A7%D9%87-phd-coach
جلسات تدريب مهني Life & Career Coaching,.Hamsa T,9,8,منذ 4 أيام و10 ساعات,أسلوب حياة,تنمية شخصية,"استشارة, دعم, تدريب, ادارة, coaching",https://khamsat.com/lifestyle/career-counseling/2902178-%D8%AC%D9%84%D8%B3%D8%A7%D8%AA-%D8%AA%D8%AF%D8%B1%D9%8A%D8%A8-%D9%85%D9%87%D9%86%D9%8A-life-career-coaching
بناء حساب لينكدان إحترافي,أحمد ع.,1,1,منذ شهرين و19 يوم,أسلوب حياة,تنمية شخصية,"لينكدان, تصميم cv, بروفايل لينكدان, حساب إحترافي, تحسين لينكدان",https://khamsat.com/lifestyle/career-counseling/3692461-%D8%A8%D9%86%D8%A7%D8%A1-%D8%AD%D8%B3%D8%A7%D8%A8-%D9%84%D9%8A%D9%86%D9%83%D8%AF%D8%A7%D9%86-%D8%A5%D8%AD%D8%AA%D8%B1%D8%A7%D9%81%D9%8A
سأدربك على إجراء مقابلة عمل إحترافية باللغة الإنجليزية بثقة,.Abd Alkader D,13,7,منذ 3 سنوات و3 أشهر,أسلوب حياة,تنمية شخصية,"لغة, تدريب, اون, إنكليزية, تدريس",https://khamsat.com/lifestyle/career-counseling/2014990-%D8%B3%D8%A3%D8%AF%D8%B1%D8%A8%D9%83-%D8%B9%D9%84%D9%89-%D8%A5%D8%AC%D8%B1%D8%A7%D8%A1-%D9%85%D9%82%D8%A7%D8%A8%D9%84%D8%A9-%D8%B9%D9%85%D9%84-%D8%A5%D8%AD%D8%AA%D8%B1%D8%A7%D9%81%D9%8A%D8%A9-%D8%A8%D8%A7%D9%84%D9%84%D8%BA%D8%A9-%D8%A7%D9%84%D8%A5%D9%86%D8%AC%D9%84%D9%8A%D8%B2%D9%8A%D8%A9-%D8%A8%D8%AB%D9%82%D8%A9
جلسة لتنمية المهارات الناعمة,.Zahraa F,2,2,منذ 4 أشهر و7 أيام,أسلوب حياة,تنمية شخصية,"نصائح, تطوير الذات, سلوك, جلسة, جلسة تدريب مهارات",https://khamsat.com/lifestyle/career-counseling/3590225-%D8%AC%D9%84%D8%B3%D8%A9-%D9%84%D8%AA%D9%86%D9%85%D9%8A%D8%A9-%D8%A7%D9%84%D9%85%D9%87%D8%A7%D8%B1%D8%A7%D8%AA-%D8%A7%D9%84%D9%86%D8%A7%D8%B9%D9%85%D8%A9
إرشاد الشباب بعد التخرج لتجاوز الشتات وتحديد المسار المهني,مصطفى ش.,2,2,منذ 4 أشهر و22 يوم,أسلوب حياة,تنمية شخصية,"تدريب, linkedin, cv, تخرج, تخطيط",https://khamsat.com/lifestyle/career-counseling/3043899-%D8%A5%D8%B1%D8%B4%D8%A7%D8%AF-%D8%A7%D9%84%D8%B4%D8%A8%D8%A7%D8%A8-%D8%A8%D8%B9%D8%AF-%D8%A7%D9%84%D8%AA%D8%AE%D8%B1%D8%AC-%D9%84%D8%AA%D8%AC%D8%A7%D9%88%D8%B2-%D8%A7%D9%84%D8%B4%D8%AA%D8%A7%D8%AA-%D9%88%D8%AA%D8%AD%D8%AF%D9%8A%D8%AF-%D8%A7%D9%84%D9%85%D8%B3%D8%A7%D8%B1-%D8%A7%D9%84%D9%85%D9%87%D9%86%D9%8A
دورة ستجعلك تحصل على وظيفة في أكبر الشركات بأعلى المرتبات,أحمد م.,9,5,منذ 3 سنوات و11 شهر,أسلوب حياة,تنمية شخصية,"وظيفة, عمل, تحفيز, حل, تواصل, وقت, تخطيط, تنظيم, ناجح, تحصل",https://khamsat.com/lifestyle/career-counseling/1020682-%D8%AF%D9%88%D8%B1%D8%A9-%D8%B3%D8%AA%D8%AC%D8%B9%D9%84%D9%83-%D8%AA%D8%AD%D8%B5%D9%84-%D8%B9%D9%84%D9%89-%D9%88%D8%B8%D9%8A%D9%81%D8%A9-%D9%81%D9%8A-%D8%A3%D9%83%D8%A8%D8%B1-%D8%A7%D9%84%D8%B4%D8%B1%D9%83%D8%A7%D8%AA-%D8%A8%D8%A3%D8%B9%D9%84%D9%89-%D8%A7%D9%84%D9%85%D8%B1%D8%AA%D8%A8%D8%A7%D8%AA
اختبار الذكاء العاطفي للأفراد,.Zahraa F,1,1,منذ 3 أشهر و9 أيام,أسلوب حياة,تنمية شخصية,"تطوير, اختبار, تدريب, تقييم, الذكاء العاطفي",https://khamsat.com/lifestyle/career-counseling/3630652-%D8%A7%D8%AE%D8%AA%D8%A8%D8%A7%D8%B1-%D8%A7%D9%84%D8%B0%D9%83%D8%A7%D8%A1-%D8%A7%D9%84%D8%B9%D8%A7%D8%B7%D9%81%D9%8A-%D9%84%D9%84%D8%A3%D9%81%D8%B1%D8%A7%D8%AF
