Titre,Vendeur,Acheteurs,Notes,Date Dernier Avis,Catégorie,Sous-Catégorie,Mots Clés,Lien
صياغة جميع المستندات القانونية وكتابة المذكرات والعقود,.Ahmed A,0,0,Aucun avis,أعمال,خدمات قانونية,"كتابة, خدمات, الاستشارات, محامي, صياغة عقود",https://khamsat.com/business/legal-documents/3928302-%D8%B5%D9%8A%D8%A7%D8%BA%D8%A9-%D8%AC%D9%85%D9%8A%D8%B9-%D8%A7%D9%84%D9%85%D8%B3%D8%AA%D9%86%D8%AF%D8%A7%D8%AA-%D8%A7%D9%84%D9%82%D8%A7%D9%86%D9%88%D9%86%D9%8A%D8%A9-%D9%88%D9%83%D8%AA%D8%A7%D8%A8%D8%A9-%D8%A7%D9%84%D9%85%D8%B0%D9%83%D8%B1%D8%A7%D8%AA-%D9%88%D8%A7%D9%84%D8%B9%D9%82%D9%88%D8%AF
اعداد ومراجعة عقود واتفاقيات,.Mohamed M,0,0,Aucun avis,أعمال,خدمات قانونية,"استشارة, دراسة, عقود, عقد, صياغة عقود",https://khamsat.com/business/legal-documents/3902977-%D8%A7%D8%B9%D8%AF%D8%A7%D8%AF-%D9%88%D9%85%D8%B1%D8%A7%D8%AC%D8%B9%D8%A9-%D8%B9%D9%82%D9%88%D8%AF-%D9%88%D8%A7%D8%AA%D9%81%D8%A7%D9%82%D9%8A%D8%A7%D8%AA
الشروط والأحكام للمنصات السعودية,.Salem B,0,0,Aucun avis,أعمال,خدمات قانونية,"السعودية, privacy policy, سياسة الخصوصية, الشروط والاحكام, terms and conditions",https://khamsat.com/business/legal-documents/2972141-%D8%A7%D9%84%D8%B4%D8%B1%D9%88%D8%B7-%D9%88%D8%A7%D9%84%D8%A3%D8%AD%D9%83%D8%A7%D9%85-%D9%84%D9%84%D9%85%D9%86%D8%B5%D8%A7%D8%AA-%D8%A7%D9%84%D8%B3%D8%B9%D9%88%D8%AF%D9%8A%D8%A9
صياغة جميع المستندات القانونية وكتابة المذكرات والعقود,.Ahmed A,0,0,Aucun avis,أعمال,خدمات قانونية,"كتابة, خدمات, الاستشارات, محامي, صياغة عقود",https://khamsat.com/business/legal-documents/3928302-%D8%B5%D9%8A%D8%A7%D8%BA%D8%A9-%D8%AC%D9%85%D9%8A%D8%B9-%D8%A7%D9%84%D9%85%D8%B3%D8%AA%D9%86%D8%AF%D8%A7%D8%AA-%D8%A7%D9%84%D9%82%D8%A7%D9%86%D9%88%D9%86%D9%8A%D8%A9-%D9%88%D9%83%D8%AA%D8%A7%D8%A8%D8%A9-%D8%A7%D9%84%D9%85%D8%B0%D9%83%D8%B1%D8%A7%D8%AA-%D9%88%D8%A7%D9%84%D8%B9%D9%82%D9%88%D8%AF
صياغة صحيفة دعوى وفقا للنظام السعودي,بشرى س.,0,0,Aucun avis,أعمال,خدمات قانونية,"كتابة, قانون, صحيفة, مذكرة, خدمات قانونية",https://khamsat.com/business/legal-documents/3295322-%D8%B5%D9%8A%D8%A7%D8%BA%D8%A9-%D8%B5%D8%AD%D9%8A%D9%81%D8%A9-%D8%AF%D8%B9%D9%88%D9%89-%D9%88%D9%81%D9%82%D8%A7-%D9%84%D9%84%D9%86%D8%B8%D8%A7%D9%85-%D8%A7%D9%84%D8%B3%D8%B9%D9%88%D8%AF%D9%8A
اعداد ومراجعة عقود واتفاقيات,.Mohamed M,0,0,Aucun avis,أعمال,خدمات قانونية,"استشارة, دراسة, عقود, عقد, صياغة عقود",https://khamsat.com/business/legal-documents/3902977-%D8%A7%D8%B9%D8%AF%D8%A7%D8%AF-%D9%88%D9%85%D8%B1%D8%A7%D8%AC%D8%B9%D8%A9-%D8%B9%D9%82%D9%88%D8%AF-%D9%88%D8%A7%D8%AA%D9%81%D8%A7%D9%82%D9%8A%D8%A7%D8%AA
صياغة كافة العقود القانونية صحيحة وملزمة يضمن لك كافة حقوقك.,.Nour S,0,0,Aucun avis,أعمال,خدمات قانونية,"خدمات, قانون, محامى, قانونية, صياغة عقود",https://khamsat.com/business/legal-documents/2982370-%D8%B5%D9%8A%D8%A7%D8%BA%D8%A9-%D9%83%D8%A7%D9%81%D8%A9-%D8%A7%D9%84%D8%B9%D9%82%D9%88%D8%AF-%D8%A7%D9%84%D9%82%D8%A7%D9%86%D9%88%D9%86%D9%8A%D8%A9-%D8%B5%D8%AD%D9%8A%D8%AD%D8%A9-%D9%88%D9%85%D9%84%D8%B2%D9%85%D8%A9-%D9%8A%D8%B6%D9%85%D9%86-%D9%84%D9%83-%D9%83%D8%A7%D9%81%D8%A9-%D8%AD%D9%82%D9%88%D9%82%D9%83
كتابة وصياغة كافة العقود القانونية,خالد م.,0,0,Aucun avis,أعمال,خدمات قانونية,"استشارات, قانون, محامى, عقد, صياغة عقود",https://khamsat.com/business/legal-documents/3189552-%D9%83%D8%AA%D8%A7%D8%A8%D8%A9-%D9%88%D8%B5%D9%8A%D8%A7%D8%BA%D8%A9-%D9%83%D8%A7%D9%81%D8%A9-%D8%A7%D9%84%D8%B9%D9%82%D9%88%D8%AF-%D8%A7%D9%84%D9%82%D8%A7%D9%86%D9%88%D9%86%D9%8A%D8%A9
كتابة وصياغة العقود القانونية لضمان الحقوق وتجنب المنزاعات,.Hussain E,0,0,Aucun avis,أعمال,خدمات قانونية,"استشارات, كتابة, صياغة, محامى, صياغة عقود",https://khamsat.com/business/legal-documents/3192506-%D9%83%D8%AA%D8%A7%D8%A8%D8%A9-%D9%88%D8%B5%D9%8A%D8%A7%D8%BA%D8%A9-%D8%A7%D9%84%D8%B9%D9%82%D9%88%D8%AF-%D8%A7%D9%84%D9%82%D8%A7%D9%86%D9%88%D9%86%D9%8A%D8%A9-%D9%84%D8%B6%D9%85%D8%A7%D9%86-%D8%A7%D9%84%D8%AD%D9%82%D9%88%D9%82-%D9%88%D8%AA%D8%AC%D9%86%D8%A8-%D8%A7%D9%84%D9%85%D9%86%D8%B2%D8%A7%D8%B9%D8%A7%D8%AA
صياغة عقود برمجة المواقع والتطبيقات,.Abeer A,0,0,Aucun avis,أعمال,خدمات قانونية,"قانون, استشارات قانونية, اتفاقية, عقد برمجة, عقد تصميم وتطوير",https://khamsat.com/business/legal-documents/1762281-%D8%B5%D9%8A%D8%A7%D8%BA%D8%A9-%D8%B9%D9%82%D9%88%D8%AF-%D8%A8%D8%B1%D9%85%D8%AC%D8%A9-%D8%A7%D9%84%D9%85%D9%88%D8%A7%D9%82%D8%B9-%D9%88%D8%A7%D9%84%D8%AA%D8%B7%D8%A8%D9%8A%D9%82%D8%A7%D8%AA
كتابة صحف الدعاوى والاستئناف ومذكرات النقض بالقضاء المصرى,.Hussain E,0,0,Aucun avis,أعمال,خدمات قانونية,"كتابة, صياغة, مصري, قضايا, دعوى",https://khamsat.com/business/legal-documents/3183940-%D9%83%D8%AA%D8%A7%D8%A8%D8%A9-%D8%B5%D8%AD%D9%81-%D8%A7%D9%84%D8%AF%D8%B9%D8%A7%D9%88%D9%89-%D9%88%D8%A7%D9%84%D8%A7%D8%B3%D8%AA%D8%A6%D9%86%D8%A7%D9%81-%D9%88%D9%85%D8%B0%D9%83%D8%B1%D8%A7%D8%AA-%D8%A7%D9%84%D9%86%D9%82%D8%B6-%D8%A8%D8%A7%D9%84%D9%82%D8%B6%D8%A7%D8%A1-%D8%A7%D9%84%D9%85%D8%B5%D8%B1%D9%89
صياغة عقود الشراكة والبيع والايجار وفقا للقوانين في الخليج,.Ibrahim A,0,0,Aucun avis,أعمال,خدمات قانونية,"شركة, صياغة, السعودية, عقود, شراكة",https://khamsat.com/business/legal-documents/3307705-%D8%B5%D9%8A%D8%A7%D8%BA%D8%A9-%D8%B9%D9%82%D9%88%D8%AF-%D8%A7%D9%84%D8%B4%D8%B1%D8%A7%D9%83%D8%A9-%D9%88%D8%A7%D9%84%D8%A8%D9%8A%D8%B9-%D9%88%D8%A7%D9%84%D8%A7%D9%8A%D8%AC%D8%A7%D8%B1-%D9%88%D9%81%D9%82%D8%A7-%D9%84%D9%84%D9%82%D9%88%D8%A7%D9%86%D9%8A%D9%86-%D9%81%D9%8A-%D8%A7%D9%84%D8%AE%D9%84%D9%8A%D8%AC
صياغة عقد تسويق طبقا للنظام السعودى,احمد س.,0,0,Aucun avis,أعمال,خدمات قانونية,"تسويق, استشارات, شركة, صياغة, خدمات, عقود, قانون, قانوني, السعودي, خدمات قانونية",https://khamsat.com/business/legal-documents/2736644-%D8%B5%D9%8A%D8%A7%D8%BA%D8%A9-%D8%B9%D9%82%D8%AF-%D8%AA%D8%B3%D9%88%D9%8A%D9%82-%D8%B7%D8%A8%D9%82%D8%A7-%D9%84%D9%84%D9%86%D8%B8%D8%A7%D9%85-%D8%A7%D9%84%D8%B3%D8%B9%D9%88%D8%AF%D9%89
صياغة كافة العقود القانونية,.Aya H,17,14,منذ شهرين و13 يوم,أعمال,خدمات قانونية,"التجارية, استشارات, صياغة, عقود, التجارة, الالكترونية, المدنية, العقود, الاتفاقيات",https://khamsat.com/business/legal-documents/1233775-%D8%B5%D9%8A%D8%A7%D8%BA%D8%A9-%D9%83%D8%A7%D9%81%D8%A9-%D8%A7%D9%84%D8%B9%D9%82%D9%88%D8%AF-%D8%A7%D9%84%D9%82%D8%A7%D9%86%D9%88%D9%86%D9%8A%D8%A9
الصياغة القانونية للعقود والاتفاقيات بالعربية والإنجليزية,.Osama E,5,3,منذ 5 سنوات و6 أشهر,أعمال,خدمات قانونية,"صياغة العقود القانونية, legal drafting, كتابة اتفاقية قانونية, صياغة عقود واتفاقيات, كتابة عقد قانوني",https://khamsat.com/business/legal-documents/1058129-%D8%A7%D9%84%D8%B5%D9%8A%D8%A7%D8%BA%D8%A9-%D8%A7%D9%84%D9%82%D8%A7%D9%86%D9%88%D9%86%D9%8A%D8%A9-%D9%84%D9%84%D8%B9%D9%82%D9%88%D8%AF-%D9%88%D8%A7%D9%84%D8%A7%D8%AA%D9%81%D8%A7%D9%82%D9%8A%D8%A7%D8%AA-%D8%A8%D8%A7%D9%84%D8%B9%D8%B1%D8%A8%D9%8A%D8%A9-%D9%88%D8%A7%D9%84%D8%A5%D9%86%D8%AC%D9%84%D9%8A%D8%B2%D9%8A%D8%A9
مستندات وعقود قانونية,Non trouvé,Non trouvé,Non trouvé,Aucun avis,أعمال,خدمات قانونية,Aucun tag,https://khamsat.com/business/legal-documents/3109069-%D8%A5%D8%B9%D8%AF%D8%A7%D8%AF-%D9%88%D8%B5%D9%8A%D8%A7%D8%BA%D8%A9-%D8%A7%D9%84%D8%B9%D9%82%D9%88%D8%AF-%D8%A7%D9%84%D9%82%D8%A7%D9%86%D9%88%D9%86%D9%8A%D8%A9-%D9%84%D8%B9%D9%82%D9%88%D8%AF-%D8%A7%D9%84%D8%A8%D9%8A%D8%B9-%D9%88%D8%A7%D9%84%D8%A5%D9%8A%D8%AC%D8%A7%D8%B1
صياغة جميع العقود القانونية,.Khaled S,0,0,Aucun avis,أعمال,خدمات قانونية,"كتابة, سعودي, قانون, محامى, عقد",https://khamsat.com/business/legal-documents/3084519-%D8%B5%D9%8A%D8%A7%D8%BA%D8%A9-%D8%AC%D9%85%D9%8A%D8%B9-%D8%A7%D9%84%D8%B9%D9%82%D9%88%D8%AF-%D8%A7%D9%84%D9%82%D8%A7%D9%86%D9%88%D9%86%D9%8A%D8%A9
إعداد منهجية وسياسة السلوك المهنى والقيم الأخلاقية,.Abeer A,1,0,Aucun avis,أعمال,خدمات قانونية,"دليل, وثيقة, المهنة, السلوك, أخلاق",https://khamsat.com/business/legal-documents/2039671-%D8%A5%D8%B9%D8%AF%D8%A7%D8%AF-%D9%85%D9%86%D9%87%D8%AC%D9%8A%D8%A9-%D9%88%D8%B3%D9%8A%D8%A7%D8%B3%D8%A9-%D8%A7%D9%84%D8%B3%D9%84%D9%88%D9%83-%D8%A7%D9%84%D9%85%D9%87%D9%86%D9%89-%D9%88%D8%A7%D9%84%D9%82%D9%8A%D9%85-%D8%A7%D9%84%D8%A3%D8%AE%D9%84%D8%A7%D9%82%D9%8A%D8%A9
صياغة الدعاوى واللوائح الاعتراضية طبقاً للقانون السعودي,.Aya H,1,1,منذ 6 سنوات وشهر,أعمال,خدمات قانونية,"استشارة, السعودية, لائحة, دعاوى, استئناف, اعتراضية",https://khamsat.com/business/legal-documents/1229651-%D8%B5%D9%8A%D8%A7%D8%BA%D8%A9-%D8%A7%D9%84%D8%AF%D8%B9%D8%A7%D9%88%D9%89-%D9%88%D8%A7%D9%84%D9%84%D9%88%D8%A7%D8%A6%D8%AD-%D8%A7%D9%84%D8%A7%D8%B9%D8%AA%D8%B1%D8%A7%D8%B6%D9%8A%D8%A9-%D8%B7%D8%A8%D9%82%D8%A7-%D9%84%D9%84%D9%82%D8%A7%D9%86%D9%88%D9%86-%D8%A7%D9%84%D8%B3%D8%B9%D9%88%D8%AF%D9%8A
كتابة و صياغة العقود القانونية,.Yousef S,0,0,Aucun avis,أعمال,خدمات قانونية,"كتابة, صياغة, عقود, العقود, صياغة عقود",https://khamsat.com/business/legal-documents/3835665-%D9%83%D8%AA%D8%A7%D8%A8%D8%A9-%D9%88-%D8%B5%D9%8A%D8%A7%D8%BA%D8%A9-%D8%A7%D9%84%D8%B9%D9%82%D9%88%D8%AF-%D8%A7%D9%84%D9%82%D8%A7%D9%86%D9%88%D9%86%D9%8A%D8%A9
سأكتب لك عقد عمل احترافي حسب قانون العمل الأردني,.Rola D,0,0,Aucun avis,أعمال,خدمات قانونية,"قالب, pdf, word, عقد, صياغة عقود",https://khamsat.com/business/legal-documents/3929834-%D8%B3%D8%A3%D9%83%D8%AA%D8%A8-%D9%84%D9%83-%D8%B9%D9%82%D8%AF-%D8%B9%D9%85%D9%84-%D8%A7%D8%AD%D8%AA%D8%B1%D8%A7%D9%81%D9%8A-%D8%AD%D8%B3%D8%A8-%D9%82%D8%A7%D9%86%D9%88%D9%86-%D8%A7%D9%84%D8%B9%D9%85%D9%84-%D8%A7%D9%84%D8%A3%D8%B1%D8%AF%D9%86%D9%8A
كتابة وصياغة العقود المدنية والتجارية,أحمد ن.,0,0,Aucun avis,أعمال,خدمات قانونية,"صياغة, عقد, القانونية, العقود, صياغة عقود",https://khamsat.com/business/legal-documents/3925307-%D9%83%D8%AA%D8%A7%D8%A8%D8%A9-%D9%88%D8%B5%D9%8A%D8%A7%D8%BA%D8%A9-%D8%A7%D9%84%D8%B9%D9%82%D9%88%D8%AF-%D8%A7%D9%84%D9%85%D8%AF%D9%86%D9%8A%D8%A9-%D9%88%D8%A7%D9%84%D8%AA%D8%AC%D8%A7%D8%B1%D9%8A%D8%A9
صياغة العقود القانونية ومراجعتها وفقا للنظام,.Amar Y,0,0,Aucun avis,أعمال,خدمات قانونية,"كتابة, مذكرات, قانونية, اعتراض, دراسة دعاوي",https://khamsat.com/business/legal-documents/2926969-%D8%B5%D9%8A%D8%A7%D8%BA%D8%A9-%D8%A7%D9%84%D8%B9%D9%82%D9%88%D8%AF-%D8%A7%D9%84%D9%82%D8%A7%D9%86%D9%88%D9%86%D9%8A%D8%A9-%D9%88%D9%85%D8%B1%D8%A7%D8%AC%D8%B9%D8%AA%D9%87%D8%A7-%D9%88%D9%81%D9%82%D8%A7-%D9%84%D9%84%D9%86%D8%B8%D8%A7%D9%85
صياغة وإعداد العقود المدنية والتجارية بصياغة قانونية متكاملة,.Mohamed S,0,0,Aucun avis,أعمال,خدمات قانونية,"عقود, عقد, قانونية, اتفاق, صياغة عقود",https://khamsat.com/business/legal-documents/3747545-%D8%B5%D9%8A%D8%A7%D8%BA%D8%A9-%D9%88%D8%A5%D8%B9%D8%AF%D8%A7%D8%AF-%D8%A7%D9%84%D8%B9%D9%82%D9%88%D8%AF-%D8%A7%D9%84%D9%85%D8%AF%D9%86%D9%8A%D8%A9-%D9%88%D8%A7%D9%84%D8%AA%D8%AC%D8%A7%D8%B1%D9%8A%D8%A9-%D8%A8%D8%B5%D9%8A%D8%A7%D8%BA%D8%A9-%D9%82%D8%A7%D9%86%D9%88%D9%86%D9%8A%D8%A9-%D9%85%D8%AA%D9%83%D8%A7%D9%85%D9%84%D8%A9
صياغة العقود والاتفاقيات وكتابة المذكرات القانونية واللوائح,.Amar Y,0,0,Aucun avis,أعمال,خدمات قانونية,"كتابة, صياغة, عقد, صياغة عقود, استئناف",https://khamsat.com/business/legal-documents/3075940-%D8%B5%D9%8A%D8%A7%D8%BA%D8%A9-%D8%A7%D9%84%D8%B9%D9%82%D9%88%D8%AF-%D9%88%D8%A7%D9%84%D8%A7%D8%AA%D9%81%D8%A7%D9%82%D9%8A%D8%A7%D8%AA-%D9%88%D9%83%D8%AA%D8%A7%D8%A8%D8%A9-%D8%A7%D9%84%D9%85%D8%B0%D9%83%D8%B1%D8%A7%D8%AA-%D8%A7%D9%84%D9%82%D8%A7%D9%86%D9%88%D9%86%D9%8A%D8%A9-%D9%88%D8%A7%D9%84%D9%84%D9%88%D8%A7%D8%A6%D8%AD
كتابة المذكرات واللوائح الاعتراضية وصياغة العقود,.Amar Y,0,0,Aucun avis,أعمال,خدمات قانونية,"كتابة مذكرات, صياغة عقود, تحرير دعاوي, إنهاء المعاملات والقضايا",https://khamsat.com/business/legal-documents/3366592-%D9%83%D8%AA%D8%A7%D8%A8%D8%A9-%D8%A7%D9%84%D9%85%D8%B0%D9%83%D8%B1%D8%A7%D8%AA-%D9%88%D8%A7%D9%84%D9%84%D9%88%D8%A7%D8%A6%D8%AD-%D8%A7%D9%84%D8%A7%D8%B9%D8%AA%D8%B1%D8%A7%D8%B6%D9%8A%D8%A9-%D9%88%D8%B5%D9%8A%D8%A7%D8%BA%D8%A9-%D8%A7%D9%84%D8%B9%D9%82%D9%88%D8%AF
تحديث وتعديل عقود التأسيس والسجلات التجارية للشركات,.Moustafa S,10,8,منذ سنتين و18 يوم,أعمال,خدمات قانونية,"شركات, تحديث, عقود, الشركات",https://khamsat.com/business/legal-documents/1052519-%D8%AA%D8%AD%D8%AF%D9%8A%D8%AB-%D9%88%D8%AA%D8%B9%D8%AF%D9%8A%D9%84-%D8%B9%D9%82%D9%88%D8%AF-%D8%A7%D9%84%D8%AA%D8%A3%D8%B3%D9%8A%D8%B3-%D9%88%D8%A7%D9%84%D8%B3%D8%AC%D9%84%D8%A7%D8%AA-%D8%A7%D9%84%D8%AA%D8%AC%D8%A7%D8%B1%D9%8A%D8%A9-%D9%84%D9%84%D8%B4%D8%B1%D9%83%D8%A7%D8%AA
صياغة مذكرات قانونية مدعّمة بالمواد والمبادئ القضائية,.Mahmoud S,0,0,Aucun avis,أعمال,خدمات قانونية,"قانون, قضايا, مذكرة, خدمات قانونية, صياغة عقود",https://khamsat.com/business/legal-documents/3929429-%D8%B5%D9%8A%D8%A7%D8%BA%D8%A9-%D9%85%D8%B0%D9%83%D8%B1%D8%A7%D8%AA-%D9%82%D8%A7%D9%86%D9%88%D9%86%D9%8A%D8%A9-%D9%85%D8%AF%D8%B9%D9%85%D8%A9-%D8%A8%D8%A7%D9%84%D9%85%D9%88%D8%A7%D8%AF-%D9%88%D8%A7%D9%84%D9%85%D8%A8%D8%A7%D8%AF%D8%A6-%D8%A7%D9%84%D9%82%D8%B6%D8%A7%D8%A6%D9%8A%D8%A9
صياغة عقد قانوني احترافي بالعربية وفق المعايير الخليجية,.Mohammed A,0,0,Aucun avis,أعمال,خدمات قانونية,"صياغة, تجارية, عقود, قانون, صياغة عقود",https://khamsat.com/business/legal-documents/3330517-%D8%B5%D9%8A%D8%A7%D8%BA%D8%A9-%D8%B9%D9%82%D8%AF-%D9%82%D8%A7%D9%86%D9%88%D9%86%D9%8A-%D8%A7%D8%AD%D8%AA%D8%B1%D8%A7%D9%81%D9%8A-%D8%A8%D8%A7%D9%84%D8%B9%D8%B1%D8%A8%D9%8A%D8%A9-%D9%88%D9%81%D9%82-%D8%A7%D9%84%D9%85%D8%B9%D8%A7%D9%8A%D9%8A%D8%B1-%D8%A7%D9%84%D8%AE%D9%84%D9%8A%D8%AC%D9%8A%D8%A9
صياغة كافة أنواع العقود والاتفاقيات وفقاً للقوانين العمانية,.Mohamed K,0,0,Aucun avis,أعمال,خدمات قانونية,"صياغة, عقود, قانون, اتفاقية, سلطنة عمان",https://khamsat.com/business/legal-documents/2909194-%D8%B5%D9%8A%D8%A7%D8%BA%D8%A9-%D9%83%D8%A7%D9%81%D8%A9-%D8%A3%D9%86%D9%88%D8%A7%D8%B9-%D8%A7%D9%84%D8%B9%D9%82%D9%88%D8%AF-%D9%88%D8%A7%D9%84%D8%A7%D8%AA%D9%81%D8%A7%D9%82%D9%8A%D8%A7%D8%AA-%D9%88%D9%81%D9%82%D8%A7-%D9%84%D9%84%D9%82%D9%88%D8%A7%D9%86%D9%8A%D9%86-%D8%A7%D9%84%D8%B9%D9%85%D8%A7%D9%86%D9%8A%D8%A9
كتابة و صياغة كافة التوكيلات و المحررات الرسمية و العرفية,خالد م.,0,0,Aucun avis,أعمال,خدمات قانونية,"قانون, محامى, قانونية, توكيلات, محررات رسمية",https://khamsat.com/business/legal-documents/3190200-%D9%83%D8%AA%D8%A7%D8%A8%D8%A9-%D9%88-%D8%B5%D9%8A%D8%A7%D8%BA%D8%A9-%D9%83%D8%A7%D9%81%D8%A9-%D8%A7%D9%84%D8%AA%D9%88%D9%83%D9%8A%D9%84%D8%A7%D8%AA-%D9%88-%D8%A7%D9%84%D9%85%D8%AD%D8%B1%D8%B1%D8%A7%D8%AA-%D8%A7%D9%84%D8%B1%D8%B3%D9%85%D9%8A%D8%A9-%D9%88-%D8%A7%D9%84%D8%B9%D8%B1%D9%81%D9%8A%D8%A9
صياغة و مراجعة المستندات و العقود القانونيه,محمود ط.,0,0,Aucun avis,أعمال,خدمات قانونية,"عقود, اتفاقية, خدمات قانونية, صياغة عقود, legal agreements",https://khamsat.com/business/legal-documents/3764415-%D8%B5%D9%8A%D8%A7%D8%BA%D8%A9-%D9%88-%D9%85%D8%B1%D8%A7%D8%AC%D8%B9%D8%A9-%D8%A7%D9%84%D9%85%D8%B3%D8%AA%D9%86%D8%AF%D8%A7%D8%AA-%D9%88-%D8%A7%D9%84%D8%B9%D9%82%D9%88%D8%AF-%D8%A7%D9%84%D9%82%D8%A7%D9%86%D9%88%D9%86%D9%8A%D9%87
تقديم خدمة متخصصة في كتابة عقد فرنشايز بشكل محترف,محمد ج.,0,0,Aucun avis,أعمال,خدمات قانونية,"صياغة, عقود, تجارى, اتفاقية, امتياز",https://khamsat.com/business/legal-documents/2830799-%D8%AA%D9%82%D8%AF%D9%8A%D9%85-%D8%AE%D8%AF%D9%85%D8%A9-%D9%85%D8%AA%D8%AE%D8%B5%D8%B5%D8%A9-%D9%81%D9%8A-%D9%83%D8%AA%D8%A7%D8%A8%D8%A9-%D8%B9%D9%82%D8%AF-%D9%81%D8%B1%D9%86%D8%B4%D8%A7%D9%8A%D8%B2-%D8%A8%D8%B4%D9%83%D9%84-%D9%85%D8%AD%D8%AA%D8%B1%D9%81
عقد بيع كامل البنود متوافق مع الانظمة العربية و القانونية,محمد ا.,0,0,Aucun avis,أعمال,خدمات قانونية,"عقود, محامى, عقد, صياغة عقود, عقد بيع",https://khamsat.com/business/legal-documents/3394491-%D8%B9%D9%82%D8%AF-%D8%A8%D9%8A%D8%B9-%D9%83%D8%A7%D9%85%D9%84-%D8%A7%D9%84%D8%A8%D9%86%D9%88%D8%AF-%D9%85%D8%AA%D9%88%D8%A7%D9%81%D9%82-%D9%85%D8%B9-%D8%A7%D9%84%D8%A7%D9%86%D8%B8%D9%85%D8%A9-%D8%A7%D9%84%D8%B9%D8%B1%D8%A8%D9%8A%D8%A9-%D9%88-%D8%A7%D9%84%D9%82%D8%A7%D9%86%D9%88%D9%86%D9%8A%D8%A9
خدمة مراجعة العقود وصياغة كافة أنواع العقود,محمد أ.,0,0,Aucun avis,أعمال,خدمات قانونية,"كتابة, صياغة, عقد, قانونية, صياغة عقود",https://khamsat.com/business/legal-documents/2967111-%D8%AE%D8%AF%D9%85%D8%A9-%D9%85%D8%B1%D8%A7%D8%AC%D8%B9%D8%A9-%D8%A7%D9%84%D8%B9%D9%82%D9%88%D8%AF-%D9%88%D8%B5%D9%8A%D8%A7%D8%BA%D8%A9-%D9%83%D8%A7%D9%81%D8%A9-%D8%A3%D9%86%D9%88%D8%A7%D8%B9-%D8%A7%D9%84%D8%B9%D9%82%D9%88%D8%AF
صياغة عقود الوكالة التجارية وعقود الامتياز التجاري (فرنشايز),.Aya H,0,0,Aucun avis,أعمال,خدمات قانونية,"تجارة, الكترونية, تجارية, تجاري, عقد, وكالة, امتياز, فرنشايز",https://khamsat.com/business/legal-documents/2060106-%D8%B5%D9%8A%D8%A7%D8%BA%D8%A9-%D8%B9%D9%82%D9%88%D8%AF-%D8%A7%D9%84%D9%88%D9%83%D8%A7%D9%84%D8%A9-%D8%A7%D9%84%D8%AA%D8%AC%D8%A7%D8%B1%D9%8A%D8%A9-%D9%88%D8%B9%D9%82%D9%88%D8%AF-%D8%A7%D9%84%D8%A7%D9%85%D8%AA%D9%8A%D8%A7%D8%B2-%D8%A7%D9%84%D8%AA%D8%AC%D8%A7%D8%B1%D9%8A-%D9%81%D8%B1%D9%86%D8%B4%D8%A7%D9%8A%D8%B2
صياغة عقود الملكية الفكرية والعلامات التجارية,.Aya H,0,0,Aucun avis,أعمال,خدمات قانونية,"عقود, علامة تجارية, قانون, عقد, استشارات قانونية, صياغة عقود, ملكية فكرية, تأليف ونشر",https://khamsat.com/business/legal-documents/2635870-%D8%B5%D9%8A%D8%A7%D8%BA%D8%A9-%D8%B9%D9%82%D9%88%D8%AF-%D8%A7%D9%84%D9%85%D9%84%D9%83%D9%8A%D8%A9-%D8%A7%D9%84%D9%81%D9%83%D8%B1%D9%8A%D8%A9-%D9%88%D8%A7%D9%84%D8%B9%D9%84%D8%A7%D9%85%D8%A7%D8%AA-%D8%A7%D9%84%D8%AA%D8%AC%D8%A7%D8%B1%D9%8A%D8%A9
صياغة اللائحة الداخلية للمؤسسات والشركات,.Aya H,1,0,Aucun avis,أعمال,خدمات قانونية,"شركات, مؤسسات, عمل, لائحة, العمل, تنظيم",https://khamsat.com/business/legal-documents/1233768-%D8%B5%D9%8A%D8%A7%D8%BA%D8%A9-%D8%A7%D9%84%D9%84%D8%A7%D8%A6%D8%AD%D8%A9-%D8%A7%D9%84%D8%AF%D8%A7%D8%AE%D9%84%D9%8A%D8%A9-%D9%84%D9%84%D9%85%D8%A4%D8%B3%D8%B3%D8%A7%D8%AA-%D9%88%D8%A7%D9%84%D8%B4%D8%B1%D9%83%D8%A7%D8%AA
اعداد وصياغة كافة العقود القانونية الالكترونية والفرنشيز,.Ashraf H,0,0,Aucun avis,أعمال,خدمات قانونية,"استشارات, محامى, عقد, قانونية, صياغة عقود",https://khamsat.com/business/legal-documents/3320381-%D8%A7%D8%B9%D8%AF%D8%A7%D8%AF-%D9%88%D8%B5%D9%8A%D8%A7%D8%BA%D8%A9-%D9%83%D8%A7%D9%81%D8%A9-%D8%A7%D9%84%D8%B9%D9%82%D9%88%D8%AF-%D8%A7%D9%84%D9%82%D8%A7%D9%86%D9%88%D9%86%D9%8A%D8%A9-%D8%A7%D9%84%D8%A7%D9%84%D9%83%D8%AA%D8%B1%D9%88%D9%86%D9%8A%D8%A9-%D9%88%D8%A7%D9%84%D9%81%D8%B1%D9%86%D8%B4%D9%8A%D8%B2
دعاوى الأحوال الشخصية وفقا للنظام السعودى ( كتابة ),عوض ا.,6,2,منذ سنة و7 أشهر,أعمال,خدمات قانونية,"كتابه, قانون, الطلاق, الزيارة, الرؤيه, الخلع, النكاح, النفقه, الفسخ, الحضانه",https://khamsat.com/business/legal-documents/2788166-%D8%AF%D8%B9%D8%A7%D9%88%D9%89-%D8%A7%D9%84%D8%A3%D8%AD%D9%88%D8%A7%D9%84-%D8%A7%D9%84%D8%B4%D8%AE%D8%B5%D9%8A%D8%A9-%D9%88%D9%81%D9%82%D8%A7-%D9%84%D9%84%D9%86%D8%B8%D8%A7%D9%85-%D8%A7%D9%84%D8%B3%D8%B9%D9%88%D8%AF%D9%89-%D9%83%D8%AA%D8%A7%D8%A8%D8%A9
اعداد لوائح الدعوى والمذكرات الجوابية والاعتراضية بالسعودية,أسامه ا.,0,0,Aucun avis,أعمال,خدمات قانونية,"استشارات, السعودية, لائحة, عقود, قانون, قانونية, مذكرة, دعوى, اعتراض, استئناف",https://khamsat.com/business/legal-documents/2742368-%D8%A7%D8%B9%D8%AF%D8%A7%D8%AF-%D9%84%D9%88%D8%A7%D8%A6%D8%AD-%D8%A7%D9%84%D8%AF%D8%B9%D9%88%D9%89-%D9%88%D8%A7%D9%84%D9%85%D8%B0%D9%83%D8%B1%D8%A7%D8%AA-%D8%A7%D9%84%D8%AC%D9%88%D8%A7%D8%A8%D9%8A%D8%A9-%D9%88%D8%A7%D9%84%D8%A7%D8%B9%D8%AA%D8%B1%D8%A7%D8%B6%D9%8A%D8%A9-%D8%A8%D8%A7%D9%84%D8%B3%D8%B9%D9%88%D8%AF%D9%8A%D8%A9
صياغة لوائح العمل ولوائح الجزاءات داخل الشركات والمؤسسات,كريم ا.,0,0,Aucun avis,أعمال,خدمات قانونية,"شركات, مؤسسات, شركة, السعودية, لائحة, الشركات, العمل, لوائح, محام, داخليه",https://khamsat.com/business/legal-documents/2785516-%D8%B5%D9%8A%D8%A7%D8%BA%D8%A9-%D9%84%D9%88%D8%A7%D8%A6%D8%AD-%D8%A7%D9%84%D8%B9%D9%85%D9%84-%D9%88%D9%84%D9%88%D8%A7%D8%A6%D8%AD-%D8%A7%D9%84%D8%AC%D8%B2%D8%A7%D8%A1%D8%A7%D8%AA-%D8%AF%D8%A7%D8%AE%D9%84-%D8%A7%D9%84%D8%B4%D8%B1%D9%83%D8%A7%D8%AA-%D9%88%D8%A7%D9%84%D9%85%D8%A4%D8%B3%D8%B3%D8%A7%D8%AA
صياغة ومراجعة كافة العقود  أشخاص شركات,كريم ا.,0,0,Aucun avis,أعمال,خدمات قانونية,"استشارات, صياغة, عقود, الكتابة, استشارات قانونية, المدنية, القانونية, العقود",https://khamsat.com/business/legal-documents/2785480-%D8%B5%D9%8A%D8%A7%D8%BA%D8%A9-%D9%88%D9%85%D8%B1%D8%A7%D8%AC%D8%B9%D8%A9-%D9%83%D8%A7%D9%81%D8%A9-%D8%A7%D9%84%D8%B9%D9%82%D9%88%D8%AF-%D8%A3%D8%B4%D8%AE%D8%A7%D8%B5-%D8%B4%D8%B1%D9%83%D8%A7%D8%AA
إعداد وصياغة اللوائح الداخلية لتنظيم العمل في الشركات والمنشآت,.Mostafa A,0,0,Aucun avis,أعمال,خدمات قانونية,"شركات, مؤسسات, شركة, عمل, لائحة, عقود, الشركات, العمل, تنظيم, قانون",https://khamsat.com/business/legal-documents/2233505-%D8%A5%D8%B9%D8%AF%D8%A7%D8%AF-%D9%88%D8%B5%D9%8A%D8%A7%D8%BA%D8%A9-%D8%A7%D9%84%D9%84%D9%88%D8%A7%D8%A6%D8%AD-%D8%A7%D9%84%D8%AF%D8%A7%D8%AE%D9%84%D9%8A%D8%A9-%D9%84%D8%AA%D9%86%D8%B8%D9%8A%D9%85-%D8%A7%D9%84%D8%B9%D9%85%D9%84-%D9%81%D9%8A-%D8%A7%D9%84%D8%B4%D8%B1%D9%83%D8%A7%D8%AA-%D9%88%D8%A7%D9%84%D9%85%D9%86%D8%B4%D8%A2%D8%AA
صياغة وكتابة عقد تسويق بالعمولة,عبدالعزيز م.,7,6,منذ 10 أشهر و26 يوم,أعمال,خدمات قانونية,"التسويق بالمحتوى, كتابة عقد, صيغة عقد تسويق بالعمولة, كتابة عقد تسويق, صياغة العقود السعودية",https://khamsat.com/business/legal-documents/2560995-%D8%B5%D9%8A%D8%A7%D8%BA%D8%A9-%D9%88%D9%83%D8%AA%D8%A7%D8%A8%D8%A9-%D8%B9%D9%82%D8%AF-%D8%AA%D8%B3%D9%88%D9%8A%D9%82-%D8%A8%D8%A7%D9%84%D8%B9%D9%85%D9%88%D9%84%D8%A9
صياغة العقود وفقا لأنظمة المملكة العربية السعودية,.Ahmed A,18,10,منذ 6 أشهر و6 أيام,أعمال,خدمات قانونية,"مراجعة, صياغة, السعودية, عقود, انظمة",https://khamsat.com/business/legal-documents/2268644-%D8%B5%D9%8A%D8%A7%D8%BA%D8%A9-%D8%A7%D9%84%D8%B9%D9%82%D9%88%D8%AF-%D9%88%D9%81%D9%82%D8%A7-%D9%84%D8%A3%D9%86%D8%B8%D9%85%D8%A9-%D8%A7%D9%84%D9%85%D9%85%D9%84%D9%83%D8%A9-%D8%A7%D9%84%D8%B9%D8%B1%D8%A8%D9%8A%D8%A9-%D8%A7%D9%84%D8%B3%D8%B9%D9%88%D8%AF%D9%8A%D8%A9
