Titre,Vendeur,Acheteurs,Notes,Date Dernier Avis,Catégorie,Sous-Catégorie,Mots Clés,Lien
مستشارك العقلى والنفسى لمشاكلك المختلفه,محمد ع.,2,2,منذ 3 سنوات وشهرين,أسلوب حياة,تنمية شخصية,"حل, مشكله, نفسى, فضفضه, ارهاق",https://khamsat.com/lifestyle/life-coaching/1874019-%D9%85%D8%B3%D8%AA%D8%B4%D8%A7%D8%B1%D9%83-%D8%A7%D9%84%D8%B9%D9%82%D9%84%D9%89-%D9%88%D8%A7%D9%84%D9%86%D9%81%D8%B3%D9%89-%D9%84%D9%85%D8%B4%D8%A7%D9%83%D9%84%D9%83-%D8%A7%D9%84%D9%85%D8%AE%D8%AA%D9%84%D9%81%D9%87
تقديم استشارات شخصية ونفسية,.Balsam A,5,3,منذ سنتين و3 أشهر,أسلوب حياة,تنمية شخصية,"استشارات, علم, نفس",https://khamsat.com/lifestyle/life-coaching/1947789-%D8%AA%D9%82%D8%AF%D9%8A%D9%85-%D8%A7%D8%B3%D8%AA%D8%B4%D8%A7%D8%B1%D8%A7%D8%AA-%D8%B4%D8%AE%D8%B5%D9%8A%D8%A9-%D9%88%D9%86%D9%81%D8%B3%D9%8A%D8%A9
جلسه استماع ودعم نفسي ومساعده,.Nada E,0,0,Aucun avis,أسلوب حياة,تنمية شخصية,"مساعدة, فضفضة, مشكلات, استشارات نفسية",https://khamsat.com/lifestyle/life-coaching/3470626-%D8%AC%D9%84%D8%B3%D9%87-%D8%A7%D8%B3%D8%AA%D9%85%D8%A7%D8%B9-%D9%88%D8%AF%D8%B9%D9%85-%D9%86%D9%81%D8%B3%D9%8A-%D9%88%D9%85%D8%B3%D8%A7%D8%B9%D8%AF%D9%87
استشارات شخصية من صديق الكترونيًا,فاطمه ج.,0,0,Aucun avis,أسلوب حياة,تنمية شخصية,"استشارة, نفسية, استشارات نفسية",https://khamsat.com/lifestyle/life-coaching/2945513-%D8%A7%D8%B3%D8%AA%D8%B4%D8%A7%D8%B1%D8%A7%D8%AA-%D8%B4%D8%AE%D8%B5%D9%8A%D8%A9-%D9%85%D9%86-%D8%B5%D8%AF%D9%8A%D9%82-%D8%A7%D9%84%D9%83%D8%AA%D8%B1%D9%88%D9%86%D9%8A%D8%A7
عقد جلسات للفضفضة والاستشارات النفسية والنقاش والراحة,.Muhammed H,0,0,Aucun avis,أسلوب حياة,تنمية شخصية,"حلول, دعم, فضفضة, استشارات نفسية, نقاش",https://khamsat.com/lifestyle/life-coaching/3322850-%D8%B9%D9%82%D8%AF-%D8%AC%D9%84%D8%B3%D8%A7%D8%AA-%D9%84%D9%84%D9%81%D8%B6%D9%81%D8%B6%D8%A9-%D9%88%D8%A7%D9%84%D8%A7%D8%B3%D8%AA%D8%B4%D8%A7%D8%B1%D8%A7%D8%AA-%D8%A7%D9%84%D9%86%D9%81%D8%B3%D9%8A%D8%A9-%D9%88%D8%A7%D9%84%D9%86%D9%82%D8%A7%D8%B4-%D9%88%D8%A7%D9%84%D8%B1%D8%A7%D8%AD%D8%A9
تحليل وتقييم مقياس اضطرابات الشخصية بشكل احترافي,.Hanaa M,1,0,Aucun avis,أسلوب حياة,تنمية شخصية,"تطوير, استشارات, تحليل, شخصية, نفسية",https://khamsat.com/lifestyle/life-coaching/3052935-%D8%AA%D8%AD%D9%84%D9%8A%D9%84-%D9%88%D8%AA%D9%82%D9%8A%D9%8A%D9%85-%D9%85%D9%82%D9%8A%D8%A7%D8%B3-%D8%A7%D8%B6%D8%B7%D8%B1%D8%A7%D8%A8%D8%A7%D8%AA-%D8%A7%D9%84%D8%B4%D8%AE%D8%B5%D9%8A%D8%A9-%D8%A8%D8%B4%D9%83%D9%84-%D8%A7%D8%AD%D8%AA%D8%B1%D8%A7%D9%81%D9%8A
استشارة نفسية كتابية فردية,.Doha R,0,0,Aucun avis,أسلوب حياة,تنمية شخصية,"دعم, تحفيز, تطوير الذات, فضفضة, استشارات نفسية",https://khamsat.com/lifestyle/life-coaching/3280461-%D8%A7%D8%B3%D8%AA%D8%B4%D8%A7%D8%B1%D8%A9-%D9%86%D9%81%D8%B3%D9%8A%D8%A9-%D9%83%D8%AA%D8%A7%D8%A8%D9%8A%D8%A9-%D9%81%D8%B1%D8%AF%D9%8A%D8%A9
استشارة في مجال التربية للأطفال,.Samer S,0,0,Aucun avis,أسلوب حياة,تنمية شخصية,"حماية, تربية, تمارين, تفاعل, الطفل",https://khamsat.com/lifestyle/life-coaching/1639922-%D8%A7%D8%B3%D8%AA%D8%B4%D8%A7%D8%B1%D8%A9-%D9%81%D9%8A-%D9%85%D8%AC%D8%A7%D9%84-%D8%A7%D9%84%D8%AA%D8%B1%D8%A8%D9%8A%D8%A9-%D9%84%D9%84%D8%A3%D8%B7%D9%81%D8%A7%D9%84
مستشار أسري واجتماعي متخصص,عزيزه ز.,1,1,منذ سنة و12 يوم,أسلوب حياة,تنمية شخصية,"استشارات, نصائح, فضفضة, مشكلات, نفسيه",https://khamsat.com/lifestyle/life-coaching/3077526-%D9%85%D8%B3%D8%AA%D8%B4%D8%A7%D8%B1-%D8%A3%D8%B3%D8%B1%D9%8A-%D9%88%D8%A7%D8%AC%D8%AA%D9%85%D8%A7%D8%B9%D9%8A-%D9%85%D8%AA%D8%AE%D8%B5%D8%B5
فضفضة نفسية لأمانك النفسي,منة الله ق.,0,0,Aucun avis,أسلوب حياة,تنمية شخصية,"تطوير, استشارات, نصائح, مشكلة, نفسية",https://khamsat.com/lifestyle/life-coaching/3578250-%D9%81%D8%B6%D9%81%D8%B6%D8%A9-%D9%86%D9%81%D8%B3%D9%8A%D8%A9-%D9%84%D8%A3%D9%85%D8%A7%D9%86%D9%83-%D8%A7%D9%84%D9%86%D9%81%D8%B3%D9%8A
أخصائية إرشاد أسري وخطط تعديل سلوك,.Madiha H,0,0,Aucun avis,أسلوب حياة,تنمية شخصية,"دعم, تطوير الذات, ارشاد, الاطفال, استشارات نفسية",https://khamsat.com/lifestyle/life-coaching/3804517-%D8%A3%D8%AE%D8%B5%D8%A7%D8%A6%D9%8A%D8%A9-%D8%A5%D8%B1%D8%B4%D8%A7%D8%AF-%D8%A3%D8%B3%D8%B1%D9%8A-%D9%88%D8%AE%D8%B7%D8%B7-%D8%AA%D8%B9%D8%AF%D9%8A%D9%84-%D8%B3%D9%84%D9%88%D9%83
أسلوب حياه استشارات شخصيه استشارات نفسية,.Dina M,0,0,Aucun avis,أسلوب حياة,تنمية شخصية,"استشارات, شخصية, اجتماعية, تربوية, استشارات نفسية",https://khamsat.com/lifestyle/life-coaching/2959417-%D8%A3%D8%B3%D9%84%D9%88%D8%A8-%D8%AD%D9%8A%D8%A7%D9%87-%D8%A7%D8%B3%D8%AA%D8%B4%D8%A7%D8%B1%D8%A7%D8%AA-%D8%B4%D8%AE%D8%B5%D9%8A%D9%87-%D8%A7%D8%B3%D8%AA%D8%B4%D8%A7%D8%B1%D8%A7%D8%AA-%D9%86%D9%81%D8%B3%D9%8A%D8%A9
تقديم استشارات تربوية للتعامل مع الأطفال والمراهقين,.Soha Z,0,0,Aucun avis,أسلوب حياة,تنمية شخصية,استشارات تربوية,https://khamsat.com/lifestyle/life-coaching/2416229-%D8%AA%D9%82%D8%AF%D9%8A%D9%85-%D8%A7%D8%B3%D8%AA%D8%B4%D8%A7%D8%B1%D8%A7%D8%AA-%D8%AA%D8%B1%D8%A8%D9%88%D9%8A%D8%A9-%D9%84%D9%84%D8%AA%D8%B9%D8%A7%D9%85%D9%84-%D9%85%D8%B9-%D8%A7%D9%84%D8%A3%D8%B7%D9%81%D8%A7%D9%84-%D9%88%D8%A7%D9%84%D9%85%D8%B1%D8%A7%D9%87%D9%82%D9%8A%D9%86
تدريب واستشارة شخصية تربوية أسرية دراسية أو حياتية,عبدالرحمان ا.,2,2,منذ 4 سنوات و6 أيام,أسلوب حياة,تنمية شخصية,"تطوير, اقتصاد, تدريب, عقود, اسلامي, استشارات نفسية, توثيق, استشارة شخصية, معاملات مالية, دورة تكوينية",https://khamsat.com/lifestyle/life-coaching/1473112-%D8%AA%D8%AF%D8%B1%D9%8A%D8%A8-%D9%88%D8%A7%D8%B3%D8%AA%D8%B4%D8%A7%D8%B1%D8%A9-%D8%B4%D8%AE%D8%B5%D9%8A%D8%A9-%D8%AA%D8%B1%D8%A8%D9%88%D9%8A%D8%A9-%D8%A3%D8%B3%D8%B1%D9%8A%D8%A9-%D8%AF%D8%B1%D8%A7%D8%B3%D9%8A%D8%A9-%D8%A3%D9%88-%D8%AD%D9%8A%D8%A7%D8%AA%D9%8A%D8%A9
تحليل شخصيتك من خط يدك وتوقيعك,.Mahmoud K,0,0,Aucun avis,أسلوب حياة,تنمية شخصية,"استشارات, تحليل, تطوير الذات, شخصيه, التحليل",https://khamsat.com/lifestyle/life-coaching/3871412-%D8%AA%D8%AD%D9%84%D9%8A%D9%84-%D8%B4%D8%AE%D8%B5%D9%8A%D8%AA%D9%83-%D9%85%D9%86-%D8%AE%D8%B7-%D9%8A%D8%AF%D9%83-%D9%88%D8%AA%D9%88%D9%82%D9%8A%D8%B9%D9%83
أساعدك تكتشف تفكيرك الغلط وتشوف الصورة الكاملة لحياتك,.Shady R,0,0,Aucun avis,أسلوب حياة,تنمية شخصية,"استشارة, تطوير الذات, استفسارات, التحليل",https://khamsat.com/lifestyle/life-coaching/3887161-%D8%A3%D8%B3%D8%A7%D8%B9%D8%AF%D9%83-%D8%AA%D9%83%D8%AA%D8%B4%D9%81-%D8%AA%D9%81%D9%83%D9%8A%D8%B1%D9%83-%D8%A7%D9%84%D8%BA%D9%84%D8%B7-%D9%88%D8%AA%D8%B4%D9%88%D9%81-%D8%A7%D9%84%D8%B5%D9%88%D8%B1%D8%A9-%D8%A7%D9%84%D9%83%D8%A7%D9%85%D9%84%D8%A9-%D9%84%D8%AD%D9%8A%D8%A7%D8%AA%D9%83
جلسة اكتشاف الذات عبر المراسلة,.Mohamed Y,0,0,Aucun avis,أسلوب حياة,تنمية شخصية,"تطوير الذات, ارشاد, إستشارة",https://khamsat.com/lifestyle/life-coaching/3890860-%D8%AC%D9%84%D8%B3%D8%A9-%D8%A7%D9%83%D8%AA%D8%B4%D8%A7%D9%81-%D8%A7%D9%84%D8%B0%D8%A7%D8%AA-%D8%B9%D8%A8%D8%B1-%D8%A7%D9%84%D9%85%D8%B1%D8%A7%D8%B3%D9%84%D8%A9
كوتشينج شخصي لايف كوتش كوتش صحي,.Mahmoud K,0,0,Aucun avis,أسلوب حياة,تنمية شخصية,"استشارة, تطوير الذات, جلسة, سمنة",https://khamsat.com/lifestyle/life-coaching/3846265-%D9%83%D9%88%D8%AA%D8%B4%D9%8A%D9%86%D8%AC-%D8%B4%D8%AE%D8%B5%D9%8A-%D9%84%D8%A7%D9%8A%D9%81-%D9%83%D9%88%D8%AA%D8%B4-%D9%83%D9%88%D8%AA%D8%B4-%D8%B5%D8%AD%D9%8A
استشارات عاطفية وزوجية لمساعدتك على تحسين علاقتك بسرية تامة,أمير ج.,0,0,Aucun avis,أسلوب حياة,تنمية شخصية,"استشارة, حلول, شخصية, دعم, علاقات",https://khamsat.com/lifestyle/life-coaching/3766891-%D8%A7%D8%B3%D8%AA%D8%B4%D8%A7%D8%B1%D8%A7%D8%AA-%D8%B9%D8%A7%D8%B7%D9%81%D9%8A%D8%A9-%D9%88%D8%B2%D9%88%D8%AC%D9%8A%D8%A9-%D9%84%D9%85%D8%B3%D8%A7%D8%B9%D8%AF%D8%AA%D9%83-%D8%B9%D9%84%D9%89-%D8%AA%D8%AD%D8%B3%D9%8A%D9%86-%D8%B9%D9%84%D8%A7%D9%82%D8%AA%D9%83-%D8%A8%D8%B3%D8%B1%D9%8A%D8%A9-%D8%AA%D8%A7%D9%85%D8%A9
سأكون صديقك للاستماع والدعم من خلال جلسة فضفضة مريحة,أمير ج.,0,0,Aucun avis,أسلوب حياة,تنمية شخصية,"نصائح, دعم, نفسية, فضفضة, مشكلات",https://khamsat.com/lifestyle/life-coaching/3762090-%D8%B3%D8%A3%D9%83%D9%88%D9%86-%D8%B5%D8%AF%D9%8A%D9%82%D9%83-%D9%84%D9%84%D8%A7%D8%B3%D8%AA%D9%85%D8%A7%D8%B9-%D9%88%D8%A7%D9%84%D8%AF%D8%B9%D9%85-%D9%85%D9%86-%D8%AE%D9%84%D8%A7%D9%84-%D8%AC%D9%84%D8%B3%D8%A9-%D9%81%D8%B6%D9%81%D8%B6%D8%A9-%D9%85%D8%B1%D9%8A%D8%AD%D8%A9
اختبر مدى تقديرك لذاتك self-esteem,رهام س.,3,3,منذ سنة و4 أشهر,أسلوب حياة,تنمية شخصية,"استبيان, الذات, تقدير, مفهوم",https://khamsat.com/lifestyle/life-coaching/1960428-%D8%A7%D8%AE%D8%AA%D8%A8%D8%B1-%D9%85%D8%AF%D9%89-%D8%AA%D9%82%D8%AF%D9%8A%D8%B1%D9%83-%D9%84%D8%B0%D8%A7%D8%AA%D9%83-self-esteem
كوتش حياة معتمد استشارات نفسية أسرية تعديل سلوك معرفي,.Madiha H,1,1,منذ شهر و24 يوم,أسلوب حياة,تنمية شخصية,"تطوير, مشاكل, علاج, استشارات نفسية, جلسة",https://khamsat.com/lifestyle/life-coaching/3382556-%D9%83%D9%88%D8%AA%D8%B4-%D8%AD%D9%8A%D8%A7%D8%A9-%D9%85%D8%B9%D8%AA%D9%85%D8%AF-%D8%A7%D8%B3%D8%AA%D8%B4%D8%A7%D8%B1%D8%A7%D8%AA-%D9%86%D9%81%D8%B3%D9%8A%D8%A9-%D8%A3%D8%B3%D8%B1%D9%8A%D8%A9-%D8%AA%D8%B9%D8%AF%D9%8A%D9%84-%D8%B3%D9%84%D9%88%D9%83-%D9%85%D8%B9%D8%B1%D9%81%D9%8A
تقديم تدريب نفسي ومهاري للأطفال والمراهقين(ساعة),آسية ا.,7,5,منذ سنة و4 أشهر,أسلوب حياة,تنمية شخصية,"تعليم, تدريب, أطفال, نفسي, مراهق, تربوي, نفسى",https://khamsat.com/lifestyle/life-coaching/1585854-%D8%AA%D9%82%D8%AF%D9%8A%D9%85-%D8%AA%D8%AF%D8%B1%D9%8A%D8%A8-%D9%86%D9%81%D8%B3%D9%8A-%D9%88%D9%85%D9%87%D8%A7%D8%B1%D9%8A-%D9%84%D9%84%D8%A3%D8%B7%D9%81%D8%A7%D9%84-%D9%88%D8%A7%D9%84%D9%85%D8%B1%D8%A7%D9%87%D9%82%D9%8A%D9%86%D8%B3%D8%A7%D8%B9%D8%A9
اخصائية نفسانية للطفل والمراهق والراشد,.Hanaa M,1,0,Aucun avis,أسلوب حياة,تنمية شخصية,"استشارات, تفريغ, شخصية, تربية, استشارات نفسية",https://khamsat.com/lifestyle/life-coaching/3018615-%D8%A7%D8%AE%D8%B5%D8%A7%D8%A6%D9%8A%D8%A9-%D9%86%D9%81%D8%B3%D8%A7%D9%86%D9%8A%D8%A9-%D9%84%D9%84%D8%B7%D9%81%D9%84-%D9%88%D8%A7%D9%84%D9%85%D8%B1%D8%A7%D9%87%D9%82-%D9%88%D8%A7%D9%84%D8%B1%D8%A7%D8%B4%D8%AF
استشارة ودورات تنمية ذاتية وموارد بشرية,.Heba H,0,0,Aucun avis,أسلوب حياة,تنمية شخصية,"ذاتية, تنمية, بشرية, موارد, hr",https://khamsat.com/lifestyle/life-coaching/2295947-%D8%A7%D8%B3%D8%AA%D8%B4%D8%A7%D8%B1%D8%A9-%D9%88%D8%AF%D9%88%D8%B1%D8%A7%D8%AA-%D8%AA%D9%86%D9%85%D9%8A%D8%A9-%D8%B0%D8%A7%D8%AA%D9%8A%D8%A9-%D9%88%D9%85%D9%88%D8%A7%D8%B1%D8%AF-%D8%A8%D8%B4%D8%B1%D9%8A%D8%A9
استشارات شخصيه استشارات نفسيه,.Dina M,0,0,Aucun avis,أسلوب حياة,تنمية شخصية,"استشارة, مشاكل, حلول, دعم, علاج, تحفيز, نفسية, مساعده, نفسي, استشارات نفسية",https://khamsat.com/lifestyle/life-coaching/2605088-%D8%A7%D8%B3%D8%AA%D8%B4%D8%A7%D8%B1%D8%A7%D8%AA-%D8%B4%D8%AE%D8%B5%D9%8A%D9%87-%D8%A7%D8%B3%D8%AA%D8%B4%D8%A7%D8%B1%D8%A7%D8%AA-%D9%86%D9%81%D8%B3%D9%8A%D9%87
فضفضة واستماع وحل المشاكل,.Rowaan R,2,2,منذ 11 شهر و11 يوم,أسلوب حياة,تنمية شخصية,"حلول, دعم, محادثة, شخصيه, فضفضة",https://khamsat.com/lifestyle/life-coaching/3097268-%D9%81%D8%B6%D9%81%D8%B6%D8%A9-%D9%88%D8%A7%D8%B3%D8%AA%D9%85%D8%A7%D8%B9-%D9%88%D8%AD%D9%84-%D8%A7%D9%84%D9%85%D8%B4%D8%A7%D9%83%D9%84
استشارات تربوية في التعليم و تدريب المدربين للعروض التقديمية,.Effat E,1,0,Aucun avis,أسلوب حياة,تنمية شخصية,"مدرب, كوتش",https://khamsat.com/lifestyle/life-coaching/374029-%D8%A7%D8%B3%D8%AA%D8%B4%D8%A7%D8%B1%D8%A7%D8%AA-%D8%AA%D8%B1%D8%A8%D9%88%D9%8A%D8%A9-%D9%81%D9%8A-%D8%A7%D9%84%D8%AA%D8%B9%D9%84%D9%8A%D9%85-%D9%88-%D8%AA%D8%AF%D8%B1%D9%8A%D8%A8-%D8%A7%D9%84%D9%85%D8%AF%D8%B1%D8%A8%D9%8A%D9%86-%D9%84%D9%84%D8%B9%D8%B1%D9%88%D8%B6-%D8%A7%D9%84%D8%AA%D9%82%D8%AF%D9%8A%D9%85%D9%8A%D8%A9
استشارات نفسية اجتماعية وجلسات أسرية,.Samar A,2,0,Aucun avis,أسلوب حياة,تنمية شخصية,"استشارة, استشارات, مشاكل, حلول, دعم, تحفيز, الذات, اجتماعية, نفسية, استشارات نفسية",https://khamsat.com/lifestyle/life-coaching/2806760-%D8%A7%D8%B3%D8%AA%D8%B4%D8%A7%D8%B1%D8%A7%D8%AA-%D9%86%D9%81%D8%B3%D9%8A%D8%A9-%D8%A7%D8%AC%D8%AA%D9%85%D8%A7%D8%B9%D9%8A%D8%A9-%D9%88%D8%AC%D9%84%D8%B3%D8%A7%D8%AA-%D8%A3%D8%B3%D8%B1%D9%8A%D8%A9
حل مشاكلك من خلال استشارة في اي جانب من جوانب الحياه,.Mariem K,0,0,Aucun avis,أسلوب حياة,تنمية شخصية,"استشارة, مشاكل, علاج, حل, نفسية",https://khamsat.com/lifestyle/life-coaching/2036002-%D8%AD%D9%84-%D9%85%D8%B4%D8%A7%D9%83%D9%84%D9%83-%D9%85%D9%86-%D8%AE%D9%84%D8%A7%D9%84-%D8%A7%D8%B3%D8%AA%D8%B4%D8%A7%D8%B1%D8%A9-%D9%81%D9%8A-%D8%A7%D9%8A-%D8%AC%D8%A7%D9%86%D8%A8-%D9%85%D9%86-%D8%AC%D9%88%D8%A7%D9%86%D8%A8-%D8%A7%D9%84%D8%AD%D9%8A%D8%A7%D9%87
جلسه دعم نفسي أونلاين لمساعدتك على تجاوز القلق,.Fatma Al Zahraa E,1,1,منذ 4 أشهر و10 أيام,أسلوب حياة,تنمية شخصية,"استشارة, استشارات, دعم, مشكلات, نفسي",https://khamsat.com/lifestyle/life-coaching/3494672-%D8%AC%D9%84%D8%B3%D9%87-%D8%AF%D8%B9%D9%85-%D9%86%D9%81%D8%B3%D9%8A-%D8%A3%D9%88%D9%86%D9%84%D8%A7%D9%8A%D9%86-%D9%84%D9%85%D8%B3%D8%A7%D8%B9%D8%AF%D8%AA%D9%83-%D8%B9%D9%84%D9%89-%D8%AA%D8%AC%D8%A7%D9%88%D8%B2-%D8%A7%D9%84%D9%82%D9%84%D9%82
مدربة حياة معتمدة Life Coach,وفاء ا.,0,0,Aucun avis,أسلوب حياة,تنمية شخصية,"استشارة, تطوير الذات, فضفضة, استشارات نفسية, مدرب حياة",https://khamsat.com/lifestyle/life-coaching/3104535-%D9%85%D8%AF%D8%B1%D8%A8%D8%A9-%D8%AD%D9%8A%D8%A7%D8%A9-%D9%85%D8%B9%D8%AA%D9%85%D8%AF%D8%A9-life-coach
جلسة فضفضة  بدون تشخيص او حكم.,.Menna E,0,0,Aucun avis,أسلوب حياة,تنمية شخصية,"دعم, محادثة, نفسية, فضفضة, مشكلات",https://khamsat.com/lifestyle/life-coaching/3525438-%D8%AC%D9%84%D8%B3%D8%A9-%D9%81%D8%B6%D9%81%D8%B6%D8%A9-%D8%A8%D8%AF%D9%88%D9%86-%D8%AA%D8%B4%D8%AE%D9%8A%D8%B5-%D8%A7%D9%88-%D8%AD%D9%83%D9%85
الاستشارات النفسية وتطوير الذات وتقديم الدعم النفسي.,نور الهدى ش.,1,6,منذ 3 أشهر و11 يوم,أسلوب حياة,تنمية شخصية,"استشارات, ارشاد, النجاح, مشكلات, نفسيه",https://khamsat.com/lifestyle/life-coaching/2551563-%D8%A7%D9%84%D8%A7%D8%B3%D8%AA%D8%B4%D8%A7%D8%B1%D8%A7%D8%AA-%D8%A7%D9%84%D9%86%D9%81%D8%B3%D9%8A%D8%A9-%D9%88%D8%AA%D8%B7%D9%88%D9%8A%D8%B1-%D8%A7%D9%84%D8%B0%D8%A7%D8%AA-%D9%88%D8%AA%D9%82%D8%AF%D9%8A%D9%85-%D8%A7%D9%84%D8%AF%D8%B9%D9%85-%D8%A7%D9%84%D9%86%D9%81%D8%B3%D9%8A
استشارة شخصية لحياتك و أعمالك بهدوء وسرية لإستعادة توازنك,.Mohamed A,0,0,Aucun avis,أسلوب حياة,تنمية شخصية,"حل مشكلة, مشاكل عائلية, استشارات حياتية, مساعدة فى للإتزان النفسي, استشارة للضغوط الحياتية",https://khamsat.com/lifestyle/life-coaching/3066014-%D8%A7%D8%B3%D8%AA%D8%B4%D8%A7%D8%B1%D8%A9-%D8%B4%D8%AE%D8%B5%D9%8A%D8%A9-%D9%84%D8%AD%D9%8A%D8%A7%D8%AA%D9%83-%D9%88-%D8%A3%D8%B9%D9%85%D8%A7%D9%84%D9%83-%D8%A8%D9%87%D8%AF%D9%88%D8%A1-%D9%88%D8%B3%D8%B1%D9%8A%D8%A9-%D9%84%D8%A5%D8%B3%D8%AA%D8%B9%D8%A7%D8%AF%D8%A9-%D8%AA%D9%88%D8%A7%D8%B2%D9%86%D9%83
تقديم إستشارات لتحقيق توازن الشخصية,سعد ي.,0,0,Aucun avis,أسلوب حياة,تنمية شخصية,"تطوير, حلول, شخصية, علاج, استشارات نفسية",https://khamsat.com/lifestyle/life-coaching/3796407-%D8%AA%D9%82%D8%AF%D9%8A%D9%85-%D8%A5%D8%B3%D8%AA%D8%B4%D8%A7%D8%B1%D8%A7%D8%AA-%D9%84%D8%AA%D8%AD%D9%82%D9%8A%D9%82-%D8%AA%D9%88%D8%A7%D8%B2%D9%86-%D8%A7%D9%84%D8%B4%D8%AE%D8%B5%D9%8A%D8%A9
تقديم استشارات تربوية ونفسية علمية واحترافية للأفراد,.Mona E,0,0,Aucun avis,أسلوب حياة,تنمية شخصية,"علم, تربية, نفس, مدرب, استشارات نفسية",https://khamsat.com/lifestyle/life-coaching/3795089-%D8%AA%D9%82%D8%AF%D9%8A%D9%85-%D8%A7%D8%B3%D8%AA%D8%B4%D8%A7%D8%B1%D8%A7%D8%AA-%D8%AA%D8%B1%D8%A8%D9%88%D9%8A%D8%A9-%D9%88%D9%86%D9%81%D8%B3%D9%8A%D8%A9-%D8%B9%D9%84%D9%85%D9%8A%D8%A9-%D9%88%D8%A7%D8%AD%D8%AA%D8%B1%D8%A7%D9%81%D9%8A%D8%A9-%D9%84%D9%84%D8%A3%D9%81%D8%B1%D8%A7%D8%AF
كيفية الإتصال والتواصل مع الآخرين,.Omar R,2,1,منذ 9 سنوات و10 أشهر,أسلوب حياة,تنمية شخصية,"نصائح, كتاب, تنمية بشرية, الاتصال, التواصل, علم النفس, التخاطب, فن التواصل, فنون التواصل",https://khamsat.com/lifestyle/life-coaching/348793-%D9%83%D9%8A%D9%81%D9%8A%D8%A9-%D8%A7%D9%84%D8%A5%D8%AA%D8%B5%D8%A7%D9%84-%D9%88%D8%A7%D9%84%D8%AA%D9%88%D8%A7%D8%B5%D9%84-%D9%85%D8%B9-%D8%A7%D9%84%D8%A2%D8%AE%D8%B1%D9%8A%D9%86
إدارة وتطوير وتقييم التواصل اللفظي,اياد غ.,0,0,Aucun avis,أسلوب حياة,تنمية شخصية,"تطوير, تواصل, تقييم, مهارات, التواصل اللفظي",https://khamsat.com/lifestyle/life-coaching/2938565-%D8%A5%D8%AF%D8%A7%D8%B1%D8%A9-%D9%88%D8%AA%D8%B7%D9%88%D9%8A%D8%B1-%D9%88%D8%AA%D9%82%D9%8A%D9%8A%D9%85-%D8%A7%D9%84%D8%AA%D9%88%D8%A7%D8%B5%D9%84-%D8%A7%D9%84%D9%84%D9%81%D8%B8%D9%8A
استشارات شخصية ونفسية وترفيهية,.Amin S,0,0,Aucun avis,أسلوب حياة,تنمية شخصية,"استشارات نفسية, استشارات عامة, مرشد نفسي, تنظيم جداول سفر",https://khamsat.com/lifestyle/life-coaching/3811387-%D8%A7%D8%B3%D8%AA%D8%B4%D8%A7%D8%B1%D8%A7%D8%AA-%D8%B4%D8%AE%D8%B5%D9%8A%D8%A9-%D9%88%D9%86%D9%81%D8%B3%D9%8A%D8%A9-%D9%88%D8%AA%D8%B1%D9%81%D9%8A%D9%87%D9%8A%D8%A9
تدريب الأطفال على مهارات الكوتشينج,.Mahmoud K,0,0,Aucun avis,أسلوب حياة,تنمية شخصية,"تعليم, تدريب, تدريب عن بعد, اطفال",https://khamsat.com/lifestyle/life-coaching/3854219-%D8%AA%D8%AF%D8%B1%D9%8A%D8%A8-%D8%A7%D9%84%D8%A3%D8%B7%D9%81%D8%A7%D9%84-%D8%B9%D9%84%D9%89-%D9%85%D9%87%D8%A7%D8%B1%D8%A7%D8%AA-%D8%A7%D9%84%D9%83%D9%88%D8%AA%D8%B4%D9%8A%D9%86%D8%AC
استشارة نفسية فردية وأسرية life coaching,.Shadia A,1,1,منذ سنة و11 شهر,أسلوب حياة,تنمية شخصية,"استشارة نفسية, استشارات نفسية",https://khamsat.com/lifestyle/life-coaching/2788669-%D8%A7%D8%B3%D8%AA%D8%B4%D8%A7%D8%B1%D8%A9-%D9%86%D9%81%D8%B3%D9%8A%D8%A9-%D9%81%D8%B1%D8%AF%D9%8A%D8%A9-%D9%88%D8%A3%D8%B3%D8%B1%D9%8A%D8%A9-life-coaching
استشارة في التنمية الذاتية لفهم نفسك وتوازن حياتك بعمق ووعي.,.Hussein S,0,0,Aucun avis,أسلوب حياة,تنمية شخصية,"استشارة, تطوير, نصائح, شخصية, دعم",https://khamsat.com/lifestyle/life-coaching/3879601-%D8%A7%D8%B3%D8%AA%D8%B4%D8%A7%D8%B1%D8%A9-%D9%81%D9%8A-%D8%A7%D9%84%D8%AA%D9%86%D9%85%D9%8A%D8%A9-%D8%A7%D9%84%D8%B0%D8%A7%D8%AA%D9%8A%D8%A9-%D9%84%D9%81%D9%87%D9%85-%D9%86%D9%81%D8%B3%D9%83-%D9%88%D8%AA%D9%88%D8%A7%D8%B2%D9%86-%D8%AD%D9%8A%D8%A7%D8%AA%D9%83-%D8%A8%D8%B9%D9%85%D9%82-%D9%88%D9%88%D8%B9%D9%8A
جلسة دعم نفسي وفضفضة أونلاين مع أخصائية إرشاد نفسي,.Qamar Rajab B,0,0,Aucun avis,أسلوب حياة,تنمية شخصية,"استشارة, دعم, ارشاد, فضفضة",https://khamsat.com/lifestyle/life-coaching/3280598-%D8%AC%D9%84%D8%B3%D8%A9-%D8%AF%D8%B9%D9%85-%D9%86%D9%81%D8%B3%D9%8A-%D9%88%D9%81%D8%B6%D9%81%D8%B6%D8%A9-%D8%A3%D9%88%D9%86%D9%84%D8%A7%D9%8A%D9%86-%D9%85%D8%B9-%D8%A3%D8%AE%D8%B5%D8%A7%D8%A6%D9%8A%D8%A9-%D8%A5%D8%B1%D8%B4%D8%A7%D8%AF-%D9%86%D9%81%D8%B3%D9%8A
استشارات ودعم وتطور نفسي لأجلك فقط,.Shahad Y,1,1,منذ 3 أشهر و23 يوم,أسلوب حياة,تنمية شخصية,"استشارة, تطوير, دعم, بلانر",https://khamsat.com/lifestyle/life-coaching/3650363-%D8%A7%D8%B3%D8%AA%D8%B4%D8%A7%D8%B1%D8%A7%D8%AA-%D9%88%D8%AF%D8%B9%D9%85-%D9%88%D8%AA%D8%B7%D9%88%D8%B1-%D9%86%D9%81%D8%B3%D9%8A-%D9%84%D8%A3%D8%AC%D9%84%D9%83-%D9%81%D9%82%D8%B7
اسال واستشير فى كل ما يشعرك بعدم الارتياح,أميرة ا.,1,1,منذ سنة وشهر,أسلوب حياة,تنمية شخصية,"تحليل, مقالات, دراسة, تحسين, تقييم",https://khamsat.com/lifestyle/life-coaching/3060833-%D8%A7%D8%B3%D8%A7%D9%84-%D9%88%D8%A7%D8%B3%D8%AA%D8%B4%D9%8A%D8%B1-%D9%81%D9%89-%D9%83%D9%84-%D9%85%D8%A7-%D9%8A%D8%B4%D8%B9%D8%B1%D9%83-%D8%A8%D8%B9%D8%AF%D9%85-%D8%A7%D9%84%D8%A7%D8%B1%D8%AA%D9%8A%D8%A7%D8%AD
الصفحة المطلوبة غير موجودة,Non trouvé,Non trouvé,Non trouvé,Aucun avis,Inconnu,Inconnu,Aucun tag,https://khamsat.com/lifestyle/life-coaching/1960449-%D8%A7%D8%AE%D8%AA%D8%A8%D8%A7%D8%B1-%D8%A7%D9%84%D8%A5%D9%83%D8%AA%D8%A6%D8%A7%D8%A8-%D8%A7%D9%84%D8%A7%D9%83%D9%84%D9%8A%D9%86%D9%83%D9%8Adepression-test
جلسات استشارية لتقليل حدة الأفكار المزعجة والمخاوف والقلق,.Khalil L,0,0,Aucun avis,أسلوب حياة,تنمية شخصية,"استشارة, علاج, فضفضة, نفسي, استشارات نفسية",https://khamsat.com/lifestyle/life-coaching/2968310-%D8%AC%D9%84%D8%B3%D8%A7%D8%AA-%D8%A7%D8%B3%D8%AA%D8%B4%D8%A7%D8%B1%D9%8A%D8%A9-%D9%84%D8%AA%D9%82%D9%84%D9%8A%D9%84-%D8%AD%D8%AF%D8%A9-%D8%A7%D9%84%D8%A3%D9%81%D9%83%D8%A7%D8%B1-%D8%A7%D9%84%D9%85%D8%B2%D8%B9%D8%AC%D8%A9-%D9%88%D8%A7%D9%84%D9%85%D8%AE%D8%A7%D9%88%D9%81-%D9%88%D8%A7%D9%84%D9%82%D9%84%D9%82
تحليل رسومات الأطفال من الجانب النمائي والإسقاطي,حسيبة ص.,0,0,Aucun avis,أسلوب حياة,تنمية شخصية,"رسم, تحليل, لوحة, طفل, رسوم كرتونية",https://khamsat.com/lifestyle/life-coaching/3826689-%D8%AA%D8%AD%D9%84%D9%8A%D9%84-%D8%B1%D8%B3%D9%88%D9%85%D8%A7%D8%AA-%D8%A7%D9%84%D8%A3%D8%B7%D9%81%D8%A7%D9%84-%D9%85%D9%86-%D8%A7%D9%84%D8%AC%D8%A7%D9%86%D8%A8-%D8%A7%D9%84%D9%86%D9%85%D8%A7%D8%A6%D9%8A-%D9%88%D8%A7%D9%84%D8%A5%D8%B3%D9%82%D8%A7%D8%B7%D9%8A
تحليل صور ورسومات الأطفال,.Walaa A,0,0,Aucun avis,أسلوب حياة,تنمية شخصية,"تحليل, لوحة, طفل",https://khamsat.com/lifestyle/life-coaching/2265370-%D8%AA%D8%AD%D9%84%D9%8A%D9%84-%D8%B5%D9%88%D8%B1-%D9%88%D8%B1%D8%B3%D9%88%D9%85%D8%A7%D8%AA-%D8%A7%D9%84%D8%A3%D8%B7%D9%81%D8%A7%D9%84
20 سؤال لإختبار شخصيتك ما إذا كنت إنطوائي,احمد ح.,0,0,Aucun avis,أسلوب حياة,تنمية شخصية,"نصائح, تحليل, دراسة, اختبار, شخصية, عالمي, نفسية, نفس, شخصيات, قوة, ضعف, اختلاف, معتمد, انطوائي",https://khamsat.com/lifestyle/life-coaching/1681734-20-%D8%B3%D8%A4%D8%A7%D9%84-%D9%84%D8%A5%D8%AE%D8%AA%D8%A8%D8%A7%D8%B1-%D8%B4%D8%AE%D8%B5%D9%8A%D8%AA%D9%83-%D9%85%D8%A7-%D8%A5%D8%B0%D8%A7-%D9%83%D9%86%D8%AA-%D8%A5%D9%86%D8%B7%D9%88%D8%A7%D8%A6%D9%8A
جلسة استماع سرية ودعم نفسي كتابيًا,أمال ل.,0,0,Aucun avis,أسلوب حياة,تنمية شخصية,"استشارة, دعم, ارشاد, فضفضة, استشارات نفسية",https://khamsat.com/lifestyle/life-coaching/3880864-%D8%AC%D9%84%D8%B3%D8%A9-%D8%A7%D8%B3%D8%AA%D9%85%D8%A7%D8%B9-%D8%B3%D8%B1%D9%8A%D8%A9-%D9%88%D8%AF%D8%B9%D9%85-%D9%86%D9%81%D8%B3%D9%8A-%D9%83%D8%AA%D8%A7%D8%A8%D9%8A%D8%A7
سأرسل لك كتاب قيم جدا من تأليفي يساعدك على التوقف عن التدخين,.Haitham E,0,0,Aucun avis,أسلوب حياة,تنمية شخصية,"التوقف عن التدخين, الإقلاع عن التدخين",https://khamsat.com/lifestyle/life-coaching/928850-%D8%B3%D8%A3%D8%B1%D8%B3%D9%84-%D9%84%D9%83-%D9%83%D8%AA%D8%A7%D8%A8-%D9%82%D9%8A%D9%85-%D8%AC%D8%AF%D8%A7-%D9%85%D9%86-%D8%AA%D8%A3%D9%84%D9%8A%D9%81%D9%8A-%D9%8A%D8%B3%D8%A7%D8%B9%D8%AF%D9%83-%D8%B9%D9%84%D9%89-%D8%A7%D9%84%D8%AA%D9%88%D9%82%D9%81-%D8%B9%D9%86-%D8%A7%D9%84%D8%AA%D8%AF%D8%AE%D9%8A%D9%86
