Titre,Vendeur,Acheteurs,Notes,Date Dernier Avis,Catégorie,Sous-Catégorie,Mots Clés,Lien
مونتاج فيديو احترافي كامل يوتيوب أو ريلز انستجرام و فيسبوك,.Yassien W,0,0,Aucun avis,فيديو وأنيميشن,فيديوهات سوشيال وإعلانات,"مونتاج, مونتاج فيديو, مونتاج احترافي, سوشل ميديا, ريلز",https://khamsat.com/video-design/video-editing/3410022-%D9%85%D9%88%D9%86%D8%AA%D8%A7%D8%AC-%D9%81%D9%8A%D8%AF%D9%8A%D9%88-%D8%A7%D8%AD%D8%AA%D8%B1%D8%A7%D9%81%D9%8A-%D9%83%D8%A7%D9%85%D9%84-%D9%8A%D9%88%D8%AA%D9%8A%D9%88%D8%A8-%D8%A3%D9%88-%D8%B1%D9%8A%D9%84%D8%B2-%D8%A7%D9%86%D8%B3%D8%AA%D8%AC%D8%B1%D8%A7%D9%85-%D9%88-%D9%81%D9%8A%D8%B3%D8%A8%D9%88%D9%83
مونتاج فيديو ريلز احترافي,.Amr K,0,0,Aucun avis,فيديو وأنيميشن,فيديوهات سوشيال وإعلانات,"فيديو, مونتاج, مونتير, مونتاج احترافي, ريلز",https://khamsat.com/video-design/video-editing/3706339-%D9%85%D9%88%D9%86%D8%AA%D8%A7%D8%AC-%D9%81%D9%8A%D8%AF%D9%8A%D9%88-%D8%B1%D9%8A%D9%84%D8%B2-%D8%A7%D8%AD%D8%AA%D8%B1%D8%A7%D9%81%D9%8A
مونتاج ريلز فايرال احترافي,.Mohamed S,1,1,منذ 12 يوم و16 ساعة,فيديو وأنيميشن,فيديوهات سوشيال وإعلانات,"مونتاج فيديو, تحرير فيديو, video editing, مونتاج احترافي, ريلز",https://khamsat.com/video-design/video-editing/3908203-%D9%85%D9%88%D9%86%D8%AA%D8%A7%D8%AC-%D8%B1%D9%8A%D9%84%D8%B2-%D9%81%D8%A7%D9%8A%D8%B1%D8%A7%D9%84-%D8%A7%D8%AD%D8%AA%D8%B1%D8%A7%D9%81%D9%8A
عمل مونتاج لجميع انواع الفيدهات بطريقة احترافية,مريم ح.,4,3,منذ 3 أشهر ويوم,فيديو وأنيميشن,تحرير الفيديو,"youtube, مونتاج, جرافيك, تصميم فيديو, فيديوهات",https://khamsat.com/video-design/video-editing/2760090-%D8%B9%D9%85%D9%84-%D9%85%D9%88%D9%86%D8%AA%D8%A7%D8%AC-%D9%84%D8%AC%D9%85%D9%8A%D8%B9-%D8%A7%D9%86%D9%88%D8%A7%D8%B9-%D8%A7%D9%84%D9%81%D9%8A%D8%AF%D9%87%D8%A7%D8%AA-%D8%A8%D8%B7%D8%B1%D9%8A%D9%82%D8%A9-%D8%A7%D8%AD%D8%AA%D8%B1%D8%A7%D9%81%D9%8A%D8%A9
عمل تحرير ومونتاج فيديوهات احترافي,بلال ب.,52,48,منذ 9 أشهر و16 يوم,فيديو وأنيميشن,تحرير الفيديو,"إعلان, مونتاج, مونتاج فيديو, مونتاج احترافي, مونتاج يوتيوب",https://khamsat.com/video-design/video-editing/2148802-%D8%B9%D9%85%D9%84-%D8%AA%D8%AD%D8%B1%D9%8A%D8%B1-%D9%88%D9%85%D9%88%D9%86%D8%AA%D8%A7%D8%AC-%D9%81%D9%8A%D8%AF%D9%8A%D9%88%D9%87%D8%A7%D8%AA-%D8%A7%D8%AD%D8%AA%D8%B1%D8%A7%D9%81%D9%8A
مونتاج احترافي للقطات الدرون او عقارك او شركتك,.Jafar A,0,0,Aucun avis,فيديو وأنيميشن,تحرير الفيديو,"مونتاج فيديو, فيديوهات, عقارات, مونتاج عقارات, مونتاج درون",https://khamsat.com/video-design/video-editing/2862300-%D9%85%D9%88%D9%86%D8%AA%D8%A7%D8%AC-%D8%A7%D8%AD%D8%AA%D8%B1%D8%A7%D9%81%D9%8A-%D9%84%D9%84%D9%82%D8%B7%D8%A7%D8%AA-%D8%A7%D9%84%D8%AF%D8%B1%D9%88%D9%86-%D8%A7%D9%88-%D8%B9%D9%82%D8%A7%D8%B1%D9%83-%D8%A7%D9%88-%D8%B4%D8%B1%D9%83%D8%AA%D9%83
مونتاچ فيديوهات إحترافي بأكثر من شكل وفكرة,محمد ع.,0,1,منذ سنة و3 أشهر,فيديو وأنيميشن,تحرير الفيديو,"مونتاج فيديو, افتر افكت, برمير, مونتاج احترافي, ريلز",https://khamsat.com/video-design/video-editing/2941271-%D9%85%D9%88%D9%86%D8%AA%D8%A7-%D9%81%D9%8A%D8%AF%D9%8A%D9%88%D9%87%D8%A7%D8%AA-%D8%A5%D8%AD%D8%AA%D8%B1%D8%A7%D9%81%D9%8A-%D8%A8%D8%A3%D9%83%D8%AB%D8%B1-%D9%85%D9%86-%D8%B4%D9%83%D9%84-%D9%88%D9%81%D9%83%D8%B1%D8%A9
تحرير ومنتاج فيديو يبرز رسالتك بافضل صورة ممكنة,.Abdulrhmn R,0,0,Aucun avis,فيديو وأنيميشن,تحرير الفيديو,"مونتاج فيديو, مونتير, مونتاج الفيديو, مونتاج احترافي, مونتاج يوتيوب",https://khamsat.com/video-design/video-editing/3599796-%D8%AA%D8%AD%D8%B1%D9%8A%D8%B1-%D9%88%D9%85%D9%86%D8%AA%D8%A7%D8%AC-%D9%81%D9%8A%D8%AF%D9%8A%D9%88-%D9%8A%D8%A8%D8%B1%D8%B2-%D8%B1%D8%B3%D8%A7%D9%84%D8%AA%D9%83-%D8%A8%D8%A7%D9%81%D8%B6%D9%84-%D8%B5%D9%88%D8%B1%D8%A9-%D9%85%D9%85%D9%83%D9%86%D8%A9
مونتاج الفيديوهات وتعديل الصوت,.Nada M,3,3,منذ 6 سنوات وشهرين,فيديو وأنيميشن,تحرير الفيديو,"تصميم, فيديو, لوجو, فيسبوك, يوتيوب, عرض, جرافيك, انترو, ميديا, انيميشن, تحريك, انستجرام, موشن, سوشيا",https://khamsat.com/video-design/video-editing/1151493-%D9%85%D9%88%D9%86%D8%AA%D8%A7%D8%AC-%D8%A7%D9%84%D9%81%D9%8A%D8%AF%D9%8A%D9%88%D9%87%D8%A7%D8%AA-%D9%88%D8%AA%D8%B9%D8%AF%D9%8A%D9%84-%D8%A7%D9%84%D8%B5%D9%88%D8%AA
مونتاج فيديو ترويجي لمنتج,.Mohamed M,9,5,منذ 4 سنوات و9 أشهر,فيديو وأنيميشن,تحرير الفيديو,"تصميم, اعلان, فيديو, عمل, مونتاج",https://khamsat.com/video-design/video-editing/1172929-%D9%85%D9%88%D9%86%D8%AA%D8%A7%D8%AC-%D9%81%D9%8A%D8%AF%D9%8A%D9%88-%D8%AA%D8%B1%D9%88%D9%8A%D8%AC%D9%8A-%D9%84%D9%85%D9%86%D8%AA%D8%AC
مونتاج تلاوات قرآنية مع كتابة الآيات,مبارك ص.,0,0,Aucun avis,فيديو وأنيميشن,إنتاج الفيديو,"تصميم, قرآن, مونتاج, القرآن, القران",https://khamsat.com/video-design/video-editing/3077993-%D9%85%D9%88%D9%86%D8%AA%D8%A7%D8%AC-%D8%AA%D9%84%D8%A7%D9%88%D8%A7%D8%AA-%D9%82%D8%B1%D8%A2%D9%86%D9%8A%D8%A9-%D9%85%D8%B9-%D9%83%D8%AA%D8%A7%D8%A8%D8%A9-%D8%A7%D9%84%D8%A2%D9%8A%D8%A7%D8%AA
مونتاج وتصميم فديو احترافي بجودة عالية,احمد ش.,5,5,منذ 5 أشهر و7 أيام,فيديو وأنيميشن,تحرير الفيديو,"تصميم احترافي, مونتاج, جرافيك, editing, مونتاج فيديوهات",https://khamsat.com/video-design/video-editing/3007630-%D9%85%D9%88%D9%86%D8%AA%D8%A7%D8%AC-%D9%88%D8%AA%D8%B5%D9%85%D9%8A%D9%85-%D9%81%D8%AF%D9%8A%D9%88-%D8%A7%D8%AD%D8%AA%D8%B1%D8%A7%D9%81%D9%8A-%D8%A8%D8%AC%D9%88%D8%AF%D8%A9-%D8%B9%D8%A7%D9%84%D9%8A%D8%A9
مونتاج احترافي للريلز بخبره 5 سنوات,.Abo S,0,0,Aucun avis,فيديو وأنيميشن,فيديوهات سوشيال وإعلانات,"مونتاج, مقاطع, مونتاج فيديوهات, مونتاج احترافي, ريلز",https://khamsat.com/video-design/video-editing/3117903-%D9%85%D9%88%D9%86%D8%AA%D8%A7%D8%AC-%D8%A7%D8%AD%D8%AA%D8%B1%D8%A7%D9%81%D9%8A-%D9%84%D9%84%D8%B1%D9%8A%D9%84%D8%B2-%D8%A8%D8%AE%D8%A8%D8%B1%D9%87-5-%D8%B3%D9%86%D9%88%D8%A7%D8%AA
مونتاج فيديوهات المطاعم و السيارات بستايل Speed Ramp,.Abo S,0,0,Aucun avis,فيديو وأنيميشن,تحرير الفيديو,"اعلان, مطاعم, تصميم فيديو, مونتاج احترافي, speed ramp",https://khamsat.com/video-design/video-editing/3616335-%D9%85%D9%88%D9%86%D8%AA%D8%A7%D8%AC-%D9%81%D9%8A%D8%AF%D9%8A%D9%88%D9%87%D8%A7%D8%AA-%D8%A7%D9%84%D9%85%D8%B7%D8%A7%D8%B9%D9%85-%D9%88-%D8%A7%D9%84%D8%B3%D9%8A%D8%A7%D8%B1%D8%A7%D8%AA-%D8%A8%D8%B3%D8%AA%D8%A7%D9%8A%D9%84-speed-ramp
مونتاج فيديوهاتك باحترافة و جودة-Video editing,.Ezzeldin K,0,0,Aucun avis,فيديو وأنيميشن,تحرير الفيديو,"مونتاج فيديو, مونتير, video editing, ريلز, reels",https://khamsat.com/video-design/video-editing/3674499-%D9%85%D9%88%D9%86%D8%AA%D8%A7%D8%AC-%D9%81%D9%8A%D8%AF%D9%8A%D9%88%D9%87%D8%A7%D8%AA%D9%83-%D8%A8%D8%A7%D8%AD%D8%AA%D8%B1%D8%A7%D9%81%D8%A9-%D9%88-%D8%AC%D9%88%D8%AF%D8%A9-video-editing
مونتاج فيديو احترافي بتسليم سريع,المعتز بالله و.,0,0,Aucun avis,فيديو وأنيميشن,تحرير الفيديو,"مونتاج, video editing, مونتاج احترافي, video editor, مونتاج يوتيوب",https://khamsat.com/video-design/video-editing/3710922-%D9%85%D9%88%D9%86%D8%AA%D8%A7%D8%AC-%D9%81%D9%8A%D8%AF%D9%8A%D9%88-%D8%A7%D8%AD%D8%AA%D8%B1%D8%A7%D9%81%D9%8A-%D8%A8%D8%AA%D8%B3%D9%84%D9%8A%D9%85-%D8%B3%D8%B1%D9%8A%D8%B9
تصميم فيديوهات كرة قدم من طلبك باحترافية و بجودة عالية,.Aymen A,17,11,منذ 4 سنوات و4 أشهر,فيديو وأنيميشن,تحرير الفيديو,"تصميم, يوتيوب, مونتاج, طلبك, تيكتوك",https://khamsat.com/video-design/video-editing/790977-%D8%AA%D8%B5%D9%85%D9%8A%D9%85-%D9%81%D9%8A%D8%AF%D9%8A%D9%88%D9%87%D8%A7%D8%AA-%D9%83%D8%B1%D8%A9-%D9%82%D8%AF%D9%85-%D9%85%D9%86-%D8%B7%D9%84%D8%A8%D9%83-%D8%A8%D8%A7%D8%AD%D8%AA%D8%B1%D8%A7%D9%81%D9%8A%D8%A9-%D9%88-%D8%A8%D8%AC%D9%88%D8%AF%D8%A9-%D8%B9%D8%A7%D9%84%D9%8A%D8%A9
تصميم فيديوهات كرة قدم من طلبك باحترافية و بجودة عالية,.Aymen A,17,11,منذ 4 سنوات و4 أشهر,فيديو وأنيميشن,تحرير الفيديو,"تصميم, يوتيوب, مونتاج, طلبك, تيكتوك",https://khamsat.com/video-design/video-editing/790977-%D8%AA%D8%B5%D9%85%D9%8A%D9%85-%D9%81%D9%8A%D8%AF%D9%8A%D9%88%D9%87%D8%A7%D8%AA-%D9%83%D8%B1%D8%A9-%D9%82%D8%AF%D9%85-%D9%85%D9%86-%D8%B7%D9%84%D8%A8%D9%83-%D8%A8%D8%A7%D8%AD%D8%AA%D8%B1%D8%A7%D9%81%D9%8A%D8%A9-%D9%88-%D8%A8%D8%AC%D9%88%D8%AF%D8%A9-%D8%B9%D8%A7%D9%84%D9%8A%D8%A9
مونتاج فيديو احترافي باستخدام أقوى البرامج و المؤثرات,.Yahia A,0,0,Aucun avis,فيديو وأنيميشن,تحرير الفيديو,"فيديو, يوتيوب, مونتاج, مونتاج فيديو",https://khamsat.com/video-design/video-editing/2666083-%D9%85%D9%88%D9%86%D8%AA%D8%A7%D8%AC-%D9%81%D9%8A%D8%AF%D9%8A%D9%88-%D8%A7%D8%AD%D8%AA%D8%B1%D8%A7%D9%81%D9%8A-%D8%A8%D8%A7%D8%B3%D8%AA%D8%AE%D8%AF%D8%A7%D9%85-%D8%A3%D9%82%D9%88%D9%89-%D8%A7%D9%84%D8%A8%D8%B1%D8%A7%D9%85%D8%AC-%D9%88-%D8%A7%D9%84%D9%85%D8%A4%D8%AB%D8%B1%D8%A7%D8%AA
مونتاج احترافي لآيات القرآن الكريم وفيديوهات هادفة,.Ahmed L,0,0,Aucun avis,فيديو وأنيميشن,إنتاج الفيديو,"تصميم, قران, مونتاج فيديو, المونتاج, مونتاج احترافي",https://khamsat.com/video-design/video-editing/3765208-%D9%85%D9%88%D9%86%D8%AA%D8%A7%D8%AC-%D8%A7%D8%AD%D8%AA%D8%B1%D8%A7%D9%81%D9%8A-%D9%84%D8%A2%D9%8A%D8%A7%D8%AA-%D8%A7%D9%84%D9%82%D8%B1%D8%A2%D9%86-%D8%A7%D9%84%D9%83%D8%B1%D9%8A%D9%85-%D9%88%D9%81%D9%8A%D8%AF%D9%8A%D9%88%D9%87%D8%A7%D8%AA-%D9%87%D8%A7%D8%AF%D9%81%D8%A9
مونتاج فيديوهات وريلزات احترافية,محمد ا.,3,3,منذ 17 يوم و11 ساعة,فيديو وأنيميشن,تحرير الفيديو,"تصميم, فيديو, 3d, مونتاج فيديو, بودكاست",https://khamsat.com/video-design/video-editing/3544205-%D9%85%D9%88%D9%86%D8%AA%D8%A7%D8%AC-%D9%81%D9%8A%D8%AF%D9%8A%D9%88%D9%87%D8%A7%D8%AA-%D9%88%D8%B1%D9%8A%D9%84%D8%B2%D8%A7%D8%AA-%D8%A7%D8%AD%D8%AA%D8%B1%D8%A7%D9%81%D9%8A%D8%A9
تصميم فيديو كليب احترافى لليوتيوب,.Ahmed M,0,0,Aucun avis,فيديو وأنيميشن,فيديوهات سوشيال وإعلانات,"تصميم, فيديو, كليب",https://khamsat.com/video-design/video-editing/2297851-%D8%AA%D8%B5%D9%85%D9%8A%D9%85-%D9%81%D9%8A%D8%AF%D9%8A%D9%88-%D9%83%D9%84%D9%8A%D8%A8-%D8%A7%D8%AD%D8%AA%D8%B1%D8%A7%D9%81%D9%89-%D9%84%D9%84%D9%8A%D9%88%D8%AA%D9%8A%D9%88%D8%A8
مونتاج سينمائي احترافي 5$ مقابل 5 دقائق,عبدالعزيز ا.,0,0,Aucun avis,فيديو وأنيميشن,تحرير الفيديو,"فيديو, مونتاج, احترافي, موشن, سينمائي",https://khamsat.com/video-design/video-editing/1655556-%D9%85%D9%88%D9%86%D8%AA%D8%A7%D8%AC-%D8%B3%D9%8A%D9%86%D9%85%D8%A7%D8%A6%D9%8A-%D8%A7%D8%AD%D8%AA%D8%B1%D8%A7%D9%81%D9%8A-5-%D9%85%D9%82%D8%A7%D8%A8%D9%84-5-%D8%AF%D9%82%D8%A7%D8%A6%D9%82
سأقوم بتصميم وتحرير الفيديو الخاص بك بإبداع واحترافية,هيثم م.,0,0,Aucun avis,فيديو وأنيميشن,تحرير الفيديو,"فيديو اعلاني, مونتاج فيديو, تصميم فيديو, فيديو يوتيوب, فيديو موشن جرافيك",https://khamsat.com/video-design/video-editing/3411988-%D8%B3%D8%A3%D9%82%D9%88%D9%85-%D8%A8%D8%AA%D8%B5%D9%85%D9%8A%D9%85-%D9%88%D8%AA%D8%AD%D8%B1%D9%8A%D8%B1-%D8%A7%D9%84%D9%81%D9%8A%D8%AF%D9%8A%D9%88-%D8%A7%D9%84%D8%AE%D8%A7%D8%B5-%D8%A8%D9%83-%D8%A8%D8%A5%D8%A8%D8%AF%D8%A7%D8%B9-%D9%88%D8%A7%D8%AD%D8%AA%D8%B1%D8%A7%D9%81%D9%8A%D8%A9
مونتاج الفيديو علي برنامج ادوبي بريميير  Adobe Premiere,.Ibrahim I,9,7,منذ 7 أشهر و13 يوم,فيديو وأنيميشن,تحرير الفيديو,"مونتاج, مونتير, تحرير فيديو, تعديل الفيديو, مونتاج احترافي",https://khamsat.com/video-design/video-editing/2901297-%D9%85%D9%88%D9%86%D8%AA%D8%A7%D8%AC-%D8%A7%D9%84%D9%81%D9%8A%D8%AF%D9%8A%D9%88-%D8%B9%D9%84%D9%8A-%D8%A8%D8%B1%D9%86%D8%A7%D9%85%D8%AC-%D8%A7%D8%AF%D9%88%D8%A8%D9%8A-%D8%A8%D8%B1%D9%8A%D9%85%D9%8A%D9%8A%D8%B1-adobe-premiere
ازالة الكروما أو الخلفية الخضراء من الفيديو باحترافية,.Ahmed D,0,0,Aucun avis,فيديو وأنيميشن,تحرير الفيديو,"كروما, تحرير فيديو, ازالة الخلفية, تغيير الخلفية, remove background",https://khamsat.com/video-design/video-editing/3096379-%D8%A7%D8%B2%D8%A7%D9%84%D8%A9-%D8%A7%D9%84%D9%83%D8%B1%D9%88%D9%85%D8%A7-%D8%A3%D9%88-%D8%A7%D9%84%D8%AE%D9%84%D9%81%D9%8A%D8%A9-%D8%A7%D9%84%D8%AE%D8%B6%D8%B1%D8%A7%D8%A1-%D9%85%D9%86-%D8%A7%D9%84%D9%81%D9%8A%D8%AF%D9%8A%D9%88-%D8%A8%D8%A7%D8%AD%D8%AA%D8%B1%D8%A7%D9%81%D9%8A%D8%A9
مونتاج فيديو Adobe Premiere Pro و After Effects و DaVinci,.Moamen F,0,0,Aucun avis,فيديو وأنيميشن,تحرير الفيديو,"مونتاج فيديو, مونتير, after effect, premiere, video editor",https://khamsat.com/video-design/video-editing/3017509-%D9%85%D9%88%D9%86%D8%AA%D8%A7%D8%AC-%D9%81%D9%8A%D8%AF%D9%8A%D9%88-adobe-premiere-pro-%D9%88-after-effects-%D9%88-davinci
تحرير الفيديوهات ومونتاج بطريقة احترافية لليوتيوب,.Ahmed D,0,0,Aucun avis,فيديو وأنيميشن,فيديوهات سوشيال وإعلانات,"يوتيوب, مونتاج, مونتاج فيديو, تحرير فيديو, video editing",https://khamsat.com/video-design/video-editing/3096341-%D8%AA%D8%AD%D8%B1%D9%8A%D8%B1-%D8%A7%D9%84%D9%81%D9%8A%D8%AF%D9%8A%D9%88%D9%87%D8%A7%D8%AA-%D9%88%D9%85%D9%88%D9%86%D8%AA%D8%A7%D8%AC-%D8%A8%D8%B7%D8%B1%D9%8A%D9%82%D8%A9-%D8%A7%D8%AD%D8%AA%D8%B1%D8%A7%D9%81%D9%8A%D8%A9-%D9%84%D9%84%D9%8A%D9%88%D8%AA%D9%8A%D9%88%D8%A8
مونتاج فيديو بطريقة احترافية,.Ahmad A,0,0,Aucun avis,فيديو وأنيميشن,تحرير الفيديو,"مونتاج, مونتاج فيديو, مونتاج احترافي, ريلز, مونتاج يوتيوب",https://khamsat.com/video-design/video-editing/3288682-%D9%85%D9%88%D9%86%D8%AA%D8%A7%D8%AC-%D9%81%D9%8A%D8%AF%D9%8A%D9%88-%D8%A8%D8%B7%D8%B1%D9%8A%D9%82%D8%A9-%D8%A7%D8%AD%D8%AA%D8%B1%D8%A7%D9%81%D9%8A%D8%A9
مونتاج احترافى لجميع أنواع الفيديوهات,.Baher A,0,0,Aucun avis,فيديو وأنيميشن,تحرير الفيديو,"فيديو, يوتيوب, مونتاج, editing, ريلز",https://khamsat.com/video-design/video-editing/3498501-%D9%85%D9%88%D9%86%D8%AA%D8%A7%D8%AC-%D8%A7%D8%AD%D8%AA%D8%B1%D8%A7%D9%81%D9%89-%D9%84%D8%AC%D9%85%D9%8A%D8%B9-%D8%A3%D9%86%D9%88%D8%A7%D8%B9-%D8%A7%D9%84%D9%81%D9%8A%D8%AF%D9%8A%D9%88%D9%87%D8%A7%D8%AA
مونتاج فيديو احترافي باستخدام Premiere Pro بجودة عالية,فهد ف.,0,0,Aucun avis,فيديو وأنيميشن,تحرير الفيديو,"تصميم, مونتاج فيديو, premiere, مونتاج احترافي, مونتاج يوتيوب",https://khamsat.com/video-design/video-editing/3134798-%D9%85%D9%88%D9%86%D8%AA%D8%A7%D8%AC-%D9%81%D9%8A%D8%AF%D9%8A%D9%88-%D8%A7%D8%AD%D8%AA%D8%B1%D8%A7%D9%81%D9%8A-%D8%A8%D8%A7%D8%B3%D8%AA%D8%AE%D8%AF%D8%A7%D9%85-premiere-pro-%D8%A8%D8%AC%D9%88%D8%AF%D8%A9-%D8%B9%D8%A7%D9%84%D9%8A%D8%A9
مونتاج احترافي لكل انواع محتواك,سيف الأزل م.,0,0,Aucun avis,فيديو وأنيميشن,تحرير الفيديو,"فيديو, اعلانات, مونتاج, انيميشن, سوشل ميديا",https://khamsat.com/video-design/video-editing/3617545-%D9%85%D9%88%D9%86%D8%AA%D8%A7%D8%AC-%D8%A7%D8%AD%D8%AA%D8%B1%D8%A7%D9%81%D9%8A-%D9%84%D9%83%D9%84-%D8%A7%D9%86%D9%88%D8%A7%D8%B9-%D9%85%D8%AD%D8%AA%D9%88%D8%A7%D9%83
تصميم مؤثرات VFX للفيديو الخاص بك,.Maged H,0,0,Aucun avis,فيديو وأنيميشن,تحرير الفيديو,"تصميم, مونتاج فيديو, vfx, after effect",https://khamsat.com/video-design/video-editing/3755856-%D8%AA%D8%B5%D9%85%D9%8A%D9%85-%D9%85%D8%A4%D8%AB%D8%B1%D8%A7%D8%AA-vfx-%D9%84%D9%84%D9%81%D9%8A%D8%AF%D9%8A%D9%88-%D8%A7%D9%84%D8%AE%D8%A7%D8%B5-%D8%A8%D9%83
مونتاج فيديوهات و ريلز بجودة عالية,محمد ع.,0,0,Aucun avis,فيديو وأنيميشن,فيديوهات سوشيال وإعلانات,"مونتاج, مونتاج فيديو, مونتاج احترافي, ريلز, reels",https://khamsat.com/video-design/video-editing/3614691-%D9%85%D9%88%D9%86%D8%AA%D8%A7%D8%AC-%D9%81%D9%8A%D8%AF%D9%8A%D9%88%D9%87%D8%A7%D8%AA-%D9%88-%D8%B1%D9%8A%D9%84%D8%B2-%D8%A8%D8%AC%D9%88%D8%AF%D8%A9-%D8%B9%D8%A7%D9%84%D9%8A%D8%A9
مونتاج احترافي لأي فيديو بأحدث ستايلات مع إضافة موشن جرافيك,محمد م.,0,0,Aucun avis,فيديو وأنيميشن,تحرير الفيديو,"فيديو, مونتاج, مونتاج فيديو, video editor, reels",https://khamsat.com/video-design/video-editing/3756549-%D9%85%D9%88%D9%86%D8%AA%D8%A7%D8%AC-%D8%A7%D8%AD%D8%AA%D8%B1%D8%A7%D9%81%D9%8A-%D9%84%D8%A3%D9%8A-%D9%81%D9%8A%D8%AF%D9%8A%D9%88-%D8%A8%D8%A3%D8%AD%D8%AF%D8%AB-%D8%B3%D8%AA%D8%A7%D9%8A%D9%84%D8%A7%D8%AA-%D9%85%D8%B9-%D8%A5%D8%B6%D8%A7%D9%81%D8%A9-%D9%85%D9%88%D8%B4%D9%86-%D8%AC%D8%B1%D8%A7%D9%81%D9%8A%D9%83
مونتاج الفيديو باحترافية وجودة عالية,محمود م.,0,0,Aucun avis,فيديو وأنيميشن,تحرير الفيديو,"تصميم, مقاطع, مونتاج فيديو, فيديو يوتيوب, تعديل الفيديو",https://khamsat.com/video-design/video-editing/2657726-%D9%85%D9%88%D9%86%D8%AA%D8%A7%D8%AC-%D8%A7%D9%84%D9%81%D9%8A%D8%AF%D9%8A%D9%88-%D8%A8%D8%A7%D8%AD%D8%AA%D8%B1%D8%A7%D9%81%D9%8A%D8%A9-%D9%88%D8%AC%D9%88%D8%AF%D8%A9-%D8%B9%D8%A7%D9%84%D9%8A%D8%A9
مونتاج احترافي للفيديوهات,.Bavly A,0,0,Aucun avis,فيديو وأنيميشن,تحرير الفيديو,"مونتاج, انستجرام, مونتاج احترافي, ريلز, تيك توك",https://khamsat.com/video-design/video-editing/3590995-%D9%85%D9%88%D9%86%D8%AA%D8%A7%D8%AC-%D8%A7%D8%AD%D8%AA%D8%B1%D8%A7%D9%81%D9%8A-%D9%84%D9%84%D9%81%D9%8A%D8%AF%D9%8A%D9%88%D9%87%D8%A7%D8%AA
مونتاج الفيديوهات بشكل احترافي,.Abedo M,0,0,Aucun avis,فيديو وأنيميشن,تحرير الفيديو,"يوتيوب, مونتاج فيديو, مونتاج احترافي, مونتاج تيك توك",https://khamsat.com/video-design/video-editing/3127533-%D9%85%D9%88%D9%86%D8%AA%D8%A7%D8%AC-%D8%A7%D9%84%D9%81%D9%8A%D8%AF%D9%8A%D9%88%D9%87%D8%A7%D8%AA-%D8%A8%D8%B4%D9%83%D9%84-%D8%A7%D8%AD%D8%AA%D8%B1%D8%A7%D9%81%D9%8A
تصميم فيديو ترويجي 15 ثانية لتطبيقك مع تعليق صوتي,.Sabah A,0,1,منذ 3 سنوات وشهر,فيديو وأنيميشن,فيديوهات سوشيال وإعلانات,"تصميم, لغة, فيديو, صوت, تعليق, ترويجي, فصحى",https://khamsat.com/video-design/video-editing/2303315-%D8%AA%D8%B5%D9%85%D9%8A%D9%85-%D9%81%D9%8A%D8%AF%D9%8A%D9%88-%D8%AA%D8%B1%D9%88%D9%8A%D8%AC%D9%8A-15-%D8%AB%D8%A7%D9%86%D9%8A%D8%A9-%D9%84%D8%AA%D8%B7%D8%A8%D9%8A%D9%82%D9%83-%D9%85%D8%B9-%D8%AA%D8%B9%D9%84%D9%8A%D9%82-%D8%B5%D9%88%D8%AA%D9%8A
أمنتج لك فيديوهات يوتيوب او إعلانات او ريلز بإحترافية,محمد ا.,0,0,Aucun avis,فيديو وأنيميشن,فيديوهات سوشيال وإعلانات,"فيديو اعلاني, مونتاج فيديو, تصميم فيديو, مونتاج احترافي, ريلز",https://khamsat.com/video-design/video-editing/3575884-%D8%A3%D9%85%D9%86%D8%AA%D8%AC-%D9%84%D9%83-%D9%81%D9%8A%D8%AF%D9%8A%D9%88%D9%87%D8%A7%D8%AA-%D9%8A%D9%88%D8%AA%D9%8A%D9%88%D8%A8-%D8%A7%D9%88-%D8%A5%D8%B9%D9%84%D8%A7%D9%86%D8%A7%D8%AA-%D8%A7%D9%88-%D8%B1%D9%8A%D9%84%D8%B2-%D8%A8%D8%A5%D8%AD%D8%AA%D8%B1%D8%A7%D9%81%D9%8A%D8%A9
خدمه مونتاج احترافي لجميع انواع الفيديوهات,.Mohamed R,0,0,Aucun avis,فيديو وأنيميشن,تحرير الفيديو,"فيديو, مونتاج, مونتاج فيديو, مونتير, مونتاج احترافي",https://khamsat.com/video-design/video-editing/3335769-%D8%AE%D8%AF%D9%85%D9%87-%D9%85%D9%88%D9%86%D8%AA%D8%A7%D8%AC-%D8%A7%D8%AD%D8%AA%D8%B1%D8%A7%D9%81%D9%8A-%D9%84%D8%AC%D9%85%D9%8A%D8%B9-%D8%A7%D9%86%D9%88%D8%A7%D8%B9-%D8%A7%D9%84%D9%81%D9%8A%D8%AF%D9%8A%D9%88%D9%87%D8%A7%D8%AA
مونتاج فيديو وتصميم فيديو,.Zeinebou B,0,0,Aucun avis,فيديو وأنيميشن,تحرير الفيديو,"فيديو, مونتاج فيديو, مونتاج يوتيوب",https://khamsat.com/video-design/video-editing/3003056-%D9%85%D9%88%D9%86%D8%AA%D8%A7%D8%AC-%D9%81%D9%8A%D8%AF%D9%8A%D9%88-%D9%88%D8%AA%D8%B5%D9%85%D9%8A%D9%85-%D9%81%D9%8A%D8%AF%D9%8A%D9%88
مونتاج بسيط ومنظم لفيديوهات الجيمينج بشكل احترافي,.Ahmed W,0,0,Aucun avis,فيديو وأنيميشن,تحرير الفيديو,"مونتاج, مونتاج فيديو, للفيديو, مونتاج احترافي, مونتاج يوتيوب",https://khamsat.com/video-design/video-editing/3674444-%D9%85%D9%88%D9%86%D8%AA%D8%A7%D8%AC-%D8%A8%D8%B3%D9%8A%D8%B7-%D9%88%D9%85%D9%86%D8%B8%D9%85-%D9%84%D9%81%D9%8A%D8%AF%D9%8A%D9%88%D9%87%D8%A7%D8%AA-%D8%A7%D9%84%D8%AC%D9%8A%D9%85%D9%8A%D9%86%D8%AC-%D8%A8%D8%B4%D9%83%D9%84-%D8%A7%D8%AD%D8%AA%D8%B1%D8%A7%D9%81%D9%8A
مونتاج للفديوهات الدعائية,.Eyad K,0,0,Aucun avis,فيديو وأنيميشن,فيديوهات سوشيال وإعلانات,"مونتاج, مونتاج فيديو, فيديوهات, editing, تحرير فيديو",https://khamsat.com/video-design/video-editing/3685181-%D9%85%D9%88%D9%86%D8%AA%D8%A7%D8%AC-%D9%84%D9%84%D9%81%D8%AF%D9%8A%D9%88%D9%87%D8%A7%D8%AA-%D8%A7%D9%84%D8%AF%D8%B9%D8%A7%D8%A6%D9%8A%D8%A9
مونتاج ريلز احترافي لفيديوهاتك تريند,.Ahmed A,0,0,Aucun avis,فيديو وأنيميشن,فيديوهات سوشيال وإعلانات,"فيديو, مونتاج فيديو, مونتاج فيديوهات, مونتاج احترافي, ريلز",https://khamsat.com/video-design/video-editing/3454014-%D9%85%D9%88%D9%86%D8%AA%D8%A7%D8%AC-%D8%B1%D9%8A%D9%84%D8%B2-%D8%A7%D8%AD%D8%AA%D8%B1%D8%A7%D9%81%D9%8A-%D9%84%D9%81%D9%8A%D8%AF%D9%8A%D9%88%D9%87%D8%A7%D8%AA%D9%83-%D8%AA%D8%B1%D9%8A%D9%86%D8%AF
مونتاج الفديوهات بشكل مماشي مع التريند الحالي بشكل احترافي,.Eyad K,0,0,Aucun avis,فيديو وأنيميشن,تحرير الفيديو,"مونتاج, الفيديو, فيديو اعلاني, تصميم فيديو, ريلز",https://khamsat.com/video-design/video-editing/3685159-%D9%85%D9%88%D9%86%D8%AA%D8%A7%D8%AC-%D8%A7%D9%84%D9%81%D8%AF%D9%8A%D9%88%D9%87%D8%A7%D8%AA-%D8%A8%D8%B4%D9%83%D9%84-%D9%85%D9%85%D8%A7%D8%B4%D9%8A-%D9%85%D8%B9-%D8%A7%D9%84%D8%AA%D8%B1%D9%8A%D9%86%D8%AF-%D8%A7%D9%84%D8%AD%D8%A7%D9%84%D9%8A-%D8%A8%D8%B4%D9%83%D9%84-%D8%A7%D8%AD%D8%AA%D8%B1%D8%A7%D9%81%D9%8A
سأقدم لك مونتاج فيديو مذهل,عبد الرحيم ا.,16,14,منذ سنة و8 أشهر,فيديو وأنيميشن,تحرير الفيديو,"تصميم, فيديو, تحرير, مونتاج",https://khamsat.com/video-design/video-editing/1378324-%D8%B3%D8%A3%D9%82%D8%AF%D9%85-%D9%84%D9%83-%D9%85%D9%88%D9%86%D8%AA%D8%A7%D8%AC-%D9%81%D9%8A%D8%AF%D9%8A%D9%88-%D9%85%D8%B0%D9%87%D9%84
مونتاج  الفيديو باحترافية,.Haytham M,45,39,منذ 7 أشهر ويوم,فيديو وأنيميشن,تحرير الفيديو,"فيديو, تحرير, يوتيوب, مونتاج, تعديل",https://khamsat.com/video-design/video-editing/1740607-%D9%85%D9%88%D9%86%D8%AA%D8%A7%D8%AC-%D8%A7%D9%84%D9%81%D9%8A%D8%AF%D9%8A%D9%88-%D8%A8%D8%A7%D8%AD%D8%AA%D8%B1%D8%A7%D9%81%D9%8A%D8%A9
ساقوم بعمل مونتاج احترافي وتحريك الشعار الخاص بك ومقدمة لك,محمد ف.,5,6,منذ سنتين و8 أشهر,فيديو وأنيميشن,تحرير الفيديو,"مونتاج, احترافي, video, slideshow, editing, color, correction, aj",https://khamsat.com/video-design/video-editing/1703862-%D8%B3%D8%A7%D9%82%D9%88%D9%85-%D8%A8%D8%B9%D9%85%D9%84-%D9%85%D9%88%D9%86%D8%AA%D8%A7%D8%AC-%D8%A7%D8%AD%D8%AA%D8%B1%D8%A7%D9%81%D9%8A-%D9%88%D8%AA%D8%AD%D8%B1%D9%8A%D9%83-%D8%A7%D9%84%D8%B4%D8%B9%D8%A7%D8%B1-%D8%A7%D9%84%D8%AE%D8%A7%D8%B5-%D8%A8%D9%83-%D9%88%D9%85%D9%82%D8%AF%D9%85%D8%A9-%D9%84%D9%83
