Titre,Vendeur,Acheteurs,Notes,Date Dernier Avis,Catégorie,Sous-Catégorie,Mots Clés,Lien
تحرير فيديو الألعاب بشكل احترافي يجعل طريقة اللعب الخاصة بك,.Emad Eldeen E,0,0,Aucun avis,فيديو وأنيميشن,تحرير الفيديو,"تصميم, مونتاج فيديو, مونتاج فيديوهات, مونتاج يوتيوب, جيمينج",https://khamsat.com/video-design/video-editing/3731507-%D8%AA%D8%AD%D8%B1%D9%8A%D8%B1-%D9%81%D9%8A%D8%AF%D9%8A%D9%88-%D8%A7%D9%84%D8%A3%D9%84%D8%B9%D8%A7%D8%A8-%D8%A8%D8%B4%D9%83%D9%84-%D8%A7%D8%AD%D8%AA%D8%B1%D8%A7%D9%81%D9%8A-%D9%8A%D8%AC%D8%B9%D9%84-%D8%B7%D8%B1%D9%8A%D9%82%D8%A9-%D8%A7%D9%84%D9%84%D8%B9%D8%A8-%D8%A7%D9%84%D8%AE%D8%A7%D8%B5%D8%A9-%D8%A8%D9%83
خدمة تعديل فيديوهات بجودة عالية وإبداع فني,محمود ا.,0,0,Aucun avis,فيديو وأنيميشن,تحرير الفيديو,"مونتاج فيديو, ادوبي, montage, video editing",https://khamsat.com/video-design/video-editing/3455490-%D8%AE%D8%AF%D9%85%D8%A9-%D8%AA%D8%B9%D8%AF%D9%8A%D9%84-%D9%81%D9%8A%D8%AF%D9%8A%D9%88%D9%87%D8%A7%D8%AA-%D8%A8%D8%AC%D9%88%D8%AF%D8%A9-%D8%B9%D8%A7%D9%84%D9%8A%D8%A9-%D9%88%D8%A5%D8%A8%D8%AF%D8%A7%D8%B9-%D9%81%D9%86%D9%8A
مونتاج فيديوهات احترافية عالية الجودة,يوساب س.,0,0,Aucun avis,فيديو وأنيميشن,تحرير الفيديو,"مونتاج, تصميم فيديو, فيديوهات, بريمير, مونتاج احترافي",https://khamsat.com/video-design/video-editing/3652805-%D9%85%D9%88%D9%86%D8%AA%D8%A7%D8%AC-%D9%81%D9%8A%D8%AF%D9%8A%D9%88%D9%87%D8%A7%D8%AA-%D8%A7%D8%AD%D8%AA%D8%B1%D8%A7%D9%81%D9%8A%D8%A9-%D8%B9%D8%A7%D9%84%D9%8A%D8%A9-%D8%A7%D9%84%D8%AC%D9%88%D8%AF%D8%A9
قص ولصق وتعديل الفيديوهات احترافيه,.Mohamed S,0,0,Aucun avis,فيديو وأنيميشن,تحرير الفيديو,"تصميم, تصميم فيديو, editor, مونتاج فيديوهات, تصحيح الالوان",https://khamsat.com/video-design/video-editing/3413075-%D9%82%D8%B5-%D9%88%D9%84%D8%B5%D9%82-%D9%88%D8%AA%D8%B9%D8%AF%D9%8A%D9%84-%D8%A7%D9%84%D9%81%D9%8A%D8%AF%D9%8A%D9%88%D9%87%D8%A7%D8%AA-%D8%A7%D8%AD%D8%AA%D8%B1%D8%A7%D9%81%D9%8A%D9%87
مونتاج احترافي بجودة 4K مع مؤثرات وانتقالات سينمائية,.Abdulrahman M,0,0,Aucun avis,فيديو وأنيميشن,تحرير الفيديو,"فيديو اعلاني, مونتاج فيديو, تصميم فيديو, ريلز, مونتاج يوتيوب",https://khamsat.com/video-design/video-editing/3881163-%D9%85%D9%88%D9%86%D8%AA%D8%A7%D8%AC-%D8%A7%D8%AD%D8%AA%D8%B1%D8%A7%D9%81%D9%8A-%D8%A8%D8%AC%D9%88%D8%AF%D8%A9-4k-%D9%85%D8%B9-%D9%85%D8%A4%D8%AB%D8%B1%D8%A7%D8%AA-%D9%88%D8%A7%D9%86%D8%AA%D9%82%D8%A7%D9%84%D8%A7%D8%AA-%D8%B3%D9%8A%D9%86%D9%85%D8%A7%D8%A6%D9%8A%D8%A9
مونتاج فيديوهات إحترافية بجودة عالية جدا,.Ahmed E,0,0,Aucun avis,فيديو وأنيميشن,تحرير الفيديو,"مونتاج, مونتاج فيديو, after effect, مونتاج احترافي, مونتاج يوتيوب",https://khamsat.com/video-design/video-editing/3846604-%D9%85%D9%88%D9%86%D8%AA%D8%A7%D8%AC-%D9%81%D9%8A%D8%AF%D9%8A%D9%88%D9%87%D8%A7%D8%AA-%D8%A5%D8%AD%D8%AA%D8%B1%D8%A7%D9%81%D9%8A%D8%A9-%D8%A8%D8%AC%D9%88%D8%AF%D8%A9-%D8%B9%D8%A7%D9%84%D9%8A%D8%A9-%D8%AC%D8%AF%D8%A7
مونتاج ريلز و فيديوهات السوشيال ميديا و الاعلانات,.Hamza H,0,0,Aucun avis,فيديو وأنيميشن,فيديوهات سوشيال وإعلانات,"اعلان, مونتاج, مونتير, موشن جرافيك, مونتاج احترافي",https://khamsat.com/video-design/video-editing/3683561-%D9%85%D9%88%D9%86%D8%AA%D8%A7%D8%AC-%D8%B1%D9%8A%D9%84%D8%B2-%D9%88-%D9%81%D9%8A%D8%AF%D9%8A%D9%88%D9%87%D8%A7%D8%AA-%D8%A7%D9%84%D8%B3%D9%88%D8%B4%D9%8A%D8%A7%D9%84-%D9%85%D9%8A%D8%AF%D9%8A%D8%A7-%D9%88-%D8%A7%D9%84%D8%A7%D8%B9%D9%84%D8%A7%D9%86%D8%A7%D8%AA
مونتاج فيديوهات إحترافية بجودة عالية جدا,.Ahmed E,0,0,Aucun avis,فيديو وأنيميشن,تحرير الفيديو,"مونتاج, مونتاج فيديو, after effect, مونتاج احترافي, مونتاج يوتيوب",https://khamsat.com/video-design/video-editing/3846604-%D9%85%D9%88%D9%86%D8%AA%D8%A7%D8%AC-%D9%81%D9%8A%D8%AF%D9%8A%D9%88%D9%87%D8%A7%D8%AA-%D8%A5%D8%AD%D8%AA%D8%B1%D8%A7%D9%81%D9%8A%D8%A9-%D8%A8%D8%AC%D9%88%D8%AF%D8%A9-%D8%B9%D8%A7%D9%84%D9%8A%D8%A9-%D8%AC%D8%AF%D8%A7
مونتاج ريلز و فيديوهات السوشيال ميديا و الاعلانات,.Hamza H,0,0,Aucun avis,فيديو وأنيميشن,فيديوهات سوشيال وإعلانات,"اعلان, مونتاج, مونتير, موشن جرافيك, مونتاج احترافي",https://khamsat.com/video-design/video-editing/3683561-%D9%85%D9%88%D9%86%D8%AA%D8%A7%D8%AC-%D8%B1%D9%8A%D9%84%D8%B2-%D9%88-%D9%81%D9%8A%D8%AF%D9%8A%D9%88%D9%87%D8%A7%D8%AA-%D8%A7%D9%84%D8%B3%D9%88%D8%B4%D9%8A%D8%A7%D9%84-%D9%85%D9%8A%D8%AF%D9%8A%D8%A7-%D9%88-%D8%A7%D9%84%D8%A7%D8%B9%D9%84%D8%A7%D9%86%D8%A7%D8%AA
تصميم فيديوهات احترافية وموشن جرافيك,محمد ص.,0,0,Aucun avis,فيديو وأنيميشن,تحرير الفيديو,"يوتيوب, تصميم فيديو, موشن جرافيك, فيديو ترويجي, فيديو موشن جرافيك",https://khamsat.com/video-design/video-editing/3212043-%D8%AA%D8%B5%D9%85%D9%8A%D9%85-%D9%81%D9%8A%D8%AF%D9%8A%D9%88%D9%87%D8%A7%D8%AA-%D8%A7%D8%AD%D8%AA%D8%B1%D8%A7%D9%81%D9%8A%D8%A9-%D9%88%D9%85%D9%88%D8%B4%D9%86-%D8%AC%D8%B1%D8%A7%D9%81%D9%8A%D9%83
اقدم لك خدمة مونتاج الفيديو بشكل احترافي,عبدالرحمن ا.,0,0,Aucun avis,فيديو وأنيميشن,تحرير الفيديو,"فيديو, تحرير, مونتاج, مونتاج فيديو, مونتاج يوتيوب",https://khamsat.com/video-design/video-editing/3009681-%D8%A7%D9%82%D8%AF%D9%85-%D9%84%D9%83-%D8%AE%D8%AF%D9%85%D8%A9-%D9%85%D9%88%D9%86%D8%AA%D8%A7%D8%AC-%D8%A7%D9%84%D9%81%D9%8A%D8%AF%D9%8A%D9%88-%D8%A8%D8%B4%D9%83%D9%84-%D8%A7%D8%AD%D8%AA%D8%B1%D8%A7%D9%81%D9%8A
مونتاج احترافي للريلز,رضوان م.,0,0,Aucun avis,فيديو وأنيميشن,فيديوهات سوشيال وإعلانات,"فيديو اعلاني, مونتاج فيديو, مونتاج احترافي, ريلز, reels",https://khamsat.com/video-design/video-editing/3601252-%D9%85%D9%88%D9%86%D8%AA%D8%A7%D8%AC-%D8%A7%D8%AD%D8%AA%D8%B1%D8%A7%D9%81%D9%8A-%D9%84%D9%84%D8%B1%D9%8A%D9%84%D8%B2
سأمنتج لك فيديو شورت 3D احترافي بجودة عالية ومؤثرات جذابة,.Adem B,0,0,Aucun avis,فيديو وأنيميشن,فيديوهات سوشيال وإعلانات,"مونتاج فيديو, تصميم فيديو, موشن جرافيك, مونتاج فيديوهات, مونتاج يوتيوب",https://khamsat.com/video-design/video-editing/3494865-%D8%B3%D8%A3%D9%85%D9%86%D8%AA%D8%AC-%D9%84%D9%83-%D9%81%D9%8A%D8%AF%D9%8A%D9%88-%D8%B4%D9%88%D8%B1%D8%AA-3d-%D8%A7%D8%AD%D8%AA%D8%B1%D8%A7%D9%81%D9%8A-%D8%A8%D8%AC%D9%88%D8%AF%D8%A9-%D8%B9%D8%A7%D9%84%D9%8A%D8%A9-%D9%88%D9%85%D8%A4%D8%AB%D8%B1%D8%A7%D8%AA-%D8%AC%D8%B0%D8%A7%D8%A8%D8%A9
مونتاج احترافي لفيديوهات الريلز والتيك توك والسوشيال ميديا,عبدالرحمن ا.,0,0,Aucun avis,فيديو وأنيميشن,فيديوهات سوشيال وإعلانات,"مونتاج, مونتاج فيديو, تعديل فيديوهات, سوشيال ميديا, ريلز",https://khamsat.com/video-design/video-editing/3839688-%D9%85%D9%88%D9%86%D8%AA%D8%A7%D8%AC-%D8%A7%D8%AD%D8%AA%D8%B1%D8%A7%D9%81%D9%8A-%D9%84%D9%81%D9%8A%D8%AF%D9%8A%D9%88%D9%87%D8%A7%D8%AA-%D8%A7%D9%84%D8%B1%D9%8A%D9%84%D8%B2-%D9%88%D8%A7%D9%84%D8%AA%D9%8A%D9%83-%D8%AA%D9%88%D9%83-%D9%88%D8%A7%D9%84%D8%B3%D9%88%D8%B4%D9%8A%D8%A7%D9%84-%D9%85%D9%8A%D8%AF%D9%8A%D8%A7
تصميم ومونتاج فيديو احترافي,.Omar N,48,34,منذ 4 أشهر و27 يوم,فيديو وأنيميشن,تحرير الفيديو,"مونتاج, تصميم اعلان, مونتاج فيديو, تعديل فيديو, مونتاج يوتيوب",https://khamsat.com/video-design/video-editing/2440516-%D8%AA%D8%B5%D9%85%D9%8A%D9%85-%D9%88%D9%85%D9%88%D9%86%D8%AA%D8%A7%D8%AC-%D9%81%D9%8A%D8%AF%D9%8A%D9%88-%D8%A7%D8%AD%D8%AA%D8%B1%D8%A7%D9%81%D9%8A
مونتاج فيديو احترافي قصير,.Ahmed Y,0,0,Aucun avis,فيديو وأنيميشن,فيديوهات سوشيال وإعلانات,"مونتاج, video editing, مونتاج احترافي, ريلز, reels",https://khamsat.com/video-design/video-editing/3540120-%D9%85%D9%88%D9%86%D8%AA%D8%A7%D8%AC-%D9%81%D9%8A%D8%AF%D9%8A%D9%88-%D8%A7%D8%AD%D8%AA%D8%B1%D8%A7%D9%81%D9%8A-%D9%82%D8%B5%D9%8A%D8%B1
مونتاج فيديوهات ريلز احترافية تجذب الأنظار وتزيد جمهورك,.Ahmed E,0,0,Aucun avis,فيديو وأنيميشن,فيديوهات سوشيال وإعلانات,"يوتيوب, مونتاج, مونتاج فيديو, مونتاج احترافي, ريلز",https://khamsat.com/video-design/video-editing/3874014-%D9%85%D9%88%D9%86%D8%AA%D8%A7%D8%AC-%D9%81%D9%8A%D8%AF%D9%8A%D9%88%D9%87%D8%A7%D8%AA-%D8%B1%D9%8A%D9%84%D8%B2-%D8%A7%D8%AD%D8%AA%D8%B1%D8%A7%D9%81%D9%8A%D8%A9-%D8%AA%D8%AC%D8%B0%D8%A8-%D8%A7%D9%84%D8%A3%D9%86%D8%B8%D8%A7%D8%B1-%D9%88%D8%AA%D8%B2%D9%8A%D8%AF-%D8%AC%D9%85%D9%87%D9%88%D8%B1%D9%83
مونتاج وتعديل فيديوهات بشكل احترافي,.Ahmed M,0,0,Aucun avis,فيديو وأنيميشن,تحرير الفيديو,"مونتاج, تعديل فيديوهات, مونتاج احترافي, ريلز, مونتاج يوتيوب",https://khamsat.com/video-design/video-editing/3618942-%D9%85%D9%88%D9%86%D8%AA%D8%A7%D8%AC-%D9%88%D8%AA%D8%B9%D8%AF%D9%8A%D9%84-%D9%81%D9%8A%D8%AF%D9%8A%D9%88%D9%87%D8%A7%D8%AA-%D8%A8%D8%B4%D9%83%D9%84-%D8%A7%D8%AD%D8%AA%D8%B1%D8%A7%D9%81%D9%8A
مونتاج فيديوهات بأحترافية خاصة لقناتك وشركتك,.Ahmed M,19,13,منذ سنة و3 أشهر,فيديو وأنيميشن,تحرير الفيديو,"مونتاج, فيديو اعلاني, مونتاج فيديو, editing, ريلز",https://khamsat.com/video-design/video-editing/1399113-%D9%85%D9%88%D9%86%D8%AA%D8%A7%D8%AC-%D9%81%D9%8A%D8%AF%D9%8A%D9%88%D9%87%D8%A7%D8%AA-%D8%A8%D8%A3%D8%AD%D8%AA%D8%B1%D8%A7%D9%81%D9%8A%D8%A9-%D8%AE%D8%A7%D8%B5%D8%A9-%D9%84%D9%82%D9%86%D8%A7%D8%AA%D9%83-%D9%88%D8%B4%D8%B1%D9%83%D8%AA%D9%83
مونتاج فيديوهات سفر عالية الجودة,يوساب س.,0,0,Aucun avis,فيديو وأنيميشن,تحرير الفيديو,"مونتاج, مونتاج فيديو, سفر, تصميم فيديو, بريمير",https://khamsat.com/video-design/video-editing/3643510-%D9%85%D9%88%D9%86%D8%AA%D8%A7%D8%AC-%D9%81%D9%8A%D8%AF%D9%8A%D9%88%D9%87%D8%A7%D8%AA-%D8%B3%D9%81%D8%B1-%D8%B9%D8%A7%D9%84%D9%8A%D8%A9-%D8%A7%D9%84%D8%AC%D9%88%D8%AF%D8%A9
مونتاج فيديو احترافي لأي مجال,.Maria L,0,0,Aucun avis,فيديو وأنيميشن,تحرير الفيديو,"مونتاج, مونتاج فيديو, مونتاج احترافي, video editor, مونتاج يوتيوب",https://khamsat.com/video-design/video-editing/2967676-%D9%85%D9%88%D9%86%D8%AA%D8%A7%D8%AC-%D9%81%D9%8A%D8%AF%D9%8A%D9%88-%D8%A7%D8%AD%D8%AA%D8%B1%D8%A7%D9%81%D9%8A-%D9%84%D8%A3%D9%8A-%D9%85%D8%AC%D8%A7%D9%84
اقدم لك مونتاج إحترافي لفديوهاتك,محمد إ.,23,18,منذ 3 سنوات وشهر,فيديو وأنيميشن,تحرير الفيديو,"فيديو, تحرير, تصوير, مونتاج, تعديل, video, edit",https://khamsat.com/video-design/video-editing/1298092-%D8%A7%D9%82%D8%AF%D9%85-%D9%84%D9%83-%D9%85%D9%88%D9%86%D8%AA%D8%A7%D8%AC-%D8%A5%D8%AD%D8%AA%D8%B1%D8%A7%D9%81%D9%8A-%D9%84%D9%81%D8%AF%D9%8A%D9%88%D9%87%D8%A7%D8%AA%D9%83
مونتاج وتحرير الفيديوهات بشكل متكامل,.John A,9,7,منذ يوم وساعتين,فيديو وأنيميشن,تحرير الفيديو,"مونتاج, مونتاج فيديو, video editing, تحرير الفيديو, video editor",https://khamsat.com/video-design/video-editing/2715606-%D9%85%D9%88%D9%86%D8%AA%D8%A7%D8%AC-%D9%88%D8%AA%D8%AD%D8%B1%D9%8A%D8%B1-%D8%A7%D9%84%D9%81%D9%8A%D8%AF%D9%8A%D9%88%D9%87%D8%A7%D8%AA-%D8%A8%D8%B4%D9%83%D9%84-%D9%85%D8%AA%D9%83%D8%A7%D9%85%D9%84
مونتاج واخرج الفيديوهات ( اخبار ، تقارير ، وثائقيات ، برومو),محمد ا.,0,0,Aucun avis,فيديو وأنيميشن,تحرير الفيديو,"تصميم, فيديو, تحرير, جرافيك, التصميم, ابداع, انفو, موشن",https://khamsat.com/video-design/video-editing/2355003-%D9%85%D9%88%D9%86%D8%AA%D8%A7%D8%AC-%D9%88%D8%A7%D8%AE%D8%B1%D8%AC-%D8%A7%D9%84%D9%81%D9%8A%D8%AF%D9%8A%D9%88%D9%87%D8%A7%D8%AA-%D8%A7%D8%AE%D8%A8%D8%A7%D8%B1-%D8%AA%D9%82%D8%A7%D8%B1%D9%8A%D8%B1-%D9%88%D8%AB%D8%A7%D8%A6%D9%82%D9%8A%D8%A7%D8%AA-%D8%A8%D8%B1%D9%88%D9%85%D9%88
مونتاج احترافي للفيديوهات الطويلة بجودة عالية,اسر ا.,0,0,Aucun avis,فيديو وأنيميشن,تحرير الفيديو,"فيديو, محتوى, مونتاج فيديو, مونتاج احترافي, مونتاج يوتيوب",https://khamsat.com/video-design/video-editing/3092991-%D9%85%D9%88%D9%86%D8%AA%D8%A7%D8%AC-%D8%A7%D8%AD%D8%AA%D8%B1%D8%A7%D9%81%D9%8A-%D9%84%D9%84%D9%81%D9%8A%D8%AF%D9%8A%D9%88%D9%87%D8%A7%D8%AA-%D8%A7%D9%84%D8%B7%D9%88%D9%8A%D9%84%D8%A9-%D8%A8%D8%AC%D9%88%D8%AF%D8%A9-%D8%B9%D8%A7%D9%84%D9%8A%D8%A9
مونتاج الريلز الاحترافي للمنصات والمنتجات,.Ahmed A,0,0,Aucun avis,فيديو وأنيميشن,فيديوهات سوشيال وإعلانات,"اعلانات, مونتاج فيديو, انستجرام, ريلز, مونتاج مونتح",https://khamsat.com/video-design/video-editing/3819903-%D9%85%D9%88%D9%86%D8%AA%D8%A7%D8%AC-%D8%A7%D9%84%D8%B1%D9%8A%D9%84%D8%B2-%D8%A7%D9%84%D8%A7%D8%AD%D8%AA%D8%B1%D8%A7%D9%81%D9%8A-%D9%84%D9%84%D9%85%D9%86%D8%B5%D8%A7%D8%AA-%D9%88%D8%A7%D9%84%D9%85%D9%86%D8%AA%D8%AC%D8%A7%D8%AA
خدمة تعديل ومونتاج فيديو متكاملة,.Abouzayd G,0,0,Aucun avis,فيديو وأنيميشن,تحرير الفيديو,"editor, video editing, مونتاج احترافي, مونتاج يوتيوب, reels",https://khamsat.com/video-design/video-editing/3779619-%D8%AE%D8%AF%D9%85%D8%A9-%D8%AA%D8%B9%D8%AF%D9%8A%D9%84-%D9%88%D9%85%D9%88%D9%86%D8%AA%D8%A7%D8%AC-%D9%81%D9%8A%D8%AF%D9%8A%D9%88-%D9%85%D8%AA%D9%83%D8%A7%D9%85%D9%84%D8%A9
مونتاج فيديو احترافي بجودة عالية ومحتوى جذاب,احمد م.,0,0,Aucun avis,فيديو وأنيميشن,تحرير الفيديو,"مونتاج, مونتاج فيديو, مونتاج فيديوهات, مونتاج احترافي, مونتاج يوتيوب",https://khamsat.com/video-design/video-editing/3273564-%D9%85%D9%88%D9%86%D8%AA%D8%A7%D8%AC-%D9%81%D9%8A%D8%AF%D9%8A%D9%88-%D8%A7%D8%AD%D8%AA%D8%B1%D8%A7%D9%81%D9%8A-%D8%A8%D8%AC%D9%88%D8%AF%D8%A9-%D8%B9%D8%A7%D9%84%D9%8A%D8%A9-%D9%88%D9%85%D8%AD%D8%AA%D9%88%D9%89-%D8%AC%D8%B0%D8%A7%D8%A8
عمل مونتاج إحترافي لأي فيديو تريده وبأي شكل,.Mohammed G,16,16,منذ 6 أشهر و21 يوم,فيديو وأنيميشن,تحرير الفيديو,"مونتاج, اليوتيوب, مونتير, بريمير, video editing",https://khamsat.com/video-design/video-editing/2559527-%D8%B9%D9%85%D9%84-%D9%85%D9%88%D9%86%D8%AA%D8%A7%D8%AC-%D8%A5%D8%AD%D8%AA%D8%B1%D8%A7%D9%81%D9%8A-%D9%84%D8%A3%D9%8A-%D9%81%D9%8A%D8%AF%D9%8A%D9%88-%D8%AA%D8%B1%D9%8A%D8%AF%D9%87-%D9%88%D8%A8%D8%A3%D9%8A-%D8%B4%D9%83%D9%84
مونتاج إحترافى بجودة عالية على برنامج Adobe Premiere Pro,زياد ه.,0,0,Aucun avis,فيديو وأنيميشن,تحرير الفيديو,"تصميم, فيديو, مونتاج, عالية, جودة, pro, adobe, premiere",https://khamsat.com/video-design/video-editing/2301990-%D9%85%D9%88%D9%86%D8%AA%D8%A7%D8%AC-%D8%A5%D8%AD%D8%AA%D8%B1%D8%A7%D9%81%D9%89-%D8%A8%D8%AC%D9%88%D8%AF%D8%A9-%D8%B9%D8%A7%D9%84%D9%8A%D8%A9-%D8%B9%D9%84%D9%89-%D8%A8%D8%B1%D9%86%D8%A7%D9%85%D8%AC-adobe-premiere-pro
مونتاج وتصميم فيديو ترويجى,مصطفى ع.,7,5,منذ 3 سنوات و7 أشهر,فيديو وأنيميشن,تحرير الفيديو,"تصميم, فيديو, مونتاج, دعائى, ترويجى, برومو, تريلر",https://khamsat.com/video-design/video-editing/1956396-%D9%85%D9%88%D9%86%D8%AA%D8%A7%D8%AC-%D9%88%D8%AA%D8%B5%D9%85%D9%8A%D9%85-%D9%81%D9%8A%D8%AF%D9%8A%D9%88-%D8%AA%D8%B1%D9%88%D9%8A%D8%AC%D9%89
مونتاج فيديوهات بشكل احترافي وجذاب,.Mohammed S,3,3,منذ 28 يوم و9 ساعات,فيديو وأنيميشن,تحرير الفيديو,"مونتاج, مونتاج فيديو, انترو, مونتير, مونتاج احترافي",https://khamsat.com/video-design/video-editing/3393768-%D9%85%D9%88%D9%86%D8%AA%D8%A7%D8%AC-%D9%81%D9%8A%D8%AF%D9%8A%D9%88%D9%87%D8%A7%D8%AA-%D8%A8%D8%B4%D9%83%D9%84-%D8%A7%D8%AD%D8%AA%D8%B1%D8%A7%D9%81%D9%8A-%D9%88%D8%AC%D8%B0%D8%A7%D8%A8
اقدم خدمة مونتاج فيديوهات احترافية,عـبـد الـبـاسـط ج.,0,0,Aucun avis,فيديو وأنيميشن,تحرير الفيديو,"فيديو, مونتاج, مونتاج فيديو, مونتاج الفيديو, مونتاج يوتيوب",https://khamsat.com/video-design/video-editing/3010789-%D8%A7%D9%82%D8%AF%D9%85-%D8%AE%D8%AF%D9%85%D8%A9-%D9%85%D9%88%D9%86%D8%AA%D8%A7%D8%AC-%D9%81%D9%8A%D8%AF%D9%8A%D9%88%D9%87%D8%A7%D8%AA-%D8%A7%D8%AD%D8%AA%D8%B1%D8%A7%D9%81%D9%8A%D8%A9
مونتاج إحترافي بطريقة سينمائية لكل أنواع الفيديو,ضيف ق.,0,0,Aucun avis,فيديو وأنيميشن,تحرير الفيديو,"فيديو اعلاني, مونتاج فيديو, مونتاج احترافي, مونتاج يوتيوب, تصحيح الالوان",https://khamsat.com/video-design/video-editing/3190572-%D9%85%D9%88%D9%86%D8%AA%D8%A7%D8%AC-%D8%A5%D8%AD%D8%AA%D8%B1%D8%A7%D9%81%D9%8A-%D8%A8%D8%B7%D8%B1%D9%8A%D9%82%D8%A9-%D8%B3%D9%8A%D9%86%D9%85%D8%A7%D8%A6%D9%8A%D8%A9-%D9%84%D9%83%D9%84-%D8%A3%D9%86%D9%88%D8%A7%D8%B9-%D8%A7%D9%84%D9%81%D9%8A%D8%AF%D9%8A%D9%88
مونتاج مقاطع الفيديو بإحترافية,.Kareem D,0,0,Aucun avis,فيديو وأنيميشن,تحرير الفيديو,"يوتيوب, مونتاج فيديو, تحرير فيديو, مونتاج احترافي, ريلز",https://khamsat.com/video-design/video-editing/3290127-%D9%85%D9%88%D9%86%D8%AA%D8%A7%D8%AC-%D9%85%D9%82%D8%A7%D8%B7%D8%B9-%D8%A7%D9%84%D9%81%D9%8A%D8%AF%D9%8A%D9%88-%D8%A8%D8%A5%D8%AD%D8%AA%D8%B1%D8%A7%D9%81%D9%8A%D8%A9
فيديو احترافي-Professional Video,.Maher M,0,0,Aucun avis,فيديو وأنيميشن,تحرير الفيديو,"فيديو, youtube, تصميم اعلان, video, vedio",https://khamsat.com/video-design/video-editing/2774374-%D9%81%D9%8A%D8%AF%D9%8A%D9%88-%D8%A7%D8%AD%D8%AA%D8%B1%D8%A7%D9%81%D9%8A-professional-video
مونتاج  الفيديوهات بشكل احترافي,مصعب ج.,0,0,Aucun avis,فيديو وأنيميشن,تحرير الفيديو,"youtube, مونتاج, مونتاج فيديو, ريلز, مونتاج يوتيوب",https://khamsat.com/video-design/video-editing/2830461-%D9%85%D9%88%D9%86%D8%AA%D8%A7%D8%AC-%D8%A7%D9%84%D9%81%D9%8A%D8%AF%D9%8A%D9%88%D9%87%D8%A7%D8%AA-%D8%A8%D8%B4%D9%83%D9%84-%D8%A7%D8%AD%D8%AA%D8%B1%D8%A7%D9%81%D9%8A
مونتاج فيديو احترافي مع الموثرات صوتية والبصرية,عـبـد الـبـاسـط ج.,0,0,Aucun avis,فيديو وأنيميشن,تحرير الفيديو,"فيديو, مونتاج, احترافي, تعديل, editing",https://khamsat.com/video-design/video-editing/3010865-%D9%85%D9%88%D9%86%D8%AA%D8%A7%D8%AC-%D9%81%D9%8A%D8%AF%D9%8A%D9%88-%D8%A7%D8%AD%D8%AA%D8%B1%D8%A7%D9%81%D9%8A-%D9%85%D8%B9-%D8%A7%D9%84%D9%85%D9%88%D8%AB%D8%B1%D8%A7%D8%AA-%D8%B5%D9%88%D8%AA%D9%8A%D8%A9-%D9%88%D8%A7%D9%84%D8%A8%D8%B5%D8%B1%D9%8A%D8%A9
مونتاج احترافي لجميع انواع الفديوهات,عبدالرحمن ع.,0,0,Aucun avis,فيديو وأنيميشن,تحرير الفيديو,"فيديو, مونتاج فيديو, تفريغ فديوهات, video editing, مونتاج احترافي",https://khamsat.com/video-design/video-editing/3168526-%D9%85%D9%88%D9%86%D8%AA%D8%A7%D8%AC-%D8%A7%D8%AD%D8%AA%D8%B1%D8%A7%D9%81%D9%8A-%D9%84%D8%AC%D9%85%D9%8A%D8%B9-%D8%A7%D9%86%D9%88%D8%A7%D8%B9-%D8%A7%D9%84%D9%81%D8%AF%D9%8A%D9%88%D9%87%D8%A7%D8%AA
مونتاج احترافي + تصميم Thumbnails جذابة لفيديوهاتك (YouTube,.Hicham F,0,0,Aucun avis,فيديو وأنيميشن,فيديوهات سوشيال وإعلانات,"مونتاج, مونتاج فيديو, تصميم فيديو, video editing, مونتاج يوتيوب",https://khamsat.com/video-design/video-editing/3715713-%D9%85%D9%88%D9%86%D8%AA%D8%A7%D8%AC-%D8%A7%D8%AD%D8%AA%D8%B1%D8%A7%D9%81%D9%8A-%D8%AA%D8%B5%D9%85%D9%8A%D9%85-thumbnails-%D8%AC%D8%B0%D8%A7%D8%A8%D8%A9-%D9%84%D9%81%D9%8A%D8%AF%D9%8A%D9%88%D9%87%D8%A7%D8%AA%D9%83-youtube
مونتاج فيديو احترافي بجودة عالية لمواقع التواصل واليوتيوب,.Ahmed H,0,0,Aucun avis,فيديو وأنيميشن,فيديوهات سوشيال وإعلانات,"مونتاج فيديو, تصميم فيديو, تعديل الفيديو, سوشيل ميديا, تيكتوك",https://khamsat.com/video-design/video-editing/3781260-%D9%85%D9%88%D9%86%D8%AA%D8%A7%D8%AC-%D9%81%D9%8A%D8%AF%D9%8A%D9%88-%D8%A7%D8%AD%D8%AA%D8%B1%D8%A7%D9%81%D9%8A-%D8%A8%D8%AC%D9%88%D8%AF%D8%A9-%D8%B9%D8%A7%D9%84%D9%8A%D8%A9-%D9%84%D9%85%D9%88%D8%A7%D9%82%D8%B9-%D8%A7%D9%84%D8%AA%D9%88%D8%A7%D8%B5%D9%84-%D9%88%D8%A7%D9%84%D9%8A%D9%88%D8%AA%D9%8A%D9%88%D8%A8
خدمه تصميم الفيديوهات .,مازن م.,3,2,منذ 5 سنوات و10 أشهر,فيديو وأنيميشن,تحرير الفيديو,فيديو,https://khamsat.com/video-design/video-editing/679865-%D8%AE%D8%AF%D9%85%D9%87-%D8%AA%D8%B5%D9%85%D9%8A%D9%85-%D8%A7%D9%84%D9%81%D9%8A%D8%AF%D9%8A%D9%88%D9%87%D8%A7%D8%AA-
مونتاج واعداد وانتاج الفيديو,.Abdelrazk A,0,0,Aucun avis,فيديو وأنيميشن,تحرير الفيديو,"فيديو, تحرير, youtube, مونتاج, احترافي, تصميم فيديو, تحرير فيديو, مونتاج احترافي, video editor, ريلز",https://khamsat.com/video-design/video-editing/2789215-%D9%85%D9%88%D9%86%D8%AA%D8%A7%D8%AC-%D9%88%D8%A7%D8%B9%D8%AF%D8%A7%D8%AF-%D9%88%D8%A7%D9%86%D8%AA%D8%A7%D8%AC-%D8%A7%D9%84%D9%81%D9%8A%D8%AF%D9%8A%D9%88
تصميم ومونتاج بجودة واحترافية,محمد ت.,56,47,منذ 16 يوم و9 ساعات,فيديو وأنيميشن,تحرير الفيديو,"تصميم, مونتاج, احترافي, مونتاج فيديو, مونتير, بريمير, ادوبي, المونتاج, تعديل الفيديو, تحرير الفيديو",https://khamsat.com/video-design/video-editing/2489746-%D8%AA%D8%B5%D9%85%D9%8A%D9%85-%D9%88%D9%85%D9%88%D9%86%D8%AA%D8%A7%D8%AC-%D8%A8%D8%AC%D9%88%D8%AF%D8%A9-%D9%88%D8%A7%D8%AD%D8%AA%D8%B1%D8%A7%D9%81%D9%8A%D8%A9
مونتاج مقطع فيديو لك بشكل فايروسي,اسلام و.,0,0,Aucun avis,فيديو وأنيميشن,تحرير الفيديو,"مونتاج, الفيديو, مونتاج فيديو, مونتاج فيديوهات, ريلز",https://khamsat.com/video-design/video-editing/3402539-%D9%85%D9%88%D9%86%D8%AA%D8%A7%D8%AC-%D9%85%D9%82%D8%B7%D8%B9-%D9%81%D9%8A%D8%AF%D9%8A%D9%88-%D9%84%D9%83-%D8%A8%D8%B4%D9%83%D9%84-%D9%81%D8%A7%D9%8A%D8%B1%D9%88%D8%B3%D9%8A
منتاج فيديوهات طويلة وفيديوهات اليوتيوب,.Youssef B,0,0,Aucun avis,فيديو وأنيميشن,فيديوهات سوشيال وإعلانات,"مونتاج فيديو, منتاج, مونتاج فيديوهات, مونتاج احترافي, مونتاج يوتيوب",https://khamsat.com/video-design/video-editing/3749605-%D9%85%D9%86%D8%AA%D8%A7%D8%AC-%D9%81%D9%8A%D8%AF%D9%8A%D9%88%D9%87%D8%A7%D8%AA-%D8%B7%D9%88%D9%8A%D9%84%D8%A9-%D9%88%D9%81%D9%8A%D8%AF%D9%8A%D9%88%D9%87%D8%A7%D8%AA-%D8%A7%D9%84%D9%8A%D9%88%D8%AA%D9%8A%D9%88%D8%A8
تصميم ومونتاج فيديو مع تعديلات,سليمان ا.,2,2,منذ 4 أشهر ويومين,فيديو وأنيميشن,تحرير الفيديو,"تصميم, فيديو, مونتاج فيديو, video, editing",https://khamsat.com/video-design/video-editing/3451098-%D8%AA%D8%B5%D9%85%D9%8A%D9%85-%D9%88%D9%85%D9%88%D9%86%D8%AA%D8%A7%D8%AC-%D9%81%D9%8A%D8%AF%D9%8A%D9%88-%D9%85%D8%B9-%D8%AA%D8%B9%D8%AF%D9%8A%D9%84%D8%A7%D8%AA
مونتاج فيديو احترافي,.Omar A,32,22,منذ 3 أشهر و8 أيام,فيديو وأنيميشن,تحرير الفيديو,"فيديو, مونتاج, تعديل, فيديوهات",https://khamsat.com/video-design/video-editing/741618-%D9%85%D9%88%D9%86%D8%AA%D8%A7%D8%AC-%D9%81%D9%8A%D8%AF%D9%8A%D9%88-%D8%A7%D8%AD%D8%AA%D8%B1%D8%A7%D9%81%D9%8A
"مونتاج احترافي لفيديوهات Shorts, Reels, Tiktok",.Saad B,0,0,Aucun avis,فيديو وأنيميشن,فيديوهات سوشيال وإعلانات,"مونتاج فيديو احترافي, تيكتوك, فيديوهات قصيرة سوشيال ميديا, تصميم reels و tiktok, تحرير فيديو سريع وجذاب",https://khamsat.com/video-design/video-editing/3746493-%D9%85%D9%88%D9%86%D8%AA%D8%A7%D8%AC-%D8%A7%D8%AD%D8%AA%D8%B1%D8%A7%D9%81%D9%8A-%D9%84%D9%81%D9%8A%D8%AF%D9%8A%D9%88%D9%87%D8%A7%D8%AA-shorts-reels-tiktok
