Titre,Vendeur,Acheteurs,Notes,Date Dernier Avis,Catégorie,Sous-Catégorie,Mots Clés,Lien
دراسة جدوي تقدم لبنك التنمية الاجتماعي بالسعودية,عماد ا.,1,1,منذ 13 يوم و20 ساعة,أعمال,تخطيط أعمال,"تسويق, دراسة جدوى, تمويل, مخازن, مشتريات",https://khamsat.com/business/feasibility-study/2882734-%D8%AF%D8%B1%D8%A7%D8%B3%D8%A9-%D8%AC%D8%AF%D9%88%D9%8A-%D8%AA%D9%82%D8%AF%D9%85-%D9%84%D8%A8%D9%86%D9%83-%D8%A7%D9%84%D8%AA%D9%86%D9%85%D9%8A%D8%A9-%D8%A7%D9%84%D8%A7%D8%AC%D8%AA%D9%85%D8%A7%D8%B9%D9%8A-%D8%A8%D8%A7%D9%84%D8%B3%D8%B9%D9%88%D8%AF%D9%8A%D8%A9
دراسة جدوى ترشدك لتأسيس مشروعك وتقدمها للممول,.Alaa K,24,14,منذ سنة و10 أيام,أعمال,تخطيط أعمال,"دراسة جدوى, برزنتيشن, مشروع, خطة عمل, الممول",https://khamsat.com/business/feasibility-study/2443751-%D8%AF%D8%B1%D8%A7%D8%B3%D8%A9-%D8%AC%D8%AF%D9%88%D9%89-%D8%AA%D8%B1%D8%B4%D8%AF%D9%83-%D9%84%D8%AA%D8%A3%D8%B3%D9%8A%D8%B3-%D9%85%D8%B4%D8%B1%D9%88%D8%B9%D9%83-%D9%88%D8%AA%D9%82%D8%AF%D9%85%D9%87%D8%A7-%D9%84%D9%84%D9%85%D9%85%D9%88%D9%84
دراسة جدوى للتقديم على دعم ريف,قيس ع.,10,8,منذ شهر ويومين,أعمال,تخطيط أعمال,"دراسة جدوى, جدوى, خطة عمل, الجدوى",https://khamsat.com/business/feasibility-study/2958134-%D8%AF%D8%B1%D8%A7%D8%B3%D8%A9-%D8%AC%D8%AF%D9%88%D9%89-%D9%84%D9%84%D8%AA%D9%82%D8%AF%D9%8A%D9%85-%D8%B9%D9%84%D9%89-%D8%AF%D8%B9%D9%85-%D8%B1%D9%8A%D9%81
دراسة جدوى اقتصادية شاملة باللغة العربية او الانجليزية,.Ammar E,21,9,منذ 12 يوم و23 ساعة,أعمال,تخطيط أعمال,"دراسة جدوى, اعمال, مشروع, مالية, الجدوى",https://khamsat.com/business/feasibility-study/2910098-%D8%AF%D8%B1%D8%A7%D8%B3%D8%A9-%D8%AC%D8%AF%D9%88%D9%89-%D8%A7%D9%82%D8%AA%D8%B5%D8%A7%D8%AF%D9%8A%D8%A9-%D8%B4%D8%A7%D9%85%D9%84%D8%A9-%D8%A8%D8%A7%D9%84%D9%84%D8%BA%D8%A9-%D8%A7%D9%84%D8%B9%D8%B1%D8%A8%D9%8A%D8%A9-%D8%A7%D9%88-%D8%A7%D9%84%D8%A7%D9%86%D8%AC%D9%84%D9%8A%D8%B2%D9%8A%D8%A9
دراسة جدوى لمتجر أو تطبيق الكتروني,قيس ع.,59,36,منذ 3 أشهر و19 يوم,أعمال,تخطيط أعمال,"دراسة, تطبيق, إلكتروني, متجر, جدوى",https://khamsat.com/business/feasibility-study/1636740-%D8%AF%D8%B1%D8%A7%D8%B3%D8%A9-%D8%AC%D8%AF%D9%88%D9%89-%D9%84%D9%85%D8%AA%D8%AC%D8%B1-%D8%A3%D9%88-%D8%AA%D8%B7%D8%A8%D9%8A%D9%82-%D8%A7%D9%84%D9%83%D8%AA%D8%B1%D9%88%D9%86%D9%8A
دراسة جدوى اقتصادية شاملة باللغة العربية,قيس ع.,203,117,منذ 12 يوم و9 ساعات,أعمال,تخطيط أعمال,"دراسة, مالية, جدوى, اقتصادية, الجدوى",https://khamsat.com/business/feasibility-study/1473293-%D8%AF%D8%B1%D8%A7%D8%B3%D8%A9-%D8%AC%D8%AF%D9%88%D9%89-%D8%A7%D9%82%D8%AA%D8%B5%D8%A7%D8%AF%D9%8A%D8%A9-%D8%B4%D8%A7%D9%85%D9%84%D8%A9-%D8%A8%D8%A7%D9%84%D9%84%D8%BA%D8%A9-%D8%A7%D9%84%D8%B9%D8%B1%D8%A8%D9%8A%D8%A9
مُلخص دراسة جدوى السوق لمشروعك الالكتروني,أمير خ.,356,209,منذ شهر و3 أيام,أعمال,تخطيط أعمال,"استشارات, دراسة, السوق, دراسات, جدوى",https://khamsat.com/business/feasibility-study/777139-%D9%85%D9%84%D8%AE%D8%B5-%D8%AF%D8%B1%D8%A7%D8%B3%D8%A9-%D8%AC%D8%AF%D9%88%D9%89-%D8%A7%D9%84%D8%B3%D9%88%D9%82-%D9%84%D9%85%D8%B4%D8%B1%D9%88%D8%B9%D9%83-%D8%A7%D9%84%D8%A7%D9%84%D9%83%D8%AA%D8%B1%D9%88%D9%86%D9%8A
دراسة جدوي احترافية لمشروع,.Tharwat M,3,3,منذ شهرين و27 يوم,أعمال,تخطيط أعمال,"دراسة جدوى, السوق, احترافية, دراسه, المشاريع",https://khamsat.com/business/feasibility-study/3223208-%D8%AF%D8%B1%D8%A7%D8%B3%D8%A9-%D8%AC%D8%AF%D9%88%D9%8A-%D8%A7%D8%AD%D8%AA%D8%B1%D8%A7%D9%81%D9%8A%D8%A9-%D9%84%D9%85%D8%B4%D8%B1%D9%88%D8%B9
أقدم لك نموذج كامل وسهل لدراسة الجدوى الإقتصادية لمشروعك,.Alaa K,252,136,منذ 9 أشهر و25 يوم,أعمال,تخطيط أعمال,"أعمال, نموذج, ريادة, للمشاريع, الجدوى",https://khamsat.com/business/feasibility-study/1365713-%D8%A3%D9%82%D8%AF%D9%85-%D9%84%D9%83-%D9%86%D9%85%D9%88%D8%B0%D8%AC-%D9%83%D8%A7%D9%85%D9%84-%D9%88%D8%B3%D9%87%D9%84-%D9%84%D8%AF%D8%B1%D8%A7%D8%B3%D8%A9-%D8%A7%D9%84%D8%AC%D8%AF%D9%88%D9%89-%D8%A7%D9%84%D8%A5%D9%82%D8%AA%D8%B5%D8%A7%D8%AF%D9%8A%D8%A9-%D9%84%D9%85%D8%B4%D8%B1%D9%88%D8%B9%D9%83
دراسة جدوى احترافية لا مثيل لها,حسن م.,77,55,منذ 21 يوم و8 ساعات,أعمال,تخطيط أعمال,"دراسة جدوى, دراسة جدوي, دراسة جدوى مصنع, دراسة جدوى شركة, دراسة جدوى كاملة",https://khamsat.com/business/feasibility-study/1334258-%D8%AF%D8%B1%D8%A7%D8%B3%D8%A9-%D8%AC%D8%AF%D9%88%D9%89-%D8%A7%D8%AD%D8%AA%D8%B1%D8%A7%D9%81%D9%8A%D8%A9-%D9%84%D8%A7-%D9%85%D8%AB%D9%8A%D9%84-%D9%84%D9%87%D8%A7
دراسة جدوى مفصلة من اجل الاستفادة من تمويل,.Aladjel H,11,9,منذ شهر و5 أيام,أعمال,تخطيط أعمال,"تصميم, دراسة جدوى, دراسة, جدوى, دراسة سوق",https://khamsat.com/business/feasibility-study/3152073-%D8%AF%D8%B1%D8%A7%D8%B3%D8%A9-%D8%AC%D8%AF%D9%88%D9%89-%D9%85%D9%81%D8%B5%D9%84%D8%A9-%D9%85%D9%86-%D8%A7%D8%AC%D9%84-%D8%A7%D9%84%D8%A7%D8%B3%D8%AA%D9%81%D8%A7%D8%AF%D8%A9-%D9%85%D9%86-%D8%AA%D9%85%D9%88%D9%8A%D9%84
دراسة جدوى احترافية لجميع المشاريع,.Aladjel H,29,22,منذ 27 يوم و12 ساعة,أعمال,تخطيط أعمال,"اعمال, دراسات, دراسة الجدوى, دراسات مالية, دراسات و اعمال",https://khamsat.com/business/feasibility-study/2455616-%D8%AF%D8%B1%D8%A7%D8%B3%D8%A9-%D8%AC%D8%AF%D9%88%D9%89-%D8%A7%D8%AD%D8%AA%D8%B1%D8%A7%D9%81%D9%8A%D8%A9-%D9%84%D8%AC%D9%85%D9%8A%D8%B9-%D8%A7%D9%84%D9%85%D8%B4%D8%A7%D8%B1%D9%8A%D8%B9
دراسة جدوى شاملة للمشاريع الناشئة باحترافية,ماسين ا.,20,15,منذ يوم وساعة,أعمال,تخطيط أعمال,"دراسة جدوى, دراسة, مشروع, خطة عمل, الجدوى",https://khamsat.com/business/feasibility-study/2934603-%D8%AF%D8%B1%D8%A7%D8%B3%D8%A9-%D8%AC%D8%AF%D9%88%D9%89-%D8%B4%D8%A7%D9%85%D9%84%D8%A9-%D9%84%D9%84%D9%85%D8%B4%D8%A7%D8%B1%D9%8A%D8%B9-%D8%A7%D9%84%D9%86%D8%A7%D8%B4%D8%A6%D8%A9-%D8%A8%D8%A7%D8%AD%D8%AA%D8%B1%D8%A7%D9%81%D9%8A%D8%A9
عمل دراسة جدوى إحترافية شاملة لمشروعك.,.Mohamed W,12,8,منذ شهرين و16 يوم,أعمال,تخطيط أعمال,"دراسة جدوى, استشارات, دراسة, احترافي, اقتصادية",https://khamsat.com/business/feasibility-study/2806245-%D8%B9%D9%85%D9%84-%D8%AF%D8%B1%D8%A7%D8%B3%D8%A9-%D8%AC%D8%AF%D9%88%D9%89-%D8%A5%D8%AD%D8%AA%D8%B1%D8%A7%D9%81%D9%8A%D8%A9-%D8%B4%D8%A7%D9%85%D9%84%D8%A9-%D9%84%D9%85%D8%B4%D8%B1%D9%88%D8%B9%D9%83
دراسة جدوي مالية لاي مشروع,.Yousef E,112,75,منذ 19 يوم و4 ساعات,أعمال,تخطيط أعمال,"تحليل مالي, دراسة جدوى اقتصادية, دراسة مالية, حساب التكاليف, راس المال",https://khamsat.com/business/feasibility-study/1342876-%D8%AF%D8%B1%D8%A7%D8%B3%D8%A9-%D8%AC%D8%AF%D9%88%D9%8A-%D9%85%D8%A7%D9%84%D9%8A%D8%A9-%D9%84%D8%A7%D9%8A-%D9%85%D8%B4%D8%B1%D9%88%D8%B9
نموذج دراسة مالية على برنامج Excel,رفيقة م.,32,17,منذ 4 أشهر و3 أيام,أعمال,تخطيط أعمال,"دراسة, قالب, مشروع, خطة, جدوى, نموذج, اقتصادية, المالي, الجدوى",https://khamsat.com/business/feasibility-study/2621309-%D9%86%D9%85%D9%88%D8%B0%D8%AC-%D8%AF%D8%B1%D8%A7%D8%B3%D8%A9-%D9%85%D8%A7%D9%84%D9%8A%D8%A9-%D8%B9%D9%84%D9%89-%D8%A8%D8%B1%D9%86%D8%A7%D9%85%D8%AC-excel
دراسة جدوى مضمونة لمشروعك,.Aladjel H,3,2,منذ شهرين و20 يوم,أعمال,تخطيط أعمال,"دراسة, دراسات, جدوى, دراسة الجدوى, دراسة السوق",https://khamsat.com/business/feasibility-study/3448872-%D8%AF%D8%B1%D8%A7%D8%B3%D8%A9-%D8%AC%D8%AF%D9%88%D9%89-%D9%85%D8%B6%D9%85%D9%88%D9%86%D8%A9-%D9%84%D9%85%D8%B4%D8%B1%D9%88%D8%B9%D9%83
دراسة جدوي شاملة بشكل مميز,.Yousef E,140,78,منذ 17 يوم و9 ساعات,أعمال,تخطيط أعمال,"دراسة جدوى, خطة عمل, دراسة جدوى اقتصادية, دراسة مالية, خطة تشغيلية",https://khamsat.com/business/feasibility-study/1338315-%D8%AF%D8%B1%D8%A7%D8%B3%D8%A9-%D8%AC%D8%AF%D9%88%D9%8A-%D8%B4%D8%A7%D9%85%D9%84%D8%A9-%D8%A8%D8%B4%D9%83%D9%84-%D9%85%D9%85%D9%8A%D8%B2
دراسة جدوى احترافية و ممتازة لجميع المشاريع,.Aladjel H,4,4,منذ شهر ويومين,أعمال,تخطيط أعمال,"اعمال, دراسة, مشروع, مالية, دراسات",https://khamsat.com/business/feasibility-study/3224658-%D8%AF%D8%B1%D8%A7%D8%B3%D8%A9-%D8%AC%D8%AF%D9%88%D9%89-%D8%A7%D8%AD%D8%AA%D8%B1%D8%A7%D9%81%D9%8A%D8%A9-%D9%88-%D9%85%D9%85%D8%AA%D8%A7%D8%B2%D8%A9-%D9%84%D8%AC%D9%85%D9%8A%D8%B9-%D8%A7%D9%84%D9%85%D8%B4%D8%A7%D8%B1%D9%8A%D8%B9
نموذج دراسة جدوى جاهز للتعبئة ودراسة جدوى مالية,رفيقة م.,52,29,منذ شهر و6 أيام,أعمال,تخطيط أعمال,"دراسة, مشروع, جاهزة, المالي, الجدوى",https://khamsat.com/business/feasibility-study/2507284-%D9%86%D9%85%D9%88%D8%B0%D8%AC-%D8%AF%D8%B1%D8%A7%D8%B3%D8%A9-%D8%AC%D8%AF%D9%88%D9%89-%D8%AC%D8%A7%D9%87%D8%B2-%D9%84%D9%84%D8%AA%D8%B9%D8%A8%D8%A6%D8%A9-%D9%88%D8%AF%D8%B1%D8%A7%D8%B3%D8%A9-%D8%AC%D8%AF%D9%88%D9%89-%D9%85%D8%A7%D9%84%D9%8A%D8%A9
دراسة جدوى التطبيقات الإلكترونية,.Chawki D,61,27,منذ سنة و4 أشهر,أعمال,تخطيط أعمال,"دراسة, تطبيق, الكتروني, جدوى",https://khamsat.com/business/feasibility-study/1776915-%D8%AF%D8%B1%D8%A7%D8%B3%D8%A9-%D8%AC%D8%AF%D9%88%D9%89-%D8%A7%D9%84%D8%AA%D8%B7%D8%A8%D9%8A%D9%82%D8%A7%D8%AA-%D8%A7%D9%84%D8%A5%D9%84%D9%83%D8%AA%D8%B1%D9%88%D9%86%D9%8A%D8%A9
دراسة جدوي لتاسيس شركة نقل,عماد ا.,2,2,منذ 6 أشهر و12 يوم,أعمال,تخطيط أعمال,"تسويق, تطوير, دراسة, نقل, تاسيس",https://khamsat.com/business/feasibility-study/2602774-%D8%AF%D8%B1%D8%A7%D8%B3%D8%A9-%D8%AC%D8%AF%D9%88%D9%8A-%D9%84%D8%AA%D8%A7%D8%B3%D9%8A%D8%B3-%D8%B4%D8%B1%D9%83%D8%A9-%D9%86%D9%82%D9%84
دراسة جدوى اقتصادية لمشروعك,المهندس أحمد ا.,12,4,منذ 11 شهر و4 أيام,أعمال,تخطيط أعمال,"دراسة جدوى, استشارات, استثمار, مشروع, تسويقية",https://khamsat.com/business/feasibility-study/2782530-%D8%AF%D8%B1%D8%A7%D8%B3%D8%A9-%D8%AC%D8%AF%D9%88%D9%89-%D8%A7%D9%82%D8%AA%D8%B5%D8%A7%D8%AF%D9%8A%D8%A9-%D9%84%D9%85%D8%B4%D8%B1%D9%88%D8%B9%D9%83
"قالب لعمل دراسة جدوى مالية لمدة 5 سنوات ""Excel""",.Yousef E,8,3,منذ سنة و4 أشهر,أعمال,تخطيط أعمال,"دراسة جدوى, تحليل مالي, دراسة جدوى اقتصادية, القوائم المالية, نمذجة مالية",https://khamsat.com/business/feasibility-study/2703560-%D9%82%D8%A7%D9%84%D8%A8-%D9%84%D8%B9%D9%85%D9%84-%D8%AF%D8%B1%D8%A7%D8%B3%D8%A9-%D8%AC%D8%AF%D9%88%D9%89-%D9%85%D8%A7%D9%84%D9%8A%D8%A9-%D9%84%D9%85%D8%AF%D8%A9-5-%D8%B3%D9%86%D9%88%D8%A7%D8%AA-excel
استشاره دراسة جدوى اقتصادية لمشروعك,احمد خ.,1,1,منذ 11 يوم و5 ساعات,أعمال,تخطيط أعمال,"دراسة جدوى, استشارات, مشروع, اقتصادية, خطة عمل",https://khamsat.com/business/feasibility-study/3918431-%D8%A7%D8%B3%D8%AA%D8%B4%D8%A7%D8%B1%D9%87-%D8%AF%D8%B1%D8%A7%D8%B3%D8%A9-%D8%AC%D8%AF%D9%88%D9%89-%D8%A7%D9%82%D8%AA%D8%B5%D8%A7%D8%AF%D9%8A%D8%A9-%D9%84%D9%85%D8%B4%D8%B1%D9%88%D8%B9%D9%83
دراسة احترافية و دقيقة لمختلف المشاريع,شمس الدين ح.,4,5,منذ شهر ويوم,أعمال,تخطيط أعمال,"دراسة جدوى, دراسة, مشروع, مالية, جدوى",https://khamsat.com/business/feasibility-study/3000841-%D8%AF%D8%B1%D8%A7%D8%B3%D8%A9-%D8%A7%D8%AD%D8%AA%D8%B1%D8%A7%D9%81%D9%8A%D8%A9-%D9%88-%D8%AF%D9%82%D9%8A%D9%82%D8%A9-%D9%84%D9%85%D8%AE%D8%AA%D9%84%D9%81-%D8%A7%D9%84%D9%85%D8%B4%D8%A7%D8%B1%D9%8A%D8%B9
مراجعة وتدقيق دراسات الجدوى وخطط الاعمال والمشاريع,.Yousef E,22,13,منذ 4 أشهر و7 أيام,أعمال,تخطيط أعمال,"دراسة جدوى, تحليل مالي, خطة عمل, دراسة جدوى اقتصادية, دراسة اقتصادية",https://khamsat.com/business/feasibility-study/1922306-%D9%85%D8%B1%D8%A7%D8%AC%D8%B9%D8%A9-%D9%88%D8%AA%D8%AF%D9%82%D9%8A%D9%82-%D8%AF%D8%B1%D8%A7%D8%B3%D8%A7%D8%AA-%D8%A7%D9%84%D8%AC%D8%AF%D9%88%D9%89-%D9%88%D8%AE%D8%B7%D8%B7-%D8%A7%D9%84%D8%A7%D8%B9%D9%85%D8%A7%D9%84-%D9%88%D8%A7%D9%84%D9%85%D8%B4%D8%A7%D8%B1%D9%8A%D8%B9
نموذج دراسة جدوى لمصنع جاهز للتعبئة ونتائج كالمحترفين,.Yousef E,5,2,منذ 7 أشهر و22 يوم,أعمال,تخطيط أعمال,"دراسة جدوى, خطة عمل, دراسة جدوى اقتصادية, دراسة جدوى مالية, نموذج دراسة جدوى",https://khamsat.com/business/feasibility-study/2857229-%D9%86%D9%85%D9%88%D8%B0%D8%AC-%D8%AF%D8%B1%D8%A7%D8%B3%D8%A9-%D8%AC%D8%AF%D9%88%D9%89-%D9%84%D9%85%D8%B5%D9%86%D8%B9-%D8%AC%D8%A7%D9%87%D8%B2-%D9%84%D9%84%D8%AA%D8%B9%D8%A8%D8%A6%D8%A9-%D9%88%D9%86%D8%AA%D8%A7%D8%A6%D8%AC-%D9%83%D8%A7%D9%84%D9%85%D8%AD%D8%AA%D8%B1%D9%81%D9%8A%D9%86
دراسة جدوى مالية دقيقة متكاملة,حسن م.,3,3,منذ 10 أشهر و28 يوم,أعمال,تخطيط أعمال,"دراسة جدوى, خطة عمل, دراسة جدوي, دراسة مالية, دراسةمشروع",https://khamsat.com/business/feasibility-study/3033202-%D8%AF%D8%B1%D8%A7%D8%B3%D8%A9-%D8%AC%D8%AF%D9%88%D9%89-%D9%85%D8%A7%D9%84%D9%8A%D8%A9-%D8%AF%D9%82%D9%8A%D9%82%D8%A9-%D9%85%D8%AA%D9%83%D8%A7%D9%85%D9%84%D8%A9
دراسة جدوى وتقييم مشروعك,راما ا.,66,44,منذ شهر و23 يوم,أعمال,تخطيط أعمال,"دراسة جدوى, powerpoint, تدريبية, المشاريع, الجدوى",https://khamsat.com/business/feasibility-study/2598142-%D8%AF%D8%B1%D8%A7%D8%B3%D8%A9-%D8%AC%D8%AF%D9%88%D9%89-%D9%88%D8%AA%D9%82%D9%8A%D9%8A%D9%85-%D9%85%D8%B4%D8%B1%D9%88%D8%B9%D9%83
دراسة جدوى جاهزة لكوفي شوب عصري بالرياض في السعودية,.Mohamed A,3,1,منذ 10 أشهر و19 يوم,أعمال,تخطيط أعمال,"دراسة, مشروع, جدوى, شوب, كوفي",https://khamsat.com/business/feasibility-study/2128225-%D8%AF%D8%B1%D8%A7%D8%B3%D8%A9-%D8%AC%D8%AF%D9%88%D9%89-%D8%AC%D8%A7%D9%87%D8%B2%D8%A9-%D9%84%D9%83%D9%88%D9%81%D9%8A-%D8%B4%D9%88%D8%A8-%D8%B9%D8%B5%D8%B1%D9%8A-%D8%A8%D8%A7%D9%84%D8%B1%D9%8A%D8%A7%D8%B6-%D9%81%D9%8A-%D8%A7%D9%84%D8%B3%D8%B9%D9%88%D8%AF%D9%8A%D8%A9
دراسة جدوى موقع تدريب اون لاين اكاديمية تدريب,.Mahmoud O,2,1,منذ 3 أشهر و9 أيام,أعمال,تخطيط أعمال,"دراسة جدوى, دورات, اكاديمية تدريب, موقع تدريب",https://khamsat.com/business/feasibility-study/2992518-%D8%AF%D8%B1%D8%A7%D8%B3%D8%A9-%D8%AC%D8%AF%D9%88%D9%89-%D9%85%D9%88%D9%82%D8%B9-%D8%AA%D8%AF%D8%B1%D9%8A%D8%A8-%D8%A7%D9%88%D9%86-%D9%84%D8%A7%D9%8A%D9%86-%D8%A7%D9%83%D8%A7%D8%AF%D9%8A%D9%85%D9%8A%D8%A9-%D8%AA%D8%AF%D8%B1%D9%8A%D8%A8
دراسة جدوى إدارية احترافية,حسن م.,150,113,منذ يومين وساعة,أعمال,تخطيط أعمال,"دراسة جدوى, دراسة سوق, دراسة جدوي, دراسة جدوى مالية, دراسة جدوى كاملة",https://khamsat.com/business/feasibility-study/1221651-%D8%AF%D8%B1%D8%A7%D8%B3%D8%A9-%D8%AC%D8%AF%D9%88%D9%89-%D8%A5%D8%AF%D8%A7%D8%B1%D9%8A%D8%A9-%D8%A7%D8%AD%D8%AA%D8%B1%D8%A7%D9%81%D9%8A%D8%A9
نموذج دراسة الجدوى الحقيبة الشاملة,حسن م.,116,72,منذ 11 شهر و20 يوم,أعمال,تخطيط أعمال,"دراسة جدوى, دراسة جدوي, دراسة الجدوى, نموذج دراسة جدوى, دراسة جدوي كاملة",https://khamsat.com/business/feasibility-study/1251462-%D9%86%D9%85%D9%88%D8%B0%D8%AC-%D8%AF%D8%B1%D8%A7%D8%B3%D8%A9-%D8%A7%D9%84%D8%AC%D8%AF%D9%88%D9%89-%D8%A7%D9%84%D8%AD%D9%82%D9%8A%D8%A8%D8%A9-%D8%A7%D9%84%D8%B4%D8%A7%D9%85%D9%84%D8%A9
اعداد دراسة جدوى وخطة العمل التشغيليه,نجلاء ف.,3,4,منذ شهر و14 يوم,أعمال,تخطيط أعمال,"دراسة جدوى, استشارات, دراسات, خطة عمل, تحليل swat",https://khamsat.com/business/feasibility-study/2557621-%D8%A7%D8%B9%D8%AF%D8%A7%D8%AF-%D8%AF%D8%B1%D8%A7%D8%B3%D8%A9-%D8%AC%D8%AF%D9%88%D9%89-%D9%88%D8%AE%D8%B7%D8%A9-%D8%A7%D9%84%D8%B9%D9%85%D9%84-%D8%A7%D9%84%D8%AA%D8%B4%D8%BA%D9%8A%D9%84%D9%8A%D9%87
دراسة جدوى مالية لمشروعك تقدمها للممول,راما ا.,13,11,منذ 13 يوم وساعة,أعمال,تخطيط أعمال,"دراسة جدوى, مالية, جدوى, اقتصادية, الجدوى",https://khamsat.com/business/feasibility-study/3203433-%D8%AF%D8%B1%D8%A7%D8%B3%D8%A9-%D8%AC%D8%AF%D9%88%D9%89-%D9%85%D8%A7%D9%84%D9%8A%D8%A9-%D9%84%D9%85%D8%B4%D8%B1%D9%88%D8%B9%D9%83-%D8%AA%D9%82%D8%AF%D9%85%D9%87%D8%A7-%D9%84%D9%84%D9%85%D9%85%D9%88%D9%84
دراسة جدوى مبدئية عن أي مشروع,.Mohamed A,460,271,منذ 16 يوم وساعتين,أعمال,تخطيط أعمال,"دراسة, استثمار, مشاريع, جدوى, تصنيع",https://khamsat.com/business/feasibility-study/958902-%D8%AF%D8%B1%D8%A7%D8%B3%D8%A9-%D8%AC%D8%AF%D9%88%D9%89-%D9%85%D8%A8%D8%AF%D8%A6%D9%8A%D8%A9-%D8%B9%D9%86-%D8%A3%D9%8A-%D9%85%D8%B4%D8%B1%D9%88%D8%B9
دراسة جدوى دعم ريف في السعودية,.Mahmoud O,3,3,منذ 9 أشهر و14 يوم,أعمال,تخطيط أعمال,"دراسة جدوى, ريف, دعم ريف, دراسة جدوى دعم ريف",https://khamsat.com/business/feasibility-study/2992484-%D8%AF%D8%B1%D8%A7%D8%B3%D8%A9-%D8%AC%D8%AF%D9%88%D9%89-%D8%AF%D8%B9%D9%85-%D8%B1%D9%8A%D9%81-%D9%81%D9%8A-%D8%A7%D9%84%D8%B3%D8%B9%D9%88%D8%AF%D9%8A%D8%A9
دراسة الجدوى الاقتصادية لأي مشروع تريده بالأرقام,.Mahmoud O,3,2,منذ 6 أشهر و26 يوم,أعمال,تخطيط أعمال,"دراسة جدوى, دراسة, مالية, جدوى, دراسة جدوى اقتصادية",https://khamsat.com/business/feasibility-study/2981754-%D8%AF%D8%B1%D8%A7%D8%B3%D8%A9-%D8%A7%D9%84%D8%AC%D8%AF%D9%88%D9%89-%D8%A7%D9%84%D8%A7%D9%82%D8%AA%D8%B5%D8%A7%D8%AF%D9%8A%D8%A9-%D9%84%D8%A3%D9%8A-%D9%85%D8%B4%D8%B1%D9%88%D8%B9-%D8%AA%D8%B1%D9%8A%D8%AF%D9%87-%D8%A8%D8%A7%D9%84%D8%A3%D8%B1%D9%82%D8%A7%D9%85
عمل دراسات الجدوى وتقييم المشروعات,.Moustafa H,5,3,منذ سنة و9 أشهر,أعمال,تخطيط أعمال,"حسابات, دراسة, مالية, المشاريع, الجدوى",https://khamsat.com/business/feasibility-study/2629302-%D8%B9%D9%85%D9%84-%D8%AF%D8%B1%D8%A7%D8%B3%D8%A7%D8%AA-%D8%A7%D9%84%D8%AC%D8%AF%D9%88%D9%89-%D9%88%D8%AA%D9%82%D9%8A%D9%8A%D9%85-%D8%A7%D9%84%D9%85%D8%B4%D8%B1%D9%88%D8%B9%D8%A7%D8%AA
دراسة جدوى مشروعك و تقديم النصائح اللازمة لإنجاحه,.Chawki D,57,39,منذ شهر و27 يوم,أعمال,تخطيط أعمال,"دراسة, الخاص, مشروعك, جدوى",https://khamsat.com/business/feasibility-study/1729977-%D8%AF%D8%B1%D8%A7%D8%B3%D8%A9-%D8%AC%D8%AF%D9%88%D9%89-%D9%85%D8%B4%D8%B1%D9%88%D8%B9%D9%83-%D9%88-%D8%AA%D9%82%D8%AF%D9%8A%D9%85-%D8%A7%D9%84%D9%86%D8%B5%D8%A7%D8%A6%D8%AD-%D8%A7%D9%84%D9%84%D8%A7%D8%B2%D9%85%D8%A9-%D9%84%D8%A5%D9%86%D8%AC%D8%A7%D8%AD%D9%87
نموذج دراسة جدوى مالية من خلاله تستطيع عمل دراسة جدوى مشابهة,علي س.,26,9,منذ سنتين و23 يوم,أعمال,تخطيط أعمال,"الانجليزية, دراسة, استثمار, مشروع, جدوى, جاهزة, نموذج, اقتصادية, study, feasibility",https://khamsat.com/business/feasibility-study/457411-%D9%86%D9%85%D9%88%D8%B0%D8%AC-%D8%AF%D8%B1%D8%A7%D8%B3%D8%A9-%D8%AC%D8%AF%D9%88%D9%89-%D9%85%D8%A7%D9%84%D9%8A%D8%A9-%D9%85%D9%86-%D8%AE%D9%84%D8%A7%D9%84%D9%87-%D8%AA%D8%B3%D8%AA%D8%B7%D9%8A%D8%B9-%D8%B9%D9%85%D9%84-%D8%AF%D8%B1%D8%A7%D8%B3%D8%A9-%D8%AC%D8%AF%D9%88%D9%89-%D9%85%D8%B4%D8%A7%D8%A8%D9%87%D8%A9
إعداد دراسة جدوى احترافية (Feasibility study),محمد ح.,2,2,منذ سنتين و9 أشهر,أعمال,تخطيط أعمال,"دراسة, مالية, جدوى, اقتصادية, موازنة",https://khamsat.com/business/feasibility-study/1917245-%D8%A5%D8%B9%D8%AF%D8%A7%D8%AF-%D8%AF%D8%B1%D8%A7%D8%B3%D8%A9-%D8%AC%D8%AF%D9%88%D9%89-%D8%A7%D8%AD%D8%AA%D8%B1%D8%A7%D9%81%D9%8A%D8%A9-feasibility-study
(نموذج) كامل وسهل لدراسة الجدوى الإقتصادية لمشروعك,اديب م.,5,2,منذ سنة و7 أشهر,أعمال,تخطيط أعمال,"اعمال, نموذج, ريادة, للمشاريع, الاقتصادية, الجدوى, للدراسة",https://khamsat.com/business/feasibility-study/1983556-%D9%86%D9%85%D9%88%D8%B0%D8%AC-%D9%83%D8%A7%D9%85%D9%84-%D9%88%D8%B3%D9%87%D9%84-%D9%84%D8%AF%D8%B1%D8%A7%D8%B3%D8%A9-%D8%A7%D9%84%D8%AC%D8%AF%D9%88%D9%89-%D8%A7%D9%84%D8%A5%D9%82%D8%AA%D8%B5%D8%A7%D8%AF%D9%8A%D8%A9-%D9%84%D9%85%D8%B4%D8%B1%D9%88%D8%B9%D9%83
إعداد دراسة جدوى للمشروع  شاملة,.Alaa M,0,0,Aucun avis,أعمال,تخطيط أعمال,"دراسة جدوى, اعمال, دراسة, تسويقية, خطة تسويقية, استراتيجية, الاستشارات, خطة عمل, تطوير الاعمال, الجدوى",https://khamsat.com/business/feasibility-study/2807237-%D8%A5%D8%B9%D8%AF%D8%A7%D8%AF-%D8%AF%D8%B1%D8%A7%D8%B3%D8%A9-%D8%AC%D8%AF%D9%88%D9%89-%D9%84%D9%84%D9%85%D8%B4%D8%B1%D9%88%D8%B9-%D8%B4%D8%A7%D9%85%D9%84%D8%A9
دراسة جدوى بطريقة احترافية,نادية لميس ب.,0,0,Aucun avis,أعمال,تخطيط أعمال,"تسويق, دراسة, مشروعك, خطة, جدوى",https://khamsat.com/business/feasibility-study/2016142-%D8%AF%D8%B1%D8%A7%D8%B3%D8%A9-%D8%AC%D8%AF%D9%88%D9%89-%D8%A8%D8%B7%D8%B1%D9%8A%D9%82%D8%A9-%D8%A7%D8%AD%D8%AA%D8%B1%D8%A7%D9%81%D9%8A%D8%A9
دراسة جدوى اقتصادية شاملة اولية,فيصل ا.,5,5,منذ سنة و8 أشهر,أعمال,تخطيط أعمال,"استشارات, مشاريع, أعمال",https://khamsat.com/business/feasibility-study/2081418-%D8%AF%D8%B1%D8%A7%D8%B3%D8%A9-%D8%AC%D8%AF%D9%88%D9%89-%D8%A7%D9%82%D8%AA%D8%B5%D8%A7%D8%AF%D9%8A%D8%A9-%D8%B4%D8%A7%D9%85%D9%84%D8%A9-%D8%A7%D9%88%D9%84%D9%8A%D8%A9
دراسة جدوى التطبيقات والمتاجر,.Zakaria S,2,1,منذ 3 سنوات و8 أيام,أعمال,تخطيط أعمال,"استشارة, تطوير, فنية, تطبيق, مشروع, فكرة, مستشار, الإلكتروني, ادارة, المشروع, المشاريع",https://khamsat.com/business/feasibility-study/2361814-%D8%AF%D8%B1%D8%A7%D8%B3%D8%A9-%D8%AC%D8%AF%D9%88%D9%89-%D8%A7%D9%84%D8%AA%D8%B7%D8%A8%D9%8A%D9%82%D8%A7%D8%AA-%D9%88%D8%A7%D9%84%D9%85%D8%AA%D8%A7%D8%AC%D8%B1
دراسة جدوى شاملة احترافية,.Zakaria S,0,0,Aucun avis,أعمال,تخطيط أعمال,"دراسة جدوى, احترافي, مشروع, خطة تسويقية, جدوى, استراتيجية, المالية, خطة عمل, الجدوى, الدراسات",https://khamsat.com/business/feasibility-study/2723794-%D8%AF%D8%B1%D8%A7%D8%B3%D8%A9-%D8%AC%D8%AF%D9%88%D9%89-%D8%B4%D8%A7%D9%85%D9%84%D8%A9-%D8%A7%D8%AD%D8%AA%D8%B1%D8%A7%D9%81%D9%8A%D8%A9
دراسة جدوى مبدئية عن أي مشروع,اسلام ع.,1,0,Aucun avis,أعمال,تخطيط أعمال,"دراسة جدوى, دراسة, خطه, دراسه جدوي, دراسة جدوي مشروع",https://khamsat.com/business/feasibility-study/3294776-%D8%AF%D8%B1%D8%A7%D8%B3%D8%A9-%D8%AC%D8%AF%D9%88%D9%89-%D9%85%D8%A8%D8%AF%D8%A6%D9%8A%D8%A9-%D8%B9%D9%86-%D8%A3%D9%8A-%D9%85%D8%B4%D8%B1%D9%88%D8%B9
دراسة جدوى احترافية لمشروعك توضح الربح والخسارة قبل أن تبدأ,.Mahmoud A,1,1,منذ 4 أيام و22 ساعة,أعمال,تخطيط أعمال,"دراسة جدوى, مشروع, مالية, اقتصادية, خطة عمل",https://khamsat.com/business/feasibility-study/3851352-%D8%AF%D8%B1%D8%A7%D8%B3%D8%A9-%D8%AC%D8%AF%D9%88%D9%89-%D8%A7%D8%AD%D8%AA%D8%B1%D8%A7%D9%81%D9%8A%D8%A9-%D9%84%D9%85%D8%B4%D8%B1%D9%88%D8%B9%D9%83-%D8%AA%D9%88%D8%B6%D8%AD-%D8%A7%D9%84%D8%B1%D8%A8%D8%AD-%D9%88%D8%A7%D9%84%D8%AE%D8%B3%D8%A7%D8%B1%D8%A9-%D9%82%D8%A8%D9%84-%D8%A3%D9%86-%D8%AA%D8%A8%D8%AF%D8%A3
دراسة جدوى احترافية خاصة بي وليس مجرد نموذج منقول,.Mohamed H,10,4,منذ يومين وساعتين,أعمال,تخطيط أعمال,"دراسة جدوى, عمل, تحليل احصائي, دراسة, مشروع, محاسبة, خطة, دراسة السوق, تحليل سوات, تخطيط الاعمال",https://khamsat.com/business/feasibility-study/2655517-%D8%AF%D8%B1%D8%A7%D8%B3%D8%A9-%D8%AC%D8%AF%D9%88%D9%89-%D8%A7%D8%AD%D8%AA%D8%B1%D8%A7%D9%81%D9%8A%D8%A9-%D8%AE%D8%A7%D8%B5%D8%A9-%D8%A8%D9%8A-%D9%88%D9%84%D9%8A%D8%B3-%D9%85%D8%AC%D8%B1%D8%AF-%D9%86%D9%85%D9%88%D8%B0%D8%AC-%D9%85%D9%86%D9%82%D9%88%D9%84
