Titre,Vendeur,Acheteurs,Notes,Date Dernier Avis,Catégorie,Sous-Catégorie,Mots Clés,Lien
إستشارات نفسية وطرق إبداعية لتعيش حياتك كما تريد,.Aicha E,50,39,منذ يومين و21 ساعة,أسلوب حياة,تنمية شخصية,"استشارة, تطوير, استشارات, نصائح, علم, تغيير, تربية, طرق, نفسية, مدرب, النفس, واقع, مرافقة, وعي",https://khamsat.com/lifestyle/life-coaching/1235448-%D8%A5%D8%B3%D8%AA%D8%B4%D8%A7%D8%B1%D8%A7%D8%AA-%D9%86%D9%81%D8%B3%D9%8A%D8%A9-%D9%88%D8%B7%D8%B1%D9%82-%D8%A5%D8%A8%D8%AF%D8%A7%D8%B9%D9%8A%D8%A9-%D9%84%D8%AA%D8%B9%D9%8A%D8%B4-%D8%AD%D9%8A%D8%A7%D8%AA%D9%83-%D9%83%D9%85%D8%A7-%D8%AA%D8%B1%D9%8A%D8%AF
توجيهك لمعرفة كيف تعرف انك بحاجة لاستشارة شعورية,.Albrens S,3,3,منذ 4 أشهر و9 أيام,أسلوب حياة,تنمية شخصية,"استشارات, حلول, نصائح, صحة, تطوير الذات",https://khamsat.com/lifestyle/life-coaching/3128680-%D8%AA%D9%88%D8%AC%D9%8A%D9%87%D9%83-%D9%84%D9%85%D8%B9%D8%B1%D9%81%D8%A9-%D9%83%D9%8A%D9%81-%D8%AA%D8%B9%D8%B1%D9%81-%D8%A7%D9%86%D9%83-%D8%A8%D8%AD%D8%A7%D8%AC%D8%A9-%D9%84%D8%A7%D8%B3%D8%AA%D8%B4%D8%A7%D8%B1%D8%A9-%D8%B4%D8%B9%D9%88%D8%B1%D9%8A%D8%A9
جلسة استشارية لدعم اتخاذ قرار شخصي,.Ahmed M,6,4,منذ 11 شهر و19 ساعة,أسلوب حياة,تنمية شخصية,"تطوير, الذات, نفسية, العلاقات, فضفضة",https://khamsat.com/lifestyle/life-coaching/2765805-%D8%AC%D9%84%D8%B3%D8%A9-%D8%A7%D8%B3%D8%AA%D8%B4%D8%A7%D8%B1%D9%8A%D8%A9-%D9%84%D8%AF%D8%B9%D9%85-%D8%A7%D8%AA%D8%AE%D8%A7%D8%B0-%D9%82%D8%B1%D8%A7%D8%B1-%D8%B4%D8%AE%D8%B5%D9%8A
"استشارة شخصية ""تحفيزية"" للأفراد",.Ahmed M,7,7,منذ 5 أشهر و14 يوم,أسلوب حياة,تنمية شخصية,"استشارات, شخصية, تحفيز, استشارات نفسية, استشارة شخصية",https://khamsat.com/lifestyle/life-coaching/2719427-%D8%A7%D8%B3%D8%AA%D8%B4%D8%A7%D8%B1%D8%A9-%D8%B4%D8%AE%D8%B5%D9%8A%D8%A9-%D8%AA%D8%AD%D9%81%D9%8A%D8%B2%D9%8A%D8%A9-%D9%84%D9%84%D8%A3%D9%81%D8%B1%D8%A7%D8%AF
تعرّف على شخصيتك أكثر وفق مقياس MBTI,.Ahmad M,154,87,منذ 20 يوم و3 ساعات,أسلوب حياة,تنمية شخصية,"استشارات, تحليل, تنمية, بشرية, شخصيات",https://khamsat.com/lifestyle/life-coaching/575947-%D8%AA%D8%B9%D8%B1%D9%81-%D8%B9%D9%84%D9%89-%D8%B4%D8%AE%D8%B5%D9%8A%D8%AA%D9%83-%D8%A3%D9%83%D8%AB%D8%B1-%D9%88%D9%81%D9%82-%D9%85%D9%82%D9%8A%D8%A7%D8%B3-mbti
أقدم استشارات نفسية,ميمونة أم النصر س.,11,6,منذ 7 أشهر و14 يوم,أسلوب حياة,تنمية شخصية,"استشارة, دعم, علاج, نفسية, استشارات نفسية",https://khamsat.com/lifestyle/life-coaching/2897912-%D8%A3%D9%82%D8%AF%D9%85-%D8%A7%D8%B3%D8%AA%D8%B4%D8%A7%D8%B1%D8%A7%D8%AA-%D9%86%D9%81%D8%B3%D9%8A%D8%A9
أخصائية نفسية وعلاج المشاكل السلوكية والاجتماعية والاسرية,.Nouran A,15,12,منذ 9 أشهر و10 أيام,أسلوب حياة,تنمية شخصية,"استشارات, مشاكل, حلول, علاج, الصحة",https://khamsat.com/lifestyle/life-coaching/2688909-%D8%A3%D8%AE%D8%B5%D8%A7%D8%A6%D9%8A%D8%A9-%D9%86%D9%81%D8%B3%D9%8A%D8%A9-%D9%88%D8%B9%D9%84%D8%A7%D8%AC-%D8%A7%D9%84%D9%85%D8%B4%D8%A7%D9%83%D9%84-%D8%A7%D9%84%D8%B3%D9%84%D9%88%D9%83%D9%8A%D8%A9-%D9%88%D8%A7%D9%84%D8%A7%D8%AC%D8%AA%D9%85%D8%A7%D8%B9%D9%8A%D8%A9-%D9%88%D8%A7%D9%84%D8%A7%D8%B3%D8%B1%D9%8A%D8%A9
استشارات شخصية التعرف على الذات و مستويات الأدراك العقلية,.Albrens S,2,2,منذ 4 أشهر و6 أيام,أسلوب حياة,تنمية شخصية,"استشارة, تطوير, دعم, ذاتية, مشكلات",https://khamsat.com/lifestyle/life-coaching/3132483-%D8%A7%D8%B3%D8%AA%D8%B4%D8%A7%D8%B1%D8%A7%D8%AA-%D8%B4%D8%AE%D8%B5%D9%8A%D8%A9-%D8%A7%D9%84%D8%AA%D8%B9%D8%B1%D9%81-%D8%B9%D9%84%D9%89-%D8%A7%D9%84%D8%B0%D8%A7%D8%AA-%D9%88-%D9%85%D8%B3%D8%AA%D9%88%D9%8A%D8%A7%D8%AA-%D8%A7%D9%84%D8%A3%D8%AF%D8%B1%D8%A7%D9%83-%D8%A7%D9%84%D8%B9%D9%82%D9%84%D9%8A%D8%A9
تدريب عن  مجال الفراسة (تحليل الشخصيه),.Salma M,8,7,منذ 7 أشهر و26 يوم,أسلوب حياة,تنمية شخصية,"تحليل, تدريب, كورس, الشخصيه, فراسة",https://khamsat.com/lifestyle/life-coaching/1990650-%D8%AA%D8%AF%D8%B1%D9%8A%D8%A8-%D8%B9%D9%86-%D9%85%D8%AC%D8%A7%D9%84-%D8%A7%D9%84%D9%81%D8%B1%D8%A7%D8%B3%D8%A9-%D8%AA%D8%AD%D9%84%D9%8A%D9%84-%D8%A7%D9%84%D8%B4%D8%AE%D8%B5%D9%8A%D9%87
لايف كوتش للإرشاد النفسي والمهني,وفاء ا.,6,5,منذ 3 أشهر و16 يوم,أسلوب حياة,تنمية شخصية,"تحفيز, تطوير الذات, لايف, فضفضة, استشارات نفسية",https://khamsat.com/lifestyle/life-coaching/3067108-%D9%84%D8%A7%D9%8A%D9%81-%D9%83%D9%88%D8%AA%D8%B4-%D9%84%D9%84%D8%A5%D8%B1%D8%B4%D8%A7%D8%AF-%D8%A7%D9%84%D9%86%D9%81%D8%B3%D9%8A-%D9%88%D8%A7%D9%84%D9%85%D9%87%D9%86%D9%8A
استشارية العلاقات الزوجية والأسرية للوصول لحياة أفضل,.Nouran A,5,4,منذ سنة وشهرين,أسلوب حياة,تنمية شخصية,"استشارة, حلول, تربية, نفسية, العلاقات",https://khamsat.com/lifestyle/life-coaching/2741859-%D8%A7%D8%B3%D8%AA%D8%B4%D8%A7%D8%B1%D9%8A%D8%A9-%D8%A7%D9%84%D8%B9%D9%84%D8%A7%D9%82%D8%A7%D8%AA-%D8%A7%D9%84%D8%B2%D9%88%D8%AC%D9%8A%D8%A9-%D9%88%D8%A7%D9%84%D8%A3%D8%B3%D8%B1%D9%8A%D8%A9-%D9%84%D9%84%D9%88%D8%B5%D9%88%D9%84-%D9%84%D8%AD%D9%8A%D8%A7%D8%A9-%D8%A3%D9%81%D8%B6%D9%84
جلسه لايف كوتشينج لحياه افضل,.Rania G,18,14,منذ 8 أشهر و16 ساعة,أسلوب حياة,تنمية شخصية,"تطوير, مشاكل, نصائح, دعم, الذات, تحدث, مساعده, لايف, فضفضة, استشارات نفسية",https://khamsat.com/lifestyle/life-coaching/2625409-%D8%AC%D9%84%D8%B3%D9%87-%D9%84%D8%A7%D9%8A%D9%81-%D9%83%D9%88%D8%AA%D8%B4%D9%8A%D9%86%D8%AC-%D9%84%D8%AD%D9%8A%D8%A7%D9%87-%D8%A7%D9%81%D8%B6%D9%84
تحليل شخصيتك باستخدام أدوات احترافية,.Mohammed A,1,1,منذ 3 أشهر و14 يوم,أسلوب حياة,تنمية شخصية,"استشارة, تطوير, تدريب, تحفيز, تطوير الذات",https://khamsat.com/lifestyle/life-coaching/3405339-%D8%AA%D8%AD%D9%84%D9%8A%D9%84-%D8%B4%D8%AE%D8%B5%D9%8A%D8%AA%D9%83-%D8%A8%D8%A7%D8%B3%D8%AA%D8%AE%D8%AF%D8%A7%D9%85-%D8%A3%D8%AF%D9%88%D8%A7%D8%AA-%D8%A7%D8%AD%D8%AA%D8%B1%D8%A7%D9%81%D9%8A%D8%A9
استشارات نفسية واجتماعية واسرية,رشا س.,10,8,منذ 8 أيام و16 ساعة,أسلوب حياة,تنمية شخصية,"استشارات نفسية, دعم نفسي, علاج اسرى, مشاكل اجتماعية, علاج الإدمان",https://khamsat.com/lifestyle/life-coaching/2976213-%D8%A7%D8%B3%D8%AA%D8%B4%D8%A7%D8%B1%D8%A7%D8%AA-%D9%86%D9%81%D8%B3%D9%8A%D8%A9-%D9%88%D8%A7%D8%AC%D8%AA%D9%85%D8%A7%D8%B9%D9%8A%D8%A9-%D9%88%D8%A7%D8%B3%D8%B1%D9%8A%D8%A9
جلسات للتخلص من الحساسية النفسية والوصول للمتان النفسية,.Youmna E,3,2,منذ شهرين ويومين,أسلوب حياة,تنمية شخصية,"استشارة, مشاكل, نفسية, سريع الانفعال, متوتر",https://khamsat.com/lifestyle/life-coaching/2786799-%D8%AC%D9%84%D8%B3%D8%A7%D8%AA-%D9%84%D9%84%D8%AA%D8%AE%D9%84%D8%B5-%D9%85%D9%86-%D8%A7%D9%84%D8%AD%D8%B3%D8%A7%D8%B3%D9%8A%D8%A9-%D8%A7%D9%84%D9%86%D9%81%D8%B3%D9%8A%D8%A9-%D9%88%D8%A7%D9%84%D9%88%D8%B5%D9%88%D9%84-%D9%84%D9%84%D9%85%D8%AA%D8%A7%D9%86-%D8%A7%D9%84%D9%86%D9%81%D8%B3%D9%8A%D8%A9
تدرب علي الحضور الذهني واليقظة العقلية,.Doaa E,3,2,منذ سنة و5 أيام,أسلوب حياة,تنمية شخصية,"استشارة, نصائح, مساعدة, تطوير الذات, حضور, استشارات نفسية, علاج نفسي, تطوير شخصي, يقظة, تدريب الذهن",https://khamsat.com/lifestyle/life-coaching/2527830-%D8%AA%D8%AF%D8%B1%D8%A8-%D8%B9%D9%84%D9%8A-%D8%A7%D9%84%D8%AD%D8%B6%D9%88%D8%B1-%D8%A7%D9%84%D8%B0%D9%87%D9%86%D9%8A-%D9%88%D8%A7%D9%84%D9%8A%D9%82%D8%B8%D8%A9-%D8%A7%D9%84%D8%B9%D9%82%D9%84%D9%8A%D8%A9
جلسات كوتشينج لاكتشاف الذات وتطويرها وتحسين العلاقات,.Hassan Z,5,4,منذ شهرين و26 يوم,أسلوب حياة,تنمية شخصية,"تطوير الذات, علاقات, استشارات نفسية, جلسة, life coach",https://khamsat.com/lifestyle/life-coaching/3078556-%D8%AC%D9%84%D8%B3%D8%A7%D8%AA-%D9%83%D9%88%D8%AA%D8%B4%D9%8A%D9%86%D8%AC-%D9%84%D8%A7%D9%83%D8%AA%D8%B4%D8%A7%D9%81-%D8%A7%D9%84%D8%B0%D8%A7%D8%AA-%D9%88%D8%AA%D8%B7%D9%88%D9%8A%D8%B1%D9%87%D8%A7-%D9%88%D8%AA%D8%AD%D8%B3%D9%8A%D9%86-%D8%A7%D9%84%D8%B9%D9%84%D8%A7%D9%82%D8%A7%D8%AA
استشارة نفسية وإرشاد اسري,هدى ص.,17,15,منذ 29 يوم و10 ساعات,أسلوب حياة,تنمية شخصية,"استشارات, دعم, علاج, ارشاد, نفسية",https://khamsat.com/lifestyle/life-coaching/2841604-%D8%A7%D8%B3%D8%AA%D8%B4%D8%A7%D8%B1%D8%A9-%D9%86%D9%81%D8%B3%D9%8A%D8%A9-%D9%88%D8%A5%D8%B1%D8%B4%D8%A7%D8%AF-%D8%A7%D8%B3%D8%B1%D9%8A
استشارات شخصية ودعم وإرشاد نفسي,.Boshra D,5,3,منذ 14 يوم و3 ساعات,أسلوب حياة,تنمية شخصية,"استشارة, دعم, تطوير الذات, ارشاد, نفسية",https://khamsat.com/lifestyle/life-coaching/3093437-%D8%A7%D8%B3%D8%AA%D8%B4%D8%A7%D8%B1%D8%A7%D8%AA-%D8%B4%D8%AE%D8%B5%D9%8A%D8%A9-%D9%88%D8%AF%D8%B9%D9%85-%D9%88%D8%A5%D8%B1%D8%B4%D8%A7%D8%AF-%D9%86%D9%81%D8%B3%D9%8A
جلسات فضفضة واستشارات الدعم النفسي,.Garam M,16,11,منذ 26 يوم و8 ساعات,أسلوب حياة,تنمية شخصية,"نصائح, دعم, اجتماعية, فضفضة, استشارات نفسية",https://khamsat.com/lifestyle/life-coaching/2696359-%D8%AC%D9%84%D8%B3%D8%A7%D8%AA-%D9%81%D8%B6%D9%81%D8%B6%D8%A9-%D9%88%D8%A7%D8%B3%D8%AA%D8%B4%D8%A7%D8%B1%D8%A7%D8%AA-%D8%A7%D9%84%D8%AF%D8%B9%D9%85-%D8%A7%D9%84%D9%86%D9%81%D8%B3%D9%8A
جلسات فضفضه ودعم نفسي وتحفيز,.Rania G,10,9,منذ 19 يوم وساعتين,أسلوب حياة,تنمية شخصية,"استشارات, مساعدة, مشكلة, دعم, تواصل, تطوير الذات, شخصيه, نفسية, فضفضة, استشارات نفسية",https://khamsat.com/lifestyle/life-coaching/2844948-%D8%AC%D9%84%D8%B3%D8%A7%D8%AA-%D9%81%D8%B6%D9%81%D8%B6%D9%87-%D9%88%D8%AF%D8%B9%D9%85-%D9%86%D9%81%D8%B3%D9%8A-%D9%88%D8%AA%D8%AD%D9%81%D9%8A%D8%B2
استشارات علاقات شخصية وعاطفية,جهاد ع.,11,8,منذ 21 يوم و23 ساعة,أسلوب حياة,تنمية شخصية,"استشارات, عاطفية, نفسية, علاقات",https://khamsat.com/lifestyle/life-coaching/2006814-%D8%A7%D8%B3%D8%AA%D8%B4%D8%A7%D8%B1%D8%A7%D8%AA-%D8%B9%D9%84%D8%A7%D9%82%D8%A7%D8%AA-%D8%B4%D8%AE%D8%B5%D9%8A%D8%A9-%D9%88%D8%B9%D8%A7%D8%B7%D9%81%D9%8A%D8%A9
كتاب أذكى شخص في العالم في 100 يوم,.Fathi G,1,1,منذ 6 أشهر ويوم,أسلوب حياة,تنمية شخصية,"تطوير, نصائح, نجاح, شخصية, ذكاء",https://khamsat.com/lifestyle/life-coaching/3404327-%D9%83%D8%AA%D8%A7%D8%A8-%D8%A3%D8%B0%D9%83%D9%89-%D8%B4%D8%AE%D8%B5-%D9%81%D9%8A-%D8%A7%D9%84%D8%B9%D8%A7%D9%84%D9%85-%D9%81%D9%8A-100-%D9%8A%D9%88%D9%85
استشارات شخصية التعرف على الذات مستويات الأدراك العقلية,شيرين ر.,10,10,منذ 3 أشهر و22 يوم,أسلوب حياة,تنمية شخصية,"استشارة, تطوير, اكثر, ذاتك, لتعرف",https://khamsat.com/lifestyle/life-coaching/2033799-%D8%A7%D8%B3%D8%AA%D8%B4%D8%A7%D8%B1%D8%A7%D8%AA-%D8%B4%D8%AE%D8%B5%D9%8A%D8%A9-%D8%A7%D9%84%D8%AA%D8%B9%D8%B1%D9%81-%D8%B9%D9%84%D9%89-%D8%A7%D9%84%D8%B0%D8%A7%D8%AA-%D9%85%D8%B3%D8%AA%D9%88%D9%8A%D8%A7%D8%AA-%D8%A7%D9%84%D8%A3%D8%AF%D8%B1%D8%A7%D9%83-%D8%A7%D9%84%D8%B9%D9%82%D9%84%D9%8A%D8%A9
كيف تكون مرن نفسيا,.Nouran A,5,5,منذ شهرين و17 يوم,أسلوب حياة,تنمية شخصية,"مساعدة, شخصية, تدريب, علاج, تحفيز, الصحة, إستشارة",https://khamsat.com/lifestyle/life-coaching/2719723-%D9%83%D9%8A%D9%81-%D8%AA%D9%83%D9%88%D9%86-%D9%85%D8%B1%D9%86-%D9%86%D9%81%D8%B3%D9%8A%D8%A7
اخصائية نفسية لكيفية التعامل مع ذوي الاحتياجات,.Nouran A,1,1,منذ سنتين وشهرين,أسلوب حياة,تنمية شخصية,"استشارة, استشارات, مشاكل, حلول, تفريغ, مساعدة, النفسية, شخصية, فضفضة, نفسي",https://khamsat.com/lifestyle/life-coaching/2695552-%D8%A7%D8%AE%D8%B5%D8%A7%D8%A6%D9%8A%D8%A9-%D9%86%D9%81%D8%B3%D9%8A%D8%A9-%D9%84%D9%83%D9%8A%D9%81%D9%8A%D8%A9-%D8%A7%D9%84%D8%AA%D8%B9%D8%A7%D9%85%D9%84-%D9%85%D8%B9-%D8%B0%D9%88%D9%8A-%D8%A7%D9%84%D8%A7%D8%AD%D8%AA%D9%8A%D8%A7%D8%AC%D8%A7%D8%AA
أخصائية نفسية لتقييم حالات صعوبات التعلم,.Nouran A,3,1,منذ سنتين وشهرين,أسلوب حياة,تنمية شخصية,"استشارات, مشاكل, حلول, علاج, تعديل, تربية, استشارات نفسية, سلوك, الأطفال",https://khamsat.com/lifestyle/life-coaching/2707441-%D8%A3%D8%AE%D8%B5%D8%A7%D8%A6%D9%8A%D8%A9-%D9%86%D9%81%D8%B3%D9%8A%D8%A9-%D9%84%D8%AA%D9%82%D9%8A%D9%8A%D9%85-%D8%AD%D8%A7%D9%84%D8%A7%D8%AA-%D8%B5%D8%B9%D9%88%D8%A8%D8%A7%D8%AA-%D8%A7%D9%84%D8%AA%D8%B9%D9%84%D9%85
استشاري علاقات عاطفية وزوجية وإجتماعية,.Abdalrahman M,1,1,منذ 3 أشهر ويوم,أسلوب حياة,تنمية شخصية,"استشارة, شخصية, دعم, الحب, علاقات",https://khamsat.com/lifestyle/life-coaching/3645581-%D8%A7%D8%B3%D8%AA%D8%B4%D8%A7%D8%B1%D9%8A-%D8%B9%D9%84%D8%A7%D9%82%D8%A7%D8%AA-%D8%B9%D8%A7%D8%B7%D9%81%D9%8A%D8%A9-%D9%88%D8%B2%D9%88%D8%AC%D9%8A%D8%A9-%D9%88%D8%A5%D8%AC%D8%AA%D9%85%D8%A7%D8%B9%D9%8A%D8%A9
تخاطب وتعديل حروف جميع أنواع اللدغات وعلاج التلعثم,ايمان ي.,3,2,منذ 4 أشهر و17 يوم,أسلوب حياة,تنمية شخصية,"عن, بعد, تعديل, اطفال, سلوك",https://khamsat.com/lifestyle/life-coaching/2974393-%D8%AA%D8%AE%D8%A7%D8%B7%D8%A8-%D9%88%D8%AA%D8%B9%D8%AF%D9%8A%D9%84-%D8%AD%D8%B1%D9%88%D9%81-%D8%AC%D9%85%D9%8A%D8%B9-%D8%A3%D9%86%D9%88%D8%A7%D8%B9-%D8%A7%D9%84%D9%84%D8%AF%D8%BA%D8%A7%D8%AA-%D9%88%D8%B9%D9%84%D8%A7%D8%AC-%D8%A7%D9%84%D8%AA%D9%84%D8%B9%D8%AB%D9%85
كوتشينغ عائلي متخصصة : دعم للمراهقين وتوجيه للعلاقات الزوجية,يارا م.,3,3,منذ 8 أيام و3 ساعات,أسلوب حياة,تنمية شخصية,"مساعدة, التواصل, العلاقات, تربوية, استشارات نفسية",https://khamsat.com/lifestyle/life-coaching/3854915-%D9%83%D9%88%D8%AA%D8%B4%D9%8A%D9%86%D8%BA-%D8%B9%D8%A7%D8%A6%D9%84%D9%8A-%D9%85%D8%AA%D8%AE%D8%B5%D8%B5%D8%A9-%D8%AF%D8%B9%D9%85-%D9%84%D9%84%D9%85%D8%B1%D8%A7%D9%87%D9%82%D9%8A%D9%86-%D9%88%D8%AA%D9%88%D8%AC%D9%8A%D9%87-%D9%84%D9%84%D8%B9%D9%84%D8%A7%D9%82%D8%A7%D8%AA-%D8%A7%D9%84%D8%B2%D9%88%D8%AC%D9%8A%D8%A9
استشارة نفسية للتخلص من الفوبيا او الخوف بأنواعه,.Youmna E,6,5,منذ سنة و9 أشهر,أسلوب حياة,تنمية شخصية,"استشارة, معالجة, تحليل الشخصية, نفسية, مساعده, استشارة نفسية, دعم نفسي, جلسة, القلق, فوبيا",https://khamsat.com/lifestyle/life-coaching/2777616-%D8%A7%D8%B3%D8%AA%D8%B4%D8%A7%D8%B1%D8%A9-%D9%86%D9%81%D8%B3%D9%8A%D8%A9-%D9%84%D9%84%D8%AA%D8%AE%D9%84%D8%B5-%D9%85%D9%86-%D8%A7%D9%84%D9%81%D9%88%D8%A8%D9%8A%D8%A7-%D8%A7%D9%88-%D8%A7%D9%84%D8%AE%D9%88%D9%81-%D8%A8%D8%A3%D9%86%D9%88%D8%A7%D8%B9%D9%87
كوتشينغ عائلي متخصصة : دعم للمراهقين وتوجيه للعلاقات الزوجية,يارا م.,3,3,منذ 8 أيام و3 ساعات,أسلوب حياة,تنمية شخصية,"مساعدة, التواصل, العلاقات, تربوية, استشارات نفسية",https://khamsat.com/lifestyle/life-coaching/3854915-%D9%83%D9%88%D8%AA%D8%B4%D9%8A%D9%86%D8%BA-%D8%B9%D8%A7%D8%A6%D9%84%D9%8A-%D9%85%D8%AA%D8%AE%D8%B5%D8%B5%D8%A9-%D8%AF%D8%B9%D9%85-%D9%84%D9%84%D9%85%D8%B1%D8%A7%D9%87%D9%82%D9%8A%D9%86-%D9%88%D8%AA%D9%88%D8%AC%D9%8A%D9%87-%D9%84%D9%84%D8%B9%D9%84%D8%A7%D9%82%D8%A7%D8%AA-%D8%A7%D9%84%D8%B2%D9%88%D8%AC%D9%8A%D8%A9
جلسات نفسية  واستشارات نفسية وأسرية,.Mona M,6,5,منذ سنتين وشهرين,أسلوب حياة,تنمية شخصية,"استشارات, جلسات, نفسية",https://khamsat.com/lifestyle/life-coaching/2308647-%D8%AC%D9%84%D8%B3%D8%A7%D8%AA-%D9%86%D9%81%D8%B3%D9%8A%D8%A9-%D9%88%D8%A7%D8%B3%D8%AA%D8%B4%D8%A7%D8%B1%D8%A7%D8%AA-%D9%86%D9%81%D8%B3%D9%8A%D8%A9-%D9%88%D8%A3%D8%B3%D8%B1%D9%8A%D8%A9
احصل على استشارة من اخصائي تخاطب,.Muhammet B,2,2,منذ شهر و24 يوم,أسلوب حياة,تنمية شخصية,"استشارة, لغة, صحة, لغوي, تأهيل, تخاطب, تأخر",https://khamsat.com/lifestyle/life-coaching/1699521-%D8%A7%D8%AD%D8%B5%D9%84-%D8%B9%D9%84%D9%89-%D8%A7%D8%B3%D8%AA%D8%B4%D8%A7%D8%B1%D8%A9-%D9%85%D9%86-%D8%A7%D8%AE%D8%B5%D8%A7%D8%A6%D9%8A-%D8%AA%D8%AE%D8%A7%D8%B7%D8%A8
جلسة استماع بوعى لتحرير قيودك الداخلية,ايمان ق.,2,2,منذ 10 أشهر و28 يوم,أسلوب حياة,تنمية شخصية,"شخصية, محادثة, فضفضة, استشارات نفسية, جلسة",https://khamsat.com/lifestyle/life-coaching/2953051-%D8%AC%D9%84%D8%B3%D8%A9-%D8%A7%D8%B3%D8%AA%D9%85%D8%A7%D8%B9-%D8%A8%D9%88%D8%B9%D9%89-%D9%84%D8%AA%D8%AD%D8%B1%D9%8A%D8%B1-%D9%82%D9%8A%D9%88%D8%AF%D9%83-%D8%A7%D9%84%D8%AF%D8%A7%D8%AE%D9%84%D9%8A%D8%A9
جلسات علاج نفسي للكبار والمراهقين,.Yasmin K,17,13,منذ يومين و21 ساعة,أسلوب حياة,تنمية شخصية,"مشاكل, شخصية, نفسي, استشارات نفسية, جلسة",https://khamsat.com/lifestyle/life-coaching/3097800-%D8%AC%D9%84%D8%B3%D8%A7%D8%AA-%D8%B9%D9%84%D8%A7%D8%AC-%D9%86%D9%81%D8%B3%D9%8A-%D9%84%D9%84%D9%83%D8%A8%D8%A7%D8%B1-%D9%88%D8%A7%D9%84%D9%85%D8%B1%D8%A7%D9%87%D9%82%D9%8A%D9%86
برنامج علاج معرفي سلوكي  جلسات مخصصة حسب حالتك,.Asma O,4,3,منذ شهرين و6 أيام,أسلوب حياة,تنمية شخصية,"علاج, نفسي, استشارات نفسية, علاج نفسي, صحةنفسية",https://khamsat.com/lifestyle/life-coaching/3325149-%D8%A8%D8%B1%D9%86%D8%A7%D9%85%D8%AC-%D8%B9%D9%84%D8%A7%D8%AC-%D9%85%D8%B9%D8%B1%D9%81%D9%8A-%D8%B3%D9%84%D9%88%D9%83%D9%8A-%D8%AC%D9%84%D8%B3%D8%A7%D8%AA-%D9%85%D8%AE%D8%B5%D8%B5%D8%A9-%D8%AD%D8%B3%D8%A8-%D8%AD%D8%A7%D9%84%D8%AA%D9%83
توجيهك لمعرفة كيف تعرف انك بحاجة لاستشارة نفسية,.Nouran A,11,9,منذ شهر و28 يوم,أسلوب حياة,تنمية شخصية,"استشارة, استشارات, شخصية, زواج, مهارات, نفسي, استشارات نفسية",https://khamsat.com/lifestyle/life-coaching/2739019-%D8%AA%D9%88%D8%AC%D9%8A%D9%87%D9%83-%D9%84%D9%85%D8%B9%D8%B1%D9%81%D8%A9-%D9%83%D9%8A%D9%81-%D8%AA%D8%B9%D8%B1%D9%81-%D8%A7%D9%86%D9%83-%D8%A8%D8%AD%D8%A7%D8%AC%D8%A9-%D9%84%D8%A7%D8%B3%D8%AA%D8%B4%D8%A7%D8%B1%D8%A9-%D9%86%D9%81%D8%B3%D9%8A%D8%A9
جلسات لايف كوتش حاصلة على الاعتماد الدولي CIF,هبه د.,6,2,منذ سنتين و3 أشهر,أسلوب حياة,تنمية شخصية,"مشاكل, نصائح, مساعدة, تحفيز, تطوير الذات, جلسات, كوتشينج, لايف كوتش, نفسي, استشارات نفسية",https://khamsat.com/lifestyle/life-coaching/2640641-%D8%AC%D9%84%D8%B3%D8%A7%D8%AA-%D9%84%D8%A7%D9%8A%D9%81-%D9%83%D9%88%D8%AA%D8%B4-%D8%AD%D8%A7%D8%B5%D9%84%D8%A9-%D8%B9%D9%84%D9%89-%D8%A7%D9%84%D8%A7%D8%B9%D8%AA%D9%85%D8%A7%D8%AF-%D8%A7%D9%84%D8%AF%D9%88%D9%84%D9%8A-cif
جلسات نفسية واستشارات وفضفضة وإرشاد أسرى,ايمان ي.,1,0,Aucun avis,أسلوب حياة,تنمية شخصية,"استشارة, ارشاد, الحياة, استشارات نفسية",https://khamsat.com/lifestyle/life-coaching/3172924-%D8%AC%D9%84%D8%B3%D8%A7%D8%AA-%D9%86%D9%81%D8%B3%D9%8A%D8%A9-%D9%88%D8%A7%D8%B3%D8%AA%D8%B4%D8%A7%D8%B1%D8%A7%D8%AA-%D9%88%D9%81%D8%B6%D9%81%D8%B6%D8%A9-%D9%88%D8%A5%D8%B1%D8%B4%D8%A7%D8%AF-%D8%A3%D8%B3%D8%B1%D9%89
جلسة علاج جدلى سلوكى لتنظيم افكارك و مشاعرك,ايمان ق.,6,4,منذ شهرين و21 يوم,أسلوب حياة,تنمية شخصية,"علاج, استشارات نفسية, جدلى, معرفى, سلوكى",https://khamsat.com/lifestyle/life-coaching/2940509-%D8%AC%D9%84%D8%B3%D8%A9-%D8%B9%D9%84%D8%A7%D8%AC-%D8%AC%D8%AF%D9%84%D9%89-%D8%B3%D9%84%D9%88%D9%83%D9%89-%D9%84%D8%AA%D9%86%D8%B8%D9%8A%D9%85-%D8%A7%D9%81%D9%83%D8%A7%D8%B1%D9%83-%D9%88-%D9%85%D8%B4%D8%A7%D8%B9%D8%B1%D9%83
جلسة استماع ودعم عاطفي مساحة آمنة للفضفضة,شروق ع.,7,5,منذ يومين و15 ساعة,أسلوب حياة,تنمية شخصية,"استشارة, تواصل, محادثة, فضفضة, استشارات نفسية",https://khamsat.com/lifestyle/life-coaching/3221275-%D8%AC%D9%84%D8%B3%D8%A9-%D8%A7%D8%B3%D8%AA%D9%85%D8%A7%D8%B9-%D9%88%D8%AF%D8%B9%D9%85-%D8%B9%D8%A7%D8%B7%D9%81%D9%8A-%D9%85%D8%B3%D8%A7%D8%AD%D8%A9-%D8%A2%D9%85%D9%86%D8%A9-%D9%84%D9%84%D9%81%D8%B6%D9%81%D8%B6%D8%A9
استشارات نفسية لحل مشاكل العلاقات بكل انواعها,.Youmna E,1,1,منذ سنة و6 أشهر,أسلوب حياة,تنمية شخصية,"نصيحة, المشاكل, العلاقات, استشارات نفسية",https://khamsat.com/lifestyle/life-coaching/2786777-%D8%A7%D8%B3%D8%AA%D8%B4%D8%A7%D8%B1%D8%A7%D8%AA-%D9%86%D9%81%D8%B3%D9%8A%D8%A9-%D9%84%D8%AD%D9%84-%D9%85%D8%B4%D8%A7%D9%83%D9%84-%D8%A7%D9%84%D8%B9%D9%84%D8%A7%D9%82%D8%A7%D8%AA-%D8%A8%D9%83%D9%84-%D8%A7%D9%86%D9%88%D8%A7%D8%B9%D9%87%D8%A7
المساعدة على مناقشة المشاكل وايجاد الحلول المناسبة لها,.Ahmad B,3,3,منذ سنة و11 شهر,أسلوب حياة,تنمية شخصية,"مشاكل شخصية, علاج نفسي, استشارة شخصية, مساعدة شخصية, مرشد نفسي",https://khamsat.com/lifestyle/life-coaching/2415764-%D8%A7%D9%84%D9%85%D8%B3%D8%A7%D8%B9%D8%AF%D8%A9-%D8%B9%D9%84%D9%89-%D9%85%D9%86%D8%A7%D9%82%D8%B4%D8%A9-%D8%A7%D9%84%D9%85%D8%B4%D8%A7%D9%83%D9%84-%D9%88%D8%A7%D9%8A%D8%AC%D8%A7%D8%AF-%D8%A7%D9%84%D8%AD%D9%84%D9%88%D9%84-%D8%A7%D9%84%D9%85%D9%86%D8%A7%D8%B3%D8%A8%D8%A9-%D9%84%D9%87%D8%A7
استشارات شخصية مع مدرب محترف,.Mostafa T,22,16,منذ 18 يوم و21 ساعة,أسلوب حياة,تنمية شخصية,"استشارة, شخصية, مدرب, لايف كوتش, حل المشكلات",https://khamsat.com/lifestyle/life-coaching/2716110-%D8%A7%D8%B3%D8%AA%D8%B4%D8%A7%D8%B1%D8%A7%D8%AA-%D8%B4%D8%AE%D8%B5%D9%8A%D8%A9-%D9%85%D8%B9-%D9%85%D8%AF%D8%B1%D8%A8-%D9%85%D8%AD%D8%AA%D8%B1%D9%81
استشارات شخصية وحياتية وترتيب أفكار,.Aya E,6,6,منذ 7 أيام و4 ساعات,أسلوب حياة,تنمية شخصية,"استشارات, تدريب, مدرب, كوتش, مدرب حياة",https://khamsat.com/lifestyle/life-coaching/2433265-%D8%A7%D8%B3%D8%AA%D8%B4%D8%A7%D8%B1%D8%A7%D8%AA-%D8%B4%D8%AE%D8%B5%D9%8A%D8%A9-%D9%88%D8%AD%D9%8A%D8%A7%D8%AA%D9%8A%D8%A9-%D9%88%D8%AA%D8%B1%D8%AA%D9%8A%D8%A8-%D8%A3%D9%81%D9%83%D8%A7%D8%B1
استشارات نفسيه شخصية وزوجية وعائلية وتحليل شخصيات,محمد غ.,1,1,منذ 7 أشهر و17 يوم,أسلوب حياة,تنمية شخصية,"مشاكل, حلول, دعم, علاج, استشارات نفسية",https://khamsat.com/lifestyle/life-coaching/3123617-%D8%A7%D8%B3%D8%AA%D8%B4%D8%A7%D8%B1%D8%A7%D8%AA-%D9%86%D9%81%D8%B3%D9%8A%D9%87-%D8%B4%D8%AE%D8%B5%D9%8A%D8%A9-%D9%88%D8%B2%D9%88%D8%AC%D9%8A%D8%A9-%D9%88%D8%B9%D8%A7%D8%A6%D9%84%D9%8A%D8%A9-%D9%88%D8%AA%D8%AD%D9%84%D9%8A%D9%84-%D8%B4%D8%AE%D8%B5%D9%8A%D8%A7%D8%AA
استشارة فردية وشخصية مع مستشار خبير,.Mais A,9,6,منذ 7 أشهر و15 يوم,أسلوب حياة,تنمية شخصية,"استشارة, مشاكل, نصائح, دعم, علاقات",https://khamsat.com/lifestyle/life-coaching/2672650-%D8%A7%D8%B3%D8%AA%D8%B4%D8%A7%D8%B1%D8%A9-%D9%81%D8%B1%D8%AF%D9%8A%D8%A9-%D9%88%D8%B4%D8%AE%D8%B5%D9%8A%D8%A9-%D9%85%D8%B9-%D9%85%D8%B3%D8%AA%D8%B4%D8%A7%D8%B1-%D8%AE%D8%A8%D9%8A%D8%B1
life coah معالج نفسي سلوكى,.Mai S,2,0,Aucun avis,أسلوب حياة,تنمية شخصية,"استشارات, تحفيز, الذات, الشخصية, تطوير الذات, ارشاد, استفسارات, شخصيه, مشكلات, استشارات نفسية",https://khamsat.com/lifestyle/life-coaching/2723405-life-coah-%D9%85%D8%B9%D8%A7%D9%84%D8%AC-%D9%86%D9%81%D8%B3%D9%8A-%D8%B3%D9%84%D9%88%D9%83%D9%89
استشارات في مجال اللايف كوتشنج,.Aya E,6,4,منذ 8 أشهر و18 يوم,أسلوب حياة,تنمية شخصية,"مساعدة, تدريب, تحفيز, تطوير الذات, لايف كوتش",https://khamsat.com/lifestyle/life-coaching/2391391-%D8%A7%D8%B3%D8%AA%D8%B4%D8%A7%D8%B1%D8%A7%D8%AA-%D9%81%D9%8A-%D9%85%D8%AC%D8%A7%D9%84-%D8%A7%D9%84%D9%84%D8%A7%D9%8A%D9%81-%D9%83%D9%88%D8%AA%D8%B4%D9%86%D8%AC
