Titre,Vendeur,Acheteurs,Notes,Date Dernier Avis,Catégorie,Sous-Catégorie,Mots Clés,Lien
استشارات نفسية وارشاد نفسي هساعدك انك تتغلب علي مشاكلك,.Rahaf R,0,0,Aucun avis,أسلوب حياة,تنمية شخصية,"استشارات, نصائح, ارشاد, فضفضة, استشارات نفسية",https://khamsat.com/lifestyle/life-coaching/3585805-%D8%A7%D8%B3%D8%AA%D8%B4%D8%A7%D8%B1%D8%A7%D8%AA-%D9%86%D9%81%D8%B3%D9%8A%D8%A9-%D9%88%D8%A7%D8%B1%D8%B4%D8%A7%D8%AF-%D9%86%D9%81%D8%B3%D9%8A-%D9%87%D8%B3%D8%A7%D8%B9%D8%AF%D9%83-%D8%A7%D9%86%D9%83-%D8%AA%D8%AA%D8%BA%D9%84%D8%A8-%D8%B9%D9%84%D9%8A-%D9%85%D8%B4%D8%A7%D9%83%D9%84%D9%83
استشارات نفسية واسرية واجتماعية  لجميع الفئات العمرية,حنان س.,0,0,Aucun avis,أسلوب حياة,تنمية شخصية,"استشارة, نصائح, النفسية, نفسية, استشارات نفسية",https://khamsat.com/lifestyle/life-coaching/3280047-%D8%A7%D8%B3%D8%AA%D8%B4%D8%A7%D8%B1%D8%A7%D8%AA-%D9%86%D9%81%D8%B3%D9%8A%D8%A9-%D9%88%D8%A7%D8%B3%D8%B1%D9%8A%D8%A9-%D9%88%D8%A7%D8%AC%D8%AA%D9%85%D8%A7%D8%B9%D9%8A%D8%A9-%D9%84%D8%AC%D9%85%D9%8A%D8%B9-%D8%A7%D9%84%D9%81%D8%A6%D8%A7%D8%AA-%D8%A7%D9%84%D8%B9%D9%85%D8%B1%D9%8A%D8%A9
جلسات كوتشينج لاكتشاف الذات وتطويرها وتحسين العلاقات,منه م.,0,0,Aucun avis,أسلوب حياة,تنمية شخصية,"نصيحة, تطوير الذات, إستشارة, علاقات, استشارات نفسية",https://khamsat.com/lifestyle/life-coaching/3330213-%D8%AC%D9%84%D8%B3%D8%A7%D8%AA-%D9%83%D9%88%D8%AA%D8%B4%D9%8A%D9%86%D8%AC-%D9%84%D8%A7%D9%83%D8%AA%D8%B4%D8%A7%D9%81-%D8%A7%D9%84%D8%B0%D8%A7%D8%AA-%D9%88%D8%AA%D8%B7%D9%88%D9%8A%D8%B1%D9%87%D8%A7-%D9%88%D8%AA%D8%AD%D8%B3%D9%8A%D9%86-%D8%A7%D9%84%D8%B9%D9%84%D8%A7%D9%82%D8%A7%D8%AA
سأكون مستمعًا جيدًا لك بكل اهتمام واحترام دون حكم أو نقد,زينب ا.,0,0,Aucun avis,أسلوب حياة,تنمية شخصية,"استشارات, شخصية, رواية, فضفضة, جلسة",https://khamsat.com/lifestyle/life-coaching/3284329-%D8%B3%D8%A3%D9%83%D9%88%D9%86-%D9%85%D8%B3%D8%AA%D9%85%D8%B9%D8%A7-%D8%AC%D9%8A%D8%AF%D8%A7-%D9%84%D9%83-%D8%A8%D9%83%D9%84-%D8%A7%D9%87%D8%AA%D9%85%D8%A7%D9%85-%D9%88%D8%A7%D8%AD%D8%AA%D8%B1%D8%A7%D9%85-%D8%AF%D9%88%D9%86-%D8%AD%D9%83%D9%85-%D8%A3%D9%88-%D9%86%D9%82%D8%AF
اكتب لك رسالة وداع موجهة لشخص لازلت متعلقًا به,طارق ا.,0,0,Aucun avis,أسلوب حياة,تنمية شخصية,"كتابة رسالة وداع, رسالة حب مؤثرة, كتابة رسالة اعتذار, رسائل عاطفية مكتوبة, رسالة اشتياق",https://khamsat.com/lifestyle/life-coaching/3287555-%D8%A7%D9%83%D8%AA%D8%A8-%D9%84%D9%83-%D8%B1%D8%B3%D8%A7%D9%84%D8%A9-%D9%88%D8%AF%D8%A7%D8%B9-%D9%85%D9%88%D8%AC%D9%87%D8%A9-%D9%84%D8%B4%D8%AE%D8%B5-%D9%84%D8%A7%D8%B2%D9%84%D8%AA-%D9%85%D8%AA%D8%B9%D9%84%D9%82%D8%A7-%D8%A8%D9%87
مساحتك الآمنة للفضفضة والنصيحة الهادئة,فاتن د.,0,0,Aucun avis,أسلوب حياة,تنمية شخصية,"استشارة, حلول, شخصية, تواصل, محادثة",https://khamsat.com/lifestyle/life-coaching/3304155-%D9%85%D8%B3%D8%A7%D8%AD%D8%AA%D9%83-%D8%A7%D9%84%D8%A2%D9%85%D9%86%D8%A9-%D9%84%D9%84%D9%81%D8%B6%D9%81%D8%B6%D8%A9-%D9%88%D8%A7%D9%84%D9%86%D8%B5%D9%8A%D8%AD%D8%A9-%D8%A7%D9%84%D9%87%D8%A7%D8%AF%D8%A6%D8%A9
جلسات نفسية علاجية وتطويرية,.Chou R,0,0,Aucun avis,أسلوب حياة,تنمية شخصية,"استشارة, تطوير, استشارات نفسية, علاج نفسي, اسلوب حياة",https://khamsat.com/lifestyle/life-coaching/3082414-%D8%AC%D9%84%D8%B3%D8%A7%D8%AA-%D9%86%D9%81%D8%B3%D9%8A%D8%A9-%D8%B9%D9%84%D8%A7%D8%AC%D9%8A%D8%A9-%D9%88%D8%AA%D8%B7%D9%88%D9%8A%D8%B1%D9%8A%D8%A9
تقديم الدعم والأرشاد النفسي الفردي,.Mariam M,0,0,Aucun avis,أسلوب حياة,تنمية شخصية,"دعم, ارشاد, شخصيه, نفسية, استشارات نفسية",https://khamsat.com/lifestyle/life-coaching/3410508-%D8%AA%D9%82%D8%AF%D9%8A%D9%85-%D8%A7%D9%84%D8%AF%D8%B9%D9%85-%D9%88%D8%A7%D9%84%D8%A3%D8%B1%D8%B4%D8%A7%D8%AF-%D8%A7%D9%84%D9%86%D9%81%D8%B3%D9%8A-%D8%A7%D9%84%D9%81%D8%B1%D8%AF%D9%8A
استشارة عاطفية ودعم نفسي للبنات – بكل خصوصية وحب,سارة ق.,0,0,Aucun avis,أسلوب حياة,تنمية شخصية,"استشارات نفسية, مستشارة علاقات, فضفضة خاصة, مشاكل الحب, أحتاج أتكلم",https://khamsat.com/lifestyle/life-coaching/3434887-%D8%A7%D8%B3%D8%AA%D8%B4%D8%A7%D8%B1%D8%A9-%D8%B9%D8%A7%D8%B7%D9%81%D9%8A%D8%A9-%D9%88%D8%AF%D8%B9%D9%85-%D9%86%D9%81%D8%B3%D9%8A-%D9%84%D9%84%D8%A8%D9%86%D8%A7%D8%AA-%D8%A8%D9%83%D9%84-%D8%AE%D8%B5%D9%88%D8%B5%D9%8A%D8%A9-%D9%88%D8%AD%D8%A8
استشارات علاقات عاطفية وشخصية,فاطمة الزهراء غ.,0,0,Aucun avis,أسلوب حياة,تنمية شخصية,"دعم, تطوير الذات, الحب, علاقات, استشارات نفسية",https://khamsat.com/lifestyle/life-coaching/3024178-%D8%A7%D8%B3%D8%AA%D8%B4%D8%A7%D8%B1%D8%A7%D8%AA-%D8%B9%D9%84%D8%A7%D9%82%D8%A7%D8%AA-%D8%B9%D8%A7%D8%B7%D9%81%D9%8A%D8%A9-%D9%88%D8%B4%D8%AE%D8%B5%D9%8A%D8%A9
تعافيت في 90 يومًا دليل عملي ومجرب للتخلص من الإباحية,طارق ا.,0,0,Aucun avis,أسلوب حياة,تنمية شخصية,"استشارة, استشارات, دعم نفسي, علاج الادمان, التخلص من الإباحية",https://khamsat.com/lifestyle/life-coaching/3244597-%D8%AA%D8%B9%D8%A7%D9%81%D9%8A%D8%AA-%D9%81%D9%8A-90-%D9%8A%D9%88%D9%85%D8%A7-%D8%AF%D9%84%D9%8A%D9%84-%D8%B9%D9%85%D9%84%D9%8A-%D9%88%D9%85%D8%AC%D8%B1%D8%A8-%D9%84%D9%84%D8%AA%D8%AE%D9%84%D8%B5-%D9%85%D9%86-%D8%A7%D9%84%D8%A5%D8%A8%D8%A7%D8%AD%D9%8A%D8%A9
استشارات زوجية لحل كافة المشاكل الزوجية,محمد ص.,0,0,Aucun avis,أسلوب حياة,تنمية شخصية,"استشارة, نصائح, الحياة, العلاقات",https://khamsat.com/lifestyle/life-coaching/2926171-%D8%A7%D8%B3%D8%AA%D8%B4%D8%A7%D8%B1%D8%A7%D8%AA-%D8%B2%D9%88%D8%AC%D9%8A%D8%A9-%D9%84%D8%AD%D9%84-%D9%83%D8%A7%D9%81%D8%A9-%D8%A7%D9%84%D9%85%D8%B4%D8%A7%D9%83%D9%84-%D8%A7%D9%84%D8%B2%D9%88%D8%AC%D9%8A%D8%A9
فضفضة ومساحة امان لك ودعم نفسي,.Dina M,0,0,Aucun avis,أسلوب حياة,تنمية شخصية,"نصيحة, استشارات, فضفضة, استشارات نفسية, جلسة",https://khamsat.com/lifestyle/life-coaching/3197584-%D9%81%D8%B6%D9%81%D8%B6%D8%A9-%D9%88%D9%85%D8%B3%D8%A7%D8%AD%D8%A9-%D8%A7%D9%85%D8%A7%D9%86-%D9%84%D9%83-%D9%88%D8%AF%D8%B9%D9%85-%D9%86%D9%81%D8%B3%D9%8A
سأكون رفيقك الأفتراضي  جلسات فضفضة,.Yamur Y,0,0,Aucun avis,أسلوب حياة,تنمية شخصية,"فضفضة, راحة, نفسي, رفيق, لا أحكام",https://khamsat.com/lifestyle/life-coaching/3395215-%D8%B3%D8%A3%D9%83%D9%88%D9%86-%D8%B1%D9%81%D9%8A%D9%82%D9%83-%D8%A7%D9%84%D8%A3%D9%81%D8%AA%D8%B1%D8%A7%D8%B6%D9%8A-%D8%AC%D9%84%D8%B3%D8%A7%D8%AA-%D9%81%D8%B6%D9%81%D8%B6%D8%A9
جلسات فضفضة لحل المشكلات النفسية وتطوير ذاتك,آيه ت.,0,0,Aucun avis,أسلوب حياة,تنمية شخصية,"استشارات, حلول, مشكلة, دعم, نفسية",https://khamsat.com/lifestyle/life-coaching/2933091-%D8%AC%D9%84%D8%B3%D8%A7%D8%AA-%D9%81%D8%B6%D9%81%D8%B6%D8%A9-%D9%84%D8%AD%D9%84-%D8%A7%D9%84%D9%85%D8%B4%D9%83%D9%84%D8%A7%D8%AA-%D8%A7%D9%84%D9%86%D9%81%D8%B3%D9%8A%D8%A9-%D9%88%D8%AA%D8%B7%D9%88%D9%8A%D8%B1-%D8%B0%D8%A7%D8%AA%D9%83
افهم ذاتك وروحك مع فضفضة من القلب للقلب,.Zeina A,0,0,Aucun avis,أسلوب حياة,تنمية شخصية,"نصائح, مساعدة, دعم, فضفضة, استشارات نفسية",https://khamsat.com/lifestyle/life-coaching/2743751-%D8%A7%D9%81%D9%87%D9%85-%D8%B0%D8%A7%D8%AA%D9%83-%D9%88%D8%B1%D9%88%D8%AD%D9%83-%D9%85%D8%B9-%D9%81%D8%B6%D9%81%D8%B6%D8%A9-%D9%85%D9%86-%D8%A7%D9%84%D9%82%D9%84%D8%A8-%D9%84%D9%84%D9%82%D9%84%D8%A8
تفريغ نفسي ودعم عاطفي وفضفضة,الاء ع.,0,0,Aucun avis,أسلوب حياة,تنمية شخصية,"نصيحة, مساعدة, دعم, فضفضة, استشارات نفسية",https://khamsat.com/lifestyle/life-coaching/3294001-%D8%AA%D9%81%D8%B1%D9%8A%D8%BA-%D9%86%D9%81%D8%B3%D9%8A-%D9%88%D8%AF%D8%B9%D9%85-%D8%B9%D8%A7%D8%B7%D9%81%D9%8A-%D9%88%D9%81%D8%B6%D9%81%D8%B6%D8%A9
استشارة فردية مع Life coach,هدى ح.,1,1,منذ سنة و3 أشهر,أسلوب حياة,تنمية شخصية,Aucun tag,https://khamsat.com/lifestyle/life-coaching/2092001-%D8%A7%D8%B3%D8%AA%D8%B4%D8%A7%D8%B1%D8%A9-%D9%81%D8%B1%D8%AF%D9%8A%D8%A9-%D9%85%D8%B9-life-coach
برنامج علاجي فردي متكامل للثقه بالنفس,فاطمة ف.,0,0,Aucun avis,أسلوب حياة,تنمية شخصية,"استشارة, مساعدة, شخصية, علاج, نفسي",https://khamsat.com/lifestyle/life-coaching/2869289-%D8%A8%D8%B1%D9%86%D8%A7%D9%85%D8%AC-%D8%B9%D9%84%D8%A7%D8%AC%D9%8A-%D9%81%D8%B1%D8%AF%D9%8A-%D9%85%D8%AA%D9%83%D8%A7%D9%85%D9%84-%D9%84%D9%84%D8%AB%D9%82%D9%87-%D8%A8%D8%A7%D9%84%D9%86%D9%81%D8%B3
أقوم بتحليل كامل لشخصيتك ليس اختبار,.Essam A,0,0,Aucun avis,أسلوب حياة,تنمية شخصية,"شخصي, شخصية, تنمية, التحليل, تحليل شخصية",https://khamsat.com/lifestyle/life-coaching/2676060-%D8%A3%D9%82%D9%88%D9%85-%D8%A8%D8%AA%D8%AD%D9%84%D9%8A%D9%84-%D9%83%D8%A7%D9%85%D9%84-%D9%84%D8%B4%D8%AE%D8%B5%D9%8A%D8%AA%D9%83-%D9%84%D9%8A%D8%B3-%D8%A7%D8%AE%D8%AA%D8%A8%D8%A7%D8%B1
استشارة نفسية أو حياتية جلسات فضفضة بكامل السرية,عبد الرحمن ا.,12,11,منذ 5 أشهر و27 يوم,أسلوب حياة,تنمية شخصية,"برمجة, استشارة, استشارات, الصحة, لغوية",https://khamsat.com/lifestyle/life-coaching/2683804-%D8%A7%D8%B3%D8%AA%D8%B4%D8%A7%D8%B1%D8%A9-%D9%86%D9%81%D8%B3%D9%8A%D8%A9-%D8%A3%D9%88-%D8%AD%D9%8A%D8%A7%D8%AA%D9%8A%D8%A9-%D8%AC%D9%84%D8%B3%D8%A7%D8%AA-%D9%81%D8%B6%D9%81%D8%B6%D8%A9-%D8%A8%D9%83%D8%A7%D9%85%D9%84-%D8%A7%D9%84%D8%B3%D8%B1%D9%8A%D8%A9
جلسة لايف كوتش لمساعدتك في اتخاذ قرار أو تطوير ذاتك,شذا ق.,0,0,Aucun avis,أسلوب حياة,تنمية شخصية,"دعم, تطوير الذات, العلاقات, فضفضة, استشارات نفسية",https://khamsat.com/lifestyle/life-coaching/3775086-%D8%AC%D9%84%D8%B3%D8%A9-%D9%84%D8%A7%D9%8A%D9%81-%D9%83%D9%88%D8%AA%D8%B4-%D9%84%D9%85%D8%B3%D8%A7%D8%B9%D8%AF%D8%AA%D9%83-%D9%81%D9%8A-%D8%A7%D8%AA%D8%AE%D8%A7%D8%B0-%D9%82%D8%B1%D8%A7%D8%B1-%D8%A3%D9%88-%D8%AA%D8%B7%D9%88%D9%8A%D8%B1-%D8%B0%D8%A7%D8%AA%D9%83
تقديم جلسات دعم نفسي لمن تعرض لموقف صعب ..,شذا ق.,1,0,Aucun avis,أسلوب حياة,تنمية شخصية,"استشارات, تفريغ, مشكلة, دعم, حل, ارشاد, نفسية, فضفضة, نفسي, جلسة",https://khamsat.com/lifestyle/life-coaching/2536263-%D8%AA%D9%82%D8%AF%D9%8A%D9%85-%D8%AC%D9%84%D8%B3%D8%A7%D8%AA-%D8%AF%D8%B9%D9%85-%D9%86%D9%81%D8%B3%D9%8A-%D9%84%D9%85%D9%86-%D8%AA%D8%B9%D8%B1%D8%B6-%D9%84%D9%85%D9%88%D9%82%D9%81-%D8%B5%D8%B9%D8%A8-
استشارات علاقات شخصية وعاطفية,هدى ح.,2,1,منذ 3 سنوات و21 يوم,أسلوب حياة,تنمية شخصية,"استشارة, تطوير, مشاكل, كتابة, استشارات نفسية",https://khamsat.com/lifestyle/life-coaching/2152275-%D8%A7%D8%B3%D8%AA%D8%B4%D8%A7%D8%B1%D8%A7%D8%AA-%D8%B9%D9%84%D8%A7%D9%82%D8%A7%D8%AA-%D8%B4%D8%AE%D8%B5%D9%8A%D8%A9-%D9%88%D8%B9%D8%A7%D8%B7%D9%81%D9%8A%D8%A9
تقديم المشورة النفسية والإجتماعية,.Shimaa S,3,3,منذ 17 يوم و20 ساعة,أسلوب حياة,تنمية شخصية,"دعم, الذات, ارشاد, استشارات نفسية",https://khamsat.com/lifestyle/life-coaching/3317350-%D8%AA%D9%82%D8%AF%D9%8A%D9%85-%D8%A7%D9%84%D9%85%D8%B4%D9%88%D8%B1%D8%A9-%D8%A7%D9%84%D9%86%D9%81%D8%B3%D9%8A%D8%A9-%D9%88%D8%A7%D9%84%D8%A5%D8%AC%D8%AA%D9%85%D8%A7%D8%B9%D9%8A%D8%A9
استشارات ونصائح لبناء (حياه ايجابيه),.Mohammed A,1,0,Aucun avis,أسلوب حياة,تنمية شخصية,"استشارات, ونصائح",https://khamsat.com/lifestyle/life-coaching/1976313-%D8%A7%D8%B3%D8%AA%D8%B4%D8%A7%D8%B1%D8%A7%D8%AA-%D9%88%D9%86%D8%B5%D8%A7%D8%A6%D8%AD-%D9%84%D8%A8%D9%86%D8%A7%D8%A1-%D8%AD%D9%8A%D8%A7%D9%87-%D8%A7%D9%8A%D8%AC%D8%A7%D8%A8%D9%8A%D9%87
استشارة اجتماعية ونفسية وأسرية,رنا ر.,3,2,منذ سنتين و3 أشهر,أسلوب حياة,تنمية شخصية,"استشارة, وورد",https://khamsat.com/lifestyle/life-coaching/2431544-%D8%A7%D8%B3%D8%AA%D8%B4%D8%A7%D8%B1%D8%A9-%D8%A7%D8%AC%D8%AA%D9%85%D8%A7%D8%B9%D9%8A%D8%A9-%D9%88%D9%86%D9%81%D8%B3%D9%8A%D8%A9-%D9%88%D8%A3%D8%B3%D8%B1%D9%8A%D8%A9
إدارة الدخل الشخصي والثروات,علي م.,1,1,منذ 5 أشهر و16 يوم,أسلوب حياة,تنمية شخصية,"شخصي, برنامج, إدارة, ميزانية, الدخل",https://khamsat.com/lifestyle/life-coaching/3409957-%D8%A5%D8%AF%D8%A7%D8%B1%D8%A9-%D8%A7%D9%84%D8%AF%D8%AE%D9%84-%D8%A7%D9%84%D8%B4%D8%AE%D8%B5%D9%8A-%D9%88%D8%A7%D9%84%D8%AB%D8%B1%D9%88%D8%A7%D8%AA
استشارات فردية شخصية في الحياة اليومية,.Noura K,2,0,Aucun avis,أسلوب حياة,تنمية شخصية,"استشارة, شخصي, استشارات, حلول, نصائح, مساعدة, شخصيه, الحياة, نفسية, الطلاب",https://khamsat.com/lifestyle/life-coaching/2797224-%D8%A7%D8%B3%D8%AA%D8%B4%D8%A7%D8%B1%D8%A7%D8%AA-%D9%81%D8%B1%D8%AF%D9%8A%D8%A9-%D8%B4%D8%AE%D8%B5%D9%8A%D8%A9-%D9%81%D9%8A-%D8%A7%D9%84%D8%AD%D9%8A%D8%A7%D8%A9-%D8%A7%D9%84%D9%8A%D9%88%D9%85%D9%8A%D8%A9
طريقة إبداعية في حفظ واسترجاع المعلومات ( نصوص -آيات-تواريخ),.Mahmoud B,0,0,Aucun avis,أسلوب حياة,تنمية شخصية,"برمجة, حلول, تعليم, تدريب, تحفيظ",https://khamsat.com/lifestyle/life-coaching/3877993-%D8%B7%D8%B1%D9%8A%D9%82%D8%A9-%D8%A5%D8%A8%D8%AF%D8%A7%D8%B9%D9%8A%D8%A9-%D9%81%D9%8A-%D8%AD%D9%81%D8%B8-%D9%88%D8%A7%D8%B3%D8%AA%D8%B1%D8%AC%D8%A7%D8%B9-%D8%A7%D9%84%D9%85%D8%B9%D9%84%D9%88%D9%85%D8%A7%D8%AA-%D9%86%D8%B5%D9%88%D8%B5-%D8%A2%D9%8A%D8%A7%D8%AA-%D8%AA%D9%88%D8%A7%D8%B1%D9%8A%D8%AE
استشارات نفسية وجلسات فضفضة,.Mahmoud B,0,0,Aucun avis,أسلوب حياة,تنمية شخصية,"دعم, إستشارات, فضفضة, نفسي, استشارات نفسية",https://khamsat.com/lifestyle/life-coaching/3471741-%D8%A7%D8%B3%D8%AA%D8%B4%D8%A7%D8%B1%D8%A7%D8%AA-%D9%86%D9%81%D8%B3%D9%8A%D8%A9-%D9%88%D8%AC%D9%84%D8%B3%D8%A7%D8%AA-%D9%81%D8%B6%D9%81%D8%B6%D8%A9
مقياس  MBTI  العالمي لتعرف اكثر على شخصيتك !,حسام ا.,0,0,Aucun avis,أسلوب حياة,تنمية شخصية,"نصائح, تحليل, دراسة, شخصية, عالمي, نقاط, عالميا, نفسية, شخصيات, قوة, متنوعة, مقياس, ضعف, اختلاف",https://khamsat.com/lifestyle/life-coaching/1020851-%D9%85%D9%82%D9%8A%D8%A7%D8%B3-mbti-%D8%A7%D9%84%D8%B9%D8%A7%D9%84%D9%85%D9%8A-%D9%84%D8%AA%D8%B9%D8%B1%D9%81-%D8%A7%D9%83%D8%AB%D8%B1-%D8%B9%D9%84%D9%89-%D8%B4%D8%AE%D8%B5%D9%8A%D8%AA%D9%83
الخدمة الشاملة تخطيط ومتابعة التغذية والتمارين,.Mahmoud Y,1,1,منذ 5 أيام و4 ساعات,أسلوب حياة,صحة وجمال,"صحة, تخسيس, رياضة, تغذية, تمارين",https://khamsat.com/lifestyle/nutrition/3904990-%D8%A7%D9%84%D8%AE%D8%AF%D9%85%D8%A9-%D8%A7%D9%84%D8%B4%D8%A7%D9%85%D9%84%D8%A9-%D8%AA%D8%AE%D8%B7%D9%8A%D8%B7-%D9%88%D9%85%D8%AA%D8%A7%D8%A8%D8%B9%D8%A9-%D8%A7%D9%84%D8%AA%D8%BA%D8%B0%D9%8A%D8%A9-%D9%88%D8%A7%D9%84%D8%AA%D9%85%D8%A7%D8%B1%D9%8A%D9%86
متابعة تغذية  حالات سمنة ونحافة,.Mahmoud Y,28,20,منذ شهر و18 يوم,أسلوب حياة,صحة وجمال,"الصحة, تخسيس, وزن, صحي, تغذية",https://khamsat.com/lifestyle/nutrition/2830890-%D9%85%D8%AA%D8%A7%D8%A8%D8%B9%D8%A9-%D8%AA%D8%BA%D8%B0%D9%8A%D8%A9-%D8%AD%D8%A7%D9%84%D8%A7%D8%AA-%D8%B3%D9%85%D9%86%D8%A9-%D9%88%D9%86%D8%AD%D8%A7%D9%81%D8%A9
تخطيط ومتابعة أنظمة غذائية لضبط الوزن وأسلوب حياة وصحة افضل,ريهام م.,5,5,منذ شهر و14 يوم,أسلوب حياة,صحة وجمال,"استشارات, صحة, برنامج, تخسيس, تغذية",https://khamsat.com/lifestyle/nutrition/2920213-%D8%AA%D8%AE%D8%B7%D9%8A%D8%B7-%D9%88%D9%85%D8%AA%D8%A7%D8%A8%D8%B9%D8%A9-%D8%A3%D9%86%D8%B8%D9%85%D8%A9-%D8%BA%D8%B0%D8%A7%D8%A6%D9%8A%D8%A9-%D9%84%D8%B6%D8%A8%D8%B7-%D8%A7%D9%84%D9%88%D8%B2%D9%86-%D9%88%D8%A3%D8%B3%D9%84%D9%88%D8%A8-%D8%AD%D9%8A%D8%A7%D8%A9-%D9%88%D8%B5%D8%AD%D8%A9-%D8%A7%D9%81%D8%B6%D9%84
حساب القيمة الغذائية للمنتجات الغذائية,عمار ر.,1,0,Aucun avis,أسلوب حياة,صحة وجمال,"القيمة, سعرات, غذائية, nutrition, calories",https://khamsat.com/lifestyle/nutrition/3195857-%D8%AD%D8%B3%D8%A7%D8%A8-%D8%A7%D9%84%D9%82%D9%8A%D9%85%D8%A9-%D8%A7%D9%84%D8%BA%D8%B0%D8%A7%D8%A6%D9%8A%D8%A9-%D9%84%D9%84%D9%85%D9%86%D8%AA%D8%AC%D8%A7%D8%AA-%D8%A7%D9%84%D8%BA%D8%B0%D8%A7%D8%A6%D9%8A%D8%A9
حساب السعرات اليومية وسعرات اي طبق غذائي او جدول طعام صحي,مريم س.,2,2,منذ سنة و5 أيام,أسلوب حياة,صحة وجمال,"تغذية علاجية, تغذية صحية, جدول غذائي صحي, حساب السعرات, حساب الماكروز",https://khamsat.com/lifestyle/nutrition/2460054-%D8%AD%D8%B3%D8%A7%D8%A8-%D8%A7%D9%84%D8%B3%D8%B9%D8%B1%D8%A7%D8%AA-%D8%A7%D9%84%D9%8A%D9%88%D9%85%D9%8A%D8%A9-%D9%88%D8%B3%D8%B9%D8%B1%D8%A7%D8%AA-%D8%A7%D9%8A-%D8%B7%D8%A8%D9%82-%D8%BA%D8%B0%D8%A7%D8%A6%D9%8A-%D8%A7%D9%88-%D8%AC%D8%AF%D9%88%D9%84-%D8%B7%D8%B9%D8%A7%D9%85-%D8%B5%D8%AD%D9%8A
حساب السعرات الحرارية و تحديد المكونات الغذائية في طعامك,روعة س.,1,1,منذ 3 أشهر و25 يوم,أسلوب حياة,صحة وجمال,"صحة, غذاء, منتج, وزن, تغذية",https://khamsat.com/lifestyle/nutrition/2256345-%D8%AD%D8%B3%D8%A7%D8%A8-%D8%A7%D9%84%D8%B3%D8%B9%D8%B1%D8%A7%D8%AA-%D8%A7%D9%84%D8%AD%D8%B1%D8%A7%D8%B1%D9%8A%D8%A9-%D9%88-%D8%AA%D8%AD%D8%AF%D9%8A%D8%AF-%D8%A7%D9%84%D9%85%D9%83%D9%88%D9%86%D8%A7%D8%AA-%D8%A7%D9%84%D8%BA%D8%B0%D8%A7%D8%A6%D9%8A%D8%A9-%D9%81%D9%8A-%D8%B7%D8%B9%D8%A7%D9%85%D9%83
وصفات طبخ محسوبة السعرات شاملة المكونات وطريقة الاعداد,مريم س.,2,2,منذ 8 أشهر و6 أيام,أسلوب حياة,صحة وجمال,"صحة, تغذية, اكل, وصفات, طعام",https://khamsat.com/lifestyle/nutrition/3094272-%D9%88%D8%B5%D9%81%D8%A7%D8%AA-%D8%B7%D8%A8%D8%AE-%D9%85%D8%AD%D8%B3%D9%88%D8%A8%D8%A9-%D8%A7%D9%84%D8%B3%D8%B9%D8%B1%D8%A7%D8%AA-%D8%B4%D8%A7%D9%85%D9%84%D8%A9-%D8%A7%D9%84%D9%85%D9%83%D9%88%D9%86%D8%A7%D8%AA-%D9%88%D8%B7%D8%B1%D9%8A%D9%82%D8%A9-%D8%A7%D9%84%D8%A7%D8%B9%D8%AF%D8%A7%D8%AF
حساب الاستهلاك اليومي للغذاء  عبر برنامج Aisha Food Process,عمار ر.,0,0,Aucun avis,أسلوب حياة,صحة وجمال,"تغذية, خطة غذائية, تحليل الوجبات, تقييم الوجبات, الاستهلاك اليومي",https://khamsat.com/lifestyle/nutrition/3928541-%D8%AD%D8%B3%D8%A7%D8%A8-%D8%A7%D9%84%D8%A7%D8%B3%D8%AA%D9%87%D9%84%D8%A7%D9%83-%D8%A7%D9%84%D9%8A%D9%88%D9%85%D9%8A-%D9%84%D9%84%D8%BA%D8%B0%D8%A7%D8%A1-%D8%B9%D8%A8%D8%B1-%D8%A8%D8%B1%D9%86%D8%A7%D9%85%D8%AC-aisha-food-process
تصميم برنامج غذائي صحي ومتوازن لفقدان او زيادة الوزن,.Intissar K,1,0,Aucun avis,أسلوب حياة,صحة وجمال,"الصحة, رياضة, تغذية, الجمال, فقدان الوزن",https://khamsat.com/lifestyle/nutrition/3125508-%D8%AA%D8%B5%D9%85%D9%8A%D9%85-%D8%A8%D8%B1%D9%86%D8%A7%D9%85%D8%AC-%D8%BA%D8%B0%D8%A7%D8%A6%D9%8A-%D8%B5%D8%AD%D9%8A-%D9%88%D9%85%D8%AA%D9%88%D8%A7%D8%B2%D9%86-%D9%84%D9%81%D9%82%D8%AF%D8%A7%D9%86-%D8%A7%D9%88-%D8%B2%D9%8A%D8%A7%D8%AF%D8%A9-%D8%A7%D9%84%D9%88%D8%B2%D9%86
خطة الـ60 يوم للتنشيف من السمنة إلى الوزن المثالي,.Qussai M,27,12,منذ 17 ساعة و31 دقيقة,أسلوب حياة,صحة وجمال,"صحة, تخسيس, تغذية, لياقة, زيادة وزن",https://khamsat.com/lifestyle/nutrition/3899023-%D8%AE%D8%B7%D8%A9-%D8%A7%D9%84%D9%8060-%D9%8A%D9%88%D9%85-%D9%84%D9%84%D8%AA%D9%86%D8%B4%D9%8A%D9%81-%D9%85%D9%86-%D8%A7%D9%84%D8%B3%D9%85%D9%86%D8%A9-%D8%A5%D9%84%D9%89-%D8%A7%D9%84%D9%88%D8%B2%D9%86-%D8%A7%D9%84%D9%85%D8%AB%D8%A7%D9%84%D9%8A
ريجيم قاراطاي لإنقاص الوزن وحياة صحية,.Soha Z,0,0,Aucun avis,أسلوب حياة,صحة وجمال,ريجيم,https://khamsat.com/lifestyle/nutrition/2421036-%D8%B1%D9%8A%D8%AC%D9%8A%D9%85-%D9%82%D8%A7%D8%B1%D8%A7%D8%B7%D8%A7%D9%8A-%D9%84%D8%A5%D9%86%D9%82%D8%A7%D8%B5-%D8%A7%D9%84%D9%88%D8%B2%D9%86-%D9%88%D8%AD%D9%8A%D8%A7%D8%A9-%D8%B5%D8%AD%D9%8A%D8%A9
تصميم جدول غذائي ذكي باستخدام التكنولوجيا الحيوية,.Sondos M,1,1,منذ 5 أشهر و24 يوم,أسلوب حياة,صحة وجمال,"تصميم, استشارات, صحة, رياضة, تغذية",https://khamsat.com/lifestyle/nutrition/3251182-%D8%AA%D8%B5%D9%85%D9%8A%D9%85-%D8%AC%D8%AF%D9%88%D9%84-%D8%BA%D8%B0%D8%A7%D8%A6%D9%8A-%D8%B0%D9%83%D9%8A-%D8%A8%D8%A7%D8%B3%D8%AA%D8%AE%D8%AF%D8%A7%D9%85-%D8%A7%D9%84%D8%AA%D9%83%D9%86%D9%88%D9%84%D9%88%D8%AC%D9%8A%D8%A7-%D8%A7%D9%84%D8%AD%D9%8A%D9%88%D9%8A%D8%A9
كتابة خطط تغذية علاجية مخصصة لك مع متابعة دقيقة,.Jollanar S,1,1,منذ 12 يوم و22 ساعة,أسلوب حياة,صحة وجمال,"استشارات, نظام, علاج, الصحة, تغذية",https://khamsat.com/lifestyle/nutrition/3886085-%D9%83%D8%AA%D8%A7%D8%A8%D8%A9-%D8%AE%D8%B7%D8%B7-%D8%AA%D8%BA%D8%B0%D9%8A%D8%A9-%D8%B9%D9%84%D8%A7%D8%AC%D9%8A%D8%A9-%D9%85%D8%AE%D8%B5%D8%B5%D8%A9-%D9%84%D9%83-%D9%85%D8%B9-%D9%85%D8%AA%D8%A7%D8%A8%D8%B9%D8%A9-%D8%AF%D9%82%D9%8A%D9%82%D8%A9
انظمة غذائيه سمنة ونحافة وتغذية علاجية,.Marwa K,0,0,Aucun avis,أسلوب حياة,صحة وجمال,"تخسيس, اسلوب حياه, انظمة غدائية, علاج السمنه, علاج النحافه",https://khamsat.com/lifestyle/nutrition/2660230-%D8%A7%D9%86%D8%B8%D9%85%D8%A9-%D8%BA%D8%B0%D8%A7%D8%A6%D9%8A%D9%87-%D8%B3%D9%85%D9%86%D8%A9-%D9%88%D9%86%D8%AD%D8%A7%D9%81%D8%A9-%D9%88%D8%AA%D8%BA%D8%B0%D9%8A%D8%A9-%D8%B9%D9%84%D8%A7%D8%AC%D9%8A%D8%A9
نظام غذائي مخصص للتخسيس أو زيادة الوزن لجميع الأعمار,.Alaa M,0,0,Aucun avis,أسلوب حياة,صحة وجمال,"صحة, تخسيس, رياضة, وزن, تغذية",https://khamsat.com/lifestyle/nutrition/3606098-%D9%86%D8%B8%D8%A7%D9%85-%D8%BA%D8%B0%D8%A7%D8%A6%D9%8A-%D9%85%D8%AE%D8%B5%D8%B5-%D9%84%D9%84%D8%AA%D8%AE%D8%B3%D9%8A%D8%B3-%D8%A3%D9%88-%D8%B2%D9%8A%D8%A7%D8%AF%D8%A9-%D8%A7%D9%84%D9%88%D8%B2%D9%86-%D9%84%D8%AC%D9%85%D9%8A%D8%B9-%D8%A7%D9%84%D8%A3%D8%B9%D9%85%D8%A7%D8%B1
حساب السعرات الحرارية وسعرات الوجبة الغذائية التي تريد تناولها,هديل م.,0,0,Aucun avis,أسلوب حياة,صحة وجمال,"صحة, منتج, وزن, تغذية, القيمة",https://khamsat.com/lifestyle/nutrition/3919026-%D8%AD%D8%B3%D8%A7%D8%A8-%D8%A7%D9%84%D8%B3%D8%B9%D8%B1%D8%A7%D8%AA-%D8%A7%D9%84%D8%AD%D8%B1%D8%A7%D8%B1%D9%8A%D8%A9-%D9%88%D8%B3%D8%B9%D8%B1%D8%A7%D8%AA-%D8%A7%D9%84%D9%88%D8%AC%D8%A8%D8%A9-%D8%A7%D9%84%D8%BA%D8%B0%D8%A7%D8%A6%D9%8A%D8%A9-%D8%A7%D9%84%D8%AA%D9%8A-%D8%AA%D8%B1%D9%8A%D8%AF-%D8%AA%D9%86%D8%A7%D9%88%D9%84%D9%87%D8%A7
تصميم برامج غذائية متوازنة لإنقاص أو زيادة الوزن,.Rehab M,0,0,Aucun avis,أسلوب حياة,صحة وجمال,"مقالات, كتابة محتوى, صحة, صحي, تغذية",https://khamsat.com/lifestyle/nutrition/3679021-%D8%AA%D8%B5%D9%85%D9%8A%D9%85-%D8%A8%D8%B1%D8%A7%D9%85%D8%AC-%D8%BA%D8%B0%D8%A7%D8%A6%D9%8A%D8%A9-%D9%85%D8%AA%D9%88%D8%A7%D8%B2%D9%86%D8%A9-%D9%84%D8%A5%D9%86%D9%82%D8%A7%D8%B5-%D8%A3%D9%88-%D8%B2%D9%8A%D8%A7%D8%AF%D8%A9-%D8%A7%D9%84%D9%88%D8%B2%D9%86
تخطيط ومتابعة الوزن للوصول الى الجسم المثالي,.Muhammad O,0,0,Aucun avis,أسلوب حياة,صحة وجمال,"استشارات, صحة, تخسيس, تغذية, حرق دهون",https://khamsat.com/lifestyle/nutrition/3892867-%D8%AA%D8%AE%D8%B7%D9%8A%D8%B7-%D9%88%D9%85%D8%AA%D8%A7%D8%A8%D8%B9%D8%A9-%D8%A7%D9%84%D9%88%D8%B2%D9%86-%D9%84%D9%84%D9%88%D8%B5%D9%88%D9%84-%D8%A7%D9%84%D9%89-%D8%A7%D9%84%D8%AC%D8%B3%D9%85-%D8%A7%D9%84%D9%85%D8%AB%D8%A7%D9%84%D9%8A
دليلك للحصول على البورد الأمريكي في جودة الرعاية الصحية CPHQ,بكري أ.,9,5,منذ 11 شهر و15 يوم,أسلوب حياة,صحة وجمال,"جودة, شهادة, دليلك, الصحية, الرعاية",https://khamsat.com/lifestyle/nutrition/2135951-%D8%AF%D9%84%D9%8A%D9%84%D9%83-%D9%84%D9%84%D8%AD%D8%B5%D9%88%D9%84-%D8%B9%D9%84%D9%89-%D8%A7%D9%84%D8%A8%D9%88%D8%B1%D8%AF-%D8%A7%D9%84%D8%A3%D9%85%D8%B1%D9%8A%D9%83%D9%8A-%D9%81%D9%8A-%D8%AC%D9%88%D8%AF%D8%A9-%D8%A7%D9%84%D8%B1%D8%B9%D8%A7%D9%8A%D8%A9-%D8%A7%D9%84%D8%B5%D8%AD%D9%8A%D8%A9-cphq
