Titre,Vendeur,Acheteurs,Notes,Date Dernier Avis,Catégorie,Sous-Catégorie,Mots Clés,Lien
كتابة مقالات علمية باللغة العربية/انكليزية,مهى ر.,4,3,منذ 3 سنوات و6 أشهر,كتابة وترجمة,محتوى مواقع,"علوم, مقال, موضوع, سيو",https://khamsat.com/writing/articles-blogposts/1998614-%D9%83%D8%AA%D8%A7%D8%A8%D8%A9-%D9%85%D9%82%D8%A7%D9%84%D8%A7%D8%AA-%D8%B9%D9%84%D9%85%D9%8A%D8%A9-%D8%A8%D8%A7%D9%84%D9%84%D8%BA%D8%A9-%D8%A7%D9%84%D8%B9%D8%B1%D8%A8%D9%8A%D8%A9%D8%A7%D9%86%D9%83%D9%84%D9%8A%D8%B2%D9%8A%D8%A9
كتابة 3 مقالات حصرية فى كافة المجالات,.Omar A,2,2,منذ 7 سنوات و9 أشهر,كتابة وترجمة,محتوى مواقع,"مقالات, حصرية, seo, سيو, متنوعة",https://khamsat.com/writing/articles-blogposts/834636-%D9%83%D8%AA%D8%A7%D8%A8%D8%A9-3-%D9%85%D9%82%D8%A7%D9%84%D8%A7%D8%AA-%D8%AD%D8%B5%D8%B1%D9%8A%D8%A9-%D9%81%D9%89-%D9%83%D8%A7%D9%81%D8%A9-%D8%A7%D9%84%D9%85%D8%AC%D8%A7%D9%84%D8%A7%D8%AA
ساقدم لك مقال,.Munira S,0,0,Aucun avis,كتابة وترجمة,محتوى مواقع,"كتابة, مقالات, تطوير الذات, كتابة مقالات, مقالات حصرية",https://khamsat.com/writing/articles-blogposts/2963121-%D8%B3%D8%A7%D9%82%D8%AF%D9%85-%D9%84%D9%83-%D9%85%D9%82%D8%A7%D9%84
خدمة كتابة مقالات ومواضيع الحصرية في جميع المجالات .,محمد ن.,21,18,منذ سنتين و9 أشهر,كتابة وترجمة,محتوى مواقع,"كتابة, مقالات, تدوين, تقارير, سيو",https://khamsat.com/writing/articles-blogposts/208350-%D8%AE%D8%AF%D9%85%D8%A9-%D9%83%D8%AA%D8%A7%D8%A8%D8%A9-%D9%85%D9%82%D8%A7%D9%84%D8%A7%D8%AA-%D9%88%D9%85%D9%88%D8%A7%D8%B6%D9%8A%D8%B9-%D8%A7%D9%84%D8%AD%D8%B5%D8%B1%D9%8A%D8%A9-%D9%81%D9%8A-%D8%AC%D9%85%D9%8A%D8%B9-%D8%A7%D9%84%D9%85%D8%AC%D8%A7%D9%84%D8%A7%D8%AA-
كتابة مقالات تتصدر نتائج البحث في جميع المجالات,فارس ع.,0,0,Aucun avis,كتابة وترجمة,محتوى مواقع,"wordpress, blogger, seo, كتابة مقالات, المدونة",https://khamsat.com/writing/articles-blogposts/3392634-%D9%83%D8%AA%D8%A7%D8%A8%D8%A9-%D9%85%D9%82%D8%A7%D9%84%D8%A7%D8%AA-%D8%AA%D8%AA%D8%B5%D8%AF%D8%B1-%D9%86%D8%AA%D8%A7%D8%A6%D8%AC-%D8%A7%D9%84%D8%A8%D8%AD%D8%AB-%D9%81%D9%8A-%D8%AC%D9%85%D9%8A%D8%B9-%D8%A7%D9%84%D9%85%D8%AC%D8%A7%D9%84%D8%A7%D8%AA
كتابة مقال حصري احترافي باللغة العربية في أي مجال,حفصه م.,0,0,Aucun avis,كتابة وترجمة,محتوى مواقع,"ترجمة, كتابة, مقالات",https://khamsat.com/writing/articles-blogposts/3867503-%D9%83%D8%AA%D8%A7%D8%A8%D8%A9-%D9%85%D9%82%D8%A7%D9%84-%D8%AD%D8%B5%D8%B1%D9%8A-%D8%A7%D8%AD%D8%AA%D8%B1%D8%A7%D9%81%D9%8A-%D8%A8%D8%A7%D9%84%D9%84%D8%BA%D8%A9-%D8%A7%D9%84%D8%B9%D8%B1%D8%A8%D9%8A%D8%A9-%D9%81%D9%8A-%D8%A3%D9%8A-%D9%85%D8%AC%D8%A7%D9%84
كتابة محتوى احترافي يدعم SEO,روان ح.,0,0,Aucun avis,كتابة وترجمة,محتوى مواقع,"كتابه, لوجو, كتابة, محتوى, احترافي",https://khamsat.com/writing/articles-blogposts/3824340-%D9%83%D8%AA%D8%A7%D8%A8%D8%A9-%D9%85%D8%AD%D8%AA%D9%88%D9%89-%D8%A7%D8%AD%D8%AA%D8%B1%D8%A7%D9%81%D9%8A-%D9%8A%D8%AF%D8%B9%D9%85-seo
كتابة مقالات SEO احترافية بالعربية أو الألمانية | أسلوب بشري,.Abdallah A,0,0,Aucun avis,كتابة وترجمة,محتوى مواقع,"كتابة محتوى مواقع, seo, كتابة إبداعية, كتابةمقالات",https://khamsat.com/writing/articles-blogposts/3586575-%D9%83%D8%AA%D8%A7%D8%A8%D8%A9-%D9%85%D9%82%D8%A7%D9%84%D8%A7%D8%AA-seo-%D8%A7%D8%AD%D8%AA%D8%B1%D8%A7%D9%81%D9%8A%D8%A9-%D8%A8%D8%A7%D9%84%D8%B9%D8%B1%D8%A8%D9%8A%D8%A9-%D8%A3%D9%88-%D8%A7%D9%84%D8%A3%D9%84%D9%85%D8%A7%D9%86%D9%8A%D8%A9-%D8%A3%D8%B3%D9%84%D9%88%D8%A8-%D8%A8%D8%B4%D8%B1%D9%8A
كتابة مقالات بكافة المجالات متوافقة مع SEO,محمد م.,0,0,Aucun avis,كتابة وترجمة,محتوى مواقع,"كتابة, seo, سيو, كتابة المقالات, تحسين محركات البحث",https://khamsat.com/writing/articles-blogposts/3424533-%D9%83%D8%AA%D8%A7%D8%A8%D8%A9-%D9%85%D9%82%D8%A7%D9%84%D8%A7%D8%AA-%D8%A8%D9%83%D8%A7%D9%81%D8%A9-%D8%A7%D9%84%D9%85%D8%AC%D8%A7%D9%84%D8%A7%D8%AA-%D9%85%D8%AA%D9%88%D8%A7%D9%81%D9%82%D8%A9-%D9%85%D8%B9-seo
كتابة مقالات أو محتوى متوافق مع قواعد السيو,.Abeer E,0,0,Aucun avis,كتابة وترجمة,محتوى مواقع,"مقالات, محركات البحث, محتوى مواقع, بوستات, تحسين السيو",https://khamsat.com/writing/articles-blogposts/3193742-%D9%83%D8%AA%D8%A7%D8%A8%D8%A9-%D9%85%D9%82%D8%A7%D9%84%D8%A7%D8%AA-%D8%A3%D9%88-%D9%85%D8%AD%D8%AA%D9%88%D9%89-%D9%85%D8%AA%D9%88%D8%A7%D9%81%D9%82-%D9%85%D8%B9-%D9%82%D9%88%D8%A7%D8%B9%D8%AF-%D8%A7%D9%84%D8%B3%D9%8A%D9%88
كتابة مقالات و تدوينات احترافية متوافقة مع معايير الـSEO,.Omar S,0,0,Aucun avis,كتابة وترجمة,محتوى مواقع,"كتابة, مقالات, تدوين, seo",https://khamsat.com/writing/articles-blogposts/3677577-%D9%83%D8%AA%D8%A7%D8%A8%D8%A9-%D9%85%D9%82%D8%A7%D9%84%D8%A7%D8%AA-%D9%88-%D8%AA%D8%AF%D9%88%D9%8A%D9%86%D8%A7%D8%AA-%D8%A7%D8%AD%D8%AA%D8%B1%D8%A7%D9%81%D9%8A%D8%A9-%D9%85%D8%AA%D9%88%D8%A7%D9%81%D9%82%D8%A9-%D9%85%D8%B9-%D9%85%D8%B9%D8%A7%D9%8A%D9%8A%D8%B1-%D8%A7%D9%84%D9%80seo
كتابة مقالات حصرية لموقعك,.Tareq M,2,2,منذ 3 سنوات و8 أشهر,كتابة وترجمة,محتوى مواقع,"عربية, موقع, كتابة, مواضيع, مقالات, موضوع",https://khamsat.com/writing/articles-blogposts/675052-%D9%83%D8%AA%D8%A7%D8%A8%D8%A9-%D9%85%D9%82%D8%A7%D9%84%D8%A7%D8%AA-%D8%AD%D8%B5%D8%B1%D9%8A%D8%A9-%D9%84%D9%85%D9%88%D9%82%D8%B9%D9%83
كتابة مقالات احترافية متوافقة مع الـ SEO تتصدر نتائج البحث,.Naima S,0,0,Aucun avis,كتابة وترجمة,محتوى مواقع,"كتابة, مقالات, كتابة مقالات, سيو, كاتب",https://khamsat.com/writing/articles-blogposts/2857942-%D9%83%D8%AA%D8%A7%D8%A8%D8%A9-%D9%85%D9%82%D8%A7%D9%84%D8%A7%D8%AA-%D8%A7%D8%AD%D8%AA%D8%B1%D8%A7%D9%81%D9%8A%D8%A9-%D9%85%D8%AA%D9%88%D8%A7%D9%81%D9%82%D8%A9-%D9%85%D8%B9-%D8%A7%D9%84%D9%80-seo-%D8%AA%D8%AA%D8%B5%D8%AF%D8%B1-%D9%86%D8%AA%D8%A7%D8%A6%D8%AC-%D8%A7%D9%84%D8%A8%D8%AD%D8%AB
كتابة مقالات تتوافق مع السيو,.Asmaa A,0,0,Aucun avis,كتابة وترجمة,محتوى مواقع,"مقالات, كتابة محتوى, word, السيو, كتابة إبداعية",https://khamsat.com/writing/articles-blogposts/3805288-%D9%83%D8%AA%D8%A7%D8%A8%D8%A9-%D9%85%D9%82%D8%A7%D9%84%D8%A7%D8%AA-%D8%AA%D8%AA%D9%88%D8%A7%D9%81%D9%82-%D9%85%D8%B9-%D8%A7%D9%84%D8%B3%D9%8A%D9%88
كتابة مقالات متنوعة بطريقة احترافية ومبدعة,هاجر ع.,0,0,Aucun avis,كتابة وترجمة,محتوى مواقع,"اعلان, ترجمة, فرنسية, كتاب, مقال",https://khamsat.com/writing/articles-blogposts/3798724-%D9%83%D8%AA%D8%A7%D8%A8%D8%A9-%D9%85%D9%82%D8%A7%D9%84%D8%A7%D8%AA-%D9%85%D8%AA%D9%86%D9%88%D8%B9%D8%A9-%D8%A8%D8%B7%D8%B1%D9%8A%D9%82%D8%A9-%D8%A7%D8%AD%D8%AA%D8%B1%D8%A7%D9%81%D9%8A%D8%A9-%D9%88%D9%85%D8%A8%D8%AF%D8%B9%D8%A9
كتابة مقالات إبداعية وفقاً لقواعد ال SEO,.Mennatallah O,0,0,Aucun avis,كتابة وترجمة,محتوى مواقع,"wordpress, كتابه المقالات بطريقة مميزة",https://khamsat.com/writing/articles-blogposts/2451513-%D9%83%D8%AA%D8%A7%D8%A8%D8%A9-%D9%85%D9%82%D8%A7%D9%84%D8%A7%D8%AA-%D8%A5%D8%A8%D8%AF%D8%A7%D8%B9%D9%8A%D8%A9-%D9%88%D9%81%D9%82%D8%A7-%D9%84%D9%82%D9%88%D8%A7%D8%B9%D8%AF-%D8%A7%D9%84-seo
مقالات عربية احترافية متوافقة مع السيو لزيادة ظهور موقعك,خديجة وسام ر.,0,0,Aucun avis,كتابة وترجمة,محتوى مواقع,"العربية, مقالات, حصرية, seo, سيو",https://khamsat.com/writing/articles-blogposts/3130025-%D9%85%D9%82%D8%A7%D9%84%D8%A7%D8%AA-%D8%B9%D8%B1%D8%A8%D9%8A%D8%A9-%D8%A7%D8%AD%D8%AA%D8%B1%D8%A7%D9%81%D9%8A%D8%A9-%D9%85%D8%AA%D9%88%D8%A7%D9%81%D9%82%D8%A9-%D9%85%D8%B9-%D8%A7%D9%84%D8%B3%D9%8A%D9%88-%D9%84%D8%B2%D9%8A%D8%A7%D8%AF%D8%A9-%D8%B8%D9%87%D9%88%D8%B1-%D9%85%D9%88%D9%82%D8%B9%D9%83
أكتب لك مقالات حصرية متوافقة مع SEO باللغة العربية,زكرياء ز.,0,0,Aucun avis,كتابة وترجمة,محتوى مواقع,"كتابة, مقالات, كتابة مقالات, تدوينات, كتابة مقالات حصرية",https://khamsat.com/writing/articles-blogposts/3788476-%D8%A3%D9%83%D8%AA%D8%A8-%D9%84%D9%83-%D9%85%D9%82%D8%A7%D9%84%D8%A7%D8%AA-%D8%AD%D8%B5%D8%B1%D9%8A%D8%A9-%D9%85%D8%AA%D9%88%D8%A7%D9%81%D9%82%D8%A9-%D9%85%D8%B9-seo-%D8%A8%D8%A7%D9%84%D9%84%D8%BA%D8%A9-%D8%A7%D9%84%D8%B9%D8%B1%D8%A8%D9%8A%D8%A9
إعداد تقرير أكاديمي منسق عن الذكاء الاصطناعي,سناء م.,0,0,Aucun avis,كتابة وترجمة,محتوى مواقع,"كتابة, pdf, تقرير, أبحاث علمية, كاتب محتوى",https://khamsat.com/writing/articles-blogposts/3666885-%D8%A5%D8%B9%D8%AF%D8%A7%D8%AF-%D8%AA%D9%82%D8%B1%D9%8A%D8%B1-%D8%A3%D9%83%D8%A7%D8%AF%D9%8A%D9%85%D9%8A-%D9%85%D9%86%D8%B3%D9%82-%D8%B9%D9%86-%D8%A7%D9%84%D8%B0%D9%83%D8%A7%D8%A1-%D8%A7%D9%84%D8%A7%D8%B5%D8%B7%D9%86%D8%A7%D8%B9%D9%8A
كتابة مقالات وابحاث على WORD وعمل ملفات PDF,سليمان ا.,0,0,Aucun avis,كتابة وترجمة,محتوى مواقع,"كتابة, word, كتابة السيرة الذاتية, كتابة مقالات, كتابة بحث",https://khamsat.com/writing/articles-blogposts/3089426-%D9%83%D8%AA%D8%A7%D8%A8%D8%A9-%D9%85%D9%82%D8%A7%D9%84%D8%A7%D8%AA-%D9%88%D8%A7%D8%A8%D8%AD%D8%A7%D8%AB-%D8%B9%D9%84%D9%89-word-%D9%88%D8%B9%D9%85%D9%84-%D9%85%D9%84%D9%81%D8%A7%D8%AA-pdf
الكتابة على الوورد word باللغات : عربية - فرنسية - انجليزية,.Soufiane Z,0,0,Aucun avis,كتابة وترجمة,محتوى مواقع,"رسومات, كتابة, وورد, word, تنسيق, مشاريع, تصحيح, بيانات, ادخال, franais",https://khamsat.com/writing/articles-blogposts/250224-%D8%A7%D9%84%D9%83%D8%AA%D8%A7%D8%A8%D8%A9-%D8%B9%D9%84%D9%89-%D8%A7%D9%84%D9%88%D9%88%D8%B1%D8%AF-word-%D8%A8%D8%A7%D9%84%D9%84%D8%BA%D8%A7%D8%AA-%D8%B9%D8%B1%D8%A8%D9%8A%D8%A9-%D9%81%D8%B1%D9%86%D8%B3%D9%8A%D8%A9-%D8%A7%D9%86%D8%AC%D9%84%D9%8A%D8%B2%D9%8A%D8%A9
كتابة مقالات احترافية بالعربية والإنجليزية في جميع المجالات,.Idris M,0,0,Aucun avis,كتابة وترجمة,محتوى مواقع,"مقالات, سيو, كتابة مقالات حصرية, أكاديمي, كتابةمقالات",https://khamsat.com/writing/articles-blogposts/3597221-%D9%83%D8%AA%D8%A7%D8%A8%D8%A9-%D9%85%D9%82%D8%A7%D9%84%D8%A7%D8%AA-%D8%A7%D8%AD%D8%AA%D8%B1%D8%A7%D9%81%D9%8A%D8%A9-%D8%A8%D8%A7%D9%84%D8%B9%D8%B1%D8%A8%D9%8A%D8%A9-%D9%88%D8%A7%D9%84%D8%A5%D9%86%D8%AC%D9%84%D9%8A%D8%B2%D9%8A%D8%A9-%D9%81%D9%8A-%D8%AC%D9%85%D9%8A%D8%B9-%D8%A7%D9%84%D9%85%D8%AC%D8%A7%D9%84%D8%A7%D8%AA
كتابة مقالات متوافقة مع قواعد السيو SEO,.Mohamed E,0,0,Aucun avis,كتابة وترجمة,محتوى مواقع,"كتابة, مقالات, محتوى, كتابة مقالات, كتابة مقالات حصرية",https://khamsat.com/writing/articles-blogposts/3584159-%D9%83%D8%AA%D8%A7%D8%A8%D8%A9-%D9%85%D9%82%D8%A7%D9%84%D8%A7%D8%AA-%D9%85%D8%AA%D9%88%D8%A7%D9%81%D9%82%D8%A9-%D9%85%D8%B9-%D9%82%D9%88%D8%A7%D8%B9%D8%AF-%D8%A7%D9%84%D8%B3%D9%8A%D9%88-seo
كتابة مقالات حصرية متوافقة مع (SEO),.Mohamed E,0,0,Aucun avis,كتابة وترجمة,محتوى مواقع,"تدقيق لغوي, كتابة, seo, كتابة مقالات حصرية, تصدر نتائج البحث",https://khamsat.com/writing/articles-blogposts/3723440-%D9%83%D8%AA%D8%A7%D8%A8%D8%A9-%D9%85%D9%82%D8%A7%D9%84%D8%A7%D8%AA-%D8%AD%D8%B5%D8%B1%D9%8A%D8%A9-%D9%85%D8%AA%D9%88%D8%A7%D9%81%D9%82%D8%A9-%D9%85%D8%B9-seo
كتابة مقالات أو محتوى عربي احترافي بأسلوب جذّاب ومتقن.,.Doha M,0,0,Aucun avis,كتابة وترجمة,محتوى مواقع,"كتابة مقالات, كتابة ابداعية, كاتبة محتوى, محتوى عربي",https://khamsat.com/writing/articles-blogposts/3858804-%D9%83%D8%AA%D8%A7%D8%A8%D8%A9-%D9%85%D9%82%D8%A7%D9%84%D8%A7%D8%AA-%D8%A3%D9%88-%D9%85%D8%AD%D8%AA%D9%88%D9%89-%D8%B9%D8%B1%D8%A8%D9%8A-%D8%A7%D8%AD%D8%AA%D8%B1%D8%A7%D9%81%D9%8A-%D8%A8%D8%A3%D8%B3%D9%84%D9%88%D8%A8-%D8%AC%D8%B0%D8%A7%D8%A8-%D9%88%D9%85%D8%AA%D9%82%D9%86
أنا كاتبة محتوى محترفة أمتلك خبرة في إعداد وكتابة المقالات,نعمة الله ج.,1,1,منذ يومين و29 دقيقة,كتابة وترجمة,محتوى مواقع,"مقالات, كتابة محتوى, كتابة مقالات, تحسين محركات البحث, تحسين السيو",https://khamsat.com/writing/articles-blogposts/3891751-%D8%A3%D9%86%D8%A7-%D9%83%D8%A7%D8%AA%D8%A8%D8%A9-%D9%85%D8%AD%D8%AA%D9%88%D9%89-%D9%85%D8%AD%D8%AA%D8%B1%D9%81%D8%A9-%D8%A3%D9%85%D8%AA%D9%84%D9%83-%D8%AE%D8%A8%D8%B1%D8%A9-%D9%81%D9%8A-%D8%A5%D8%B9%D8%AF%D8%A7%D8%AF-%D9%88%D9%83%D8%AA%D8%A7%D8%A8%D8%A9-%D8%A7%D9%84%D9%85%D9%82%D8%A7%D9%84%D8%A7%D8%AA
كتابة مقالة احترافية  عن اي موضوع تريده,حبيبه س.,0,0,Aucun avis,كتابة وترجمة,محتوى مواقع,"سيو, كتابه محتوي, كتابه محتوي مواقع, محتوي باللغة العربية, كتابه مقالات احترافيه",https://khamsat.com/writing/articles-blogposts/3186819-%D9%83%D8%AA%D8%A7%D8%A8%D8%A9-%D9%85%D9%82%D8%A7%D9%84%D8%A9-%D8%A7%D8%AD%D8%AA%D8%B1%D8%A7%D9%81%D9%8A%D8%A9-%D8%B9%D9%86-%D8%A7%D9%8A-%D9%85%D9%88%D8%B6%D9%88%D8%B9-%D8%AA%D8%B1%D9%8A%D8%AF%D9%87
رفع مقالات على ووردبريس وتحسين السيو بشكل احترافي,ضحى ر.,0,0,Aucun avis,كتابة وترجمة,محتوى مواقع,"كتابة مقالات, كلمات مفتاحية, تحسين السيو, رفع مقالات, نشر مقالات على الورد بريس",https://khamsat.com/writing/articles-blogposts/3075342-%D8%B1%D9%81%D8%B9-%D9%85%D9%82%D8%A7%D9%84%D8%A7%D8%AA-%D8%B9%D9%84%D9%89-%D9%88%D9%88%D8%B1%D8%AF%D8%A8%D8%B1%D9%8A%D8%B3-%D9%88%D8%AA%D8%AD%D8%B3%D9%8A%D9%86-%D8%A7%D9%84%D8%B3%D9%8A%D9%88-%D8%A8%D8%B4%D9%83%D9%84-%D8%A7%D8%AD%D8%AA%D8%B1%D8%A7%D9%81%D9%8A
سأقوم بكتابة مقال احترافي,.Rehab M,0,0,Aucun avis,كتابة وترجمة,محتوى مواقع,ترجمة,https://khamsat.com/writing/articles-blogposts/3534013-%D8%B3%D8%A3%D9%82%D9%88%D9%85-%D8%A8%D9%83%D8%AA%D8%A7%D8%A8%D8%A9-%D9%85%D9%82%D8%A7%D9%84-%D8%A7%D8%AD%D8%AA%D8%B1%D8%A7%D9%81%D9%8A
كتابة مقالات احترافية متوافقة مع السيو لزيادة ظهور موقعك,.Farida A,0,0,Aucun avis,كتابة وترجمة,محتوى مواقع,"العربية, حصرية, كتابة مقالات, السيو, تحسين محركات البحث",https://khamsat.com/writing/articles-blogposts/3683050-%D9%83%D8%AA%D8%A7%D8%A8%D8%A9-%D9%85%D9%82%D8%A7%D9%84%D8%A7%D8%AA-%D8%A7%D8%AD%D8%AA%D8%B1%D8%A7%D9%81%D9%8A%D8%A9-%D9%85%D8%AA%D9%88%D8%A7%D9%81%D9%82%D8%A9-%D9%85%D8%B9-%D8%A7%D9%84%D8%B3%D9%8A%D9%88-%D9%84%D8%B2%D9%8A%D8%A7%D8%AF%D8%A9-%D8%B8%D9%87%D9%88%D8%B1-%D9%85%D9%88%D9%82%D8%B9%D9%83
كتابة  مقالات صديقة لمحركات البحث,.Alan D,1,1,منذ سنة و14 يوم,كتابة وترجمة,محتوى مواقع,"كتابة, مقالات, مقال, كتابة مقالات, مقالات حصرية",https://khamsat.com/writing/articles-blogposts/2834235-%D9%83%D8%AA%D8%A7%D8%A8%D8%A9-%D9%85%D9%82%D8%A7%D9%84%D8%A7%D8%AA-%D8%B5%D8%AF%D9%8A%D9%82%D8%A9-%D9%84%D9%85%D8%AD%D8%B1%D9%83%D8%A7%D8%AA-%D8%A7%D9%84%D8%A8%D8%AD%D8%AB
كتابة مقالات حصرية للمواقع,.Mahmoud D,3,2,منذ 5 سنوات و8 أيام,كتابة وترجمة,محتوى مواقع,"كتابة, خدمات, المقالات, الحصرية",https://khamsat.com/writing/articles-blogposts/772916-%D9%83%D8%AA%D8%A7%D8%A8%D8%A9-%D9%85%D9%82%D8%A7%D9%84%D8%A7%D8%AA-%D8%AD%D8%B5%D8%B1%D9%8A%D8%A9-%D9%84%D9%84%D9%85%D9%88%D8%A7%D9%82%D8%B9
كتابة محتوى متنوع للمقالات,.Anas T,0,0,Aucun avis,كتابة وترجمة,محتوى مواقع,"كتابة, مقالات, كتابة محتوى, محتوى, ابحاث",https://khamsat.com/writing/articles-blogposts/3725695-%D9%83%D8%AA%D8%A7%D8%A8%D8%A9-%D9%85%D8%AD%D8%AA%D9%88%D9%89-%D9%85%D8%AA%D9%86%D9%88%D8%B9-%D9%84%D9%84%D9%85%D9%82%D8%A7%D9%84%D8%A7%D8%AA
كتابة مقالات حصرية في مدونة المتجر علي منصة سلة,.Abdelrahman Y,0,0,Aucun avis,كتابة وترجمة,محتوى مواقع,"مدونة, كتابة, مقالات, سلة, متجر سلة",https://khamsat.com/writing/articles-blogposts/3191823-%D9%83%D8%AA%D8%A7%D8%A8%D8%A9-%D9%85%D9%82%D8%A7%D9%84%D8%A7%D8%AA-%D8%AD%D8%B5%D8%B1%D9%8A%D8%A9-%D9%81%D9%8A-%D9%85%D8%AF%D9%88%D9%86%D8%A9-%D8%A7%D9%84%D9%85%D8%AA%D8%AC%D8%B1-%D8%B9%D9%84%D9%8A-%D9%85%D9%86%D8%B5%D8%A9-%D8%B3%D9%84%D8%A9
كتابة مقالات احترافية متوافقة مع السيو في جميع المجالات,ضحى ر.,0,0,Aucun avis,كتابة وترجمة,محتوى مواقع,"موقع, محتوى, seo, كتابة المقالات, كتابة مقالات حصرية",https://khamsat.com/writing/articles-blogposts/3076977-%D9%83%D8%AA%D8%A7%D8%A8%D8%A9-%D9%85%D9%82%D8%A7%D9%84%D8%A7%D8%AA-%D8%A7%D8%AD%D8%AA%D8%B1%D8%A7%D9%81%D9%8A%D8%A9-%D9%85%D8%AA%D9%88%D8%A7%D9%81%D9%82%D8%A9-%D9%85%D8%B9-%D8%A7%D9%84%D8%B3%D9%8A%D9%88-%D9%81%D9%8A-%D8%AC%D9%85%D9%8A%D8%B9-%D8%A7%D9%84%D9%85%D8%AC%D8%A7%D9%84%D8%A7%D8%AA
كتابة مقالة متوافقة معايير السيو,.Marco B,0,0,Aucun avis,كتابة وترجمة,محتوى مواقع,"مقالات, كتابة محتوى مواقع, كتابة محتوى, seo, كتابة مقالات, كتابة المقالات, مقالات حصرية, كتابه مقالات, كتابة مقالات حصرية, كتابة المحتوى",https://khamsat.com/writing/articles-blogposts/2722331-%D9%83%D8%AA%D8%A7%D8%A8%D8%A9-%D9%85%D9%82%D8%A7%D9%84%D8%A9-%D9%85%D8%AA%D9%88%D8%A7%D9%81%D9%82%D8%A9-%D9%85%D8%B9%D8%A7%D9%8A%D9%8A%D8%B1-%D8%A7%D9%84%D8%B3%D9%8A%D9%88
كتابة مقال في المجال الذي تختاره,وائل ع.,2,2,منذ 3 سنوات و9 أشهر,كتابة وترجمة,محتوى مواقع,"مقال, تقرير, صحفي, أدبي",https://khamsat.com/writing/articles-blogposts/1960849-%D9%83%D8%AA%D8%A7%D8%A8%D8%A9-%D9%85%D9%82%D8%A7%D9%84-%D9%81%D9%8A-%D8%A7%D9%84%D9%85%D8%AC%D8%A7%D9%84-%D8%A7%D9%84%D8%B0%D9%8A-%D8%AA%D8%AE%D8%AA%D8%A7%D8%B1%D9%87
كتابة المقالات الإبداعية احترافياً,زهير ح.,12,9,منذ سنة و18 يوم,كتابة وترجمة,محتوى مواقع,صياغة كتابة مقالات تأليف نشر,https://khamsat.com/writing/articles-blogposts/1678606-%D9%83%D8%AA%D8%A7%D8%A8%D8%A9-%D8%A7%D9%84%D9%85%D9%82%D8%A7%D9%84%D8%A7%D8%AA-%D8%A7%D9%84%D8%A5%D8%A8%D8%AF%D8%A7%D8%B9%D9%8A%D8%A9-%D8%A7%D8%AD%D8%AA%D8%B1%D8%A7%D9%81%D9%8A%D8%A7
كتابه مقالات باللغة العربية أو الانجليزية,.Kholoud Y,7,5,منذ 3 سنوات و5 أشهر,كتابة وترجمة,محتوى مواقع,"كتابه, مقالات",https://khamsat.com/writing/articles-blogposts/1070511-%D9%83%D8%AA%D8%A7%D8%A8%D9%87-%D9%85%D9%82%D8%A7%D9%84%D8%A7%D8%AA-%D8%A8%D8%A7%D9%84%D9%84%D8%BA%D8%A9-%D8%A7%D9%84%D8%B9%D8%B1%D8%A8%D9%8A%D8%A9-%D8%A3%D9%88-%D8%A7%D9%84%D8%A7%D9%86%D8%AC%D9%84%D9%8A%D8%B2%D9%8A%D8%A9
كتابة النصوص والمقالات ساكتب نصا ابداعيا موافقا لقواعد السيو,لنا ع.,1,1,منذ سنة و28 يوم,كتابة وترجمة,محتوى مواقع,"كتابة, ابداعية, قصصية",https://khamsat.com/writing/articles-blogposts/1793704-%D9%83%D8%AA%D8%A7%D8%A8%D8%A9-%D8%A7%D9%84%D9%86%D8%B5%D9%88%D8%B5-%D9%88%D8%A7%D9%84%D9%85%D9%82%D8%A7%D9%84%D8%A7%D8%AA-%D8%B3%D8%A7%D9%83%D8%AA%D8%A8-%D9%86%D8%B5%D8%A7-%D8%A7%D8%A8%D8%AF%D8%A7%D8%B9%D9%8A%D8%A7-%D9%85%D9%88%D8%A7%D9%81%D9%82%D8%A7-%D9%84%D9%82%D9%88%D8%A7%D8%B9%D8%AF-%D8%A7%D9%84%D8%B3%D9%8A%D9%88
مقالات احترافية ومُحسّنة لمحركات البحث,.Tareq A,0,0,Aucun avis,كتابة وترجمة,محتوى مواقع,"كتابة محتوى احترافي, مقالات محسنة لمحركات البحث, منشورات مدونة عالية الجودة, محتوى مواقع ويب جذاب, خدمات كتابة المحتوى",https://khamsat.com/writing/articles-blogposts/3133890-%D9%85%D9%82%D8%A7%D9%84%D8%A7%D8%AA-%D8%A7%D8%AD%D8%AA%D8%B1%D8%A7%D9%81%D9%8A%D8%A9-%D9%88%D9%85%D8%AD%D8%B3%D9%86%D8%A9-%D9%84%D9%85%D8%AD%D8%B1%D9%83%D8%A7%D8%AA-%D8%A7%D9%84%D8%A8%D8%AD%D8%AB
كتابة مقالات باللغة الإنجليزية متوافقة مع قواعد السيو SEO,.Tareq B,1,0,Aucun avis,كتابة وترجمة,محتوى مواقع,"ووردبريس, كتابة, مقالات, محتوى, seo",https://khamsat.com/writing/articles-blogposts/3327944-%D9%83%D8%AA%D8%A7%D8%A8%D8%A9-%D9%85%D9%82%D8%A7%D9%84%D8%A7%D8%AA-%D8%A8%D8%A7%D9%84%D9%84%D8%BA%D8%A9-%D8%A7%D9%84%D8%A5%D9%86%D8%AC%D9%84%D9%8A%D8%B2%D9%8A%D8%A9-%D9%85%D8%AA%D9%88%D8%A7%D9%81%D9%82%D8%A9-%D9%85%D8%B9-%D9%82%D9%88%D8%A7%D8%B9%D8%AF-%D8%A7%D9%84%D8%B3%D9%8A%D9%88-seo
مقالات حصري متوافقة مع السي يو,.Mohamed A,0,0,Aucun avis,كتابة وترجمة,محتوى مواقع,"كتابة, مقالات, seo, حصري, ادنسيس",https://khamsat.com/writing/articles-blogposts/2362974-%D9%85%D9%82%D8%A7%D9%84%D8%A7%D8%AA-%D8%AD%D8%B5%D8%B1%D9%8A-%D9%85%D8%AA%D9%88%D8%A7%D9%81%D9%82%D8%A9-%D9%85%D8%B9-%D8%A7%D9%84%D8%B3%D9%8A-%D9%8A%D9%88
كتابة مقالات في جميع المجالات,توفة ا.,2,1,منذ 11 شهر و13 يوم,كتابة وترجمة,محتوى مواقع,"كتابة, مقالات, writing, articles",https://khamsat.com/writing/articles-blogposts/2992892-%D9%83%D8%AA%D8%A7%D8%A8%D8%A9-%D9%85%D9%82%D8%A7%D9%84%D8%A7%D8%AA-%D9%81%D9%8A-%D8%AC%D9%85%D9%8A%D8%B9-%D8%A7%D9%84%D9%85%D8%AC%D8%A7%D9%84%D8%A7%D8%AA
كتابة محتوى-مقالات أدبية ونثرية,رحيم ص.,21,15,منذ سنتين و6 أشهر,كتابة وترجمة,محتوى مواقع,"كتابة, مقالات, شعر, نثر, أدبي, ابداعية, نثري",https://khamsat.com/writing/articles-blogposts/1662122-%D9%83%D8%AA%D8%A7%D8%A8%D8%A9-%D9%85%D8%AD%D8%AA%D9%88%D9%89-%D9%85%D9%82%D8%A7%D9%84%D8%A7%D8%AA-%D8%A3%D8%AF%D8%A8%D9%8A%D8%A9-%D9%88%D9%86%D8%AB%D8%B1%D9%8A%D8%A9
كتابة مقالات احترافية متوافقة مع السيو SEO بالعربية,.Mohamed A,0,0,Aucun avis,كتابة وترجمة,محتوى مواقع,"مقالات, كتابة مقالات, سيو, كتابة مقالات حصرية",https://khamsat.com/writing/articles-blogposts/3848969-%D9%83%D8%AA%D8%A7%D8%A8%D8%A9-%D9%85%D9%82%D8%A7%D9%84%D8%A7%D8%AA-%D8%A7%D8%AD%D8%AA%D8%B1%D8%A7%D9%81%D9%8A%D8%A9-%D9%85%D8%AA%D9%88%D8%A7%D9%81%D9%82%D8%A9-%D9%85%D8%B9-%D8%A7%D9%84%D8%B3%D9%8A%D9%88-seo-%D8%A8%D8%A7%D9%84%D8%B9%D8%B1%D8%A8%D9%8A%D8%A9
كتابة مقالات احترافية عربي/ انجليزي متوافقة مع السيو,زينب ع.,0,0,Aucun avis,كتابة وترجمة,محتوى مواقع,"كتابة محتوى مواقع, احترافية, seo, كتابة مقالات, سيو",https://khamsat.com/writing/articles-blogposts/3289882-%D9%83%D8%AA%D8%A7%D8%A8%D8%A9-%D9%85%D9%82%D8%A7%D9%84%D8%A7%D8%AA-%D8%A7%D8%AD%D8%AA%D8%B1%D8%A7%D9%81%D9%8A%D8%A9-%D8%B9%D8%B1%D8%A8%D9%8A-%D8%A7%D9%86%D8%AC%D9%84%D9%8A%D8%B2%D9%8A-%D9%85%D8%AA%D9%88%D8%A7%D9%81%D9%82%D8%A9-%D9%85%D8%B9-%D8%A7%D9%84%D8%B3%D9%8A%D9%88
أكتب مقالات احترافية بأسلوب أدبي جذاب بدون أخطاء لغوية,.Osman M,0,0,Aucun avis,كتابة وترجمة,محتوى مواقع,"كتابة, مقالات, كتابة مقالات حصرية, قصة قصيرة, كتابة إبداعية",https://khamsat.com/writing/articles-blogposts/3822684-%D8%A3%D9%83%D8%AA%D8%A8-%D9%85%D9%82%D8%A7%D9%84%D8%A7%D8%AA-%D8%A7%D8%AD%D8%AA%D8%B1%D8%A7%D9%81%D9%8A%D8%A9-%D8%A8%D8%A3%D8%B3%D9%84%D9%88%D8%A8-%D8%A3%D8%AF%D8%A8%D9%8A-%D8%AC%D8%B0%D8%A7%D8%A8-%D8%A8%D8%AF%D9%88%D9%86-%D8%A3%D8%AE%D8%B7%D8%A7%D8%A1-%D9%84%D8%BA%D9%88%D9%8A%D8%A9
كتابة مقالات حصرية ومتوافقة مع معايير السيو SEO,.Aymane D,0,0,Aucun avis,كتابة وترجمة,محتوى مواقع,"كتابة, مقالات, محتوى, سيو, كتابة مقالات حصرية",https://khamsat.com/writing/articles-blogposts/3131155-%D9%83%D8%AA%D8%A7%D8%A8%D8%A9-%D9%85%D9%82%D8%A7%D9%84%D8%A7%D8%AA-%D8%AD%D8%B5%D8%B1%D9%8A%D8%A9-%D9%88%D9%85%D8%AA%D9%88%D8%A7%D9%81%D9%82%D8%A9-%D9%85%D8%B9-%D9%85%D8%B9%D8%A7%D9%8A%D9%8A%D8%B1-%D8%A7%D9%84%D8%B3%D9%8A%D9%88-seo
كتابة مقالات بكافة أنواعها,.Israa S,16,11,منذ سنتين و11 شهر,كتابة وترجمة,محتوى مواقع,"عربية, إنجليزي, كتابة, مقالة, مقالات, محتوى, مقال, seo, السيو, مقالات حصرية",https://khamsat.com/writing/articles-blogposts/1178246-%D9%83%D8%AA%D8%A7%D8%A8%D8%A9-%D9%85%D9%82%D8%A7%D9%84%D8%A7%D8%AA-%D8%A8%D9%83%D8%A7%D9%81%D8%A9-%D8%A3%D9%86%D9%88%D8%A7%D8%B9%D9%87%D8%A7
